id,text,topic_id
315,"Gross domestic product (GDP) is the sum of all incomes distributed in a year, including disposable personal income (DPI). So, GDP and DPI are positively correlated. That is, they generally move in the same direction and follow each other closely. &#8230; <a href=""https://fredblog.stlouisfed.org/2025/12/why-did-gdp-and-personal-income-diverge-during-covid/"">Continue reading <span class=""meta-nav"">&#8594;</span></a>",T5
316,"The current softening in the labor market is hitting recent college graduates especially hard, suggesting the traditional college premium may be weakening. At least for quickly landing a job. In this post, we take a longer view of the unemployment &#8230; <a href=""https://fredblog.stlouisfed.org/2025/11/the-unemployment-gap-between-college-graduates-and-noncollege-workers/"">Continue reading <span class=""meta-nav"">&#8594;</span></a>",T5
317,"How do prices change over time? Prices tend to go up, especially over long periods. But some prices can increase much faster than others and some can even decrease. Over the past 40 years or so, price changes for goods &#8230; <a href=""https://fredblog.stlouisfed.org/2025/11/long-term-price-trends/"">Continue reading <span class=""meta-nav"">&#8594;</span></a>",T0
318,"The FRED Blog often discusses inflation—in particular, the consumer price index reported by the US Bureau of Labor Statistics. The CPI from the BLS measures the average change over time in the prices paid by urban consumers for a representative &#8230; <a href=""https://fredblog.stlouisfed.org/2025/11/the-harmonized-consumer-price-index/"">Continue reading <span class=""meta-nav"">&#8594;</span></a>",T0
319,"Each year brings a new set of economic challenges: In 2025, major areas of focus included tariffs and trade tensions, as well as the financial pressures facing younger adults. New York Fed economists contributed insightful research on both topics—and readers took notice. In fact, all five of the year’s most-read posts on <em>Liberty Street Economics</em> analyzed aspects of these issues. Read on to see how the restoration of student loan data to credit reports affected borrowers’ credit scores, whether the costs of a college degree are still worth it, how businesses are responding to higher tariffs, and why the U.S. runs a trade deficit.<br />",T5
320,"Call Reports are regulatory filings in which commercial banks report their assets, liabilities, income, and other information. They are one of the most-used data sources in banking and finance. In this post, we describe a <a href=""https://www.newyorkfed.org/research/banking_research/balance-sheets-income-statements"">new dataset</a> made available on the Federal Reserve Bank of New York’s website that contains time-consistent balance sheets and income statements for commercial banks in the United States from 1959 to 2025.",T9
321,"Banks must extract useful signals of a potential borrower's quality from a large set of possibly informative characteristics when making lending decisions. A model that speaks to how banks specialize in lending to an industry in order to better extract signals from data, can potentially be applied to a number of real-world scenarios. In this post, we apply lessons from such a model to a topic of timely relevance in economics: job market recommendation letters. Institutions looking to hire new economists must evaluate PhD applicants based on limited and often noisy signals of future performance, including letters of recommendation from these applicants’ advisors or co-authors. Using insights from our model, we argue that the value of these letters depends on who reads them.",T4
322,"Why does the banking industry remain prone to large and costly disruptions despite being so heavily regulated? Is there a need for more regulation, less regulation, or simply different regulation? Our <a href=""https://www.newyorkfed.org/research/staff_reports/sr1155.html"">recent Staff Report</a> combines insights from academic research in economics, finance, and accounting to provide a deeper understanding of the challenges involved in designing and implementing bank regulation, as well as opportunities for future exploration. This post focuses on the regulation of bank capital, but the ideas are applicable more broadly.",T4
323,"This post presents an update of the economic forecasts generated by the Federal Reserve Bank of New York’s dynamic stochastic general equilibrium (DSGE) model. We describe very briefly our forecast and its change since <a href=""https://libertystreeteconomics.newyorkfed.org/2025/09/the-new-york-fed-dsge-model-forecast-september-2025/"" rel=""noreferrer noopener"" target=""_blank"">September 2025</a>. To summarize, growth in 2025 is expected to be stronger than in September due to a lower projected path of the policy rate, as well as higher productivity. Inflation projections are higher in 2025 because of cost-push shocks, which capture the effects of tariffs. The model’s predictions for the short-run real natural rate of interest (or r*) in 2025 have decreased relative to September.",T5
324,"Following the recent passage of <a href=""https://www.congress.gov/bill/119th-congress/senate-bill/1582"" rel=""noreferrer noopener"" target=""_blank"">legislation in the U.S.</a>, payment stablecoins seem to be on the brink of wider-scale adoption and explosive growth in market capitalization. In this post, we contend that the driving factor is not their proximity to digital cash instruments, but rather how they are transferred—via global, open-access, peer-to-peer systems, or “permissionless blockchains,” for short.",T4
325,"There has been a lot of interest in firms’ pricing decisions in the past few years—both during the inflation surge of 2021-23 and in the more recent rounds of tariff increases. In this post, we let firms speak for themselves about what factors they consider when adjusting prices in response to various shocks. The analysis is based on an ongoing research project, joint with the Atlanta and Cleveland Federal Reserve Banks, on how businesses set prices and the extent of passthrough of cost increases. In particular, we leverage the qualitative portion of the study based on open-ended interviews with senior decision-makers on how they approach pricing decisions in their firms. Rather than a uniform approach, a very nuanced picture emerges of businesses trying to balance competing objectives while keeping an eye on demand conditions for their products as well as on their direct competitors’ behavior in the market.",T0
326,"A <a href=""https://libertystreeteconomics.newyorkfed.org/2012/10/is-us-monetary-policy-seasonal/"" rel=""noreferrer noopener"" target=""_blank"">2012 <em>Liberty Street Economics</em> post</a> noted that U.S. monetary policy exhibits a surprising degree of seasonal behavior: over the 1987-2008 period, the Federal Reserve was much more likely to lower interest rates (or abstain from raising rates) in the first month of each quarter than in the two subsequent months. Thirteen years later, we revisit that analysis to investigate whether the seasonal pattern in monetary policy still holds today, in the wake of a rate hiking cycle, a pandemic, a surge in inflation, and a second round of rate hikes. We find that the pattern has indeed continued; however, unlike in the earlier sample period, it can be completely explained by the timing of the FOMC calendar.",T0
327,"In a <a href=""https://libertystreeteconomics.newyorkfed.org/u-s-banks-have-developed-a-significant-nonbank-footprint"">previous post</a>, we documented how, over the past five decades, the typical U.S. bank has evolved from an entity mainly focused on deposit taking and loan making to a more diversified conglomerate also incorporating a variety of nonbank activities. In this post, we show that an important driver of the evolution of this new organizational form is the desire of banks to efficiently manage liquidity needs.<br />",T4
328,"<br />In light of the rapid growth of nonbank financial institutions (NBFIs), many have argued that bank-led financial intermediation is on the decline, based on the traditional notion that banks operate to take in deposits and make loans. However, we argue that deposit-taking and loan-making have not accurately characterized U.S. banking operations in recent decades. Instead, as we propose in this post, absent regulatory restrictions, banks naturally expand their boundaries to include NBFI subsidiaries. A significant component of the growth of NBFIs has in fact taken place <em>inside </em>the boundaries of banking firms.",T4
329,"In 2025, the Federal Reserve has cut interest rates, trade policy has shifted abruptly, and economic policy uncertainty has increased. How have these developments affected the functioning of the key U.S. Treasury securities market? In this post, we return to some familiar metrics to assess the recent behavior of Treasury market liquidity. We find that liquidity briefly worsened around the April 2025 tariff announcements but that its relation to Treasury volatility has been similar to what it was in the past.",T0
330,"Bank failures and distress can be costly to the economy, causing losses to creditors and reducing the flow of credit and other financial intermediation services. Thus, there is significant value in being able to identify “at risk” banks in a timely and accurate way. In a <a href=""https://libertystreeteconomics.newyorkfed.org/2025/09/economic-capital-a-new-measure-of-bank-solvency/"" rel=""noreferrer noopener"" target=""_blank"">previous post</a>, we presented a new solvency metric, Economic Capital, and showed how solvency risks in the U.S. banking industry have evolved over time according to this measure. In this post, we continue to draw on our recent <a href=""https://www.newyorkfed.org/research/staff_reports/sr1144.html"" rel=""noreferrer noopener"" target=""_blank"">Staff Report</a> to present analysis showing that Economic Capital identifies failing banks earlier and more accurately than more conventional solvency measures.",T4
331,"As in previous years, we provide in this post an update on the vulnerability of the U.S. banking system based on four analytical models that capture different aspects of this vulnerability. We use data through 2025:Q2 for our analysis, and also discuss how the vulnerability measures have changed since our last update <a href=""https://libertystreeteconomics.newyorkfed.org/2024/11/banking-system-vulnerability-2024-update/?_ppp=6960e497ee"">one year ago</a>.",T4
332,"After the Great Financial Crisis, the European Central Bank (ECB) extended its monetary policy toolbox to include the use of long-term loans to banks at interest rates close to zero or even negative. These central bank interventions were aimed at supporting the transmission of expansionary monetary policy and likely played a crucial role in bolstering the financial stability of the euro area, namely by reducing the chance of bank runs. However, quantitative evidence on the effects of these interventions on financial stability remains scant. In this post, we quantify the effectiveness of central bank lending programs in supporting financial stability through the lens of a novel structural model discussed in this <a href=""https://papers.ssrn.com/sol3/papers.cfm?abstract_id=3708226"">paper</a>.",T4
333,"Every state in the country has a law permitting involuntary hospitalization if a person presents a danger to themselves or others as a result of mental illness. If a person reaches this high bar, the logic goes, they should be confined in a psychiatric hospital for treatment until they are stabilized. (The process is also sometimes called involuntary commitment, involuntary psychiatric hold, or sectioning.) Although there is no definitive national accounting, it is estimated that about 1.2 million involuntary psychiatric hospitalizations occur every year (<a href=""https://psychiatryonline.org/doi/10.1176/appi.ps.201900477"">Lee and Cohen 2021</a>). This puts the magnitude on par with the 1.2 million individuals imprisoned in state, federal, and military prisons every year (<a href=""https://bjs.ojp.gov/library/publications/prisoners-2021-statistical-tables"">Carson 2022</a>). In a new <a href=""https://www.newyorkfed.org/research/staff_reports/sr1158.html"">Staff Report</a>, we use data from Allegheny County, which includes Pittsburgh, to measure how psychiatric commitments are impacting an individual’s risk of danger to themselves or others, earnings, and housing.",T4
334,"Uncertainty is a key component of everyday economic decisions of consumers and, perhaps not surprisingly, it plays a central role in economic models. According to economic theory, forward-looking consumers rely on their expectations and perceived uncertainty when making economic decisions. Nevertheless, measuring the uncertainty that households actually perceive, and how it affects consumer behavior, is challenging. The probabilistic nature of the <a href=""https://www.newyorkfed.org/microeconomics/sce"" rel=""noreferrer noopener"" target=""_blank"">Survey of Consumer Expectations</a> enables us to make progress on this subject and to construct household-specific time-varying uncertainty. In our recent <a href=""https://www.newyorkfed.org/research/staff_reports/sr1148"" rel=""noreferrer noopener"" target=""_blank"">Staff Report</a>, we empirically show that the marginal propensity to consume (MPC) is increasing and concave in perceived uncertainty. This novel empirical evidence poses a challenge for the conventional consumption-savings model with incomplete markets.",T5
335,"In <a href=""https://libertystreeteconomics.newyorkfed.org/2024/09/end-of-month-liquidity-in-the-treasury-market/"" rel=""noreferrer noopener"" target=""_blank"">a 2024 post</a>, we showed that interdealer trading in benchmark U.S. Treasury notes and bonds concentrates on the last trading day of the month, likely due to passive investment funds’ turn-of-month portfolio rebalancing. In this post, we extend our trading activity analysis to the full range of Treasury securities and market segments. We find that trading is even more concentrated on the last trading day of the month for other types of Treasury securities and in the dealer-to-customer segment of the market, with trading volume in off-the-run Treasuries twice as high as on other days, on average.",T8
336,"Recently instituted rule amendments have initiated a large migration of dealer-to-client Treasury repurchase trades to central clearing. To date, the main avenue used to access central clearing is Sponsored Service, a clearing product that has, until now, received little attention. This post highlights the results from <a href=""https://www.newyorkfed.org/research/staff_reports/sr1140"">a recent Staff Report</a> which presents a deep dive into Sponsored Service. Here, we summarize the description of the institutional details of this service and its costs and benefits. We then document some basic facts on how market participants use this service, based on confidential data.",T4
337,"The term “exorbitant privilege” emerged in the 1960s to describe the advantages derived by the U.S. economy from the dollar’s status as the de facto global reserve currency. In this post, we examine the exorbitant privilege that accrued to the Netherlands in the eighteenth century, when the Dutch guilder enjoyed global <a href=""https://www.ijcb.org/journal/ijcb16q4a2.pdf"">reserve currency</a> status. We show how the private actions of financial institutions created and maintained this privilege, even in the absence of a central bank. While privilege benefited the Dutch financial system in many ways, it also laid the seeds of later financial crisis.",T4
338,"U.S. trade policy remains in flux. Nevertheless, important elements of the new policy regime are apparent in data through July. What stands out are the large differences in realized tariff rates by trading partner, ranging from less than 5 percent for Canada and Mexico to 15 percent for Japan and to 40 percent for China. This post shows that the bulk of cross-country differences in tariff rates is explained by two factors:  the U.S.-Canada-Mexico free trade agreement and differing sales shares in tariff-exempt categories.",T5
339,A crucial year for private debt could mark a turning point in its history.,T4
340,"The third vintage is more than halfway to its $5bn target fundraise, filings show.",T8
341,"Staff suggests there is potential for stress in private credit, amid higher default rates and potential for higher PIK.",T4
342,"Fund closed for growth debt investments in Asia-Pacific. Also, private credit unitranche spreads narrowing. Here's today's brief for our valued subscribers only.",T4
343,London-based manager’s new open-ended global interval fund focuses on synthetic risk transfer and capital relief.,T8
344,The Italian public pension fund has issued a request for proposal for private debt funds.,T9
345,"The New York-based manager was targeting $2bn for Fund VII, but has amassed more with a boost from the strategy’s anticipated leverage.",T8
346,The vehicle’s $2.6bn final close came months before Brookfield agreed to buy the Los Angeles-based manager’s outstanding shares.,T8
347,The manager will expand its fixed income exposure through the all-cash transaction valued at $473m.,T8
348,"US attorneys claim Tricolor execs Chu, Goodgame, Kollar and Seibold fabricated data to obtain loans.",T4
349,Coinbase says three areas will dominate the crypto market in 2026,T3
350,"Price-action of dog memecoins dogecoin, shiba inu muted amid thin holiday liquidity",T13
351,Bitcoin’s rebound fades as XRP slips to $1.86 even with ETF assets at $1.25B,T13
352,"Bitcoin sinks below $87,000 as crypto assets slide, metals soar post-Xmas",T13
353,Bitcoin mining in 2025: IREN claims the crown as Bitdeer's stock trails the pack,T3
354,Coinbase named a top three 2026 fintech pick at Clear Street,T3
355,"Uniswap's token burn, protocol fee proposal backed overwhelmingly by voters",T3
356,Trust Wallet users lose $7 million to hacked Chrome extension,T11
357,"Bitcoin’s $70,000 to $80,000 zone highlights gap in historical price support",T13
358,Hong Kong regulators target 2026 legislation for virtual asset dealer and custodian rules,T11
359,"Bitcoin and ether ETFs see outflows ahead of Christmas, led by IBIT and ETHE",T13
360,"XRP ETF net assets cross $1.25 billion milestone, but price-action muted",T13
361,"Bitcoin briefly trades at $24,000 on Binance’s USD1 pair in flash move",T13
362,"Circle platform promising tokenized gold, silver swaps is 'fake,' company says",T3
363,EU’s crypto tax reporting starts in January with threat of asset seizure,T3
364,"WhiteFiber NC-1 deal is promising, says B. Riley, seeing 127% upside after stock price plunge",T13
365,XRP price reaction muted even as new income-generation opportunity appears,T13
366,"<p>※この記事は自動翻訳されています。正確な内容につきましては原文をご参照ください。 暗号資産に関する規制の動きを追っていると、2024年12月の状況が、すでにかなり前のことのように感じられます。たった12か月前と比べても、現在の世界全体の政策環境は大きく変化しました。変化のスピードは非常に速く、その勢いが弱まる兆しはほとんどありません。 そこで2026年に入る前に、2025年に起きた主な規制の変更点を振り返ります。グローバル全体の流れ、地域ごとの動き、そして2026年に特に注目されるトピックについて整理します。より詳しい背景や分析は、チェイナリシス Road to Crypto Regulation シリーズと2025 Geography of Cryptocurrency Reportをご覧ください。 世界の視点から見る、デジタル資産政策「5つの大きな流れ」 1. 規制導入の進捗と、運用段階での摩擦・課題 ここ数年、各国・地域で、デジタル資産を対象とする包括的な規制枠組みの整備が進んできました。進み具合に差はあったものの、全体としては大きな前進が見られました。ただし、その進展は国や地域により不均一でした。 2025年になり、「法律を作る段階」から「実際に運用・実装する段階」に移行すると、その実装プロセス自体が、立法（法律を作ること）と同じくらい、政治的にも実務的にも複雑であることが明らかになりました。 EU ではMiCA（Markets in&#8230;</p>
<p>The post <a href=""https://www.chainalysis.com/blog/2025-crypto-regulatory-round-up-japanese/"">2025年暗号資産規制の総括と今後の論点</a> appeared first on <a href=""https://www.chainalysis.com"">Chainalysis</a>.</p>",T4
367,"<p>For observers of crypto regulation, December 2024 feels like a long time ago. The global policy landscape today looks markedly&#8230;</p>
<p>The post <a href=""https://www.chainalysis.com/blog/2025-crypto-regulatory-round-up/"">2025 Crypto Regulatory Round-Up: What Changed and What’s Ahead</a> appeared first on <a href=""https://www.chainalysis.com"">Chainalysis</a>.</p>",T3
368,"<p>TL;DR AI and blockchain technologies are converging to create autonomous financial systems where AI provides the decision-making layer and blockchain&#8230;</p>
<p>The post <a href=""https://www.chainalysis.com/blog/ai-and-crypto-agentic-payments/"">The Convergence of AI and Cryptocurrency: From Digital Transactions to Agentic Payments</a> appeared first on <a href=""https://www.chainalysis.com"">Chainalysis</a>.</p>",T14
369,"<p>Following the Money is a Q&#38;A series that spotlights how Chainalysis customers use our products in the real world —&#8230;</p>
<p>The post <a href=""https://www.chainalysis.com/blog/following-the-money-with-chainalysis-clement-santerre-meria/"">Following the Money with Chainalysis: 9 Questions for Clément Santerre</a> appeared first on <a href=""https://www.chainalysis.com"">Chainalysis</a>.</p>",T11
370,<p>※この記事は自動翻訳されています。正確な内容につきましては原文をご参照ください。 暗号資産サービスから2025年上半期だけで21億7000万ドル以上が盗まれるなど、分散型金融（DeFi）およびWeb3プロトコルをハッカー、運用上の不具合、ガバナンス攻撃、金融的な不正から守ることがこれまで以上に急務となっています。これには、積極的な予防、データセキュリティ基盤、ツール整備、エコシステム全体での連携への継続的な投資が必要です。 統一された防御体制：チェーン・開発者・エンドユーザーの保護 当社はエコシステムを強化するため、ブロックチェーン財団と連携し、チェーン自体のセキュリティ強化だけでなく、各ネットワーク上でプロトコルを構築する開発者に特化したHexagateの無料提供も行っています。 Hexagateとは？リアルタイムのオンチェーンセキュリティレイヤー Hexagateはオンチェーン環境向けのランタイムセキュリティプラットフォームで、進行中の攻撃を検知し、損失が発生する前にチームが対策を講じられるよう支援します。従来のサイバーセキュリティがサーバーやクラウドを守るのに対し、Hexagateはスマートコントラクト、トランザクション、オンチェーン資産を守る、従来型ツールがカバーできない領域のためのソリューションです。 &#160; チェーン向け：インフラ一貫性の確保 チェーンのセキュリティ担当者は、インフラやトレジャリーの保護という重要かつ複雑なミッションに直面しています。主要なブロックチェーンでは、エンドツーエンドのオンチェーンセキュリティ確保のためにHexagateを導入し、以下のような保護を実現しています。 リアルタイム脅威インテリジェンス：新たな攻撃ベクトルを即座に把握 エコシステム全体のモニタリング：オンチェーン活動を包括的に監視 ウォレット侵害検知：運用ウォレットやトレジャリーウォレットの侵害を早期に特定 リスク自動低減：エクスプロイトを未然に防ぎ、ブロックチェーンネットワークの健全性を維持するツール 当社は、Base、Avalanche、Plasma、MegaETH、Polygon、Cronos、Immutableなど、業界のリーダーと提携できていることを誇りに思います。 開発者向け：無料AI搭載プロトコル保護 Web3プロトコルの構築には多大な労力がかかります。開発者は、プロダクトの革新、優れたユーザー体験、持続可能なトークノミクス、効率的なオンボーディング、大規模なスケーリングなど、複雑な課題のバランスを常に求められます。 しかし、その全ての基盤となるのがセキュリティです。セキュリティは最も重要かつ困難なフロンティアであり、1件のエクスプロイトが甚大な経済的損失やユーザーの信頼喪失に直結します。 ブロックチェーン財団との戦略的パートナーシッ,T4
