id,text,topic_id
163,"Turkish Airlines is considered the best airline in Europe. Besides a few complaints, I get the hype &mdash; and I'd actually recommend eating the food.",T4
164,"Brett Ratner, known for the 'Rush Hour' films, returns with a Melania Trump documentary after 2017 misconduct allegations.",T2
165,"Jeremy Brand Yuan left San Francisco for Taiwan, and takes video calls with his US colleagues from his $27,000 boat. He feels lucky, but has made sacrifices.",T4
166,"Heavy AI use can inflate confidence, weaken judgment, and leave workers struggling when tools are removed, innovation theorist John Nosta said.",T7
167,"Automotive and AI professionals share how to be a robotaxi tourist in China, including the apps to download and the best cities to ride in.",T7
168,"James Hwang was laid off by Amazon in October. He says the job market has felt like a ""brick wall"" he can't break through.",T4
169,Micro drama apps like ReelShort and DramaBox have gotten pushback over violence and misogyny in plots from producers and fans.,T7
170,iPod inventor Tony Fadell said founders like Meta' Mark Zuckerberg think differently about privacy issues after becoming parents.,T7
171,"Electric and gas providers more than doubled rate increase requests to state regulators last year, often citing soaring demand from AI data centers.",T4
172,"The health reporter Kim Schewitz often feels tired, and hoped tracking her blood sugar levels using a continuous glucose monitor would help. Then the app told her to do calf raises for 15 minutes.",T4
173,"Across Minneapolis, Target employees are marching and volunteering amid the immigration crackdown, while pressing company leadership to do more",T10
174,"Wall Street tailors say major weight loss transformations were once rare. Now, the ""Ozempic effect"" is creating a surge in demand for their services.",T9
175,"Jordan Blake Banks, an American who moved to Finland, said the pay is lower but healthcare education, and childcare are much more accessible.",T0
176,"It takes a while for a job posting to turn into a hire. That can be frustrating for job seekers applying to work in the low-hire, low-fire job market.",T10
177,Hedge funds dust off a years-in-the-making relative value trade to profit from fallback mismatch,T8
178,A fast-to-calibrate model to simulate a credit rating transition matrix is presented,T0
179,Dealers split between counterparty credit risk and market risk frameworks for repack RWAs,T13
180,"Tracker funds are choking out active managers, leading to hyped valuations for a dangerously small number of equities",T9
181,"Few large European dealers drove clearing rates down, while US and UK banks increased reliance on CCPs",T6
182,Schindler slams ‘misconception’ that regulators intend to impose standardised bank-like rules,T0
183,"A well-known experiment points to an alternative way to assess stock-picker performance, say iM Global Partner’s Luc Dumontier and Joan Serfaty",T8
184,"Bank-owned streaming venue targets mid-year launch, offering “all you can eat” subscription fees",T14
185,Outright UST holdings drive surge with $900bn rise in six months,T9
186,Apollo-owned insurer still sees payments from sold CDS protection on a 2006 synthetic resecuritisation,T9
187,New supervisory principles support FHLB funding over discount window preparedness,T0
188,"Futures, options and swaps customer funds log biggest annual jump since 2020",T8
189,"Financial firms are open to using a wider variety of collateral when posting VM on uncleared derivatives, but concerns are slowing efforts to use more non-cash alternatives",T0
190,Traders split over whether insurers’ retreat from FX hedging is help or hindrance,T8
191,Critics warn UK will miss opportunity to simplify transaction reporting if it spurns UPI,T14
192,Lender ranks second only to Bank of America for loans to business credit intermediaries,T0
193,Australia’s move to monthly inflation reporting set to revitalise local inflation-linked bond and swap markets,T11
194,Dublin filing points to Q1 launch for Calamos Autocallable Income Ucits ETF,T9
195,"Michel Semaan, head of RepoClear at LSEG, discusses evolving requirements in repo clearing",T13
196,President Trump announced Kevin Warsh as his nominee to succeed Jerome H. Powell as chair of the Federal Reserve. Our reporter Colby Smith explains why the choice matters for the economy.,T2
197,"If confirmed by the Senate, Kevin M. Warsh, a former governor at the central bank, will replace Jerome H. Powell, whose term as chair ends in May.",T2
198,"Tariffs have protected some companies, but more often they’ve hit the parts and materials many factories need to make finished goods.",T1
199,"Loloi stockpiled rugs from India, Turkey and other countries in advance, but inventory is running low.",T6
200,"Inflation is elevated but steady and the job market is holding up, leading economists to predict that the Federal Reserve will keep interest rates at current levels.",T11
201,"A few key necessities are driving dissatisfaction, particularly among the young, our poll finds.",T10
202,"The Trump administration has unleashed a barrage of attacks on the Federal Reserve, including a criminal investigation into its chair, Jerome H. Powell.",T2
203,"The Federal Reserve chose to pause rate cuts, even as it faces relentless attacks from President Trump for not cutting borrowing costs fast enough.",T2
204,"Municipal debt issuance surpassed $500 billion last year, a record that’s found a deep pool of buyers.",T10
205,"The tech giant has spent more than $6 million on TV ads in state capitals and Washington, with the message that data centers create jobs.",T14
206,Farmers are critical to Iowa’s economy. They have been battered by President Trump’s tariffs and are not experiencing the “golden age” that the president promised.,T1
207,"The Federal Reserve is expected to hold interest rates steady on Wednesday, despite relentless attacks from President Trump over borrowing costs.",T2
208,The cost of borrowing is already choking crucial public spending in many developing economies. Now it’s raising broader alarms.,T10
209,"The administration announced a $1.6 billion deal with USA Rare Earth. The firm also does business with Cantor Fitzgerald, which is run by the sons of President Trump’s commerce secretary.",T2
210,"President Trump threatened to increase tariffs on South Korean exports, including cars, citing the country’s slow ratification of a trade deal.",T1
211,"Andrew Ross Sorkin, editor at large of DealBook, describes how leaders at the World Economic Forum in Davos remain on edge after President Trump, for now, backed down from threats of using tariffs or military force to gain Greenland.",T1
212,The president’s quick reversal on tariffs over Greenland was another sign of his willingness to rip up the international order — even parts of it that he himself has made.,T1
213,"President Trump may be on the verge of having his authority on imposing tariffs curtailed, but that hasn’t slowed down his threats.",T1
214,"Mr. Warsh is known as a consensus builder, skills he will need if he is to head the Federal Reserve when President Trump is demanding rock-bottom rates.",T2
215,The Treasury Secretary Scott Bessent tried to avoid providing President Trump with a clear recommendation to lead the central bank.,T2
216,"Investors are increasingly souring on the United States, as illustrated by the declining dollar, the stalled stock market and rising government borrowing costs.",T6
217,"Energy experts said that governors and legislatures have tools to keep electricity prices from rising further, and might even be able to lower them.",T1
218,"Kevin A. Hassett had been seen as the front-runner in the Fed race, but his deep ties to the president raised questions about his independence.",T2
219,"The decision to nominate Brett Matsumoto, a career government economist, came six months after the president fired the previous commissioner.",T2
220,"The world body warned it would run out of money by July and have to close its New York headquarters if countries, namely the United States, did not pay annual dues that amount to billions of dollars.",T1
221,"The New Shepard rocket from Blue Origin, which brought 92 people on trips to the edge of space, will cease flying for at least two years as the company prioritizes NASA contracts.",T4
222,The president is demanding that the federal government pay him at least $10 billion over the unauthorized disclosure of his tax returns during his first term.,T11
223,President Trump announced Kevin Warsh as his nominee to succeed Jerome H. Powell as chair of the Federal Reserve. Our reporter Colby Smith explains why the choice matters for the economy.,T2
224,"For more than 30 years, he drew fans for dispensing weekly produce punditry on a New York television station, building on a sales career that began when he was 5.",T14
225,"Test your knowledge of credit cards, buying a home, saving for college or retirement and other things that affect your wallet.",T0
226,"Buffeted by tariffs and trade tensions, Prime Minister Keir Starmer took British business leaders to China and emerged with deals on visas and Scotch whisky, as well as pledges to deepen ties.",T1
227,"Kevin M. Warsh, whom Mr. Trump tapped to become the next chair of the Federal Reserve, could face fierce resistance if he tries to pursue substantially lower borrowing costs.",T2
228,"The company’s chief executive, Elon Musk, said this week that it would stop making the car, an electric pioneer in 2012, as well as the Model X.",T9
229,"The first step, consumer finance experts say, is to ask your card issuer to reduce the rate. And with average balances now $6,500, consider using your tax refund to put a dent in the debt.",T0
230,"The U.S. stock market has become so concentrated that even broad index funds are no longer well diversified, our columnist says.",T6
231,Late letters are causing distress to some in Britain and fueling criticism of its 500-year-old postal service.,T10
232,Some investors are worried that President Trump’s nominee to run the Federal Reserve may not be a guaranteed “yes” on cutting interest rates.,T2
233,"If confirmed by the Senate, Kevin M. Warsh, a former governor at the central bank, will replace Jerome H. Powell, whose term as chair ends in May.",T2
234,"Historically, U.S. workers with a bachelor’s degree or higher have enjoyed better employment outcomes. That’s starting to shift, labor data shows.",T11
235,The agency has been without a permanent leader since August when Trump fired its previous commissioner Erika McEntarfer over a weaker-than-expected jobs report.,T2
236,The president accused Canada of blocking the sale of U.S.-made Gulfstream aircraft and said he would raise tariffs in the latest dispute to rock the once-chummy relationship.,T1
237,"Venezuelan officials welcomed the announcement, which followed the U.S. capture this month of their president, Nicolás Maduro.",T12
238,"President Donalf Trump nominates Kevin Warsh as new Fed chair, potentially affecting interest rates and the economy",T2
239,The Wall Street veteran once held hawkish views on interest rates but has recently signaled a stance more in line with the president’s public demands.,T2
240,The news comes just two weeks after the parent company filed for bankruptcy. Only 12 off-price stores will remain open.,T4
241,"Historically, U.S. workers with a bachelor’s degree or higher have enjoyed better employment outcomes. That’s starting to shift, labor data shows.",T11
242,The agency has been without a permanent leader since August when Trump fired its previous commissioner Erika McEntarfer over a weaker-than-expected jobs report.,T2
243,The president accused Canada of blocking the sale of U.S.-made Gulfstream aircraft and said he would raise tariffs in the latest dispute to rock the once-chummy relationship.,T1
244,"Venezuelan officials welcomed the announcement, which followed the U.S. capture this month of their president, Nicolás Maduro.",T12
245,"President Donalf Trump nominates Kevin Warsh as new Fed chair, potentially affecting interest rates and the economy",T2
246,The Wall Street veteran once held hawkish views on interest rates but has recently signaled a stance more in line with the president’s public demands.,T2
247,The news comes just two weeks after the parent company filed for bankruptcy. Only 12 off-price stores will remain open.,T4
248,"The cybercriminals in control of Kimwolf -- a disruptive botnet that has infected more than 2 million devices -- recently shared a screenshot indicating they'd compromised the control panel for Badbox 2.0, a vast China-based botnet powered by malicious software that comes pre-installed on many Android TV streaming boxes. Both the FBI and Google say they are hunting for the people behind Badbox 2.0, and thanks to bragging by the Kimwolf botmasters we may now have a much clearer idea about that.",T3
249,"A new Internet-of-Things botnet called Kimwolf has spread to more than 2 million devices, forcing infected systems to participate in massive distributed denial-of-service (DDoS) attacks and to relay other malicious and abusive Internet traffic. Kimwolf's ability to scan the local networks of compromised systems for other IoT devices to infect makes it a sobering threat to organizations, and new research reveals Kimwolf is surprisingly prevalent in government and corporate networks.",T3
250,"Microsoft today issued patches to plug at least 113 security holes in its various Windows operating systems and supported software. Eight of the vulnerabilities earned Microsoft's most-dire ""critical"" rating, and the company warns that attackers are already exploiting one of the bugs fixed today.",T3
251,"Our first story of 2026 revealed how a destructive new botnet called Kimwolf rapidly grew to infect more than two million devices by mass-compromising a vast number of unofficial Android TV streaming boxes. Today, we'll dig through digital clues left behind by the hackers, network operators, and cybercrime services that appear to have benefitted from Kimwolf's spread.",T3
252,"The story you are reading is a series of scoops nestled inside a far more urgent Internet-wide security advisory. The vulnerability at issue has been exploited for months already, and it's time for a broader awareness of the threat. The short version is that everything you thought you knew about the security of the internal network behind your Internet router probably is now dangerously out of date.",T3
253,"KrebsOnSecurity.com celebrates its 16th anniversary today! A huge ""thank you"" to all of our readers -- newcomers, long-timers and drive-by critics alike. Your engagement this past year here has been tremendous and truly a salve on a handful of dark days. Happily, comeuppance was a strong theme running through our coverage in 2025, with a primary focus on entities that enabled complex and globally-dispersed cybercrime services.",T3
254,"The Trump administration has pursued a staggering range of policy pivots this past year that threaten to weaken the nation’s ability and willingness to address a broad spectrum of technology challenges, from cybersecurity and privacy to countering disinformation, fraud and corruption. These shifts, along with the president’s efforts to restrict free speech and freedom of the press, have come at such a rapid clip that many readers probably aren’t even aware of them all.",T7
255,"Direct navigation -- the act of visiting a website by manually typing a domain name in a web browser -- has never been riskier: A new study finds the vast majority of ""parked"" domains -- mostly expired or dormant domain names, or common misspellings of popular websites -- are now configured to redirect visitors to sites that foist scams and malware.",T3
256,"Microsoft today pushed updates to fix at least 56 security flaws in its Windows operating systems and supported software. This final Patch Tuesday of 2025 tackles one zero-day bug that is already being exploited, as well as two publicly disclosed vulnerabilities.",T3
257,A sprawling academic cheating network turbocharged by Google Ads that has generated nearly $25 million in revenue has curious connections to a Kremlin-connected oligarch whose Russian university builds drones for Russia's war against Ukraine.,T3
258,"Dark Reading asked readers whether agentic AI attacks, advanced deepfake threats, board recognition of cyber as a top priority, or password-less technology adoption would be most likely to become a trending reality for 2026.",T7
259,"Security teams need to be thinking about this list of emerging cybersecurity realities, to avoid rolling the dice on enterprise security risks (and opportunities).",T3
260,The Tenable One AI Exposure add-on discovers unsanctioned AI use in the organization and enforces policy compliance with approved tools.,T7
261,"The popular open source AI assistant (aka ClawdBot, MoltBot) has taken off, raising security concerns over its privileged, autonomous control within users' computers.",T7
262,"Advanced persistent threat (APT) groups have deployed new cyber weapons against a variety of targets, highlighting the increasing threats to the region.",T3
263,Federal agencies will no longer be required to solicit software attestations that they comply with NIST's Secure Software Development Framework (SSDF). What that means long term is unclear.,T3
264,"A new around of vulnerabilities in the popular AI automation platform could let attackers hijack servers and steal credentials, allowing full takeover.",T7
265,"If an attacker splits a malicious prompt into discrete chunks, some large language models (LLMs) will get lost in the details and miss the true intent.",T3
266,"In the latest edition of &quot;Reporters' Notebook,&quot; a trio of journalists urge the cybersecurity industry to prioritize patching vulnerabilities, preparing for quantum threats, and refining AI applications,",T7
267,"Ransomware defense requires focusing on business resilience. This means patching issues promptly, improving user education, and deploying multifactor authentication.",T3
268,"Russian and Chinese nation-state attackers are exploiting a months-old WinRAR vulnerability, despite a patch that came out last July.",T3
269,"To stop the ongoing attacks, the cybersecurity vendor took the drastic step of temporarily disabling FortiCloud single sign-on (SSO) authentication for all devices.",T3
270,The retail sector must adapt as consumers become more cybersecurity-conscious. Increased attack transparency is a good place to start.,T3
271,"In two separate campaigns, attackers used the JScript C2 framework to target Chinese gambling websites and Asian government entities with new backdoors.",T3
272,"The region is up against tactics like data-leak extortion, credential-stealing campaigns, edge-device exploitation, and attackers leveraging AI.",T3
273,"AI &quot;model collapse,&quot; where LLMs over time train on more and more AI-generated data and become degraded as a result, can introduce inaccuracies, promulgate malicious activity, and impact PII protections.",T7
274,A new ransomware strain that entered the scene last year has poorly designed code and uses Hebrew language that might be a false flag.,T3
275,"While telnet is considered obsolete, the network protocol is still used by hundreds of thousands of legacy systems and IoT devices for remote access.",T3
276,"To exploit the vulnerability, an attacker would need either system access or be able to convince a user to open a malicious Office file.",T3
277,"The malware-as-a-service kit enables malicious extensions to overlay pages on real websites without changing the visible URL, signaling a fresh challenge for enterprise security.",T3
278,"Moltbook lets 32,000 AI bots trade jokes, tips, and complaints about humans.",T7
279,Ars spoke to several software devs about AI and found enthusiasm tempered by unease.,T7
280,Settlement comes more than 6 years after Gary DeMercurio and Justin Wynn's ordeal began.,T8
281,"We have no proof that AI models suffer, but Anthropic acts like they might for training purposes.",T7
282,"One of the last holdouts for ransomware discussions, RAMP is taken down.",T3
283,"Over 400,000 H200 chips coming to tech giants as China tries to balance tech needs with self-reliance.",T4
284,"The open source ""Jarvis"" chats via WhatsApp but requires access to your files and accounts.",T7
285,Abusing Microsoft's reputation may make scam harder to spot.,T3
286,Unusually detailed post explains how OpenAI handles the Codex agent loop.,T7
287,Company's autodiscover caused users' test credentials to be sent outside Microsoft networks.,T3
288,The onslaught includes LLMs finding bogus vulnerabilities and code that won't compile.,T3
289,"New policy requires ""buy for me"" AI tools and chatbots to obtain permission before accessing the platform.",T7
290,Even well-known services with millions of users are exposing sensitive data.,T3
291,The web's best guide to spotting AI writing has become a manual for hiding it.,T7
292,"Opinion: As software power tools, AI agents may make people busier than ever before.",T7
293,Reseller says Rackspace plans to charge it 706 percent more.,T9
294,Ads coming to free tier and new $8/month ChatGPT Go plan in US.,T14
295,Windows laggards still using the vulnerable hashing function: Your days are numbered.,T3
296,"Amid fears of bubble, world's top chipmaker TSMC says customers just keep asking for more.",T4
297,"Wikimedia Enterprise signs Microsoft, Meta, Amazon, Perplexity, and Mistral to API access deals.",T3
298,"The House Committee on the Budget convened a hearing at which Phillip L. Swagel, CBO's Director, testified about the agency's work. This document provides CBO's answers to questions submitted for the record after the hearing.",T12
299,"As passed by the House of Representatives on December 17, 2025",T12
300,"As reported by the Senate Committee on Health, Education, Labor, and Pensions on September 8, 2025",T12
301,"Federal troop deployments to U.S. cities cost a total of $496 million in 2025, CBO estimates. Continuing current deployments will cost $93 million a month; 1,000 Guard personnel deployed to a city will cost at least $18 million a month.",T10
302,The Majority Leader of the House of Representatives announces bills that will be considered under suspension of the rules in that chamber. CBO estimates the effects of those bills on direct spending and revenues.,T12
303,"As ordered reported by the House Committee on the Judiciary on December 18, 2025",T12
304,"As ordered reported by the House Committee on the Judiciary on November 20, 2025",T12
305,"As ordered reported by the House Committee on Foreign Affairs on January 21, 2026",T12
306,"As ordered reported by the Senate Committee on the Judiciary on January 15, 2026",T12
307,"As ordered reported by the Senate Committee on Veterans’ Affairs on July 30, 2025",T12
308,"As ordered reported by the House Committee on Foreign Affairs on January 21, 2026",T12
309,"As ordered reported by the House Committee on Oversight and Government Reform on December 2, 2025",T12
310,"As ordered reported by the House Committee on Oversight and Government Reform on December 2, 2025",T12
311,"As ordered reported by the House Committee on Oversight and Government Reform on May 21, 2025",T12
312,"As ordered reported by the House Committee on Foreign Affairs on January 21, 2026",T12
313,"As ordered reported by the Senate Committee on Commerce, Science, and Transportation on June 25, 2025",T12
314,"CBO estimates the costs of federal credit programs in 2026 in two ways—following procedures prescribed by the Federal Credit Reform Act and using a fair-value approach, which measures the market value of the government's obligations.",T0
315,"As posted on the website of the House Committee on Rules on January 20, 2026",T12
316,"As posted on the website of the House Committee on Rules on January 20, 2026",T12
317,"As ordered reported by the Senate Committee on Commerce, Science, and Transportation 
on October 21, 2025",T12
318,"The US Census Bureau collects data and reports on the poverty level each year. Their statistical definition of poverty has to do with the affordability of food. As they describe, the Office of Management and Budget’s Directive 14 sets a &#8230; <a href=""https://fredblog.stlouisfed.org/2026/01/food-affordability-and-estimated-poverty/"">Continue reading <span class=""meta-nav"">&#8594;</span></a>",T11
319,"On January 23, 2026, the Bureau of Economic Analysis released real GDP data for all US states for the third quarter of 2025. The FRED map above shows the percentage change growth rates from the previous quarter: Light yellow denotes &#8230; <a href=""https://fredblog.stlouisfed.org/2026/01/real-gdp-growth-by-state-third-quarter-2025/"">Continue reading <span class=""meta-nav"">&#8594;</span></a>",T11
320,"On January 7, 2026, the Bureau of Labor Statistics released the third quarter data for total nonfarm employees at the state and metro levels in 2025. These numbers are being released a little later than usual due to the government &#8230; <a href=""https://fredblog.stlouisfed.org/2026/01/state-and-metro-employment-third-quarter-2025/"">Continue reading <span class=""meta-nav"">&#8594;</span></a>",T11
321,"The scale of US international trade as a share of the entire US economy peaked around 2011. Since then, US international trade has moderated. In this post, we look at how this moderation affected international goods exports from the top &#8230; <a href=""https://fredblog.stlouisfed.org/2026/01/the-current-ranking-of-top-exporting-us-states/"">Continue reading <span class=""meta-nav"">&#8594;</span></a>",T1
