id,text,topic_id
319,"Mortgage loans allow households to buy a home or to borrow money against the value of a home they already own. With mortgage loans, the real estate is offered as collateral, a payback guarantee for the lender. Our FRED graph &#8230; <a href=""https://fredblog.stlouisfed.org/2026/01/what-can-mortgage-loans-do/"">Continue reading <span class=""meta-nav"">&#8594;</span></a>",T1
320,"When the US Census conducts the monthly Current Population Survey on behalf of the Bureau of Labor Statistics (BLS), it asks households more than 200 questions about their employment status. One of those questions is “Do you currently want a &#8230; <a href=""https://fredblog.stlouisfed.org/2026/01/who-wants-a-job-now/"">Continue reading <span class=""meta-nav"">&#8594;</span></a>",T3
321,"Over the course of 2025, the average tariff rate on U.S. imports increased from 2.6 to 13 percent. In this blog post, we ask how much of the tariffs were paid by the U.S., using import data through November 2025. We find that nearly 90 percent of the tariffs’ economic burden fell on U.S. firms and consumers.",T2
322,"The Federal Reserve Bank of New York's <a href=""https://www.newyorkfed.org/microeconomics"" rel=""noreferrer noopener"" target=""_blank"">Center for Microeconomic Data</a> recently released its <a href=""https://www.newyorkfed.org/medialibrary/interactives/householdcredit/data/pdf/HHDC_2025Q4"" rel=""noreferrer noopener"" target=""_blank"">Quarterly Report on Household Debt and Credit</a> for the fourth quarter of 2025, revealing continued growth in household debt balances. Aggregate household debt balances rose by $191 billion to reach $18.8 trillion, marking a $4.6 trillion increase since the end of 2019. Mortgage balances grew by $98 billion to $13.2 trillion, while credit card debt increased by $44 billion to $1.28 trillion. Credit card and auto loan delinquency rates appear to have stabilized, albeit at elevated rates. By contrast, the delinquency rate for mortgages—although still near low levels on a longer-term basis—has been steadily increasing over the past few years. Underlying these aggregate figures, however, there are notable differences in mortgage credit performance across places with different income levels and labor and housing market dynamics. This analysis, as well as the Q",T10
323,"Inflation does not always respond to cost and demand pressures in the same way. When shocks are small, the mapping from costs to prices is roughly proportional—double the shock, double the inflation response. But when the economy is hit by large shocks, this proportionality breaks down. As the recent surge and subsequent decline of global inflation showed, price growth can accelerate—or decelerate—by more than one-for-one relative to the size of the disturbance. Economists refer to this pattern as nonlinear inflation dynamics. In this post, I discuss what these nonlinearities mean, how they relate to the slope of the Phillips curve discussed in a <a href=""https://libertystreeteconomics.newyorkfed.org/2026/02/anatomy-not-autopsy-of-the-phillips-curve"">companion post</a>, and how firm-level data can help us understand the mechanisms behind them.",T2
324,"The relationship between inflation and real economic activity has long been central to debates in macroeconomics and monetary policy. At the core of this debate is the Phillips curve (PC), which measures how strongly inflation reacts to movements in economic conditions. The steepness of this curve matters enormously for monetary policy: if the PC is steeper, inflation rises faster during booms and falls faster in recessions, which entails central banks having to act more forcefully if they want to stabilize inflation around their target. Prior analysis found astonishingly small estimates of the slope of the PC, which suggests that the curve is “flat” (or even dead). In this post, I present evidence from coauthored research showing that, contrary to the conventional view, the Phillips curve is alive and steep, and it captures inflation volatility remarkably well once real marginal cost is used instead of standard real economic activity measures.",T2
325,"The New York Fed’s <a href=""https://www.newyorkfed.org/research/economic-heterogeneity-indicators"" rel=""noreferrer noopener"" target=""_blank"">Economic Heterogeneity Indicators</a> (EHIs) aim to study macroeconomic outcomes experienced by various groups of people and businesses. We recently added a suite of indicators describing the performance of small businesses to the EHIs—both for the region (defined, for the purpose of this study, as New York, New Jersey, and Connecticut) and nationally. Small businesses are critical to employment generation as they accounted for <a href=""https://advocacy.sba.gov/wp-content/uploads/2025/09/EconomicBulletin_SecondQtr2025_090325_FINAL.pdf"" rel=""noreferrer noopener"" target=""_blank"">almost 63 percent of new private sector jobs since 2005</a> and employed <a href=""https://advocacy.sba.gov/wp-content/uploads/2025/06/United_States_2025-State-Profile.pdf"" rel=""noreferrer noopener"" target=""_blank"">almost 46 percent of all U.S. workers in 2025</a>. Thus, understanding economic trends and impacts for small businesses is important for designing effective monetary policy and aligns with the New York Fed’s mission to support the regional economy. In this post",T3
326,"We are enhancing our set of <a href=""https://www.newyorkfed.org/research/economic-heterogeneity-indicators"">Economic Heterogeneity Indicators</a> (EHIs) by adding a set of metrics on consumer spending with data presented by income, education, race and ethnicity, age, and urban status. The data will help track the evolution of aggregate behavior by analyzing the spending of specific groups in a more timely manner than is possible using public surveys.",T3
327,"It is common for price measures to consider changes in quality. That is, a price index might fall even though listed prices are unchanged because the quality of the item has improved. An adjustment for quality captures the fact that consumers are effectively getting more for the same dollar when product quality rises. In practice, however, it is notoriously difficult to measure quality changes since it requires access to detailed data on all product characteristics that matter to consumers. We offer a novel method to infer quality changes and apply it to U.S. import price indices. When we account for quality improvements in this way, we find that the import price inflation based on official measures has been overstated, revealing that consumers have been getting more from their purchases of imported goods than what standard quality adjustments suggest.",T2
328,"In our <a href=""https://libertystreeteconomics.newyorkfed.org/2026/01/disability-in-the-labor-market-employment-and-participation/"">previous post</a> we learned that, in general, people with disabilities participate in the labor market at significantly lower rates, and that they are much more likely to be unemployed. Despite these patterns, we found that the labor force participation of workers with disabilities rose noticeably following the pandemic. A relevant question then is how earnings of workers with disabilities compare with workers without disabilities. In this companion post we investigate differences in weekly earnings for workers with and without disabilities. We find that workers with disabilities earn considerably less than workers without disabilities. Additionally, with few exceptions, their earnings have remained roughly constant in real terms since the pre-pandemic period.",T3
329,"Among people in prime working age (25-54), around 7 percent have a disability of some kind. In this set of companion posts, we will examine how prime-aged workers with disabilities have fared in the labor market compared to the year prior to the pandemic. In this first post, we will show that people with disabilities are far less likely to be employed than people without disabilities, with both lower labor force participation and higher unemployment playing a role. We will also show that although employment rates of people with disabilities are very low, they have risen rapidly during the post-pandemic period, largely because of rising labor force participation. Our results are consistent with an increased prevalence of work from home (WFH) arrangements in the post-COVID period differentially benefiting people with disabilities.",T3
330,"Good measures of labor market tightness are essential to predict wage inflation and to calibrate monetary policy. In an <a href=""https://libertystreeteconomics.newyorkfed.org/2024/10/a-new-indicator-of-labor-market-tightness-for-predicting-wage-inflation/"">October 2024 post</a>, we introduced a new indicator of labor market tightness and showed that it tracked wage inflation best out of a broad range of tightness measures. In this post, we update our index through 2025 and show that it also <em>forecasts</em> future wage inflation best both in and out of sample. In addition, we highlight availability of the index as a <a href=""https://www.newyorkfed.org/research/labor-market-tightness"">new regularly updated feature</a> on the New York Fed's website.",T3
331,"The European Union has been an early adopter of carbon policies, with the introduction of the EU Emissions Trading System (ETS) in 2005. This scheme sets a common price for carbon and is applied to the most polluting manufacturing sectors. By increasing the cost of emissions-intensive production, the system incentivizes firms to decrease their use of fossil fuels. However, as we show in a <a href=""https://libertystreeteconomics.newyorkfed.org/2026/01/what-can-undermine-a-carbon-tax/"">companion post</a>, the policy’s impact was moderated by firms increasing their reliance on high-emissions imports. To eliminate this workaround, the EU will expand the ETS to imports in 2026, through the Carbon Border Adjustment Mechanism (CBAM). The CBAM will essentially put a tariff on imported goods based on their carbon content. Our <a href=""https://www.newyorkfed.org/research/staff_reports/sr1136"">recent work</a> provides a quantitative analysis of how the ETS and CBAM affect firms’ supply choice decisions, and the resulting changes in domestic prices and emissions.<br />",T2
332,"Several countries have implemented a carbon tax or cap-and-trade system to establish high carbon prices and create a disincentive for the use of fossil fuels. Essentially, the tax encourages firms to substitute toward low carbon emission energy. Costs also rise for firms down the supply chain that use production inputs with high-emission content, so the total impact of a carbon tax can be large. In practice, however, firms also have an incentive to find an offset to a carbon tax. In this post, based on our <a href=""https://www.newyorkfed.org/research/staff_reports/sr1136"">recent work</a>, we present evidence of one such adaptation strategy. We show that French firms increased their imports of high-emission inputs from suppliers outside the European Union’s cap-and-trade system, known as the EU Emissions Trading System (EU ETS), reducing the effectiveness of this approach to cutting carbon emissions—an adaptation strategy that leads to “carbon leakage.” To help stop this leakage, the EU is implementing a ""carbon tariff"" in 2026, which is the topic of a <a href=""https://libertystreeteconomics.newyorkfed.org/2026/01/what-is-a-carbon-tariff-and-why-is-the-eu-imposing-one/"">companion po",T2
333,"Why do some entrepreneurs drive economic growth while others do not? This piece discusses <a href=""https://www.nber.org/papers/w33766"">new work </a>that studies entrepreneurs using a comprehensive dataset from Denmark. We study who becomes an entrepreneur, along with their hiring and business decisions, and find that a distinct minority are “transformative.” These individuals, who generate disproportionate productivity gains, tend to have high IQ scores, be well-educated, and hire technical (R&#38;D) workers. The data support the idea of productivity growth being driven by the symbiotic relationship between transformative entrepreneurs and R&#38;D workers. For policymakers, the lesson is that when an economy has more R&#38;D workers and transformative entrepreneurs, they sustain higher long-run productivity growth.",T3
334,"Each year brings a new set of economic challenges: In 2025, major areas of focus included tariffs and trade tensions, as well as the financial pressures facing younger adults. New York Fed economists contributed insightful research on both topics—and readers took notice. In fact, all five of the year’s most-read posts on <em>Liberty Street Economics</em> analyzed aspects of these issues. Read on to see how the restoration of student loan data to credit reports affected borrowers’ credit scores, whether the costs of a college degree are still worth it, how businesses are responding to higher tariffs, and why the U.S. runs a trade deficit.<br />",T2
335,"Call Reports are regulatory filings in which commercial banks report their assets, liabilities, income, and other information. They are one of the most-used data sources in banking and finance. In this post, we describe a <a href=""https://www.newyorkfed.org/research/banking_research/balance-sheets-income-statements"">new dataset</a> made available on the Federal Reserve Bank of New York’s website that contains time-consistent balance sheets and income statements for commercial banks in the United States from 1959 to 2025.",T3
336,"Banks must extract useful signals of a potential borrower's quality from a large set of possibly informative characteristics when making lending decisions. A model that speaks to how banks specialize in lending to an industry in order to better extract signals from data can potentially be applied to a number of real-world scenarios. In this post, we apply lessons from such a model to a topic of timely relevance in economics: job market recommendation letters. Institutions looking to hire new economists must evaluate PhD applicants based on limited and often noisy signals of future performance, including letters of recommendation from these applicants’ advisors or co-authors. Using insights from our model, we argue that the value of these letters depends on who reads them.",T10
337,"Why does the banking industry remain prone to large and costly disruptions despite being so heavily regulated? Is there a need for more regulation, less regulation, or simply different regulation? Our <a href=""https://www.newyorkfed.org/research/staff_reports/sr1155.html"">recent Staff Report</a> combines insights from academic research in economics, finance, and accounting to provide a deeper understanding of the challenges involved in designing and implementing bank regulation, as well as opportunities for future exploration. This post focuses on the regulation of bank capital, but the ideas are applicable more broadly.",T10
338,"This post presents an update of the economic forecasts generated by the Federal Reserve Bank of New York’s dynamic stochastic general equilibrium (DSGE) model. We describe very briefly our forecast and its change since <a href=""https://libertystreeteconomics.newyorkfed.org/2025/09/the-new-york-fed-dsge-model-forecast-september-2025/"" rel=""noreferrer noopener"" target=""_blank"">September 2025</a>. To summarize, growth in 2025 is expected to be stronger than in September due to a lower projected path of the policy rate, as well as higher productivity. Inflation projections are higher in 2025 because of cost-push shocks, which capture the effects of tariffs. The model’s predictions for the short-run real natural rate of interest (or r*) in 2025 have decreased relative to September.",T2
339,"Following the recent passage of <a href=""https://www.congress.gov/bill/119th-congress/senate-bill/1582"" rel=""noreferrer noopener"" target=""_blank"">legislation in the U.S.</a>, payment stablecoins seem to be on the brink of wider-scale adoption and explosive growth in market capitalization. In this post, we contend that the driving factor is not their proximity to digital cash instruments, but rather how they are transferred—via global, open-access, peer-to-peer systems, or “permissionless blockchains,” for short.",T11
340,"There has been a lot of interest in firms’ pricing decisions in the past few years—both during the inflation surge of 2021-23 and in the more recent rounds of tariff increases. In this post, we let firms speak for themselves about what factors they consider when adjusting prices in response to various shocks. The analysis is based on an ongoing research project, joint with the Atlanta and Cleveland Federal Reserve Banks, on how businesses set prices and the extent of passthrough of cost increases. In particular, we leverage the qualitative portion of the study based on open-ended interviews with senior decision-makers on how they approach pricing decisions in their firms. Rather than a uniform approach, a very nuanced picture emerges of businesses trying to balance competing objectives while keeping an eye on demand conditions for their products as well as on their direct competitors’ behavior in the market.",T2
341,"The banks have long had a stranglehold on the credit markets, but the role of private funds is becoming more influential, maintains Julien Thinat, head of distribution and credit solutions APAC, Societe Generale.",T1
342,"The manager commits two-thirds, or $1.6bn, of the total, with $330m of it at closing.",T6
343,"Patria’s first Latin American vintage raised $314m, which the company says delivered a nearly 16% IRR.",T4
344,"Schroders Capital, the private capital arm of Schroders, manages more than $25bn in private equity assets.",T1
345,Investors are not without concerns but are happy to keep increasing their private debt allocations.,T1
346,The manager will use the fund to target first-lien loans to lower mid-market sponsor- and non-sponsor owned borrowers.,T1
347,"Find out how private debt (and other alternative asset classes) have performed. Also, Singapore's Keppel secures major commitment, and Moody's finds defaults declining but stress continuing. Here's today's brief for our valued subscribers only.",T1
348,Privacore VPC Asset-Backed Credit Fund will be seeded with $250m in capital from CNO Financial and Corbin Capital.,T1
349,"Investors are looking to access new geographies, fund structures and sectors through their private credit allocation in the second half of the decade.",T1
350,"Partnership to focus on hybrid, public/private and debt investing. Apollo sees strong growth in earnings from fees and spreads.",T1
351,Ether steadies after $540 million sell wave to outperform wider crypto market,T5
352,"Strategy says it can survive even if bitcoin drops to $8,000 and will 'equitize' debt",T5
353,"Russia's daily crypto turnover is over $650 million, Ministry of Finance says",T5
354,Binance's CZ echoes Consensus panelists on lack of privacy blocking crypto adoption,T12
355,OKX snags European payments license for stablecoin and crypto card expansion,T12
356,"Crypto market drowns in red as bitcoin falls to $68,000",T5
357,Wall Street giant Apollo deepens crypto push with Morpho token deal,T11
358,Hong Kong is trying to build up its crypto regulations: State of Crypto,T11
359,Prediction markets vs. insider trading: Founders admit blockchain transparency is the only defense,T11
360,BlackRock's digital assets head: Leverage-driven volatility threatens bitcoin’s narrative,T5
361,"XRP outruns bitcoin, ether after investors piled into the recent crash",T5
362,Wall Street remains bullish on bitcoin while offshore traders retreat,T5
363,The Genius Act ripple effect: Sui executives say institutional demand has never been higher,T1
364,Elon Musk's X to launch crypto and stock trading in ‘couple weeks’,T11
365,Galaxy’s Steve Kurz sees ‘great convergence’ driving crypto’s long-term outlook,T11
366,"Bitcoin claws back to $70,000 on cooling inflation after $8.7 billion wipeout",T5
367,Trump-linked Truth Social seeks SEC approval for two crypto ETFs,T12
368,Crypto group counters Wall Street bankers with its own stablecoin principles for bill,T11
369,Wall Street analysts slash Coinbase price targets after Q4 miss — but shares rally,T5
370,U.S.-based DeFi group urges UK FCA to anchor crypto rules to 'unilateral control',T12
371,"<p>※この記事は自動翻訳されています。正確な内容につきましては原文をご参照ください。 TL;DR 米国財務省外国資産管理局（OFAC）は、英国およびオーストラリアと連携し、ランサムウェア攻撃を含むサイバー犯罪を支えていたロシアの防弾ホスティング事業者 Media Land, LLC とそのネットワークを制裁指定しました。 今回の措置には、「Yalishanda」などの別名で知られる Aleksandr Volosovik に紐づくbitcoinアドレスが1件制裁指定されていますが、Chainalysis は彼およびその企業体に帰属する数千のアドレスと、数百万ドル規模の暗号資産トランザクションを監視しています。 Volosovik のホスティング基盤は、地下取引所、洗浄サービス、詐欺師、ハッカー、アクセス販売者、マルウェア・アズ・ア・サービス事業者、そして制裁指定済みの LockBit 管理者 Dmitry Khoroshev を含むランサムウェア運営者とそのアフィリエイトまで、サイバー・キル・チェーンのほぼ全工程を支えていました。 指定対象となった複数の法人は、2025年7月の&#8230;</p>
<p>The post <a href=""https://www.chainalysis.com/blog/ofac-targets-russian-cybercrime-infrastructure-ransomware-november-2025-japanese/"">米英豪がロシア系サイバー犯罪基盤を制裁対象に、米国は麻薬密売ネットワークの暗号資産洗浄も標的化</a> appeared first on <a href=""https://www.chainalysis.com"">Chainalysis</a>.</p>",T7
372,"<p>※この記事は自動翻訳されています。正確な内容につきましては原文をご参照ください。 MegaETH 上で開発を行うビルダーの皆さまは、スマートコントラクトやトークン、プロトコル全体を対象にリアルタイムで脅威を検知する Chainalysis の Web3 セキュリティソリューション Hexagate を、今すぐご利用いただけます。 Hexagate は、エクスプロイトやハッキング、ガバナンス面・財務面でのリスクからエコシステムを守るために設計された専用ソリューションです。高度な機械学習（ML）により、不審なパターンやブロックチェーン上のトランザクション（取引履歴）をリアルタイムで検知します。これにより MegaETH の開発者は、重大なインシデントに発展する前に、実行リスクやガバナンスの悪用、トークンの異常挙動をいち早く把握できます。 今回の連携により、MegaETH のビルダーは、自前で複雑な仕組みを構築・運用することなく、エンタープライズ水準のオンチェーンセキュリティモニタリングを利用できます。信頼性を損なうことなく、より速く、より安全にプロダクトをリリースするための効率的な方法です。 このパートナーシップにより、MegaETH のビルダーは以下を無償で利用できます。 Hexagate monitoring：MegaETH 上でのリアルタイムかつ&#8230;</p>
<p>The post <a href=""https://www.chainalysis.com/blog/hexagate-supports-megaeth-ecosystem-smart-contract-security-japanese/"">Chainalysis Hexagate、MegaETH 向けリアルタイム脅威検知を提供</a> appeared first on <a href=""https://www.chainalysis.com"">Chainalysis</a>.</p>",T7
