id,text,topic_id
0,Republican and Democratic lawmakers could not advance a pair of stopgap plans in the Senate that would address the expiring Obamacare subsidies,T10
1,Costco shows investors a mixed financial snapshot on Thursday.,T3
2,"The investing edge is spotting where capital for orbital AI goes first, says Matthew Tuttle",T6
3,Chip-import dependence is a national-security threat. A “chip-for-chip” tariff could be a $230 billion revenue windfall and spur U.S. semiconductor production.,T5
4,Yoga-apparel retailer’s CEO joins the ranks of departing retail executives after tumultuous year.,T5
5,Will the so-called magazine-cover curse strike again?,T5
6,"President Donald Trump wants to show he’s trying to address the high cost of living, so he has rolled back tariffs on many grocery items and made pointed remarks at White House events.",T9
7,"The U.S. stock market just booked fresh record highs, despite economic challenges.",T1
8,“She owns two houses and lives with a disabled son.”,T10
9,“They have already paid the mortgage. It makes no sense to require them to ‘pay’ it again.”,T10
10,U.S. productivity slows down in fourth quarter while unit labor costs accelerate,T9
11,Beyond to buy rights to Buy Buy Baby brand and reunite it with Bed Bath & Beyond,T6
12,Amazon says it had best-ever Thanksgiving Holiday week with record sales and number of items sold,T11
13,U.S. stock futures and bond yields drop on reports Putin has updated nuclear doctrine,T7
14,Charter Communications announces buyout deal for Liberty Broadband at terms above its previous proposal,T6
15,General Motors unveils new all-electric Cadillac called the Vistiq with 300-mile range,T6
16,Vestas Wind Systems stock slumps as company says margins to be at low end of guidance,T1
17,Burberry shares rise on report Moncler could bid for it,T1
18,Kazatomprom reports 17% increase in production during the third quarter,T1
19,Anheuser-Busch InBev shares slip as sales come up shy of estimates,T1
20,Wingstop’s stock slides 12% after profit falls short of estimates,T1
21,Novartis hikes sales and profit guidance for the year,T1
22,Plus500 says it will meet expectations after quarterly revenue climbs 11%,T1
23,Trainline boosts guidance for the second time this year,T7
24,Barclays reports 18% profit rise as it lifts income guidance,T1
25,"London Stock Exchange Group says income grew, led by Tradeweb",T1
26,"The impact of the JLR cyber-attack continued to affect output, while analysts say spending was hit by Budget uncertainty.",T10
27,"The building society failed to monitor its customers' activity effectively between 2016 and 2021, the regulator says.",T10
28,Calvin McDonald's decision to leave at the end of January comes amid a run of poor sales for the firm in the US.,T5
29,The South American nation's output has plummeted and restoring its former glory would be a heavy lift.,T5
30,The $1bn deal will let fans generate videos and images of more than 200 Disney characters on ChatGPT and Sora.,T6
31,"Just a handful of companies can make cadmium zinc telluride, a material with powerful properties.",T5
32,A botched roof extension caused the ceiling to collapse at Kate Morris’s top-floor flat.,T10
33,California's governor Gavin Newsom issued a strongly-worded statement in response to the executive order.,T12
34,Drop-off fees will rise from £7 to £10 at the West Sussex airport from 6 January.,T1
35,It comes after intense scrutiny of the Office for Budget Responsibility in the run-up to the Budget.,T12
36,About 90 workers at a Guinness canning factory in Belfast have walked out in protest over pay.,T9
37,UK researchers will get a chance to develop applications for the tech giant's quantum processor.,T4
38,"In August, Do Kwon pleaded guilty to conspiracy to defraud and wire fraud and apologised for his actions.",T8
39,Targeted support will allow banks and financial firms to make suggestions on how to handle savings.,T0
40,"In an interview with the BBC, Dame Emma Walmsley says she will not ""shy away"" from GSK's US expansion.",T5
41,It comes after ministers struck a deal between businesses and unions aimed at allowing the bill to progress.,T9
42,The cloud computing giant's revenue miss renews questions about its financial health.,T13
43,"Mike Jeffries, who was ruled ""mentally incompetent"" by a court, is now  competent to stand trial, medical experts declare after a forensic evaluation.",T8
44,"Shops, restaurants and even the local council in Lugano now accept the cryptocurrency.",T2
45,Nvidia boss Jensen Huang is among the influential tech figures that adorn one of the two covers.,T6
46,Mexican Senator Armando Rios Piter told CNN that he plans to introduce a bill this week that would stop Mexican purchases of American corn.,T10
47,The days of plugging in an iPhone to charge won't last forever.,T7
48,"Nandan Nilekani, co-founder of one of India's biggest outsourcing companies, says an H-1B visa crackdown would ultimately hurt the U.S.",T5
49,The market is at all-time highs and many say Trump is the reason. But stocks were rallying when investors thought Hillary Clinton would win. Janet Yellen and the Fed may deserve more of the credit for the market's move.,T7
50,Apple stock is less than $1 away from its all-time high amid renewed optimism for the iPhone.,T1
51,President-elect Donald Trump focuses his criticism of NAFTA on Mexico. But Canada and America have a rocky trade history too.,T9
52,"Verizon has decided to bring back unlimited data plans. But while that's great for its subscribers, it's awful news for investors. It's another sign of how brutally competitive the telecom business is. And it's hurting Verizon's stock.",T6
53,The price of crude oil has more than doubled over the past year after bottoming out at $26 per barrel in February 2016.,T11
54,The automaker announced Monday that its first official venture in the oil-rich Middle East will be in the United Arab Emirates.,T4
55,Uber's top rival in India has some unsolicited advice for the U.S. startup: Go local.,T4
56,"Apple CEO Tim Cook wants the tech industry to take action against ""fake news"" stories that are polluting the web.",T4
57,"Sears Holdings, the company that owns retail stores Sears and Kmart, said this weekend that it would remove 31 Trump-branded items from its website.",T9
58,"Universal Biopack makes packaging that it sells to restaurants and manufacturers. But rather than plastic, it uses a mixture of bamboo and cassava.",T5
59,"Nike on Sunday launched a star-studded short film titled ""Equality"" that coincides with Black History Month.",T6
60,"Treasury secretary pick Steven Mnuchin is an executive producer on Warner Bros.' ""The Lego Batman Movie,"" which pulled in an estimated $55.6 million from U.S. audiences during its opening weekend.",T6
61,"It may seem like a recurring nightmare, but Greece is in danger of running out of money again.",T3
62,"US-based rare earth firm REalloys believes it has a road map to build a North American supply chain for critical minerals that bypasses China, working with Canadian and Japanese partners – a potential first, though not without risks and challenges.
The Ohio-based company expects to deliver rare earth products, including magnets, in early 2027, using a non-Chinese sourcing strategy that spans metal supply to procurement. In October, it received a letter of interest from the US Export-Import Bank,...",T5
63,"A federal judge ordered on Friday that US immigration officials could not detain Kilmar Abrego Garcia, hours after his release from immigration detention.
Abrego Garcia was appearing on Friday morning for a scheduled appointment at an Immigration and Customs Enforcement (ICE) field office, some 14 hours after he was released from detention on a judge’s orders. His lawyers asked the judge to block authorities from detaining him again.
Officials cannot re-detain him until the court conducts a...",T0
64,"After witnessing the effects of a tumultuous trade war with the United States this year, China’s top leaders have issued a directive to fortify the domestic economy against persistent or even heightened trade frictions.
Following the annual central economic work conference, which concluded on Thursday and set the agenda for 2026, officials emphasised “better coordinating domestic economic work and international economic and trade struggles”, anchoring a pro-growth strategy for the start of...",T5
65,"Singapore’s government on Friday gazetted as a national monument the former home of founding prime minister Lee Kuan Yew, a site long at the centre of a bitter family dispute among his children.
The action marks a pivotal moment in the saga that has gripped the city state since Lee’s death in 2015, when his children publicly clashed over whether the bungalow at 38 Oxley Road should be preserved or torn down.
Lee’s oldest son, and former prime minister, Lee Hsien Loong, favoured preserving the...",T5
66,"Hong Kong health authorities have urged the public to get the latest Covid vaccine as the next wave of the virus is set to arrive.
The Centre for Health Protection said on Friday active periods of Covid-19 came in cycles of every six to nine months.
More than five months had passed since the last periodic upsurge of Covid activity, it noted, as it asked the public to get the vaccine “in a timely manner” to reduce the risk of serious illness and death.
“According to the centre’s analysis, the...",T5
67,"Catch up on some of SCMP’s biggest China stories of the day. If you would like to see more of our reporting, please consider subscribing.
1. Japan, US defence chiefs cover radar row and other China tensions in phone call
US and Japanese defence chiefs spoke on the phone on Friday about a confrontation between Chinese and Japanese fighter jets over the weekend, with Tokyo saying it did not seek to escalate the tensions.
2. Mexico slaps tariffs of up to 50% on Chinese goods as US trade pact review...",T5
68,"When it comes to building next-generation stealth jets, experience is the foundation of speed, reliability and combat readiness. Handing this critical job to a company with no stealth fighter experience could significantly delay progress and hand competitors a strategic gift.
This is an open message from Yang Shuifeng, a lead designer of China’s cutting-edge stealth fighters.
“The experience and capability of the research and development team cannot start from zero,” Yang, senior engineer and...",T4
69,"Ukrainian President Volodymyr Zelensky visited the strategic frontline town of Kupiansk on Friday, just as Ukrainian forces reported retaking parts of the railway hub and encircling Russian troops.
Standing at the city’s entrance in a bulletproof vest, Zelensky emphasised in a video message that “it is extremely important to achieve results on the front lines so that Ukraine can achieve results in diplomacy”.
“Many Russians talked about Kupiansk – we can see. I was here, I congratulated the...",T5
70,"Tom Barrack, the United States special envoy for Syria, recently made waves at an international forum in Doha, Qatar, by suggesting that “benevolent monarchies” might be the most effective form of government for the Middle East. He also suggested that Israel was not a democracy.
His remarks were probably welcomed in some parts of the region, but probably less well received by the US and other Western media, which all but consider themselves guardians of proper world opinion.
Barrack was just...",T5
71,"Yuen Long Tai Bo Cafe shot to Internet fame after it became the subject of a viral copypasta trend on Threads.
The lengthy text, which has been copied and pasted on various online posts repeatedly, playfully referred to the cafe’s meat patties as “a tastebud nuke” and “Asia’s number one”, prompting a wave of customers to experience the hype, some from as far as Macau.",T5
72,"China is expected to set its fiscal deficit ratio at around 4 per cent of gross domestic product in 2026, analysts said, adding the affirmation of a more prominent role for fiscal policy at this week’s central economic work conference indicates a selective approach to increasing government expenditures.
In a statement issued after the annual conference ended on Tuesday, officials called for maintaining a “necessary deficit size, total debt and expenditure volume”. The December meeting of...",T9
73,"Chinese autonomous-driving technology firm Pony.ai is betting on an “asset-light” strategy and newer generations of low-cost driverless cars to drive growth for its robotaxi operation as the company expects to break even by 2030.
Under the asset-light model, Pony.ai would team up with third-party companies – such as taxi operators or ride-hailing platforms – that would fund the deployment of its robotaxi fleet, according to Leo Wang Haojun, chief financial officer.
Instead of taking on the full...",T4
74,"Manulife (International), one of the biggest life insurers and pension providers in Hong Kong and Macau, has finished moving its domicile to Hong Kong from Bermuda, making it the first insurer to successfully complete the process under a new regime, according to a statement on Friday.
The insurer said the redomiciling was a “strategic milestone” that underscored its confidence in Hong Kong’s role as a leading international financial centre and reinforced the company’s long-standing commitment to...",T5
75,"Hongkong Land is set to launch what it expects to be the largest private real estate fund in Singapore, with more than S$8 billion (US$6.2 billion) in assets under management, including prime commercial projects in the waterfront Marina Bay district.
At inception, the Singapore Central Private Real Estate Fund (SCPREF) would include one-third stakes in One Raffles Quay and Marina Bay Financial Centre Towers 1 and 2, the Hong Kong-based commercial landlord and developer said in a statement on...",T1
76,"The UK is facing an “unprecedented wave of super flu”, a health chief warned on Friday as the health minister urged doctors to call off a threatened five-day strike ahead of Christmas.
Wes Streeting said the state-funded National Health Service (NHS) was in an “incredibly precarious situation” as flu cases mounted, and was facing a “challenge unlike any it has seen since the pandemic”.
NHS figures published on Thursday showed flu cases at a record level for the time of year.
The number of cases...",T5
77,"Taipei mayor Chiang Wan-an is set to visit Shanghai for a joint forum, an event that will be watched closely by Taiwan’s ruling Democratic Progressive Party (DPP).
Chiang will travel to Shanghai on December 27 and 28 for the Shanghai-Taipei City Forum, Taiwan’s Central News Agency reported on Thursday.
On Friday, mainland state news agency Xinhua said the annual forum would convene in Shanghai on December 28 and be based on the theme “Technology Transforming Life”.
The forum, which was first...",T5
78,"Indonesia should tread carefully before deepening ties with Russia, analysts said, after President Prabowo Subianto made an unplanned visit to Moscow this week, raising questions about the diplomatic and economic costs of closer engagement – including how Washington could respond.
Russian President Vladimir Putin welcomed Prabowo on Wednesday, hailing 75 years of what the Kremlin described as “solid and steady” diplomatic relations between the two countries.
The visit was Prabowo’s second to...",T5
79,"A Japanese #MeToo campaigner’s documentary premiered in her homeland on Friday after months of delays, with one audience member saying she hoped it triggered a change in society.
Shiori Ito won a landmark 2019 civil case against a Japanese TV reporter accused of raping her – a charge he denies – and turned her ordeal into a film released last year and screened worldwide.
But some segments of Black Box Diaries contained video and audio that had been clandestinely shot or meant only for use in...",T6
80,"As Beijing prepared to mark the 88th anniversary of the Nanking massacre, China’s military mouthpiece warned on Friday that provocative actions by right-wing Japanese politicians risked plunging Asia into peril.
PLA Daily published the warning in a commentary the day before sirens will sound out across Nanjing, the capital of eastern Jiangsu province, at 10.01am during national commemorations led by the Communist Party’s Central Committee and the State Council.
According to China’s official...",T5
81,"Huawei Technologies is doubling down on foundation models with a newly formed unit, heating up the race for dominance among Chinese tech giants in the artificial intelligence sector.
The AI foundation model unit was established under Huawei’s 2012 Laboratories, the company’s strategic research and development arm that covered domains ranging from wireless technology to AI, according to a report by Chinese media outlet China Star Markets this week.
The department was actively recruiting AI...",T4
82,Legal challenge is first shot across the bows as Brussels aims to use funds for €90bn loan to Ukraine,T13
83,Move backed by Brussels would transform the bloc’s approach to admitting new members,T3
84,The Nvidia chief executive has been the driving force behind the massive AI boom that has the capacity to reshape the global economy,T6
85,The surge in the precious metal’s price could have ominous implications for the markets,T7
86,FT investigation sheds light on Wirecard fraudster’s activities in north Africa and shadow life as a Russian agent of influence,T8
87,‘International Manager’ programme closed to new recruits as CEO Georges Elhedery reshapes Europe’s largest lender,T13
88,CEO Marc Rowan has said private equity is no longer the $900bn group’s growth driver,T13
89,Kansas City’s Jeff Schmid says long-term borrowing costs will rise if policymakers lose their ‘credibility’,T10
90,Decision eases concerns that central bankers aligned with the US president would block them remaining in their roles,T9
91,"New York judge says Terraform Labs’ co-founder committed ‘fraud on an epic, generational scale’",T8
92,"U.S. stocks were mostly lower, with the Nasdaq leading declines as makers of AI infrastructure suffered steep falls, many in the double digits. Nvidia was down 16%.",T1
93,"Gold settled 1.4% lower, down two of the past three sessions, and silver fell 2.5%, down three of the past four sessions.",T7
94,"Panic fueling the selloff of Nvidia, Broadcom and other tech giants is overblown.",T6
95,"Gain insight on Experian, SoFi Technologies and more in the latest Market Talks covering Financial Services.",T13
96,"Arabica coffee prices hit a record level, as traders digested the withdrawal of President Trump’s threats to impose tariffs and economic sanctions on Colombia.",T11
97,The Yen and Swiss Franc were stronger against the dollar as investors sought safe havens after Chinese start-up DeepSeek’s new AI model hit U.S. tech stocks.,T11
98,U.S. natural gas futures fell after weekend updates took some of the chill out of early February weather forecasts.,T7
99,QXO is taking its offer directly to shareholders after being rebuffed on several occasions.,T1
100,Maverick Natural Resources has operations in Texas and Oklahoma.,T5
101,"There are some new wrinkles, especially for those who sell things online or bought an EV.",T6
102,Companies with good payouts are now the hottest bet in China markets.,T1
103,The 10-year U.S. Treasury yield fell and ING said the the long end of the Treasury curve will continue trading at higher yields even as Trump hasn’t delivered anything to shock markets so far.,T7
104,Oil edged lower in early trade as Goldman Sachs said the latest round of U.S. sanctions against Russia haven’t had a significant impact on the country’s oil exports.,T11
105,"There is little sign of crimped demand for equities among individual investors, who remain bullish after two years of blockbuster gains.",T3
106,Check out the stocks Heard on the Street writers favor in their eighth annual stock-picking contest.,T1
107,The real costs of owning a house in neighborhoods that are vulnerable to flooding and wildfires are becoming clearer.,T10
108,"Venture-capital firms are bringing AI and dealmaking to accounting, property management and other unglamorous fields.",T4
109,"Recent court cases reveal how middlemen are facilitating a booming trade, eluding a crackdown.",T1
110,The story of home affordability in the U.S. told from a single front porch.,T10
111,The president has told Bank of America and JPMorgan Chase to stop cutting conservatives off from doing business.,T9
112,"Baird downgrades PayPal after weak Q4 volumes, spending cycle cloud turnaround",T2
113,"Less New York, more Nashville: Europeans head to smaller US cities",T9
114,Nvidia edges higher premarket amid report company is mulling hike to H200 output,T6
115,"Thursday’s Insider Activity: Major Buys in Mining, Tech Amid Notable Sells",T6
116,Universal submits remedy to EU’s objections over Downtown deal,T13
117,"Analysis-Oracle’s stumble hits AI trade, but many remain bullish",T4
118,UBS shares rise as Swiss lawmakers propose compromise on capital rules,T1
119,Swiss to reduce F-35 fighter jet order from US as costs rise,T11
120,Jefferies downgrades Galp as TotalEnergies takes control of Mopane,T2
121,Arcus Biosciences stock falls after discontinuing phase 3 cancer study,T1
122,Dollar set for weekly loss; sterling weakens after GDP drop,T7
123,Asia FX steady as traders assess Fed outlook; rupee hits fresh record low,T11
124,USD/ZAR: South African rand poised for strength as BofA sees parallels to 2003 rally,T3
125,Dollar slips lower after Fed rate cut; euro set for weekly gains,T7
126,"Asia FX tepid after Fed cut; Aussie falls on weak jobs data, rupee near record low",T11
127,This is one of Goldman’s ’high-conviction’ FX calls for 2026,T7
128,Czech koruna forecast adjusted by UBS as currency rally slows,T7
129,Dollar slips ahead of Fed rate decision; Powell’s speech in spotlight,T7
130,"Asia FX, dollar muted amid Fed caution; China data shows deflation persists",T11
131,Deutsche Bank forecasts S&P 500 to hit 7000 by end of 2025,T7
132,"Trump's tariffs, Fed minutes, Rumble's Bitcoin buy - what's moving markets",T7
133,Bitcoin price today: slips to $94k as risk appetite sours on Trump tariff threat,T7
134,2025 macro outlook for the US is 'murky at best' says Deutsche Bank,T7
135,Trump says he will impose additional 10% tariffs on China over drug inflow,T9
136,"Asia stocks fall after Trump threatens tariffs, Japan's Nikkei leads losses",T11
137,"S&P 500 positioning levels at record highs, pullback risks rise, Citi warns",T7
138,"Analyst calls Bitcoin 'global bubble', could soar to infinity",T3
139,Stock market today: Dow hits record as Trump's pick for Treasury stokes optimism,T7
140,Jump in Tesla stock mostly driven by 'animal spirits/momentum' says UBS,T1
141,"Federal Reserve Board announces approval of application by Banco BTG Pactual S.A., its parent holding companies, and subsidiary, BTG Pactual Bancorp, LLC",T0
142,"Federal Reserve Board announces approval of application by The PNC Financial Services Group, Inc.",T0
143,Federal Reserve Board announces reappointment of Reserve Bank presidents and first vice presidents,T0
144,"Federal Reserve Board announces termination of enforcement actions with Credit Suisse Group AG, Credit Suisse AG, Credit Suisse Holdings (USA), Inc., Credit Suisse AG, New York Branch, and JPMorgan Chase &amp; Co.",T0
145,Federal Reserve Board and Federal Open Market Committee release economic projections from the December 9-10 FOMC meeting,T0
146,Federal Reserve Board issues enforcement action with former employee of Synovus Bank,T0
147,"Federal Reserve Board announces pricing, effective January 1, 2026, for payment services the Federal Reserve Banks provide to banks and credit unions",T0
148,"Federal Reserve Board requests public input on the impact of potential strategic changes to check services provided by the Fed, as well as check usage and preferences",T0
149,Federal Reserve Board issues enforcement action with former employee of First Financial Bank,T0
150,"Federal Reserve Board announces approval of application by Steel Newco, Inc",T0
151,"Minutes of the Board's discount rate meetings on October 6, October 20, and October 29, 2025",T12
152,Agencies issue proposal to enhance community banks’ ability to serve their communities while maintaining strong capital requirements,T0
153,Agencies issue final rule to modify certain regulatory capital standards,T0
154,Federal Reserve Board issues enforcement action with former employee of Orrstown Bank,T0
155,Federal Reserve announces College Fed Challenge winners,T0
156,Federal Reserve Board releases results of survey of senior financial officers at banks about their strategies and practices for managing reserve balances,T0
157,"Federal Reserve Board announces it will extend until February 21, 2026, the comment period on proposal to improve stress test model and scenario transparency and accountability",T0
158,"Minutes of the Federal Open Market Committee, October 28-29, 2025",T12
159,Federal Reserve Board releases information regarding enhancements to bank supervision,T0
160,"Keeper, founded in 2022, raised $4 million in pre-seed funding. Here's the startup's current pitch deck.",T1
161,"Trump has said AI would be ""destroyed in its infancy"" if companies have to comply with 50 different sets of regulations.",T4
162,"A New Zealand McDonald's is located inside a decommissioned plane, and multiple restaurants have been built inside historic homes.",T5
163,"I returned to the US after living in Europe for years, and noticed a lot of lifestyle changes, including the way I grocery shopped, worked, and ate.",T9
