id,text,topic_id
164,Disney faces an engagement problem as kids gravitate to YouTube. It's looking to OpenAI to help boost engagement.,T4
165,"Taylor Swift is known for her glamorous red-carpet looks and sparkling stage outfits. In her everyday life, she's equally fashionable and flashy.",T6
166,"After many arguments with my husband about when to leave for flights, we started arriving at the airport separately. This trick helped our marriage.",T4
167,OpenAI said Thursday it had struck a licensing agreement to use Disney's characters and other intellectual property.,T4
168,Companies face a big question: Are AI companies friend or foe?,T4
169,"HD Hyundai built two new guided-missile frigates for the Philippine Navy, giving it a firepower upgrade for South China Sea.",T6
170,"Nick Leeson is a former derivatives trader who caused the collapse of Barings, London's oldest merchant bank, which had operated for 233 years.",T3
171,"Malmö, Sweden, is just 20 minutes from Copenhagen, Denmark, via train. Affordable and fun, it's totally worth adding to your trip to Scandinavia.",T5
172,"An InMarket report found that, though consumers favor store brand coffee as prices continue to rise, Starbucks products remain their top choice.",T5
173,Ukrainian special operators described to Business Insider how they came under Russian fire driving buggies near the front lines.,T8
174,Larry Ellison saw his wealth plunge after Oracle's earnings miss spooked investors and raised fresh questions about the company's massive AI spending.,T13
175,"Law firms can't stop lawyers from tinkering with chatbots, so they're adding hallucination detectors.",T4
176,"From making real estate investing more attainable to developing 500-square-foot homes to fit in your backyard, here's why these rising stars of real estate are the ones to watch in 2025.",T10
177,"Barak Turovsky said that if a company wants to integrate AI on a software level, it needs someone with a different kind of expertise.",T4
178,The Grinch seems to be everywhere lately. At McDonald's. In the aisles at Walmart. In memes online. It's a sign of our times.,T11
179,"An internal memo, obtained by Business Insider, assessed Microsoft's deployment of cutting-edge GPUs.",T4
180,Proposal would simplify capital structure with something similar to US stress capital buffer,T0
181,Customer and total funds rose in early November as most FCMs reported declines,T1
182,"After some investors took profits in September, those that stayed in the trade are now doubling down",T1
183,"Swiss planning, large joint faculty and public presentations shape the programme",T6
184,"Note issuers sell vol to flatten exposures as Alibaba, BYD, Tencent zig-zag lower",T7
185,"Using data from January 1986 to December 2023, the authors explore the time-varying impact of energy prices on the US stock market.",T11
186,LSEG is developing its cloud-based data service to reflect how financial institutions now use information to feed systems and generate insight,T13
187,The authors investigate how personal credit data can be combined with business-level and tradeline variables in a machine learning framework to enhance default prediction.,T0
188,"Emerging market FX carry trades have generated 7.5% returns since April, but dealers question longevity",T1
189,Gauges of stock market risk rise 36% in just one year,T1
190,"As January 1 nears, Dutch pension funds consider unwind timing to avoid rush to the exit in thin year-end liquidity",T3
191,The replacement of risk-neutral pricing with entropic risk optimisation,T7
192,Changes in model confidence levels could still trip supervisory threshold even after relaxation in final RTS,T0
193,"Bank of America crosses 500bp threshold for first time, as Basel continues review",T0
194,Higher government bond yields and steeper forward curves fuel demand for new range of fixed income structures,T10
195,A shift towards market micro-structure and ML has reshaped the programme,T13
196,This paper proposes a benchmark model which can be used to predict the forward-looking probability of default of a real-world credit card portfolio.,T0
197,An SEC panel recently debated the ramifications of a future with tokenised equities,T3
198,"The author suggests a means to design a statistically distinguishable rating scale that is not excessive in relation to the existing observation statistics, allowing for more stable validation.",T10
199,The monthly trade deficit fell to its lowest level in five years after the president’s imposition of sweeping global tariffs. But it’s unclear whether the trend will persist.,T11
200,The president continues to brush off an issue that he said he would solve in his first months in office. Some Democrats say he is making the same mistake as his predecessor.,T9
201,"The central bank’s decision to lower interest rates for a third straight meeting was highly contentious, reflecting an internal divide that will likely limit how much borrowing costs will fall next year.",T0
202,President Trump’s decision to allow Nvidia to sell its chips to China has raised questions about whether he is prioritizing short-term economic gain over long-term American security interests.,T5
203,Silicon Valley is again betting everything on a new technology. But the mania is not a reboot of the late-1990s frenzy.,T6
204,The president rolled out a $12 billion bailout for farmers as he makes the case that his policy is working — or will soon.,T9
205,The chair of the central bank is dealing with internal divisions while being besieged by President Trump and front-runners jockeying to replace him.,T0
206,"A wave of companies are petitioning for exemptions from the Trump administration’s high levies on foreign-made goods, saying they are hurting business and raising prices.",T9
207,"Readers told us how insurers are raising premiums and, in some cases, cutting back coverage, as climate change shakes up the real estate market.",T10
208,Hearings that began Wednesday in Washington reflected anxiety over the future of the U.S.-Mexico-Canada trade pact and whether the president could end up scrapping it.,T9
209,"While growing evidence shows that carbon emissions are harming the economy, the journal Nature found that an outlier paper had deep flaws.",T10
210,"The scores aimed to predict a property’s risk from fires, floods and storms, but some in the real estate industry as well as homeowners have called them inaccurate.",T10
211,Data on spending this week shows that consumers are shopping big for the holidays despite inflation and economic worries.,T11
212,"The plan presented by the chancellor of the Exchequer, Rachel Reeves, called for spending increases and higher taxes on the wealthy and the middle class.",T9
213,Some experts see a dangerous combination of factors reminiscent of practices that led to previous financial crises.,T0
214,The Trump administration is spending billions of dollars on deals with ownership stakes in companies. The unusual practice shows no sign of slowing.,T1
215,"In an unusual move, Xi Jinping, the leader of China, called President Trump. The two spoke about trade, Taiwan and Ukraine, according to separate official statements.",T5
216,"With Russia looming, governments race to rebuild armed forces that shrank after the Cold War, grappling with hard issues of economics, politics and military strategy.",T5
217,"What does the September jobs report, delayed by six weeks because of the government shutdown, say about the economy? Lydia DePillis, our economics reporter, describes how the report, which was better than expected, comes at a moment of deep uncertainty.",T10
218,"As fewer people carry cash, vendors, street performers and people experiencing homelessness and unemployment are at a disadvantage.",T9
219,The lawsuit was a warning to European officials who are racing to agree to a plan to use Russian government assets in Europe to lend money to Ukraine.,T8
220,"Backed by White House officials, the tech billionaire has lashed out at the European Union after his social media platform X was fined last week.",T8
221,Changes in the tax law will have different effects on people who take the standard deduction versus high earners who itemize.,T9
222,The Oracle co-founder has pledged billions to finance Paramount’s takeover bid for Warner Bros. Discovery — which has questions about his commitment.,T6
223,"Investment in manufacturing, infrastructure and property is expected to fall this year, a remarkable turn for an economy whose growth reshaped the world.",T11
224,"Larry Ellison is backstopping Paramount’s bid for Warner Brothers, but Warner Brothers is concerned that the billionaire has not provided a personal guarantee to pay.",T6
225,"A retired lawyer lost the money in a tech support scam, a type of online fraud that is surging. Citibank said it couldn’t recover the funds, which criminals wired from inside his account.",T13
226,"As more people tune in for the “theater” of high-end auctions, Bonnie Brennan is trying to convert them into clients.",T13
227,"Harold Hamm, an Oklahoma oil tycoon, has played a central role in reshaping energy policy by allying himself with President Trump.",T9
228,The bar crawl and charity fund-raiser has been eliciting strong reactions in the city for more than 25 years. Readers shared theirs.,T1
229,"For China, President Trump’s moves to loosen chip controls, soften U.S. rhetoric and stay silent on tensions with Japan amount to a rare string of strategic gains.",T5
230,"The loss of federal funding forced a difficult decision, the executive director of Arkansas TV said: Cut PBS, or go off the air entirely.",T10
231,The maker of yoga clothing is looking for a new leader after public pressure from the company’s founder.,T6
232,"Do Kwon, who designed the virtual currencies Luna and TerraUSD, which plunged in 2022, had pleaded guilty to fraud.",T8
233,The S&amp;P 500 edged higher as investors shrugged off concerns over Oracle’s earnings. It was just enough.,T1
234,The Treasury Secretary unveiled changes to the Financial Stability Oversight Council to ease “overregulation.”,T0
235,"Carl Erik Rinsch secured funding from the streaming company for a science-fiction series, “Conquest,” that was never completed.",T6
236,"A master of leveraged buyouts, he bought baseball and hockey teams in Texas and an English soccer club, only to lose them in an avalanche of debt.",T1
237,"A tangle of problems at IndiGo, the dominant carrier, resulted in gridlocked airports across the country. Worse, it was the symptom of an even bigger problem.",T4
238,"The deal is a watershed for Hollywood, which has been trying to sort through the possible harms and upsides of generative artificial intelligence.",T4
239,A pilot program created by the Trump administration may boost the fortunes of companies eager to have air taxis in the skies in time for the 2028 Olympics in Los Angeles.,T4
240,The move marks an escalation in the Trump administration’s overhaul of fair housing enforcement.,T10
241,"Twenty Republicans joined with Democrats to overturn the order, but it faces steep odds in the Senate.",T12
242,The president is expected to attempt to classify marijuana similar to some common prescription painkillers and other drugs.,T9
243,"“We recognize a force that has dominated the year’s headlines, for better or for worse,” editor in chief Sam Jacobs writes in explaining the magazine’s choice.",T11
244,"The Federal Reserve cut interest rates by a quarter of a percentage point, seeking to steady a softening labor market.",T0
245,"Kevin Hassett continues to be the top candidate to replace Jerome Powell as Federal Reserve chair, with the president expected to make a decision in the coming weeks.",T0
246,"The Federal Reserve cut interest rates Wednesday. Here’s what that means for your mortgages, car loans and credit cards.",T0
247,A pilot program created by the Trump administration may boost the fortunes of companies eager to have air taxis in the skies in time for the 2028 Olympics in Los Angeles.,T4
248,The move marks an escalation in the Trump administration’s overhaul of fair housing enforcement.,T10
249,"Twenty Republicans joined with Democrats to overturn the order, but it faces steep odds in the Senate.",T12
250,The president is expected to attempt to classify marijuana similar to some common prescription painkillers and other drugs.,T9
251,"“We recognize a force that has dominated the year’s headlines, for better or for worse,” editor in chief Sam Jacobs writes in explaining the magazine’s choice.",T11
252,"The Federal Reserve cut interest rates by a quarter of a percentage point, seeking to steady a softening labor market.",T0
253,"Kevin Hassett continues to be the top candidate to replace Jerome Powell as Federal Reserve chair, with the president expected to make a decision in the coming weeks.",T0
254,"The Federal Reserve cut interest rates Wednesday. Here’s what that means for your mortgages, car loans and credit cards.",T0
255,"Microsoft today pushed updates to fix at least 56 security flaws in its Windows operating systems and supported software. This final Patch Tuesday of 2025 tackles one zero-day bug that is already being exploited, as well as two publicly disclosed vulnerabilities.",T14
256,A sprawling academic cheating network turbocharged by Google Ads that has generated nearly $25 million in revenue has curious connections to a Kremlin-connected oligarch whose Russian university builds drones for Russia's war against Ukraine.,T8
257,"China-based phishing groups blamed for non-stop scam SMS messages about a supposed wayward package or unpaid toll fee are promoting a new offering, just in time for the holiday shopping season: Phishing kits for mass-creating fake but convincing e-commerce websites that convert customer payment card data into mobile wallets from Apple and Google. Experts say these same phishing groups also are now using SMS lures that promise unclaimed tax refunds and mobile rewards points.",T8
258,"A prolific cybercriminal group that calls itself ""Scattered LAPSUS$ Hunters"" made headlines regularly this year by stealing data from and publicly mass extorting dozens of major corporations. But the tables seem to have turned somewhat for ""Rey,"" the moniker chosen by the technical operator and public face of the hacker group: Earlier this week, Rey confirmed his real life identity and agreed to an interview after KrebsOnSecurity tracked him down and contacted his father.",T8
259,"On the surface, the Superbox media streaming devices for sale at retailers like BestBuy and Walmart may seem like a steal: They offer unlimited access to more than 2,200 pay-per-view and streaming services like Netflix, ESPN and Hulu, all for a one-time fee of around $400. But security experts warn these TV boxes require intrusive software that forces the user's network to relay Internet traffic for others, traffic that is often tied to cybercrime activity such as advertising fraud and account takeovers.",T6
260,"In March 2024, Mozilla said it was winding down its collaboration with Onerep -- an identity protection service offered with the Firefox web browser that promises to remove users from hundreds of people-search sites -- after KrebsOnSecurity revealed Onerep's founder had created dozens of people-search services and was continuing to operate at least one of them. Sixteen months later, however, Mozilla is still promoting Onerep. This week, Mozilla announced their partnership with Onerep will officially end next month.",T8
261,An intermittent outage at Cloudflare on Tuesday briefly knocked many of the Internet's top destinations offline. Some affected Cloudflare customers were able to pivot away from the platform temporarily so that visitors could still access their websites. But security experts say doing so may have also triggered an impromptu network penetration test for organizations that have come to rely on Cloudflare to block many types of abusive and malicious traffic.,T8
262,"Microsoft this week pushed security updates to fix more than 60 vulnerabilities in its Windows operating systems and supported software, including at least one zero-day bug that is already being exploited. Microsoft also fixed a glitch that prevented some Windows 10 users from taking advantage of an extra year of security updates, which is nice because the zero-day flaw and other critical weaknesses patched today affect all versions of Windows, including Windows 10.",T14
263,"Google is suing more than two dozen unnamed individuals allegedly involved in peddling a popular China-based mobile phishing service that helps scammers impersonate hundreds of trusted brands, blast out text message lures, and convert phished payment card data into mobile wallets from Apple and Google.",T8
264,"The U.S. government is reportedly preparing to ban the sale of wireless routers and other networking gear from TP-Link Systems, a tech company that currently enjoys an estimated 50% market share among home users and small businesses. Experts say while the proposed ban may have more to do with TP-Link's ties to China than any specific technical threats, much of the rest of the industry serving this market also sources hardware from China and ships products that are insecure fresh out of the box.",T6
265,"The Trump administration appears to have dropped sanctions against Chinese actors for the Salt Typhoon attacks on US telecoms; but focusing on diplomacy alone misses the full picture, experts say.",T5
266,"Hamas's best hackers have been maturing, building better malware, and spreading their attacks more widely across the region.",T14
267,Dark Reading will continue to publish Tech Talks and Ask the Expert pieces in the Commentary section. Read on for submission guidelines.,T4
268,"Wiz disclosed a still-unpatched vulnerability in self-hosted Git service Gogs, which is a bypass for a previous RCE bug disclosed last year.",T14
269,Using artificial intelligence in operational technology environments could be a bumpy ride full of trust issues and security challenges.,T4
270,"Microsoft puts the power of AI in the hands of everyday non-technical Joes. It's a nice idea, and a surefire recipe for security issues.",T4
271,The initial access broker has been weaponizing endpoint detection and response (EDR) platforms and Windows utilities in recent high-precision attacks.,T14
272,"A new twist on the social engineering tactic is making waves, combining SEO poisoning and legitimate AI domains to install malware on victims' computers.",T14
273,"So far the attacks, which compromise virtual network computing (VNC) connections in OT systems, have not been particularly destructive, but this could change as they evolve.",T14
274,"Ransomware actors have targeted manufacturers, retailers, and the Japanese government, with many organizations requiring months to recover.",T8
275,"Proof-of-concept exploit code is publicly available for two other flaws in this month's Patch Tuesday. In total, the company issued patches for more than 1,150 flaws this year.",T14
276,"Shanya is the latest in an emerging field of packing malware, selling obfuscation functionality in order to help ransomware actors reach their target.",T8
277,"Think &quot;Blade Runner,&quot; but the robots can be hacked more easily than your home computer.",T4
278,Google has fixed a critical vulnerability that enabled attackers to add malicious instructions to common documents to exfiltrate sensitive corporate information.,T14
279,"The Apache Software Foundation's earlier fix for a critical Tika flaw missed the full scope of the vulnerability, prompting an updated advisory and CVE.",T14
280,"Attacks against CVE-2025-55182, which began almost immediately after public disclosure last week, have increased as more threat actors take advantage of the flaw.",T14
281,The US Treasury's Financial Crimes Enforcement Network shared data showing how dramatically ransomware attacks have changed over time.,T8
282,"&quot;Broadside&quot; is targeting a critical flaw in DVR systems to conduct command injection attacks, which can hijack devices to achieve persistence and move laterally.",T14
283,"Software teams at Google and other Rust adopters see safer code when using the memory-safe language, as well as fewer rollbacks and less code review.",T14
284,"Remember when Apple put that U2 album in everyone's music libraries? India wanted to do that to all of its citizens, but with a cybersecurity app. It wasn't a good idea.",T14
285,Company claims new AI model tops Gemini and matches humans on 70% of work tasks.,T4
286,"Three-year deal lets users create AI videos of Mickey Mouse, Darth Vader, and more.",T4
287,Company raises its capital expenditure forecast as it doubles down on AI infrastructure bet.,T6
288,"Devstral 2 model scores 72% on industry benchmark, nearing proprietary rivals.",T4
289,“Abandonment” offers rare chance to reclaim one of tech’s most recognized brands.,T6
290,"Facebook agrees to change ""pay or consent"" model after talks with European Commission.",T13
291,Defendants were convicted of similar crimes a decade ago. How were they cleared again?,T8
292,Open source React executes malicious code with malformed HTML—no authentication needed.,T14
293,"Report: Microsoft declared ""the era of AI agents"" in May, but enterprise customers aren't buying.",T4
294,"Researchers say there's more to the network, which has operated for 14 years.",T4
295,"Three years after Google sounded alarm bells over ChatGPT, the tables have turned.",T8
296,New research offers clues about why some prompt injection attacks may succeed.,T14
297,"Product development, internal operations among teams expected to be hit hardest.",T4
298,"Several companies are selling crypto stockpiles in effort to fund share buybacks, shore up stock prices.",T2
299,Plan will offer guaranteed payments for British startups making AI hardware,T4
300,"Voting system required three keys. One of them has been ""irretrievably lost.""",T2
301,"So far, the hackers are laying low, likely for later use.",T14
302,Google's AI infrastructure chief tells staff it needs thousandfold capacity increase in 5 years.,T4
303,"""I worry this is the big botnet flexing,"" CEO said. But outage was self-inflicted.",T8
304,"CBO finds that maintenance for Navy destroyers and amphibious warfare ships has often taken longer and required more labor than planned. Those delays affect the fleet's readiness and reflect aging ships, late inspections, and other factors.",T9
305,"As reported by the House Committee on Energy and Commerce on October 3, 2025",T12
306,"Rules Committee Print 119-16, As Posted on the Website of the House Committee on Rules on December 7, 2025",T12
307,"The federal budget deficit totaled $439 billion in October and November 2025, the first two months of fiscal year 2026, CBO estimates. That amount is $185 billion less than the deficit recorded during the same period last fiscal year.",T10
308,"As ordered reported by the House Committee on Oversight and Government Reform on December 2, 2025",T12
309,"As ordered reported by the House Committee on Oversight and Government Reform on 
December 2, 2025",T12
310,"As ordered reported by the House Committee on Oversight and Government Reform on December 2, 2025",T12
311,"As ordered reported by the House Committee on Oversight and Government Reform on 
December 2, 2025",T12
312,"As ordered reported by the House Committee on Oversight and Government Reform on 
December 2, 2025",T12
313,"As ordered reported by the House Committee on Oversight and Government Reform on 
December 2, 2025",T12
314,"As ordered reported by the House Committee on Oversight and Government Reform on 
December 2, 2025",T12
315,"As ordered reported by the House Committee on Oversight and Government Reform on 
December 2, 2025",T12
316,"As ordered reported by the House Committee on Oversight and Government Reform on 
December 2, 2025",T12
317,"As ordered reported by the House Committee on Oversight and Government Reform on 
December 2, 2025",T12
318,"As ordered reported by the House Committee on Oversight and Government Reform on 
December 2, 2025",T12
319,"As ordered reported by the House Committee on Oversight and Government Reform on 
December 2, 2025",T12
320,"As ordered reported by the House Committee on Oversight and Government Reform on 
December 2, 2025",T12
321,"As ordered reported by the House Committee on Oversight and Government Reform on 
December 2, 2025",T12
322,"All Federal Reserve Banks operate within a specific geographic area—called a district. The Cleveland Fed is in the Fourth District of the Federal Reserve System, which covers Ohio and parts of Pennsylvania, Kentucky, and West Virginia. The Cleveland Fed&#8217;s Survey &#8230; <a href=""https://fredblog.stlouisfed.org/2025/12/cleveland-fed-data-on-regional-economic-conditions/"">Continue reading <span class=""meta-nav"">&#8594;</span></a>",T0
323,"What’s really happening in US manufacturing? In our FRED graph above, we compare labor productivity for all workers in the manufacturing sector alongside the share of manufacturing employment in total US nonfarm employment since 1987. The graph tells a compelling &#8230; <a href=""https://fredblog.stlouisfed.org/2025/12/manufacturing-employment-and-productivity/"">Continue reading <span class=""meta-nav"">&#8594;</span></a>",T9
324,"In 2025, many US households reported a surge in electricity prices. According to the producer price index (PPI) for residential electric power, these prices have gone up by 7% between January and August 2025. This rise in prices can be &#8230; <a href=""https://fredblog.stlouisfed.org/2025/12/the-divergence-of-electricity-and-natural-gas-prices/"">Continue reading <span class=""meta-nav"">&#8594;</span></a>",T11
