id,text,topic_id
162,"Stars and Stripes journalists worry the Pentagon's anti-""woke"" overhaul will shatter their ability to provide the timely information troops need.",T13
163,"The job market can be tough. Building your skills, credentials, and network can help insulate your career when job security feels fleeting.",T8
164,"Costco sells a lot of brand-name goods for less than a typical retailer, but choosing the club's Kirkland Signature brand can really maximize savings.",T14
165,"While you may hear about dumbphones and digital detoxes, many people still think that social media is good for them.",T8
166,"From Elon Musk to Mark Zuckerberg, here's a look back at what industry titans were doing 10 years ago and what has changed.",T8
167,A millennial says quitting her Microsoft job to raise  her child was crucial for their development. She's now weighing a return to work.,T12
168,"""This bill is a scam. It is not a congressional stock trading ban,"" Rep. Alexandria Ocasio-Cortez told Business Insider.",T7
169,"Jay Mandel spent decades in the corporate world in marketing roles before turning to Uber Eats last fall. It pays the bills and is humbling, he said.",T14
170,"ACA subsidies expiring leaves 1.4 million fewer insured compared to 2025, as CMS data shows enrollment declines in Florida and other Southern states.",T10
171,Star Wars has new leaders as Lucasfilm chief Kathleen Kennedy steps down. Analysts shared their thoughts on how Disney should manage the franchise.,T12
172,"Lloyd Fisher shared what his career change, from corporate marketing to starting his own small landscaping business, has been like.",T14
173,"Millennials are officially all grown up, as the youngest members of the generation hit 30 this year.",T12
174,"When you're in a calorie deficit, which is essential for weight loss, you risk of losing muscle. Two personal trainers explained how to avoid this.",T14
175,The CEO of a digital economy think tank said relying on identical AI tools can erode competitive edge and weaken firms' independence.,T8
176,OpenAI published a blog post on Friday that said Elon Musk never treated the AI startup as an independent nonprofit.,T11
177,"Jenny Xiao, who founded Leonis Capital in 2021, said AI needs more investors who understand frontier AI technology.",T8
178,"Media mogul Oprah Winfrey is poised to change how we talk about the GLP-1 trend. 
It's part of the 'Oprah Effect' on wellness.",T12
179,California's Attorney General sent a cease-and-desist letter to xAI to prevent Grok from continuing to create sexualized deepfake images of children.,T6
180,Figma CEO Dylan Field says AI skills give young professionals an edge in hiring as the job market faces AI-driven changes.,T8
181,Also: Liberty Mutual rings up record age bias case; Nationwide’s fraud failings. Data by ORX News,T6
182,"Largest lenders hold highest share of central bank reserves in buffer, latest analysis shows",T5
183,"Run-prone funds drive NBFI asset growth, FSB monitoring report shows",T7
184,New exchange guidance drives rush for “proximity colo” in nearby data centres,T11
185,Deputy governor also says regulatory reform is coming to the UK gilt repo market,T7
186,"Clients in regional carry positions remain undeterred by US interventions, say dealers",T14
187,New EU framework designed to ease adoption by banks; other jurisdictions have different priorities,T5
188,$1.35 trillion notional added as banks ramp up CDS activity,T5
189,New research confirms universality of one of the most non-intuitive concepts in quant finance,T5
190,Risk.net survey finds investors are not yet ready to declare victory on inflation – with good reason,T1
191,"ALM Benchmarking study finds majority of banks relying on hard risk limits, and a minority supplementing with early-warning indicators",T5
192,Centralisation can boost efficiency when coupled with an effective pricing and attribution framework,T11
193,Variable strike put options proved popular alternative hedging format of 2025,T0
194,Heavier clearing drives bank’s balance to new high in Q3,T5
195,Head of prime derivatives services unit departs after seven years with the bank for Carbon Point,T5
196,"With a focus on price–storage dynamics in natural gas markets, the authors propose a stochastic path-dependent volatility model  with path dependence in both price volatility and storage increments",T1
197,"The authors asses Chinese climate policy uncertainty a systematic risk factor within the intertemporal capital asset pricing model framework, showing CCPU to carry a negative risk premium.",T1
198,"Model teams hold the reins, but some argue AI is an enterprise risk",T8
199,Counterparty Radar: Pimco cut $4.6bn of EUR/USD puts in Q3 amid changing stance on dollar direction,T0
200,December growth contrasts with broader FCM retrenchment from October peak,T4
201,The tariffs will allow President Trump to take a cut of Nvidia’s chip sales to China while putting off a decision about imposing higher taxes on the chip industry.,T3
202,"If SpaceX, OpenAI and Anthropic go public, they will unleash gushers of cash for Silicon Valley and Wall Street.",T11
203,"Many indicators appear to suggest that the United States is growing despite tariffs, not because of them.",T4
204,"Under Bill Pulte, Fannie Mae and Freddie Mac have pulled away from efforts to help low-income people buy homes.",T10
205,"To assuage cost-weary voters and combat inflation, the president has resorted to a mix of threats and punishments, targeting companies and policymakers alike.",T3
206,"Beef, coffee and produce were among the items that surged in price, inflation data showed.",T4
207,Surging grocery prices were offset by lower increases for appliances and vehicles in the last such report before the Federal Reserve meets to debate interest rates.,T4
208,White House officials have explored a vast array of ideas as the president looks to unfurl a housing affordability plan at an economic conference this month.,T13
209,The president appears skeptical about Americans’ concerns. How will voters respond?,T13
210,"The deal would cut tariffs and include a commitment from Taiwanese Semiconductor Manufacturing Corporation, the island’s chip giant, to build more manufacturing plants in the United States.",T12
211,"As economists pointed to some of the president’s policies to explain the latest Labor Department data, White House aides sought to make the case for optimism in the new year.",T13
212,"The agreement represents a push for deeper global cooperation, in contrast to the United States’ turning to coercion in its dealings with other countries.",T3
213,"For the central bank to lower interest rates again, officials will likely need to see more notable signs that unemployment is rising.",T4
214,"The unemployment rate fell in December, but job growth across 2025 was the lowest in five years.",T4
215,"Nicolai Tangen wanted to raise the profile of Norway’s $2.1 trillion oil fund and change corporate behavior, but he may have helped embroil it in a geopolitical tangle.",T3
216,"The monthly trade deficit continued to shrink in October after President Trump imposed sweeping tariffs on imports, the latest data showed.",T4
217,"This year, for the first time, more workers will live in states with a minimum wage of at least $15 per hour than in states with the federal minimum of $7.25.",T4
218,The robbery at the Poké Court on Wednesday was the latest in a string of thefts of high-value Pokémon trading cards.,T6
219,Stores of all kinds are using artificial intelligence to sell everything from luxury handbags to hay for horses.,T8
220,Residents and officials are still trying to revitalize East Palestine nearly three years after a derailment and chemical burn.,T7
221,Physicians with independent practices are having to cobble together unconventional office arrangements at a time of rising costs and consolidation in the medical field.,T14
222,Black female professionals have seen a steep drop in employment over the last year. They are turning to each other for pep talks and résumé advice.,T12
223,"The Federal Aviation Administration released seven advisories warning pilots to stay away from parts of the Pacific Ocean near Mexico, Colombia, Ecuador and Panama.",T13
224,Southern California Edison said its equipment most likely started the Eaton fire but asserted that government agencies and other businesses shared liability for the devastation.,T2
225,"WestJet, Canada’s second-largest carrier, backpedaled on a new seating plan after videos of crammed travelers went viral on social media.",T11
226,"Demand from centers that power artificial intelligence has driven up electricity bills, frustrating consumers.",T8
227,"The blowback set off by the Justice Department’s criminal investigation into Jerome H. Powell, the chair of the central bank, has shaken up the race to replace him.",T13
228,"Jerome H. Powell, the chair of the Federal Reserve, this week tapped a groundswell of support that has been years in the making.",T13
229,The Education Department reversed course and announced on Friday that it would delay aggressive efforts to collect what was owed on student loans.,T9
230,"Michael Saylor’s financial alchemy thrust an ordinary software company, Strategy, into the center of the crypto frenzy. It all worked spectacularly, until now.",T8
231,"The Soviet Union was Cuba’s benefactor for decades. Venezuela took up the slack, and Mexico has supplied “humanitarian aid.” But the world is changing rapidly, our columnist says.",T3
232,"Larry Fink, BlackRock’s chief executive, led an effort to elevate the World Economic Forum next week, the first without the event’s founder, Klaus Schwab.",T14
233,The company’s co-chief executive sat down for an extensive interview for the first time since announcing plans to buy Warner Bros. Discovery’s film and TV business.,T12
234,"From oil drillers to credit card companies, President Trump has been a market mover this year.",T3
235,The shutdown of online discourse within Iran has allowed both the government and its critics to flood social media outside the country with disinformation campaigns and fake images.,T6
236,The ride-hailing giant’s chief executive has made a bet on how it can finally grab a bigger piece of one of the world’s largest taxi markets.,T14
237,"The Trump administration agreed to lower tariffs on Taiwanese goods, while Taiwan said it would invest more in U.S. manufacturing.",T3
238,"Rolling debt and seven-year loans are leaving households underwater on their car, making ownership unaffordable.",T10
239,The president bought the bonds days after saying he’d be “involved” in deciding whether to approve the $83 billion deal.’,T3
240,A bipartisan proposal discussed at the White House on Friday would push tech companies to bankroll power plants as consumer anger over utility bills mounts.,T10
241,President Donald Trump suggested he may keep Kevin Hassett in his current role as a top White House economic adviser.,T13
242,Plans for more Defense Department control of Stars and Stripes surface after job seekers were asked about their commitment to President Donald Trump’s policies.,T13
243,"The oil majors may be balking on Venezuela, but smaller firms see opportunities to cash in. Some are big Trump donors.",T3
244,The criminal probe of Fed Chair Jerome Powell followed months of criticism from President Donald Trump — and then a breezy email from the U.S. attorney’s office with a line about hopping on a call.,T13
245,"Brooke Rollins drew ridicule on social media after saying a meal could be a “piece of chicken, a piece of broccoli, a corn tortilla and one other thing.”",T6
246,A fellow detainee says he witnessed Geraldo Lunas Campos being choked to death by guards at the ICE detention center in Texas on Jan. 3.,T13
247,"Rolling debt and seven-year loans are leaving households underwater on their car, making ownership unaffordable.",T10
248,The president bought the bonds days after saying he’d be “involved” in deciding whether to approve the $83 billion deal.’,T3
249,A bipartisan proposal discussed at the White House on Friday would push tech companies to bankroll power plants as consumer anger over utility bills mounts.,T10
250,President Donald Trump suggested he may keep Kevin Hassett in his current role as a top White House economic adviser.,T13
251,Plans for more Defense Department control of Stars and Stripes surface after job seekers were asked about their commitment to President Donald Trump’s policies.,T13
252,"The oil majors may be balking on Venezuela, but smaller firms see opportunities to cash in. Some are big Trump donors.",T3
253,The criminal probe of Fed Chair Jerome Powell followed months of criticism from President Donald Trump — and then a breezy email from the U.S. attorney’s office with a line about hopping on a call.,T13
254,"Brooke Rollins drew ridicule on social media after saying a meal could be a “piece of chicken, a piece of broccoli, a corn tortilla and one other thing.”",T6
255,A fellow detainee says he witnessed Geraldo Lunas Campos being choked to death by guards at the ICE detention center in Texas on Jan. 3.,T13
256,"Microsoft today issued patches to plug at least 113 security holes in its various Windows operating systems and supported software. Eight of the vulnerabilities earned Microsoft's most-dire ""critical"" rating, and the company warns that attackers are already exploiting one of the bugs fixed today.",T2
257,"Our first story of 2026 revealed how a destructive new botnet called Kimwolf rapidly grew to infect more than two million devices by mass-compromising a vast number of unofficial Android TV streaming boxes. Today, we'll dig through digital clues left behind by the hackers, network operators, and cybercrime services that appear to have benefitted from Kimwolf's spread.",T2
258,"The story you are reading is a series of scoops nestled inside a far more urgent Internet-wide security advisory. The vulnerability at issue has been exploited for months already, and it's time for a broader awareness of the threat. The short version is that everything you thought you knew about the security of the internal network behind your Internet router probably is now dangerously out of date.",T2
259,"KrebsOnSecurity.com celebrates its 16th anniversary today! A huge ""thank you"" to all of our readers -- newcomers, long-timers and drive-by critics alike. Your engagement this past year here has been tremendous and truly a salve on a handful of dark days. Happily, comeuppance was a strong theme running through our coverage in 2025, with a primary focus on entities that enabled complex and globally-dispersed cybercrime services.",T2
260,"The Trump administration has pursued a staggering range of policy pivots this past year that threaten to weaken the nation’s ability and willingness to address a broad spectrum of technology challenges, from cybersecurity and privacy to countering disinformation, fraud and corruption. These shifts, along with the president’s efforts to restrict free speech and freedom of the press, have come at such a rapid clip that many readers probably aren’t even aware of them all.",T3
261,"Direct navigation -- the act of visiting a website by manually typing a domain name in a web browser -- has never been riskier: A new study finds the vast majority of ""parked"" domains -- mostly expired or dormant domain names, or common misspellings of popular websites -- are now configured to redirect visitors to sites that foist scams and malware.",T2
262,"Microsoft today pushed updates to fix at least 56 security flaws in its Windows operating systems and supported software. This final Patch Tuesday of 2025 tackles one zero-day bug that is already being exploited, as well as two publicly disclosed vulnerabilities.",T2
263,A sprawling academic cheating network turbocharged by Google Ads that has generated nearly $25 million in revenue has curious connections to a Kremlin-connected oligarch whose Russian university builds drones for Russia's war against Ukraine.,T2
264,"China-based phishing groups blamed for non-stop scam SMS messages about a supposed wayward package or unpaid toll fee are promoting a new offering, just in time for the holiday shopping season: Phishing kits for mass-creating fake but convincing e-commerce websites that convert customer payment card data into mobile wallets from Apple and Google. Experts say these same phishing groups also are now using SMS lures that promise unclaimed tax refunds and mobile rewards points.",T2
265,"A prolific cybercriminal group that calls itself ""Scattered LAPSUS$ Hunters"" made headlines regularly this year by stealing data from and publicly mass extorting dozens of major corporations. But the tables seem to have turned somewhat for ""Rey,"" the moniker chosen by the technical operator and public face of the hacker group: Earlier this week, Rey confirmed his real life identity and agreed to an interview after KrebsOnSecurity tracked him down and contacted his father.",T2
266,"CVE-2025-64155, a command injection vulnerability, was disclosed earlier this week and quickly came under attack from a variety of IP addresses.",T2
267,Security professionals are moving up the executive ranks as enterprises face rising regulatory and compliance standards.,T8
268,"Pacific Northwest National Labs' expert cybersecurity system, ALOHA, can recreate attacks and test them against organizations' infrastructure to bolster defense.",T2
269,"Researchers detailed how Intellexa, Predator's owner, uses failed deployments and thwarted infections to strengthen its commercial spyware and generate more effective attacks.",T2
270,The upcoming Winter Games in the Italian Alps are attracting both hacktivists looking to reach billions of people and state-sponsored cyber-spies targeting the attending glitterati.,T2
271,"MITRE loses its lead as the top reporter of vulnerabilities, while new organizations pump out CVEs and reported bugs in WordPress plug-ins surge.",T2
272,Experts disagree on whether the vulnerabilities in a programmable logic controller from Delta are a five-alarm fire or not much to worry over.,T2
273,"Last year in Australia, New Zealand, and the South Pacific, Main Street businesses like retail and construction suffered more cyberattacks than their critical sector counterparts.",T2
274,"RedVDS, a cybercrime-as-a-service operation that has stolen millions from victims, lost two domains to a law enforcement operation.",T2
275,"Researchers discovered a modular, &quot;cloud-first&quot; framework that is feature-rich and designed to maintain stealthy, long-term access to Linux environments.",T2
276,"Chinese cyberattacks on Taiwan's critical infrastructure — including energy utilities and hospitals — rose 6% in 2025, averaging 2.63 million attacks a day.",T2
277,"The browser protection and detection technology will be integrated into CrowdStrike's Falcon platform to protect endpoints, browser sessions, and cloud applications.",T2
278,"When cybersecurity leadership turns over too fast, risk does not reset. It compounds.",T2
279,"The ITSM giant tacked agentic AI onto a largely unguarded legacy chatbot, exposing customers' data and connected systems.",T8
280,"The vendor's first Patch Tuesday of the year also contains fixes for 112 CVEs, nearly double the amount from last month.",T2
281,"Attackers use a sophisticated delivery mechanism of text-only files for RAT deployment, showcasing a clever way to bypass defensive tools and rely on the target's own utilities.",T2
282,The phishing campaign shows how attackers continue to weaponize legitimate cloud services and open source tools to evade detection and gain trust.,T2
283,A massive data dump reveals real identities and details of administrators and members of the notorious hacker forum.,T2
284,Researchers detailed a souped-up version of the GoBruteforcer botnet that preys on servers with weak credentials and AI-generated configurations.,T2
285,Reseller says Rackspace plans to charge it 706 percent more.,T11
286,Ads coming to free tier and new $8/month ChatGPT Go plan in US.,T11
287,Windows laggards still using the vulnerable hashing function: Your days are numbered.,T2
288,"Amid fears of bubble, world's top chipmaker TSMC says customers just keep asking for more.",T11
289,"Wikimedia Enterprise signs Microsoft, Meta, Amazon, Perplexity, and Mistral to API access deals.",T11
290,Exploit exfiltrating data from chat histories worked even after users closed chat windows.,T2
291,Indie music store says it wants fans to have confidence music was largely made by humans.,T8
292,"“General interest in AI PCs has been wavering for a while...""",T8
293,VoidLink includes an unusually broad and advanced array of capabilities.,T2
294,US defense secretary announces plans for integration despite recent controversies.,T13
295,Company responds to community concerns over electricity bills and water use.,T3
296,AI Overviews provided false liver test information experts called alarming.,T8
297,New feature will allow users to link medical and wellness records to AI chatbot.,T8
298,Will LLMs ever be able to stamp out the root cause of these attacks? Possibly not.,T2
299,Californians can now submit demands requiring 500 brokers to delete their data.,T7
300,The past year has seen plenty of hacks and outages. Here are the ones topping the list.,T2
301,"In a year where lofty promises collided with inconvenient research, would-be oracles became software tools.",T8
302,"A serious data breach has occurred, but Ars users have nothing to worry about.",T2
303,"GPS jamming has gotten cheap and easy, but there are potential solutions.",T11
304,"From compression tricks to multi-agent teamwork, here's what makes them tick.",T8
305,"In its June 2024 projections for fiscal year 2025, CBO underestimated revenues by 6 percent and outlays by 2 percent. The agency overestimated the federal budget deficit by 0.7 percent of GDP.",T10
306,"Presentation by Eric Labs, an analyst in CBO's National Security Division, at the 38th National Symposium of the Surface Navy Association.",T13
307,"As ordered reported by the House Committee on Oversight and Government Reform on December 2, 2025",T9
308,"As ordered reported by the House Committee on Energy and Commerce on December 3, 2025",T9
309,"CBO reports annually on programs whose authorizations of appropriations have already expired or will expire. This data file covers legislation enacted through September 30, 2025. A full report will be issued later this year.",T9
310,"As ordered reported by the House Committee on Energy and Commerce on December 3, 2025",T9
311,"As reported by the House Committee on Natural Resources on November 25,2025",T9
312,"Depending on how DoD implements the order to use the name ""Department of War,"" CBO estimates that costs could range from a few million dollars up to $125 million. A modest implementation of the name change would cost about $10 million.",T13
313,The Majority Leader of the House of Representatives announces bills that will be considered under suspension of the rules in that chamber. CBO estimates the effects of those bills on direct spending and revenues.,T9
314,"As posted on the website of the House Committee on Rules on January 11, 2026",T9
315,"As ordered reported by the House Committee on Education and Workforce on September 17, 2025",T9
316,"As ordered reported by the Senate Committee on Commerce, Science, and Transportation 
on October 21, 2025",T9
317,Learn more about CBO's work and its processes in a publication that is typically updated at the start of each Congress or a new session.,T9
318,"In this report, the latest in a quarterly series, CBO highlights its recent publications and summarizes its work in progress.",T9
319,"As passed by the House of Representatives on December 1, 2025",T9
320,"As ordered reported by the House Committee on Financial Services on December 17, 2025",T9
321,CBO describes three types of policy approaches to address the ongoing opioid crisis and assesses their effectiveness and likely budgetary effects.,T9
322,"As ordered reported by the House Committee on Education and Workforce on January 8, 2026",T9
323,"As ordered reported by the House Committee on Foreign Affairs on December 3, 2025",T9
324,"As ordered reported by the House Committee on Foreign Affairs on December 3, 2025",T9
325,"The scale of US international trade as a share of the entire US economy peaked around 2011. Since then, US international trade has moderated. In this post, we look at how this moderation affected international goods exports from the top &#8230; <a href=""https://fredblog.stlouisfed.org/2026/01/the-current-ranking-of-top-exporting-us-states/"">Continue reading <span class=""meta-nav"">&#8594;</span></a>",T4
326,"Mortgage loans allow households to buy a home or to borrow money against the value of a home they already own. With mortgage loans, the real estate is offered as collateral, a payback guarantee for the lender. Our FRED graph &#8230; <a href=""https://fredblog.stlouisfed.org/2026/01/what-can-mortgage-loans-do/"">Continue reading <span class=""meta-nav"">&#8594;</span></a>",T10
327,"When the US Census conducts the monthly Current Population Survey on behalf of the Bureau of Labor Statistics (BLS), it asks households more than 200 questions about their employment status. One of those questions is “Do you currently want a &#8230; <a href=""https://fredblog.stlouisfed.org/2026/01/who-wants-a-job-now/"">Continue reading <span class=""meta-nav"">&#8594;</span></a>",T4
