id,text,topic_id
384,<p>※この記事は自動翻訳されています。正確な内容につきましては原文をご参照ください。 暗号資産サービスから2025年上半期だけで21億7000万ドル以上が盗まれるなど、分散型金融（DeFi）およびWeb3プロトコルをハッカー、運用上の不具合、ガバナンス攻撃、金融的な不正から守ることがこれまで以上に急務となっています。これには、積極的な予防、データセキュリティ基盤、ツール整備、エコシステム全体での連携への継続的な投資が必要です。 統一された防御体制：チェーン・開発者・エンドユーザーの保護 当社はエコシステムを強化するため、ブロックチェーン財団と連携し、チェーン自体のセキュリティ強化だけでなく、各ネットワーク上でプロトコルを構築する開発者に特化したHexagateの無料提供も行っています。 Hexagateとは？リアルタイムのオンチェーンセキュリティレイヤー Hexagateはオンチェーン環境向けのランタイムセキュリティプラットフォームで、進行中の攻撃を検知し、損失が発生する前にチームが対策を講じられるよう支援します。従来のサイバーセキュリティがサーバーやクラウドを守るのに対し、Hexagateはスマートコントラクト、トランザクション、オンチェーン資産を守る、従来型ツールがカバーできない領域のためのソリューションです。 &#160; チェーン向け：インフラ一貫性の確保 チェーンのセキュリティ担当者は、インフラやトレジャリーの保護という重要かつ複雑なミッションに直面しています。主要なブロックチェーンでは、エンドツーエンドのオンチェーンセキュリティ確保のためにHexagateを導入し、以下のような保護を実現しています。 リアルタイム脅威インテリジェンス：新たな攻撃ベクトルを即座に把握 エコシステム全体のモニタリング：オンチェーン活動を包括的に監視 ウォレット侵害検知：運用ウォレットやトレジャリーウォレットの侵害を早期に特定 リスク自動低減：エクスプロイトを未然に防ぎ、ブロックチェーンネットワークの健全性を維持するツール 当社は、Base、Avalanche、Plasma、MegaETH、Polygon、Cronos、Immutableなど、業界のリーダーと提携できていることを誇りに思います。 開発者向け：無料AI搭載プロトコル保護 Web3プロトコルの構築には多大な労力がかかります。開発者は、プロダクトの革新、優れたユーザー体験、持続可能なトークノミクス、効率的なオンボーディング、大規模なスケーリングなど、複雑な課題のバランスを常に求められます。 しかし、その全ての基盤となるのがセキュリティです。セキュリティは最も重要かつ困難なフロンティアであり、1件のエクスプロイトが甚大な経済的損失やユーザーの信頼喪失に直結します。 ブロックチェーン財団との戦略的パートナーシッ,T13
385,"<p>※この記事は自動翻訳されています。正確な内容につきましては原文をご参照ください。 要約 北朝鮮のハッカーが2025年に暗号資産を20.2億ドル盗み、前年比51%増加、累計被害総額は67.5億ドルに到達。攻撃件数は減少傾向。 北朝鮮は、IT労働者を暗号資産サービス内部に配置したり、経営層を標的とした高度ななりすまし手法を用いるなど、少ない件数で巨額の盗難を実現している。 北朝鮮は、中国語系のマネーロンダリングサービスやブリッジサービス、ミキシングプロトコルを好んで利用し、大規模な窃盗後は約45日間で資金洗浄を完了させる傾向がある。 2025年、個人ウォレットの侵害は15万8,000件に急増し、被害者は8万人に達したが、被害総額（7億1,300万ドル）は2024年から減少した。 分散型金融（DeFi）における預かり資産（TVL）は増加したが、2024～2025年のハッキング被害額は抑制されており、セキュリティ対策の強化が効果を発揮している可能性が示唆される。 暗号資産エコシステムは2025年も厳しい1年となり、盗難被害額は増加傾向が続きました。当社の分析からは、暗号資産盗難のパターンが変化していることが明らかになり、主な変化は以下の4点です。北朝鮮（DPRK）が依然として最大の脅威であること、中央集権型サービスへの個別攻撃が深刻化していること、個人ウォレットの被害が急増していること、そして分散型金融（DeFi）ハッキングのトレンドが従来と異なる動きを見せていることです。 これらの傾向はデータから明確に読み取れ、さまざまなプラットフォームや被害者層で暗号資産盗難の様相が大きく変化していることが分かります。デジタルアセットの普及が進み、資産価値が新たな高みに到達する中で、進化するセキュリティ脅威を理解することがますます重要となっています。 全体像：2025年に34億ドル以上が盗難被害 2025年1月から12月初旬までの間に、暗号資産業界では34億ドル超の盗難被害が発生しました。そのうち、2月のBybitへの攻撃だけで15億ドルを占めています。 この総額の背後では、盗難の構成にも重要な変化が見られます。個人ウォレットの侵害による被害割合は大きく増加し、2022年の全体の7.3％から2024年には44％に拡大。2025年はBybit事件の影響が大きくなければ37％になっていたと考えられます。 一方で、中央集権型サービスでは、秘密鍵インフラや署名プロセスを狙った高度な攻撃により、損失規模がますます拡大しています。機関としての豊富なリソースや専門のセキュリティチームを擁しているにもかかわらず、これらのプラットフォームは依然として、コールドウォレットの制御をすり抜ける高度な脅威に対して脆弱なままです。こうした侵害は（下図が示すとおり）発生頻度こそ低いものの、一度起きると",T13
386,"<p>TL;DR North Korean hackers stole $2.02 billion in cryptocurrency in 2025, a 51% year-over-year increase, pushing their all-time total to&#8230;</p>
<p>The post <a href=""https://www.chainalysis.com/blog/crypto-hacking-stolen-funds-2026/"">North Korea Drives Record $2 Billion Crypto Theft Year, Pushing All-Time Total to $6.75 Billion</a> appeared first on <a href=""https://www.chainalysis.com"">Chainalysis</a>.</p>",T8
387,"<p>The end of year holiday season may be a time of celebration, but for fraudsters, it’s open season. Cybercriminals take&#8230;</p>
<p>The post <a href=""https://www.chainalysis.com/blog/follow-the-fraud-how-to-protect-your-customers-this-holiday-season/"">Follow the Fraud: How to Protect Your Customers this Holiday Season</a> appeared first on <a href=""https://www.chainalysis.com"">Chainalysis</a>.</p>",T1
388,"<p>※この記事は自動翻訳されています。正確な内容につきましては原文をご参照ください。 このたび、Chainalysis のソリューションが AWS Marketplace にて提供開始となりましたので、お知らせいたします。AWS Marketplace は、Amazon Web Services（AWS）上で稼働するパートナー企業各社が提供するソフトウェア製品が多数掲載されたデジタルカタログで、ソフトウェアの検索・評価・購入・導入をスムーズに行うことができます。 また、Chainalysis は AWS ISV Accelerate Program にも参加しています。同プログラムは、AWS 上で稼働または AWS と統合するソフトウェアソリューションを提供する&#8230;</p>
<p>The post <a href=""https://www.chainalysis.com/blog/chainalysis-solutions-available-on-aws-marketplace-japanese/"">Chainalysis のソリューションが Amazon Web Services（AWS）Marketplace で提供開始</a> appeared first on <a href=""https://www.chainalysis.com"">Chainalysis</a>.</p>",T13
389,"<p>Bitcoin (BTC) pierced $94,000 on Jan. 5, reaching its highest level since Dec. 10 and capping a rally that added nearly $100 billion to the total crypto market capitalization in 24 hours. The move came as spot Bitcoin ETFs recorded their strongest inflows in three months, derivatives positioning turned aggressively bullish, and macro conditions created [&#8230;]</p>
<p>The post <a href=""https://cryptoslate.com/bitcoin-breaks-94000-for-the-first-time-in-one-month-why-crypto-is-up-today/"">Bitcoin breaks $94,000 for the first time in a month: Why is crypto up today?</a> appeared first on <a href=""https://cryptoslate.com"">CryptoSlate</a>.</p>",T0
390,"<p>After a year of steady decline, the &#8220;memecoin dominance&#8221; ratio, a key metric tracking the sector's share of the total altcoin market, has abruptly reversed course from historic lows. This came as the total capitalization of meme assets reclaimed the $50 billion mark and tokens such as PEPE, BONK, and FLOKI posted outsized double-digit gains [&#8230;]</p>
<p>The post <a href=""https://cryptoslate.com/memecoins-are-back-but-one-specific-wallet-metric-suggests-the-50-billion-rally-is-a-dangerous-trap/"">Are memecoins back? One specific wallet metric suggests the $50 billion rally is a dangerous trap</a> appeared first on <a href=""https://cryptoslate.com"">CryptoSlate</a>.</p>",T0
391,"<p>For years, the institutional playbook for the crypto industry was simple: buy Bitcoin, perhaps dabble in Ethereum, and ignore the rest. In 2025, that playbook was rewritten. While Bitcoin retained its crown as the largest asset by total volume, the real story of the year was a dramatic structural shift in where new capital chose [&#8230;]</p>
<p>The post <a href=""https://cryptoslate.com/xrp-and-solana-dethrone-bitcoin-and-ethereum-as-institutional-favorites-in-2025/"">XRP and Solana dethrone Bitcoin and Ethereum as institutional favorites in 2025</a> appeared first on <a href=""https://cryptoslate.com"">CryptoSlate</a>.</p>",T0
392,"<p>It started, like these Polymarket &#8220;insider trading&#8221; stories usually do, with a screenshot and a smell test. A brand-new Polymarket account rolled in, threw roughly $30,000 at a long-shot outcome tied to Venezuela’s leadership, and walked away with about $400,000 in profit. U.S. forces captured Nicolás Maduro and moved him into U.S. custody ahead of [&#8230;]</p>
<p>The post <a href=""https://cryptoslate.com/another-shady-polymarket-account-turned-30k-into-400k-moments-before-the-us-captured-maduro/"">Insider trading alert as wallet turns $30k into $400k moments before the US captured Maduro</a> appeared first on <a href=""https://cryptoslate.com"">CryptoSlate</a>.</p>",T4
393,"<p>When Venezuelan President Nicolás Maduro appears in a federal courtroom in New York to face narco-terrorism charges, the world will see a geopolitical spectacle. However, for cryptocurrency investors, the proceedings carry a hidden financial stake that could reshape the global Bitcoin market for years to come. Data from Bitcoin Treasuries credit the Venezuelan government with [&#8230;]</p>
<p>The post <a href=""https://cryptoslate.com/why-bitcoin-markets-are-watching-us-arrest-of-venezuelas-maduro/"">Venezuela&#8217;s secret $60 billion Bitcoin empire from illicit gold and USDT swap rumors ignite after US &#8220;intervention&#8221;</a> appeared first on <a href=""https://cryptoslate.com"">CryptoSlate</a>.</p>",T4
394,"<p>Prior to the US market opening this week, Bitcoin traded around the low $90,000s again after the unprecedented weekend macro activity. You can feel the familiar shift in the room: less celebration, more checking phones, more chart screenshots. More people are asking the same question in different ways: “Are we about to dip?” Right now, [&#8230;]</p>
<p>The post <a href=""https://cryptoslate.com/bitcoin-to-crash-at-us-market-open-weekend-btc-spike-makes-two-new-cme-price-gaps-and-closing-one-carries-a-punishing-cost/"">Bitcoin crash imminent? Price spike makes two new CME gaps and closing one carries a punishing cost</a> appeared first on <a href=""https://cryptoslate.com"">CryptoSlate</a>.</p>",T0
395,"<p>Ethereum co-founder Vitalik Buterin has stated that the blockchain network must decide between chasing speculative trends or fulfilling its original promise as a neutral “world computer.” In two separate detailed posts on the social media platform X, Buterin reflected on 2025 as a year of significant technical progress. However, he cautioned against the network’s growing [&#8230;]</p>
<p>The post <a href=""https://cryptoslate.com/vitalik-buterin-declares-ethereum-has-solved-cryptos-biggest-problem-yet-his-2030-roadmap-exposes-a-massive-ideological-risk/"">Vitalik Buterin declares Ethereum solved crypto Trilemma, yet his 2030 roadmap exposes a massive ideological risk</a> appeared first on <a href=""https://cryptoslate.com"">CryptoSlate</a>.</p>",T8
396,"<p>When the futures market opened Monday, the screens told a story that felt backward. The U.S. had just captured Venezuela’s president, Nicolás Maduro, in a weekend operation that jolted geopolitics and dominated headlines. And yet oil did not spike. It slipped. At the same time, Bitcoin held its ground, then pushed higher. It traded around [&#8230;]</p>
<p>The post <a href=""https://cryptoslate.com/oil-prices-just-did-the-unthinkable-after-the-venezuela-raid-and-it-hands-bitcoin-a-rare-advantage/"">Oil prices just did the unthinkable after the Venezuela raid, and it hands Bitcoin a rare advantage</a> appeared first on <a href=""https://cryptoslate.com"">CryptoSlate</a>.</p>",T4
397,"<p>Washington is about to take a serious swing at crypto’s most stubborn problem: who, exactly, is supposed to police the market when a token trades like a commodity, is sold like a security, and moves through software that insists it isn’t a company at all. The Digital Asset Market Clarity Act of 2025 (better known [&#8230;]</p>
<p>The post <a href=""https://cryptoslate.com/clarity-act-heads-to-january-markup-heres-what-changes-and-what-stays-unresolved/"">Washington’s new crypto bill would strip states of power &#8211; legally bans oversight that catches front-end manipulation</a> appeared first on <a href=""https://cryptoslate.com"">CryptoSlate</a>.</p>",T8
398,"<p>Wintermute faced scrutiny for two recent events: dumping Bitcoin onto Binance during New Year's Eve's thin liquidity, then scrambling to accumulate coins in what appeared to be urgent buying ahead of the Fed announcement on Jan. 2. The claims paint a picture of coordinated manipulation: sell into weakness, buy back cheaper. On-chain data supports the [&#8230;]</p>
<p>The post <a href=""https://cryptoslate.com/major-market-maker-secretly-offloaded-1213-btc-onto-binance-during-new-years-eve-thin-liquidity/"">Major market maker secretly offloaded 1,213 BTC onto Binance during New Year&#8217;s Eve thin liquidity</a> appeared first on <a href=""https://cryptoslate.com"">CryptoSlate</a>.</p>",T0
399,"<p style=""float: right; margin: 0 0 10px 15px; width: 240px;""><img alt=""Bitcoin Core v30 bug risks fund loss during legacy wallet upgrades"" src=""https://images.cointelegraph.com/images/528_aHR0cHM6Ly9zMy5jb2ludGVsZWdyYXBoLmNvbS91cGxvYWRzLzIwMjYtMDEvMDE5YjkyNWMtNjQyOC03YjNlLWIzMTMtMmJhNGU4ODUwNmIwLmpwZw==.jpg"" /></p><p>Bitcoin Core urged users of versions 30.0 and 30.1 not to migrate legacy wallets after discovering a bug that can delete all files in a wallet directory if migration fails.</p>",T0
400,"<p style=""float: right; margin: 0 0 10px 15px; width: 240px;""><img alt=""South Korea considers pre-emptive crypto account freezes, report says"" src=""https://images.cointelegraph.com/images/528_aHR0cHM6Ly9zMy5jb2ludGVsZWdyYXBoLmNvbS91cGxvYWRzLzIwMjYtMDEvMDE5YjkyMTQtOTRlYy03MDg2LTk1OWMtZjVmMDA5ZTZmODVmLkpQRw==.jpg"" /></p><p>The proposal highlights South Korea’s push to align crypto oversight with securities markets, raising stakes for exchanges and traders alike.</p>",T0
401,"<p style=""float: right; margin: 0 0 10px 15px; width: 240px;""><img alt=""Bitcoin buying metric with average 109% gains flips positive at $88K"" src=""https://images.cointelegraph.com/images/528_aHR0cHM6Ly9zMy5jb2ludGVsZWdyYXBoLmNvbS91cGxvYWRzLzIwMjUtMTIvMDE5YjA1ZGUtOGExZS03ZWI3LWE3YjUtNWIwMmUyYjg3OWZl.jpg"" /></p><p>Institutional Bitcoin purchases exceeded newly mined supply for eight consecutive days, a signal that has historically preceded major BTC price upside.</p>",T0
402,"<p style=""float: right; margin: 0 0 10px 15px; width: 240px;""><img alt=""‘Mixed year for IPOs’ as crypto pulls down US IPO performance"" src=""https://images.cointelegraph.com/images/528_aHR0cHM6Ly9zMy5jb2ludGVsZWdyYXBoLmNvbS91cGxvYWRzLzIwMjYtMDEvMDE5YjkxNWItNWEzMy03MTI2LTgyNjctNWUwMGI1ODBlYzhjLmpwZw==.jpg"" /></p><p>Investors would have been better off investing in the S&amp;P500 than betting on US initial public offerings in 2025, with crypto and AI public debuts partly to blame.</p>",T0
403,"<p style=""float: right; margin: 0 0 10px 15px; width: 240px;""><img alt=""Bitcoin outlook bullish as whales, sharks buy retail sell-off: Santiment"" src=""https://images.cointelegraph.com/images/528_aHR0cHM6Ly9zMy5jb2ludGVsZWdyYXBoLmNvbS91cGxvYWRzLzIwMjYtMDEvMDE5YjkxOTEtMTExZC03ZTcyLWJkY2UtYzQ2YzE2OGQ3NjYzLmpwZw==.jpg"" /></p><p>Whales accumulated over $5.3 billion in Bitcoin since mid-December while retail traders took profits, creating bullish market conditions.</p>",T0
404,"<p style=""float: right; margin: 0 0 10px 15px; width: 240px;""><img alt=""Nvidia CEO says demand for computing resources is ‘skyrocketing’ "" src=""https://images.cointelegraph.com/images/528_aHR0cHM6Ly9zMy5jb2ludGVsZWdyYXBoLmNvbS91cGxvYWRzLzIwMjYtMDEvMDE5YjkxNjktZTE4Ni03NDBhLWJhNmMtMThlOTJhZDRmZDg0LmpwZw==.jpg"" /></p><p>Nvidia CEO Jensen Huang says there’s a massive race for AI computing power, which could raise questions about how much will be left for crypto mining. </p>",T2
405,"<p style=""float: right; margin: 0 0 10px 15px; width: 240px;""><img alt=""Fund manager Bill Miller IV says Bitcoin ’looks ready to go again’"" src=""https://images.cointelegraph.com/images/528_aHR0cHM6Ly9zMy5jb2ludGVsZWdyYXBoLmNvbS91cGxvYWRzLzIwMjYtMDEvMDE5YjkxMjQtNzI2Yi03ZDI3LWJiYzctMzRjZjZmOWUxNjYyLmpwZw==.jpg"" /></p><p>The crypto-friendly Trump administration and Wall Street adoption will be two of the biggest drivers behind a Bitcoin rally to new highs in 2026, two industry analysts said.</p>",T0
406,"<p style=""float: right; margin: 0 0 10px 15px; width: 240px;""><img alt=""Ethereum staking sees tidal shift as validator exit queue clears out"" src=""https://images.cointelegraph.com/images/528_aHR0cHM6Ly9zMy5jb2ludGVsZWdyYXBoLmNvbS91cGxvYWRzLzIwMjUtMTIvMDE5YjY5ODMtYWE3MS03NGJmLWE1YzEtMjBjNjNmNzMyNDRmLmpwZw==.jpg"" /></p><p>Ethereum’s validator exit queue fell near zero for the first time since July as staking demand increased, led by BitMine’s aggressive accumulation.</p>",T0
407,"<p style=""float: right; margin: 0 0 10px 15px; width: 240px;""><img alt=""Coinbase rallies 8% after Goldman Sachs upgrades stock to ‘buy’"" src=""https://images.cointelegraph.com/images/528_aHR0cHM6Ly9zMy5jb2ludGVsZWdyYXBoLmNvbS91cGxvYWRzLzIwMjYtMDEvMDE5YjkwYTgtOTFhMi03MTUwLTk4NmYtOGJiYTg4ZjBhMDZlLmpwZw==.jpg"" /></p><p>Goldman Sachs highlighted crypto firms building infrastructure over trading desks, seeing steady growth in tokenization and prediction markets.</p>",T0
408,"<p style=""float: right; margin: 0 0 10px 15px; width: 240px;""><img alt=""US crypto stocks soar double-digits as major tokens rally"" src=""https://images.cointelegraph.com/images/528_aHR0cHM6Ly9zMy5jb2ludGVsZWdyYXBoLmNvbS91cGxvYWRzLzIwMjUtMTIvMDE5YWUyODgtMTY5ZS03ZDQ4LWIwYmItYzAxZTYwNWY4YjAz.jpg"" /></p><p>Major US crypto stocks soared on Monday as the wider crypto market mounted a comeback, with Bitcoin and Ether hitting three-week highs.</p>",T0
409,"<p style=""float: right; margin: 0 0 10px 15px; width: 240px;""><img alt=""US access to Venezuelan oil could eventually lower Bitcoin mining costs, Bitfinex says"" src=""https://images.cointelegraph.com/images/528_aHR0cHM6Ly9zMy5jb2ludGVsZWdyYXBoLmNvbS91cGxvYWRzLzIwMjYtMDEvMDE5YjkwZGYtNzhhOC03M2YxLWFiY2MtNmE2MjIzMGZkZWI2LmpwZw==.jpg"" /></p><p>Bitcoin mining electricity costs could fall if Venezuelan oil production increases, though it may take several years before the benefits are fully realized, Bitfinex analysts say.</p>",T4
410,"<p style=""float: right; margin: 0 0 10px 15px; width: 240px;""><img alt=""NFT Paris cancels conferences: ‘The market collapse hit us hard‘"" src=""https://images.cointelegraph.com/images/528_aHR0cHM6Ly9zMy5jb2ludGVsZWdyYXBoLmNvbS91cGxvYWRzLzIwMjYtMDEvMDE5YjhmZTktZWFmOC03MzJhLThhNWYtYmE0OTZlOWIxN2VjLmpwZw==.jpg"" /></p><p>Total NFT market capitalization dropped significantly in 2025, from about $9 billion in January 2025 to just over $2.7 billion in 2026.</p>",T0
411,"<p style=""float: right; margin: 0 0 10px 15px; width: 240px;""><img alt=""Prediction markets move into real estate with Polymarket–Parcl deal"" src=""https://images.cointelegraph.com/images/528_aHR0cHM6Ly9zMy5jb2ludGVsZWdyYXBoLmNvbS91cGxvYWRzLzIwMjYtMDEvMDE5YjhmYjMtOTFjNS03OTMwLTllZDYtMzY5YjU4OTMxYzVkLkpQRw==.jpg"" /></p><p>Parcl’s native PRCL token surged over 100% following news of the partnership, which brings housing price indexes into prediction markets.</p>",T0
412,"<p style=""float: right; margin: 0 0 10px 15px; width: 240px;""><img alt=""Here’s what happened in crypto today"" src=""https://images.cointelegraph.com/images/528_aHR0cHM6Ly9zMy5jb2ludGVsZWdyYXBoLmNvbS91cGxvYWRzLzIwMjUtMDYvMDE5Nzk0MjMtZWY4ZS03YzYwLWI5MzctYjlkZGY3NWZlOGFk.jpg"" /></p><p>Need to know what happened in crypto today? Here is the latest news on daily trends and events impacting Bitcoin price, blockchain, DeFi, NFTs, Web3 and crypto regulation.</p>",T0
413,"<p style=""float: right; margin: 0 0 10px 15px; width: 240px;""><img alt=""Crypto companies contribute $21M to Trump PAC ahead of US midterms"" src=""https://images.cointelegraph.com/images/528_aHR0cHM6Ly9zMy5jb2ludGVsZWdyYXBoLmNvbS91cGxvYWRzLzIwMjUtMTIvMDE5YjUwMzEtMGI1My03MmUwLThmN2QtMDA5OTQ1MGRmNWVjLmpwZw==.jpg"" /></p><p>The Gemini Trust Company and parent company of Crypto.com sent millions of dollars to the Trump-supporting PAC in September and October.</p>",T0
414,"<p style=""float: right; margin: 0 0 10px 15px; width: 240px;""><img alt=""Price predictions 1/5: SPX, DXY, BTC, ETH, XRP, BNB, SOL, DOGE, ADA, BCH"" src=""https://images.cointelegraph.com/images/528_aHR0cHM6Ly9zMy5jb2ludGVsZWdyYXBoLmNvbS91cGxvYWRzLzIwMjYtMDEvMDE5YjhmMzctYzliOS03NTU4LWFjMjYtYTIxZTZhZWRjM2QzLmpwZw==.jpg"" /></p><p>Bitcoin and several major altcoins continued their march higher, indicating improving investor sentiment and sustained demand from the bulls.</p>",T0
415,"<p style=""float: right; margin: 0 0 10px 15px; width: 240px;""><img alt=""Grayscale declares first Ethereum staking payout for US-listed ETF"" src=""https://images.cointelegraph.com/images/528_aHR0cHM6Ly9zMy5jb2ludGVsZWdyYXBoLmNvbS91cGxvYWRzLzIwMjYtMDEvMDE5YjhlZmQtMTZiYy03MjQ4LTgxODItMTE0ODc3ZWI1YWZkLmpwZw==.jpg"" /></p><p>The cash distribution stems from staking rewards earned after the fund enabled Ethereum staking in October.</p>",T0
416,"<p style=""float: right; margin: 0 0 10px 15px; width: 240px;""><img alt=""China’s financial associations reclassify RWAs as ‘risky,‘ report says"" src=""https://images.cointelegraph.com/images/528_aHR0cHM6Ly9zMy5jb2ludGVsZWdyYXBoLmNvbS91cGxvYWRzLzIwMjYtMDEvMDE5YjhlY2YtNzE3Zi03YzA0LThlN2ItOTU1YWE1OWZkZTlkLmpwZw==.jpg"" /></p><p>Wu Blockchain reported the policy change listing Real-World Asset tokenization alongside stablecoins, ”air coins” and crypto mining as illegal in China.</p>",T8
417,"<p style=""float: right; margin: 0 0 10px 15px; width: 240px;""><img alt=""Bitcoin price hits $94K as crypto volume dives to lowest since late 2023"" src=""https://images.cointelegraph.com/images/528_aHR0cHM6Ly9zMy5jb2ludGVsZWdyYXBoLmNvbS91cGxvYWRzLzIwMjYtMDEvMDE5YjhlZTktMjMwNC03ZjJiLWIxMDAtYTNjYzdlYTJjOTNiLmpwZw==.jpg"" /></p><p>Bitcoin reached its highest levels in nearly a month as risk assets and precious metals headed higher on the US-Venezuela catalyst.</p>",T0
418,"<p style=""float: right; margin: 0 0 10px 15px; width: 240px;""><img alt=""Bitcoin enters 'strength' phase, but $100K debate heats up between traders"" src=""https://images.cointelegraph.com/images/528_aHR0cHM6Ly9zMy5jb2ludGVsZWdyYXBoLmNvbS91cGxvYWRzLzIwMjUtMTIvMDE5YjY2ZTEtZmJhMi03YTM0LWJlZDUtNzhhODc3MWZiZjM2LmpwZw==.jpg"" /></p><p>Bitcoin’s structure has turned bullish, yet traders are split on whether $100,000 could mark a bull expansion or bear continuation.</p>",T0
