id,text,topic_id
337,"As reported by the House Committee on Energy and Commerce on February 2, 2026",T10
338,"As ordered reported by the House Committee on Transportation and Infrastructure on December 18, 2025",T10
339,"As ordered reported by the House Committee on Oversight and Government Reform on December 2, 2025",T10
340,"As reported by the Senate Committee on Foreign Relations on June 18, 2025",T10
341,"As reported by the House Committee on Energy and Commerce on February 4, 2026",T10
342,"As reported by the House Committee on Natural Resources on January 8, 2026",T10
343,"As reported by the Senate Committee on Foreign Relations on February 10, 2026",T10
344,"As reported by the House Committee on Energy and Commerce on February 4, 2026",T10
345,"As reported by the Senate Committee on Foreign Relations on February 10, 2026",T10
346,"Today&#8217;s post explains the relationship between interest rates and exchange rates and how they&#8217;re involved in investment decisions. The data The FRED graph above tracks two rates: The solid red line shows the exchange rate between the US dollar and &#8230; <a href=""https://fredblog.stlouisfed.org/2026/02/the-link-between-interest-rates-and-exchange-rates/"">Continue reading <span class=""meta-nav"">&#8594;</span></a>",T1
347,"The title of this post may have reminded you that you need to buy some chocolate for some event in a couple of days. If you do, you may also notice that chocolate has become quite expensive. If you already &#8230; <a href=""https://fredblog.stlouisfed.org/2026/02/why-is-chocolate-so-expensive/"">Continue reading <span class=""meta-nav"">&#8594;</span></a>",T6
348,"On February 5, 2026, the Bureau of Economic Analysis released their 2024 real GDP breakdown at the county level. Here are some highlights from the data set, some of which are shown in the FRED map above: As noted above, &#8230; <a href=""https://fredblog.stlouisfed.org/2026/02/real-gdp-by-county-2024-rev/"">Continue reading <span class=""meta-nav"">&#8594;</span></a>",T9
349,"FRED recently added 7 data series about the business conditions and outlook of upstream oil and gas energy firms headquartered in the 11th Federal Reserve District. In industry lingo, upstream refers to oil and gas exploration and production and the &#8230; <a href=""https://fredblog.stlouisfed.org/2026/02/oil-and-gas-firms/"">Continue reading <span class=""meta-nav"">&#8594;</span></a>",T10
350,"In a recent FRED Blog post, we discussed how confidence intervals show the level of certainty about the accuracy of an estimate. In short: Wider confidence intervals signal more uncertainty. Also, larger survey sample sizes increase the statistical accuracy of &#8230; <a href=""https://fredblog.stlouisfed.org/2026/02/confidence-intervals-and-sampling-variation/"">Continue reading <span class=""meta-nav"">&#8594;</span></a>",T11
351,"The US Census Bureau collects data and reports on the poverty level each year. Their statistical definition of poverty has to do with the affordability of food. As they describe, the Office of Management and Budget’s Directive 14 sets a &#8230; <a href=""https://fredblog.stlouisfed.org/2026/01/food-affordability-and-estimated-poverty/"">Continue reading <span class=""meta-nav"">&#8594;</span></a>",T9
352,"On January 23, 2026, the Bureau of Economic Analysis released real GDP data for all US states for the third quarter of 2025. The FRED map above shows the percentage change growth rates from the previous quarter: Light yellow denotes &#8230; <a href=""https://fredblog.stlouisfed.org/2026/01/real-gdp-growth-by-state-third-quarter-2025/"">Continue reading <span class=""meta-nav"">&#8594;</span></a>",T9
353,"On January 7, 2026, the Bureau of Labor Statistics released the third quarter data for total nonfarm employees at the state and metro levels in 2025. These numbers are being released a little later than usual due to the government &#8230; <a href=""https://fredblog.stlouisfed.org/2026/01/state-and-metro-employment-third-quarter-2025/"">Continue reading <span class=""meta-nav"">&#8594;</span></a>",T9
354,"The scale of US international trade as a share of the entire US economy peaked around 2011. Since then, US international trade has moderated. In this post, we look at how this moderation affected international goods exports from the top &#8230; <a href=""https://fredblog.stlouisfed.org/2026/01/the-current-ranking-of-top-exporting-us-states/"">Continue reading <span class=""meta-nav"">&#8594;</span></a>",T13
355,"Mortgage loans allow households to buy a home or to borrow money against the value of a home they already own. With mortgage loans, the real estate is offered as collateral, a payback guarantee for the lender. Our FRED graph &#8230; <a href=""https://fredblog.stlouisfed.org/2026/01/what-can-mortgage-loans-do/"">Continue reading <span class=""meta-nav"">&#8594;</span></a>",T8
356,"Why do workers still segregate by sex across occupations, industries, and firms? Recent research has focused on how preferences for job amenities, like flexibility, may differ by sex. However, one “amenity” that has received relatively little attention is the sex composition of a job itself. In a recent <a href=""https://www.newyorkfed.org/research/staff_reports/sr1092"">paper</a>, I conducted a survey experiment to estimate men’s and women’s preferences for sex composition in the workplace. One result is that women and young single men prefer jobs with at least half female coworkers.",T9
357,"Data releases for inflation have been scarce over the past four months due to the government shutdown. As a result, until January 22 no personal consumer expenditures (PCE) data were available beyond September and the consumer price index (CPI) had many missing entries for the one-month changes for October and November. In this post, we use an extended version of the New York Fed's <a href=""https://www.newyorkfed.org/research/policy/mct#--:mct-inflation:trend-inflation"">Multivariate Core Trend (MCT) inflation model</a> to examine changes in underlying inflation over this period. The MCT model is well-suited to do so because it decomposes sectoral inflation rates into a trend (“persistent”) and a transitory component. In contrast to core (ex-food and energy) inflation, its aim is to remove <em>all</em> transitory factors, thus identifying the underlying trend. In addition, since the model can handle missing data—like for October—it can produce values for trend inflation for months where little or no data were released. Our findings suggest caution: while the fragmented data from November initially signaled a deceleration in price pressures, the integration of December data indicates",T11
358,"Over the course of 2025, the average tariff rate on U.S. imports increased from 2.6 to 13 percent. In this blog post, we ask how much of the tariffs were paid by the U.S., using import data through November 2025. We find that nearly 90 percent of the tariffs’ economic burden fell on U.S. firms and consumers.",T13
359,"The Federal Reserve Bank of New York's <a href=""https://www.newyorkfed.org/microeconomics"" rel=""noreferrer noopener"" target=""_blank"">Center for Microeconomic Data</a> recently released its <a href=""https://www.newyorkfed.org/medialibrary/interactives/householdcredit/data/pdf/HHDC_2025Q4"" rel=""noreferrer noopener"" target=""_blank"">Quarterly Report on Household Debt and Credit</a> for the fourth quarter of 2025, revealing continued growth in household debt balances. Aggregate household debt balances rose by $191 billion to reach $18.8 trillion, marking a $4.6 trillion increase since the end of 2019. Mortgage balances grew by $98 billion to $13.2 trillion, while credit card debt increased by $44 billion to $1.28 trillion. Credit card and auto loan delinquency rates appear to have stabilized, albeit at elevated rates. By contrast, the delinquency rate for mortgages—although still near low levels on a longer-term basis—has been steadily increasing over the past few years. Underlying these aggregate figures, however, there are notable differences in mortgage credit performance across places with different income levels and labor and housing market dynamics. This analysis, as well as the Q",T11
360,"Inflation does not always respond to cost and demand pressures in the same way. When shocks are small, the mapping from costs to prices is roughly proportional—double the shock, double the inflation response. But when the economy is hit by large shocks, this proportionality breaks down. As the recent surge and subsequent decline of global inflation showed, price growth can accelerate—or decelerate—by more than one-for-one relative to the size of the disturbance. Economists refer to this pattern as nonlinear inflation dynamics. In this post, I discuss what these nonlinearities mean, how they relate to the slope of the Phillips curve discussed in a <a href=""https://libertystreeteconomics.newyorkfed.org/2026/02/anatomy-not-autopsy-of-the-phillips-curve"">companion post</a>, and how firm-level data can help us understand the mechanisms behind them.",T11
361,"The relationship between inflation and real economic activity has long been central to debates in macroeconomics and monetary policy. At the core of this debate is the Phillips curve (PC), which measures how strongly inflation reacts to movements in economic conditions. The steepness of this curve matters enormously for monetary policy: if the PC is steeper, inflation rises faster during booms and falls faster in recessions, which entails central banks having to act more forcefully if they want to stabilize inflation around their target. Prior analysis found astonishingly small estimates of the slope of the PC, which suggests that the curve is “flat” (or even dead). In this post, I present evidence from coauthored research showing that, contrary to the conventional view, the Phillips curve is alive and steep, and it captures inflation volatility remarkably well once real marginal cost is used instead of standard real economic activity measures.",T11
362,"The New York Fed’s <a href=""https://www.newyorkfed.org/research/economic-heterogeneity-indicators"" rel=""noreferrer noopener"" target=""_blank"">Economic Heterogeneity Indicators</a> (EHIs) aim to study macroeconomic outcomes experienced by various groups of people and businesses. We recently added a suite of indicators describing the performance of small businesses to the EHIs—both for the region (defined, for the purpose of this study, as New York, New Jersey, and Connecticut) and nationally. Small businesses are critical to employment generation as they accounted for <a href=""https://advocacy.sba.gov/wp-content/uploads/2025/09/EconomicBulletin_SecondQtr2025_090325_FINAL.pdf"" rel=""noreferrer noopener"" target=""_blank"">almost 63 percent of new private sector jobs since 2005</a> and employed <a href=""https://advocacy.sba.gov/wp-content/uploads/2025/06/United_States_2025-State-Profile.pdf"" rel=""noreferrer noopener"" target=""_blank"">almost 46 percent of all U.S. workers in 2025</a>. Thus, understanding economic trends and impacts for small businesses is important for designing effective monetary policy and aligns with the New York Fed’s mission to support the regional economy. In this post",T9
363,"We are enhancing our set of <a href=""https://www.newyorkfed.org/research/economic-heterogeneity-indicators"">Economic Heterogeneity Indicators</a> (EHIs) by adding a set of metrics on consumer spending with data presented by income, education, race and ethnicity, age, and urban status. The data will help track the evolution of aggregate behavior by analyzing the spending of specific groups in a more timely manner than is possible using public surveys.",T9
364,"It is common for price measures to consider changes in quality. That is, a price index might fall even though listed prices are unchanged because the quality of the item has improved. An adjustment for quality captures the fact that consumers are effectively getting more for the same dollar when product quality rises. In practice, however, it is notoriously difficult to measure quality changes since it requires access to detailed data on all product characteristics that matter to consumers. We offer a novel method to infer quality changes and apply it to U.S. import price indices. When we account for quality improvements in this way, we find that the import price inflation based on official measures has been overstated, revealing that consumers have been getting more from their purchases of imported goods than what standard quality adjustments suggest.",T13
365,"In our <a href=""https://libertystreeteconomics.newyorkfed.org/2026/01/disability-in-the-labor-market-employment-and-participation/"">previous post</a> we learned that, in general, people with disabilities participate in the labor market at significantly lower rates, and that they are much more likely to be unemployed. Despite these patterns, we found that the labor force participation of workers with disabilities rose noticeably following the pandemic. A relevant question then is how earnings of workers with disabilities compare with workers without disabilities. In this companion post we investigate differences in weekly earnings for workers with and without disabilities. We find that workers with disabilities earn considerably less than workers without disabilities. Additionally, with few exceptions, their earnings have remained roughly constant in real terms since the pre-pandemic period.",T9
366,"Among people in prime working age (25-54), around 7 percent have a disability of some kind. In this set of companion posts, we will examine how prime-aged workers with disabilities have fared in the labor market compared to the year prior to the pandemic. In this first post, we will show that people with disabilities are far less likely to be employed than people without disabilities, with both lower labor force participation and higher unemployment playing a role. We will also show that although employment rates of people with disabilities are very low, they have risen rapidly during the post-pandemic period, largely because of rising labor force participation. Our results are consistent with an increased prevalence of work from home (WFH) arrangements in the post-COVID period differentially benefiting people with disabilities.",T9
367,"Good measures of labor market tightness are essential to predict wage inflation and to calibrate monetary policy. In an <a href=""https://libertystreeteconomics.newyorkfed.org/2024/10/a-new-indicator-of-labor-market-tightness-for-predicting-wage-inflation/"">October 2024 post</a>, we introduced a new indicator of labor market tightness and showed that it tracked wage inflation best out of a broad range of tightness measures. In this post, we update our index through 2025 and show that it also <em>forecasts</em> future wage inflation best both in and out of sample. In addition, we highlight availability of the index as a <a href=""https://www.newyorkfed.org/research/labor-market-tightness"">new regularly updated feature</a> on the New York Fed's website.",T11
368,"The European Union has been an early adopter of carbon policies, with the introduction of the EU Emissions Trading System (ETS) in 2005. This scheme sets a common price for carbon and is applied to the most polluting manufacturing sectors. By increasing the cost of emissions-intensive production, the system incentivizes firms to decrease their use of fossil fuels. However, as we show in a <a href=""https://libertystreeteconomics.newyorkfed.org/2026/01/what-can-undermine-a-carbon-tax/"">companion post</a>, the policy’s impact was moderated by firms increasing their reliance on high-emissions imports. To eliminate this workaround, the EU will expand the ETS to imports in 2026, through the Carbon Border Adjustment Mechanism (CBAM). The CBAM will essentially put a tariff on imported goods based on their carbon content. Our <a href=""https://www.newyorkfed.org/research/staff_reports/sr1136"">recent work</a> provides a quantitative analysis of how the ETS and CBAM affect firms’ supply choice decisions, and the resulting changes in domestic prices and emissions.<br />",T13
369,"Several countries have implemented a carbon tax or cap-and-trade system to establish high carbon prices and create a disincentive for the use of fossil fuels. Essentially, the tax encourages firms to substitute toward low carbon emission energy. Costs also rise for firms down the supply chain that use production inputs with high-emission content, so the total impact of a carbon tax can be large. In practice, however, firms also have an incentive to find an offset to a carbon tax. In this post, based on our <a href=""https://www.newyorkfed.org/research/staff_reports/sr1136"">recent work</a>, we present evidence of one such adaptation strategy. We show that French firms increased their imports of high-emission inputs from suppliers outside the European Union’s cap-and-trade system, known as the EU Emissions Trading System (EU ETS), reducing the effectiveness of this approach to cutting carbon emissions—an adaptation strategy that leads to “carbon leakage.” To help stop this leakage, the EU is implementing a ""carbon tariff"" in 2026, which is the topic of a <a href=""https://libertystreeteconomics.newyorkfed.org/2026/01/what-is-a-carbon-tariff-and-why-is-the-eu-imposing-one/"">companion po",T13
370,"Why do some entrepreneurs drive economic growth while others do not? This piece discusses <a href=""https://www.nber.org/papers/w33766"">new work </a>that studies entrepreneurs using a comprehensive dataset from Denmark. We study who becomes an entrepreneur, along with their hiring and business decisions, and find that a distinct minority are “transformative.” These individuals, who generate disproportionate productivity gains, tend to have high IQ scores, be well-educated, and hire technical (R&#38;D) workers. The data support the idea of productivity growth being driven by the symbiotic relationship between transformative entrepreneurs and R&#38;D workers. For policymakers, the lesson is that when an economy has more R&#38;D workers and transformative entrepreneurs, they sustain higher long-run productivity growth.",T9
371,"Each year brings a new set of economic challenges: In 2025, major areas of focus included tariffs and trade tensions, as well as the financial pressures facing younger adults. New York Fed economists contributed insightful research on both topics—and readers took notice. In fact, all five of the year’s most-read posts on <em>Liberty Street Economics</em> analyzed aspects of these issues. Read on to see how the restoration of student loan data to credit reports affected borrowers’ credit scores, whether the costs of a college degree are still worth it, how businesses are responding to higher tariffs, and why the U.S. runs a trade deficit.<br />",T9
372,"Call Reports are regulatory filings in which commercial banks report their assets, liabilities, income, and other information. They are one of the most-used data sources in banking and finance. In this post, we describe a <a href=""https://www.newyorkfed.org/research/banking_research/balance-sheets-income-statements"">new dataset</a> made available on the Federal Reserve Bank of New York’s website that contains time-consistent balance sheets and income statements for commercial banks in the United States from 1959 to 2025.",T11
373,"Banks must extract useful signals of a potential borrower's quality from a large set of possibly informative characteristics when making lending decisions. A model that speaks to how banks specialize in lending to an industry in order to better extract signals from data can potentially be applied to a number of real-world scenarios. In this post, we apply lessons from such a model to a topic of timely relevance in economics: job market recommendation letters. Institutions looking to hire new economists must evaluate PhD applicants based on limited and often noisy signals of future performance, including letters of recommendation from these applicants’ advisors or co-authors. Using insights from our model, we argue that the value of these letters depends on who reads them.",T11
374,"Why does the banking industry remain prone to large and costly disruptions despite being so heavily regulated? Is there a need for more regulation, less regulation, or simply different regulation? Our <a href=""https://www.newyorkfed.org/research/staff_reports/sr1155.html"">recent Staff Report</a> combines insights from academic research in economics, finance, and accounting to provide a deeper understanding of the challenges involved in designing and implementing bank regulation, as well as opportunities for future exploration. This post focuses on the regulation of bank capital, but the ideas are applicable more broadly.",T11
375,"This post presents an update of the economic forecasts generated by the Federal Reserve Bank of New York’s dynamic stochastic general equilibrium (DSGE) model. We describe very briefly our forecast and its change since <a href=""https://libertystreeteconomics.newyorkfed.org/2025/09/the-new-york-fed-dsge-model-forecast-september-2025/"" rel=""noreferrer noopener"" target=""_blank"">September 2025</a>. To summarize, growth in 2025 is expected to be stronger than in September due to a lower projected path of the policy rate, as well as higher productivity. Inflation projections are higher in 2025 because of cost-push shocks, which capture the effects of tariffs. The model’s predictions for the short-run real natural rate of interest (or r*) in 2025 have decreased relative to September.",T11
376,Singapore-based single-family office will invest into private debt opportunistically in 2026.,T3
377,The manager sells $1.4bn of loans in three BDCs and gates Blue Owl Capital Corp II.,T3
378,"Investors list the main causes of friction with private equity funds, in exclusive research released ahead of PEI’s NEXUS event in Florida.",T2
379,Tikehau's second credit secondaries-focused fund closes on more than $1bn having launched in the second half of 2023.,T3
380,"The BDC market provides a window into more challenging conditions, while maturity walls may force restructurings.",T3
381,"Carlyle's Taj Sidhu tells us why he's optimistic about private debt in Europe. Also, Configure finds M&#038;A market ""uneven and sector-specific"", and BNP PAMA announces Capza 7 first close. Here's today's brief for our valued subscribers only.",T3
382,"Sabrina Meng will start in a new role at the British GP next month, Private Debt Investor has learned.",T3
383,"US bankruptcy court approves sale of rent-stabilised residential properties, setting aside housing-based objections from New York City.",T8
384,The duo extends their long-standing relationship in a transaction led by the Beverly Hills-based manager’s executive suite with funding from Fairfax.,T7
385,"Fitch reports spike in redemptions in non-traded BDCs, while Stanger warns of 'hairpin turn' and Solve sees a rise in non-accruals.",T3
386,Mentioning 'bitcoin' or crypto on AI agent OpenClaw's Discord will get you banned,T5
387,"‘Bitcoin to zero’ searches spike in the U.S., but the bottom signal is mixed",T2
388,Ethereum's Vitalik Buterin proposes AI 'stewards' to help reinvent DAO governance,T4
389,Japan's SBI to issue 10 billion yen onchain bond with XRP rewards for retail investors,T1
390,"Iran’s rial collapse mirrors Lebanon’s crisis, driving citizens to bitcoin",T6
391,"Bitcoin echoes 'late 2022' bear market bottom, K33 says",T2
392,Inside France’s strict rules for selling majority stake of its state energy cloud to U.S. bitcoin miner,T13
393,Bitcoin price slips after Trump hikes worldwide tariff to 15% from 10% despite Supreme Court decision,T0
394,How AI is helping retail traders exploit prediction market 'glitches' to make easy money,T4
395,Blue Owl liquidity crisis has investors bracing for 2008-style fallout — it could mean bitcoin's next bull run,T2
396,"Small investors are buying bitcoin. For a rally to succeed, the whales need to join in.",T2
397,SEC makes quiet shift to brokers' stablecoin holdings that may pack big results,T2
398,"Bitcoin shrugs off Trump's new tariffs, nears $68,000 as altcoins lead modest bounce",T0
399,Specialized AI detects 92% of real-world DeFi exploits,T5
400,U.S. Supreme Court's decision on Trump's tariffs may not rock crypto — yet,T0
401,Dubai takes next step to make real estate flips instant in $16 billion tokenization plan,T6
402,"RWA issuers prioritize capital formation over liquidity, according to Brickken survey",T1
403,Bitcoin pops then drops as Supreme Court strikes down Trump tariffs,T0
404,"Goldman Sachs, Franklin Templeton, and Nicki Minaj: Inside Trump’s surreal Mar-a-Lago crypto summit",T3
405,"CoinDesk 20 performance update: AAVE falls 3.3%, leading index lower",T2
406,"<p>TL;DR Darknet market activity remains resilient, with aggregate DNM flows reaching nearly $2.6 billion in 2025, underscoring the persistence of&#8230;</p>
<p>The post <a href=""https://www.chainalysis.com/blog/crypto-drug-sales-darknet-markets-2026/"">From Fentanyl to Fraud: On-Chain Activity Highlights Illicit Market Evolution</a> appeared first on <a href=""https://www.chainalysis.com"">Chainalysis</a>.</p>",T6
