id,text,topic_id
382,"<p>TL;DR Crypto-enabled fraud cost victims at least $14 billion globally in 2025, with sophisticated scams like pig butchering and AI-powered&#8230;</p>
<p>The post <a href=""https://www.chainalysis.com/blog/united-kingdom-leading-fight-against-crypto-enabled-fraud/"">Why Now is the Time for the UK to Lead the Global Fight against Crypto-enabled Fraud</a> appeared first on <a href=""https://www.chainalysis.com"">Chainalysis</a>.</p>",T13
383,"<p>At its core, Chainalysis is a data company with a dataset that maps the global cryptocurrency ecosystem, providing unmatched intelligence&#8230;</p>
<p>The post <a href=""https://www.chainalysis.com/blog/workflows-no-code-automation-blockchain-insights/"">Introducing Workflows: No-Code Automation for Data-Scientist-Level Blockchain Insights</a> appeared first on <a href=""https://www.chainalysis.com"">Chainalysis</a>.</p>",T13
384,"<p>TL;DR Iran&#8217;s crypto ecosystem reached over $7.78 billion in 2025, having grown at a faster pace for most of the&#8230;</p>
<p>The post <a href=""https://www.chainalysis.com/blog/iranian-crypto-activity-geopolitical-tensions-2026/"">Inside Iran’s Growing $7.8 Billion Crypto Ecosystem: IRGC Dominance and a Flight to Bitcoin Reflect Geopolitical Tensions and Domestic Unrest</a> appeared first on <a href=""https://www.chainalysis.com"">Chainalysis</a>.</p>",T13
385,"<p>As far back as the early 1800s, the U.S. Department of the Treasury has issued economic sanctions to achieve foreign&#8230;</p>
<p>The post <a href=""https://www.chainalysis.com/blog/ofac-sanctions/"">OFAC and Crypto Crime: Every OFAC Specially Designated National with Identified Cryptocurrency Addresses</a> appeared first on <a href=""https://www.chainalysis.com"">Chainalysis</a>.</p>",T13
386,"<p>※この記事は自動翻訳されています。正確な内容につきましては原文をご参照ください。 要約 2025年、暗号資産詐欺および不正による被害額は推定170億ドルとなりました。なりすまし詐欺は前年比1,400%の急増を示し、AIを活用した詐欺は従来型の詐欺と比べて約4.5倍の利益をあげています。 大規模な詐欺組織はさらに産業化が進み、フィッシング・アズ・ア・サービス、AI生成ディープフェイク、プロのマネーロンダリングネットワークといった高度なインフラを構築しました。 カンボジアやミャンマーなどの強制労働施設を中心に、東南アジア犯罪ネットワークとの強力な結びつきが確認されており、被害者が詐欺の実行を強要されている事例も多数見つかっています。 法執行機関による過去最大規模の押収が実現し、英国での61,000ビットコイン回収やPrince Group犯罪組織に関連する150億ドルの資産差押えも行われ、暗号資産詐欺対策の能力向上が示されました。 2025年、暗号資産詐欺はオンチェーンベースで少なくとも140億ドルを受領し、2024年に最初に報告した99億ドル（執筆時点で再計算12億ドル）から大きく増加しました。これは当初の2024年予測（124億ドル）とほぼ一致しています。過去の傾向から、年次推計は報告間で平均24%増加しているため、今後さらに多くの不正ウォレットアドレスが特定されるにつれ、2025年の被害額は170億ドル超に達すると見込まれます。 今年のデータからは、詐欺師が手法を巧妙化し続けていることが明らかとなり、1件あたりの平均詐欺送金額は2024年の782ドルから2025年には2,764ドルへと253%増加しました。全体の詐欺流入も大きく増加しており、特になりすまし手法は前年比1,400%という驚異的な伸びを示しています。高利回り投資プログラム（HYIP）やロマンス詐欺（Pig Butchering）が依然として主要カテゴリですが、AIの活用、高度なSMSフィッシングサービス、複雑なマネーロンダリングネットワークを組み合わせることで、被害者をこれまで以上に効率的に標的とする手口の融合が見られます。 詐欺の従来型分類は曖昧になりつつあり、複数の手法（なりすまし、ソーシャルエンジニアリング、技術系・ウォレット系詐欺）が組み合わさるケースが増加しています。 なりすまし詐欺が爆発的に増加 なりすまし詐欺は特に懸念されるトレンドとなっており、2024年比で1,400%以上増加、これらのクラスタへの平均送金額も600%以上増加しました。この手法では、詐欺師が正規組織や権威者になりすまし、被害者をだまして送金させます。 政府なりすまし：E-ZPass詐欺ネットワーク 政府なりすましは、公式連絡への信頼を利用した非常に効果的な手口となっています。2025年には、米国のE-ZP",T4
387,"<p>Chainalysis, the blockchain data platform, today announced an extension of its partnership with long-time customer and partner, BVNK, to integrate&#8230;</p>
<p>The post <a href=""https://www.chainalysis.com/blog/bvnk-partnership-powering-compliance-self-hosted-digital-asset-payments/"">Chainalysis and BVNK Extend Partnership to Power Compliance in Self-Hosted Digital Asset Payments</a> appeared first on <a href=""https://www.chainalysis.com"">Chainalysis</a>.</p>",T13
388,"<p>The next inflection point in AI agents isn't coming from frontier labs. It's coming from infrastructure, specifically, the primitives that let agents find each other, verify identity, and communicate directly. Moltbook, a social network billing itself as &#8220;built exclusively for AI agents… Humans welcome to observe,&#8221; now hosts discussions about agent relay protocols that enable [&#8230;]</p>
<p>The post <a href=""https://cryptoslate.com/thousands-of-ai-agents-join-viral-network-to-teach-each-other-how-to-steal-keys-and-want-bitcoin-as-payment/"">Thousands of AI agents join viral network to “teach” each other how to steal keys and want Bitcoin as payment</a> appeared first on <a href=""https://cryptoslate.com"">CryptoSlate</a>.</p>",T7
389,"<p>DeFi exclusions sound protective, yet the CLARITY Act’s Bank Secrecy expansion may target your access points While supporters say the CLARITY Act could bring long-awaited regulatory certainty to crypto markets, not everyone is on board. Critics argue the bill doesn’t need to “ban DeFi” to reshape it. Their claim is that CLARITY can leave base-layer [&#8230;]</p>
<p>The post <a href=""https://cryptoslate.com/why-the-clarity-act-uses-bank-secrecy-laws-to-quietly-kill-decentralized-access-without-ever-banning-code/"">The CLARITY Act uses Bank Secrecy laws to quietly kill decentralized access without ever banning code</a> appeared first on <a href=""https://cryptoslate.com"">CryptoSlate</a>.</p>",T13
390,"<p>My $49k Bitcoin bear thesis, a January check-in, the plumbing is flashing while price bleeds I wrote my medium-term $49,000 bear thesis in late November with one simple idea, Bitcoin still moves in cycles, and the next real “this is the low” moment tends to arrive when miner economics and flows line up at the [&#8230;]</p>
<p>The post <a href=""https://cryptoslate.com/akibas-bitcoin-49k-bear-thesis-progress-this-82k-dip-looks-worse-when-the-plumbing-is-already-breaking/"">I predicted Bitcoin falling to $49k this year and January delivered some very concerning red flags</a> appeared first on <a href=""https://cryptoslate.com"">CryptoSlate</a>.</p>",T5
391,"<p>On Jan. 30, Cardano founder Charles Hoskinson announced that he has signed an integration agreement to bring USDCx, a Circle-linked stablecoin product, to the Cardano ecosystem. The infrastructure move represents a strategic effort to lower the network’s DeFi growth ceiling by establishing a sustained, reliable flow of on-chain dollar liquidity. In a social media post [&#8230;]</p>
<p>The post <a href=""https://cryptoslate.com/cardano-bets-on-circles-usdcx-to-close-liquidity-gap-and-boost-defi-prospects/"">Cardano secures $70B liquidity injection that finally solves the network&#8217;s biggest missing piece for investors</a> appeared first on <a href=""https://cryptoslate.com"">CryptoSlate</a>.</p>",T5
392,"<p>Gold’s record-breaking rally finally blinked this week, and Bitcoin’s traders are watching what comes next. After sprinting to an all-time high of $5,594.82 per ounce, spot gold slid to around $5,330 as investors took profits, a pullback of roughly 4.7% from the peak. The Kobeissi Letter noted that the precious metal's volatile price performance led [&#8230;]</p>
<p>The post <a href=""https://cryptoslate.com/how-golds-price-dip-may-ignite-a-bitcoin-rally/"">Gold just erased $5.5 trillion in value and Bitcoin bulls see one huge opening ahead</a> appeared first on <a href=""https://cryptoslate.com"">CryptoSlate</a>.</p>",T8
393,"<p>A single wallet roundtripped $142.5 million in unrealized profit on Hyperliquid, peaking on Jan. 13 before collapsing to a negative $8.76 million loss as of Jan. 29. Meanwhile, all of this was visible in real time through public dashboards. The trader built a reputation during October 2025's historic liquidation wave and now operates under a [&#8230;]</p>
<p>The post <a href=""https://cryptoslate.com/october-trump-tariff-trader-just-got-liquidated-loses-140m-erasing-all-10-10-gains/"">October Trump tariff trader loses $100M erasing all 10/10 gains after price dip</a> appeared first on <a href=""https://cryptoslate.com"">CryptoSlate</a>.</p>",T8
394,"<p>Ethereum's most infamous experiment is back. Not as a venture fund, but as something the ecosystem arguably needs more: a permanent security budget. On Jan. 29, a group of Ethereum veterans announced plans to convert roughly 75,000 ETH in decade-old recovery funds into a staked endowment whose yield will finance smart contract security work across [&#8230;]</p>
<p>The post <a href=""https://cryptoslate.com/thedaos-leftover-rescue-money-sat-for-a-decade-now-its-becoming-ethereums-permanent-security-budget/"">TheDAO’s leftover rescue money sat for a decade now it’s becoming Ethereum’s permanent $220M security budget</a> appeared first on <a href=""https://cryptoslate.com"">CryptoSlate</a>.</p>",T5
395,"<p>Bitcoin’s Thursday slide was a perfect illustration of a market that lost its marginal buyer and then discovered, in real time, how much leverage was sitting on top of that demand. The move wasn't a smooth ride lower; it came in sharp legs that pushed the price from $84,400 toward the low-$81,000s in a matter [&#8230;]</p>
<p>The post <a href=""https://cryptoslate.com/etfs-bleed-818m-bitcoin-slides-81k-1-7b-liquidated/"">Bitcoin reversal on the cards after $1.7 billion liquidation wave flushed out overleveraged traders</a> appeared first on <a href=""https://cryptoslate.com"">CryptoSlate</a>.</p>",T5
396,"<p>On Jan. 29, the Senate Agriculture Committee advanced the crypto market-structure bill, giving the legislation known as the &#8220;CLARITY Act&#8221; its first concrete win in the Senate. The Agriculture panel’s action moves the bill closer to a full Senate fight over which regulator sets the rules for spot crypto markets. However, the bigger near-term problem [&#8230;]</p>
<p>The post <a href=""https://cryptoslate.com/us-senate-advances-new-crypto-law-yet-clarity-gridlock-might-kill-the-bill-for-good/"">US Senate advances new crypto law yet CLARITY gridlock might kill the bill for good</a> appeared first on <a href=""https://cryptoslate.com"">CryptoSlate</a>.</p>",T13
397,"<p>This is a familiar story for those who have been in crypto for a while. Bitcoin crashes, rebounds, and a few altcoins follow after. Yet, that small- or medium-cap crypto with promising fundamentals never followed through. The question investors won't say aloud: Why did my token never catch the recovery bid? The answer has less [&#8230;]</p>
<p>The post <a href=""https://cryptoslate.com/altcoins-wont-recover-when-bitcoin-finally-rebounds-and-heres-why/"">Altcoins outside the top 10 won&#8217;t recover when Bitcoin finally rebounds, and here&#8217;s why</a> appeared first on <a href=""https://cryptoslate.com"">CryptoSlate</a>.</p>",T5
398,"<p style=""float: right; margin: 0 0 10px 15px; width: 240px;""><img alt=""US Treasury sanctions Iran-linked crypto exchanges for first time"" class=""type:primaryImage"" src=""https://images.cointelegraph.com/images/528_aHR0cHM6Ly9zMy5jb2ludGVsZWdyYXBoLmNvbS91cGxvYWRzLzIwMjYtMDEvMDE5YzEzODUtN2NkMC03MWQyLWFlN2ItZTIwZGQwZmFhNjZjLmpwZw==.jpg"" /></p><p>The US Treasury has sanctioned two UK-registered crypto exchanges tied to Iran’s financial system, marking the first time Washington has targeted digital asset platforms.</p>",T13
399,"<p style=""float: right; margin: 0 0 10px 15px; width: 240px;""><img alt=""Crypto billionaires deploy $40M to fight California wealth tax and union power"" class=""type:primaryImage"" src=""https://images.cointelegraph.com/images/528_aHR0cHM6Ly9zMy5jb2ludGVsZWdyYXBoLmNvbS91cGxvYWRzLzIwMjYtMDEvMDE5YzEzMTItYjEwNC03MTkwLTk5NWEtZTVlNzQyZjU0M2VlLmpwZw==.jpg"" /></p><p>Ripple co-founder Chris Larsen and venture capitalist Tim Draper are backing Grow California, a new political effort aimed at countering union-backed wealth tax proposals.</p>",T5
400,"<p style=""float: right; margin: 0 0 10px 15px; width: 240px;""><img alt=""$1.82B pulled from spot Bitcoin and Ether ETFs amid metals rally"" class=""type:primaryImage"" src=""https://images.cointelegraph.com/images/528_aHR0cHM6Ly9zMy5jb2ludGVsZWdyYXBoLmNvbS91cGxvYWRzLzIwMjYtMDEvMDE5YzEzM2EtMTcwMi03ZjJlLWJjMTQtYTY2MGFkZmVhZDIwLmpwZw==.jpg"" /></p><p>ETF analyst Eric Balchunas said many people seem to be forgetting that Bitcoin “spanked everything so bad” in 2023 and 2024, while other asset classes “still haven’t caught up.”</p>",T5
401,"<p style=""float: right; margin: 0 0 10px 15px; width: 240px;""><img alt=""Coinbase insider trading lawsuit against Armstrong, directors moves forward"" class=""type:primaryImage"" src=""https://images.cointelegraph.com/images/528_aHR0cHM6Ly9zMy5jb2ludGVsZWdyYXBoLmNvbS91cGxvYWRzLzIwMjYtMDEvMDE5YzEyZDktNmJiNi03Y2JiLWI5YTYtZDNmOWJlMmVhMjdkLmpwZw==.jpg"" /></p><p>The lawsuit alleges Marc Andreessen sold $118.7 million in Coinbase shares through Andreessen Horowitz, while CEO Brian Armstrong offloaded about $291.8 million.</p>",T5
402,"<p style=""float: right; margin: 0 0 10px 15px; width: 240px;""><img alt=""Lingering extreme fear in crypto is a 'strong bullish' sign: Santiment"" class=""type:primaryImage"" src=""https://images.cointelegraph.com/images/528_aHR0cHM6Ly9zMy5jb2ludGVsZWdyYXBoLmNvbS91cGxvYWRzLzIwMjYtMDEvMDE5YzEyNTgtMzFkMy03MzM0LWI2ZDUtODU4NjA4ODRmOGQ0LmpwZw==.jpg"" /></p><p>Crypto sentiment platform Santiment said the “silver lining” in the current crypto market is the “extreme negativity” seen on social media.</p>",T5
403,"<p style=""float: right; margin: 0 0 10px 15px; width: 240px;""><img alt=""Tether US treasury holdings reach record highs; profits fall 23% year-on-year"" class=""type:primaryImage"" src=""https://images.cointelegraph.com/images/528_aHR0cHM6Ly9zMy5jb2ludGVsZWdyYXBoLmNvbS91cGxvYWRzLzIwMjUtMTIvMDE5YWVmY2EtMzMxMC03NTcxLWIwMjYtZGI2NTg2ODQzYmM2.jpg"" /></p><p>Tether CEO Paolo Ardoino said the “structure behind” the company’s growth mattered more than its “scale” in 2025, as US Treasury holdings surpassed $122 billion.</p>",T8
404,"<p style=""float: right; margin: 0 0 10px 15px; width: 240px;""><img alt=""Bitcoin options turn bearish as BTC flirts with drop below $80K"" class=""type:primaryImage"" src=""https://images.cointelegraph.com/images/528_aHR0cHM6Ly9zMy5jb2ludGVsZWdyYXBoLmNvbS91cGxvYWRzLzIwMjUtMTIvMDE5YjI0MjgtNDQwNy03YjY1LWI3NDQtZjc5MGMxMjg4ZTQwLkpQRw==.jpg"" /></p><p>Bitcoin options flashed extreme fear signals as the spot BTC ETF outflows rose, and the odds for a drop below $80,000 increased. Will dip buyers step in to save the day?</p>",T8
405,"<p style=""float: right; margin: 0 0 10px 15px; width: 240px;""><img alt=""Here’s what happened in crypto today"" class=""type:primaryImage"" src=""https://images.cointelegraph.com/images/528_aHR0cHM6Ly9zMy5jb2ludGVsZWdyYXBoLmNvbS91cGxvYWRzLzIwMjUtMDYvMDE5Nzk0MjMtZWY4ZS03YzYwLWI5MzctYjlkZGY3NWZlOGFk.jpg"" /></p><p>Need to know what happened in crypto today? Here is the latest news on daily trends and events impacting Bitcoin price, blockchain, DeFi, NFTs, Web3 and crypto regulation.</p>",T5
406,"<p style=""float: right; margin: 0 0 10px 15px; width: 240px;""><img alt=""SoFi posts record Q4 revenue after reentering crypto market"" class=""type:primaryImage"" src=""https://images.cointelegraph.com/images/528_aHR0cHM6Ly9zMy5jb2ludGVsZWdyYXBoLmNvbS91cGxvYWRzLzIwMjYtMDEvMDE5YzExM2ItNTE0My03Mjg4LThjOTAtNjFmNThkNjA2MjZhLmpwZw==.jpg"" /></p><p>The fintech bank reported record quarterly revenue of $1 billion as it reintroduced crypto trading, launched a stablecoin and rolled out blockchain-based remittances.</p>",T5
407,"<p style=""float: right; margin: 0 0 10px 15px; width: 240px;""><img alt=""European Commission calls on 12 countries to implement crypto tax rules"" class=""type:primaryImage"" src=""https://images.cointelegraph.com/images/528_aHR0cHM6Ly9zMy5jb2ludGVsZWdyYXBoLmNvbS91cGxvYWRzLzIwMjUtMTIvMDE5YWY0YWItZjFhYi03YWY1LThlM2QtODE0NTQyMDQ1OWNi.jpg"" /></p><p>The commission also singled out Hungary for failing to comply with the EU's MiCA framework after an amendment to a local law.</p>",T13
408,"<p style=""float: right; margin: 0 0 10px 15px; width: 240px;""><img alt=""Gold is acting like the hedge Bitcoin promised to be"" class=""type:primaryImage"" src=""https://images.cointelegraph.com/images/528_aHR0cHM6Ly9zMy5jb2ludGVsZWdyYXBoLmNvbS91cGxvYWRzLzIwMjUtMTIvMDE5YjY1ZGEtZTk2MC03ODFkLTk2OGEtZWZkMzQ1MTVhN2EwLmpwZw==.jpg"" /></p><p>As the dollar weakens, investors are turning to gold — onchain and off — while Bitcoin increasingly plays a supporting role in hedging currency risk.</p>",T8
409,"<p style=""float: right; margin: 0 0 10px 15px; width: 240px;""><img alt=""Changpeng Zhao rejects claims Binance worsened crypto market crash"" class=""type:primaryImage"" src=""https://images.cointelegraph.com/images/528_aHR0cHM6Ly9zMy5jb2ludGVsZWdyYXBoLmNvbS91cGxvYWRzLzIwMjYtMDEvMDE5YzEwOGItNDY1Zi03MWNmLTlhYTAtMWNkNWVkYWVjZjBkLmpwZw==.jpg"" /></p><p>CZ pushed back on claims that Binance fueled October’s historic $19 billion crypto liquidation event, calling allegations against the exchange “far-fetched.”</p>",T5
410,"<p style=""float: right; margin: 0 0 10px 15px; width: 240px;""><img alt=""Coinbase, JPMorgan CEOs clashed over market structure bill at Davos: Report"" class=""type:primaryImage"" src=""https://images.cointelegraph.com/images/528_aHR0cHM6Ly9zMy5jb2ludGVsZWdyYXBoLmNvbS91cGxvYWRzLzIwMjYtMDEvMDE5YzEwNDctYWI2OC03MGRkLTlhMTMtOWIzZGJmNDA0ZGExLmpwZw==.jpg"" /></p><p>Brian Armstrong made the media rounds before and after he announced Coinbase was pulling its support for a major US crypto bill, reportedly facing off with Jamie Dimon in Davos.</p>",T5
411,"<p style=""float: right; margin: 0 0 10px 15px; width: 240px;""><img alt=""Bitcoin futures imbalance may spark liquidation revenge rally to $90K"" class=""type:primaryImage"" src=""https://images.cointelegraph.com/images/528_aHR0cHM6Ly9zMy5jb2ludGVsZWdyYXBoLmNvbS91cGxvYWRzLzIwMjYtMDEvMDE5YzBmN2EtNDZlYi03MjJiLWI3MzMtZjE3Y2IwNDdiNjMwLmpwZw==.jpg"" /></p><p>Bitcoin short positions continued to pile up as BTC price dropped near $81,000, potentially providing the liquidation fuel for a revenge rally back above $90,000.</p>",T5
412,"<p style=""float: right; margin: 0 0 10px 15px; width: 240px;""><img alt=""Kraken-backed SPAC raises $345M in upsized Nasdaq IPO"" class=""type:primaryImage"" src=""https://images.cointelegraph.com/images/528_aHR0cHM6Ly9zMy5jb2ludGVsZWdyYXBoLmNvbS91cGxvYWRzLzIwMjYtMDEvMDE5YzEwMWYtYzYxNC03Y2JiLWJlYzQtYTdjZmJiNGQwYmQ2LmpwZw==.jpg"" /></p><p>The blank-check company has yet to name an acquisition target, but the listing creates a new public vehicle tied to the US-based crypto exchange.</p>",T5
413,"<p style=""float: right; margin: 0 0 10px 15px; width: 240px;""><img alt=""DeFi stays outside the rules as regulators tighten elsewhere: Finance Redefined"" class=""type:primaryImage"" src=""https://images.cointelegraph.com/images/528_aHR0cHM6Ly9zMy5jb2ludGVsZWdyYXBoLmNvbS91cGxvYWRzLzIwMjUtMTIvMDE5YWU3YzktNzc2OS03ZjJjLWJiNzUtMmMyMTA4ZDRjNjY2.jpg"" /></p><p>Europe narrows crypto tax gaps, US lawmakers revisit market structure, and institutions push DeFi into compliance territory.</p>",T5
414,"<p style=""float: right; margin: 0 0 10px 15px; width: 240px;""><img alt=""Price predictions 1/30: BTC, ETH, BNB, XRP, SOL, DOGE, ADA, BCH, HYPE, XMR"" class=""type:primaryImage"" src=""https://images.cointelegraph.com/images/528_aHR0cHM6Ly9zMy5jb2ludGVsZWdyYXBoLmNvbS91cGxvYWRzLzIwMjYtMDEvMDE5YzBmYzQtYWFiNC03MGMyLWFjNmMtYjI4NGUwMzllY2VjLmpwZw==.jpg"" /></p><p>Technical charts tilt toward further downside for Bitcoin and altcoins if BTC’s critical $80,000 fails to hold. Does data suggest that bulls are buying the dips?</p>",T8
415,"<p style=""float: right; margin: 0 0 10px 15px; width: 240px;""><img alt=""Why proof-of-reserves alone doesn’t build real trust"" class=""type:primaryImage"" src=""https://images.cointelegraph.com/images/528_aHR0cHM6Ly9zMy5jb2ludGVsZWdyYXBoLmNvbS91cGxvYWRzLzIwMjYtMDEvMDE5YzEwMmMtN2U5Yi03YzJlLTlhMTAtMTgzYTMwZjg3YTFiLmpwZw==.jpg"" /></p><p>Proof-of-reserves shows assets at a single point in time, but it does not prove solvency, liquidity or sound governance. Here is what PoR misses and what real trust looks like.</p>",T5
416,"<p style=""float: right; margin: 0 0 10px 15px; width: 240px;""><img alt=""Liquidations knock Bitcoin out of world’s top 10 assets"" class=""type:primaryImage"" src=""https://images.cointelegraph.com/images/528_aHR0cHM6Ly9zMy5jb2ludGVsZWdyYXBoLmNvbS91cGxvYWRzLzIwMjYtMDEvMDE5YzBmOGEtMDIxMy03YTZjLWIyYTctZGVkMjE0ZDQxMjFmLmpwZw==.jpg"" /></p><p>A wave of leveraged liquidations erased hundreds of billions in value, reshuffling Bitcoin’s standing among the world’s largest investable assets.</p>",T5
417,"<p style=""float: right; margin: 0 0 10px 15px; width: 240px;""><img alt=""Hong Kong regulators to submit draft bill for crypto framework in 2026"" class=""type:primaryImage"" src=""https://images.cointelegraph.com/images/528_aHR0cHM6Ly9zMy5jb2ludGVsZWdyYXBoLmNvbS91cGxvYWRzLzIwMjYtMDEvMDE5YmRhOTUtY2IyZC03YzRlLWIzMDYtMDQ0ZDllZGM1MjQ3LmpwZw==.jpg"" /></p><p>An official said that Hong Kong authorities would work on a draft framework, and had begun processing license applications for stablecoin issuers and addressing crypto taxes.</p>",T5
