id,text,topic_id
161,"Entering 2026, managers to watch include giants with new products like Point72 and players making a name for themselves, like Ning Jin's Avantyr.",T8
162,Alex Yang details founding an AI startup with other high schoolers worldwide to improve Alzheimer's diagnostics.,T0
163,"After being laid off by Oracle, Clair Todd has spent about two years job hunting, reselling antiques, and rethinking her pivot to the tech industry.",T6
164,"It's been a hot year for healthcare venture investment. Backers said they expect investments in AI cost savings in 2026, plus more M&A &mdash; but not IPOs.",T0
165,"Jillian Richardson offers professional LinkedIn makeovers, and she has 4 tips on how to brag more on your profile.",T6
166,America's largest city wanted to get rid of illegal weed shops. Then came the SWAT teams.,T2
167,Overachievers and anxious workers are turning the Sunday scaries into an extra day of work.,T6
168,"Former Meta chief AI scientist Yann LeCun said current and prospective CS students need to focus on skills ""with a long shelf life.""",T0
169,Diameter Capital Partners made successful telecom and satellite bets as AI demand spread beyond chips.,T1
170,An AI security researcher says companies lack the talent to handle AI security problems &mdash; and traditional cybersecurity teams aren't enough.,T0
171,"Outside the gym, Martha Stewart says she tries to stay active by walking, gardening, and working.",T6
172,"At a revised 984 feet, the new Turkish ship would approach the length range of the American Nimitz and Ford-class carriers.",T11
173,The US is now reviewing the social media of some visa applicants. Several major tech companies are warning visa holders not to leave the country.,T7
174,"Karen Gilchrist jokes that her ""maternal instincts kicked in late,"" but by 2024 she and her husband, Pablo Slough, decided to prioritize family over climbing the corporate ladder.",T6
175,A widespread power outage in San Francisco affected thousands of residents. It also left Waymo robotaxis stalled on city streets.,T2
176,"Jonas Koh fulfilled his dream of starting a nasi lemak hawker stall. But in an area filled with a frugal older crowd, he's struggling to get sales up.",T7
177,"Lee Wan Yu, a former Disneyland parade dancer, shares a behind-the-scenes look at the audition process and what she learned from Disney's magic.",T8
178,"As iRobot's founder Colin Angle looks back on its path to bankruptcy, he says it was hard to overcome competitors in China.",T1
179,"Risk.net’s guide to the world’s leading quant master’s programmes, with the top 25 schools ranked",T0
180,"View interactive charts from Risk.net’s 46-bank study, covering ALM governance, balance-sheet strategy, stress-testing, technology and regulation",T12
181,Brokers’ own resources are outpaced by customer funds,T5
182,Liquidity and rate risks are as old as banking; but the 46 banks in our benchmarking study have different ways to manage them,T12
183,"Lack of transparent price validation data for FX forwards and swaps is holding back buy side, Vanguard’s head of FX says",T4
184,Some members not ready to commit to 2026 start date; rival FICC enhances services,T14
185,"Helaba remains the most exposed among peers, with both residential and commercial books linked heavily to climate risks",T6
186,Current CRO Edward Fishwick will be head of research at BlackRock’s RQA group,T7
187,Sharp rise in uncollateralised buy-side hedges could restrict banks’ ability to take on positions,T12
188,"The authors assess the fungibility of stablecoins, arguing that this can be equivalent to that of traditional bank deposits if  payment and settlement technologies are interoperable.",T12
189,Buy-siders doubt consent requirement will remove long-standing concerns,T10
190,Drop to 13% envisages 0.5pp decline in Pillar 2 add-ons after Basel III,T1
191,"Columbia jumps to third place, ETH-UZH tops European rivals",T1
192,The authors put forward a taxonomy for combined crises where up to four accompanying crises are apparent and how their interactions might impact firm profitability.,T11
193,How Apac compliance leaders are preparing for the next era of AI-driven oversight,T0
194,A pricing model is extended to account for negative interest rates or convenience yields,T3
195,"Investors bet Zions, Western Alliance are isolated problems, but credit risk managers are nervous",T12
196,How one firm cut loan processing times and improved fraud detection without compromising on governance,T12
197,Smallest ever distance between two countries in FSB assessment after China surges 160bp,T1
198,The latest vessel to be targeted by the United States in its pressure campaign on Venezuela was sending distress signals as it headed northeast from the Caribbean into the Atlantic.,T11
199,Economists say that a typical middle-class family today is richer than one in the 1960s. Americans in their 20s and 30s don’t believe it.,T13
200,"A reordering of the rules of trade, set on top of transformational change in technology, demographics and climate, is remaking jobs, politics and lives.",T13
201,"Data collection issues skewed the latest Consumer Price Index report, economists warned, clouding the picture for the Federal Reserve as it also grapples with a cooling labor market.",T3
202,"With tariffs unpopular and prices still high, the White House has teased the promise of tariff rebates and large tax refunds next year.",T3
203,The Trump administration singled out European tech firms by name and promised economic consequences Tuesday unless the E.U. rolls back tech regulation and lawsuits.,T11
204,The Trump administration looked to recast elements of a dour jobs report Tuesday as a sign of strength.,T13
205,"A proposal to revise an E.U. law requiring carmakers to stop producing combustion engines by 2035 would offer some relief to automakers, but it sets back the region’s climate goals.",T13
206,"Employers added 64,000 jobs in November, according to data delayed by the government shutdown, but the unemployment rate rose to a four-year high of 4.6 percent.",T13
207,The U.S. government has paused a tech-focused trade pledge with Britain over broader disagreements about Britain’s digital regulations and food safety rules.,T11
208,California and New York are among the states arguing that the Trump administration’s decision to charge that fee for skilled foreign workers is illegal.,T11
209,Corporate tax revenue has quickly dipped since Republicans passed tax cuts this summer. But economists think these tax breaks might be worth it.,T3
210,Fed officials explained their opposition to the central bank’s decision this week to cut interest rates by a quarter of a percentage point.,T10
211,The monthly trade deficit fell to its lowest level in five years after the president’s imposition of sweeping global tariffs. But it’s unclear whether the trend will persist.,T3
212,The president continues to brush off an issue that he said he would solve in his first months in office. Some Democrats say he is making the same mistake as his predecessor.,T3
213,"The central bank’s decision to lower interest rates for a third straight meeting was highly contentious, reflecting an internal divide that will likely limit how much borrowing costs will fall next year.",T12
214,President Trump’s decision to allow Nvidia to sell its chips to China has raised questions about whether he is prioritizing short-term economic gain over long-term American security interests.,T11
215,Silicon Valley is again betting everything on a new technology. But the mania is not a reboot of the late-1990s frenzy.,T0
216,The president rolled out a $12 billion bailout for farmers as he makes the case that his policy is working — or will soon.,T3
217,The chair of the central bank is dealing with internal divisions while being besieged by President Trump and front-runners jockeying to replace him.,T12
218,"A feared recession didn’t materialize, but unemployment rose, wage growth slowed and affordability challenges are mounting.",T13
219,"Our reporter, Emily Steel, found that in many states, Uber’s guidelines allow people with serious criminal convictions to drive, as long as those convictions are more than seven years old. Some of those drivers have gone on to sexually assault or harass passengers.",T0
220,"The ride-hailing giant’s background check process was intended to speed drivers onto its network while keeping costs down, internal documents show.",T7
221,"For several months, we have been investigating sexual violence during Uber and Lyft rides, which is far more pervasive than publicly disclosed. Now, we need your help.",T0
222,"Sharyn Alfonsi, a “60 Minutes” correspondent, criticized the network’s decision to remove her reporting from Sunday’s edition of the show.",T7
223,"A paraplegic engineer was part of a crew that made a suborbital journey on a spacecraft operated by Jeff Bezos’ private company, Blue Origin.",T0
224,"“Avatar: Fire and Ash” took in $88 million over the weekend, a sizable No. 1 total that nonetheless fell 34 percent behind the opening for its franchise predecessor.",T8
225,"Ynon Kreiz, the chief executive of Mattel, believes consumers squeezed by tariffs and inflation will cut back on other things before they skimp on Barbies and Hot Wheels.",T3
226,"Inside a tornado-hardened office in Texas, 1,700 American Airlines employees manage the carrier’s operations, responding to bad weather, plane trouble and ailing passengers.",T11
227,"Two high-profile crashes and a Trump administration crackdown have brought worry, and wariness, to the community.",T11
228,"The festive fairs have become vital to the success of many artists and retailers. But the booths are expensive, and the payoffs aren’t guaranteed.",T8
229,The attacker killed at last week’s Hanukkah celebration in Australia came from a Muslim area whose residents have long gone abroad to seek better lives.,T2
230,The hourslong outage affected nearly a third of the city and forced the closure of transit stations. Service was restored for most customers late Saturday.,T7
231,"A major player in the block-trading boom, he left Wall Street for the art world, winning a Jeff Koons sculpture at auction for $91 million in 2019.",T4
232,"President Trump’s trade policy, inflation and climbing stock prices shaped business and the economy this year.",T3
233,"In trying to help grown children, parents can hurt their own retirement security. Here’s how to stop the flow of money.",T6
234,"A state judge had invalidated the package, saying shareholders were not properly informed about it. Friday’s ruling cleared the plan, now worth $139 billion.",T5
235,"The basketball league will require teams to submit injury reports closer to tipoff, an attempt to close one source of inside information.",T6
236,Tree farmers and the marketing group that supports them want more Americans to buy live-cut trees. A new Home Depot ad gave them holiday hope.,T11
237,Regulators will decide whether a merger of Union Pacific and Norfolk Southern would improve shipment times or stifle competition. A decision is expected in 2027.,T13
238,Our analysis shows how the odds of working change as you change -- and some surprising recent shifts in who’s most likely to work at home.,T6
239,"Problems in the oil sector, a possible banking crisis and consumer woes lie ahead for Russia’s economy as four years of heavy military spending come due.",T3
240,CBS News postponed a ‘60 Minutes’ segment about El Salvador’s CECOT prison one day before it was set to air because the Trump administration declined to participate.,T7
241,"Treasury Secretary Scott Bessent’s partisan comments are causing concern among investors and lawmakers, as he breaks with tradition and engages in combative rhetoric.",T5
242,The future of U.S. manufacturing may hinge on whether craft can bridge a generational divide.,T13
243,Tax experts are urging Congress to shut down an arcane IRS reporting requirement that could make the savings vehicles too burdensome for most parents.,T6
244,Baby boomers and Gen Xers are taking steps to ensure their children aren’t left with the financial and emotional toll of caretaking.,T6
245,Our analysis shows how the odds of working change as you change -- and some surprising recent shifts in who’s most likely to work at home.,T6
246,"Problems in the oil sector, a possible banking crisis and consumer woes lie ahead for Russia’s economy as four years of heavy military spending come due.",T3
247,CBS News postponed a ‘60 Minutes’ segment about El Salvador’s CECOT prison one day before it was set to air because the Trump administration declined to participate.,T7
248,"Treasury Secretary Scott Bessent’s partisan comments are causing concern among investors and lawmakers, as he breaks with tradition and engages in combative rhetoric.",T5
249,The future of U.S. manufacturing may hinge on whether craft can bridge a generational divide.,T13
250,Tax experts are urging Congress to shut down an arcane IRS reporting requirement that could make the savings vehicles too burdensome for most parents.,T6
251,Baby boomers and Gen Xers are taking steps to ensure their children aren’t left with the financial and emotional toll of caretaking.,T6
252,"The Trump administration has pursued a staggering range of policy pivots this past year that threaten to weaken the nation’s ability and willingness to address a broad spectrum of technology challenges, from cybersecurity and privacy to countering disinformation, fraud and corruption. These shifts, along with the president’s efforts to restrict free speech and freedom of the press, have come at such a rapid clip that many readers probably aren’t even aware of them all.",T7
253,"Direct navigation -- the act of visiting a website by manually typing a domain name in a web browser -- has never been riskier: A new study finds the vast majority of ""parked"" domains -- mostly expired or dormant domain names, or common misspellings of popular websites -- are now configured to redirect visitors to sites that foist scams and malware.",T7
254,"Microsoft today pushed updates to fix at least 56 security flaws in its Windows operating systems and supported software. This final Patch Tuesday of 2025 tackles one zero-day bug that is already being exploited, as well as two publicly disclosed vulnerabilities.",T2
255,A sprawling academic cheating network turbocharged by Google Ads that has generated nearly $25 million in revenue has curious connections to a Kremlin-connected oligarch whose Russian university builds drones for Russia's war against Ukraine.,T0
256,"China-based phishing groups blamed for non-stop scam SMS messages about a supposed wayward package or unpaid toll fee are promoting a new offering, just in time for the holiday shopping season: Phishing kits for mass-creating fake but convincing e-commerce websites that convert customer payment card data into mobile wallets from Apple and Google. Experts say these same phishing groups also are now using SMS lures that promise unclaimed tax refunds and mobile rewards points.",T7
257,"A prolific cybercriminal group that calls itself ""Scattered LAPSUS$ Hunters"" made headlines regularly this year by stealing data from and publicly mass extorting dozens of major corporations. But the tables seem to have turned somewhat for ""Rey,"" the moniker chosen by the technical operator and public face of the hacker group: Earlier this week, Rey confirmed his real life identity and agreed to an interview after KrebsOnSecurity tracked him down and contacted his father.",T2
258,"On the surface, the Superbox media streaming devices for sale at retailers like BestBuy and Walmart may seem like a steal: They offer unlimited access to more than 2,200 pay-per-view and streaming services like Netflix, ESPN and Hulu, all for a one-time fee of around $400. But security experts warn these TV boxes require intrusive software that forces the user's network to relay Internet traffic for others, traffic that is often tied to cybercrime activity such as advertising fraud and account takeovers.",T8
259,"In March 2024, Mozilla said it was winding down its collaboration with Onerep -- an identity protection service offered with the Firefox web browser that promises to remove users from hundreds of people-search sites -- after KrebsOnSecurity revealed Onerep's founder had created dozens of people-search services and was continuing to operate at least one of them. Sixteen months later, however, Mozilla is still promoting Onerep. This week, Mozilla announced their partnership with Onerep will officially end next month.",T7
260,An intermittent outage at Cloudflare on Tuesday briefly knocked many of the Internet's top destinations offline. Some affected Cloudflare customers were able to pivot away from the platform temporarily so that visitors could still access their websites. But security experts say doing so may have also triggered an impromptu network penetration test for organizations that have come to rely on Cloudflare to block many types of abusive and malicious traffic.,T2
261,"Microsoft this week pushed security updates to fix more than 60 vulnerabilities in its Windows operating systems and supported software, including at least one zero-day bug that is already being exploited. Microsoft also fixed a glitch that prevented some Windows 10 users from taking advantage of an extra year of security updates, which is nice because the zero-day flaw and other critical weaknesses patched today affect all versions of Windows, including Windows 10.",T2
262,"The company suffered one sophisticated five-alarm campaign and one messy spray-and-pray attack, mere days apart.",T2
263,New China-aligned APT group is deploying Group Policy to sniff through government networks across Southeast Asia and Japan.,T0
264,"Reports of patients being cared for by unqualified home-care aides with fake identities continue to emerge, highlighting a need for more stringent identity authentication.",T6
265,"AI adds real value to cybersecurity today, but it cannot yet serve as a single security guardian. Here's how organizations can safely combine AI-driven analysis with deterministic rules and proven security practices.",T0
266,"North Korea shifted its strategy to patiently target &quot;bigger fish&quot; for larger payouts, using sophisticated methods to execute attacks at opportune times.",T7
267,"In the latest attacks against the vendor's SMA1000 devices, threat actors have chained a new zero-day flaw with a critical vulnerability disclosed earlier this year.",T2
268,&quot;Prince of Persia&quot; has rewritten the rules of persistence with advanced operational security and cryptographic communication with its command-and-control server.,T2
269,"Attackers are targeting admin accounts, and once authenticated, exporting device configurations including hashed credentials and other sensitive information.",T2
270,"Anthropic proves that LLMs can be fairly resistant to abuse. Most developers are either incapable of building safer tools, or unwilling to invest in doing so.",T2
271,The remote access Trojan lets an attacker remotely control a victim's phone and can generate malicious apps from inside the Play Store.,T2
272,"The future of cybersecurity means defending everywhere. Securing IoT, cloud, and remote work requires a unified edge-to-cloud strategy. (First in a three-part series.)",T2
273,"In the React2Shell saga, nonworking and trivial proof-of-concept exploits led to confusion and perhaps a false sense of security. Can the onslaught of PoCs be tamed?",T2
274,"As quantum computing advances, secure, interoperable standards will be critical to making quantum key distribution (QKD) practical, trusted, and future-proof.",T4
275,Threat actors wielding stolen AWS Identity and Access Management (IAM) credentials leverage Amazon EC and EC2 infrastructure across multiple customer environments.,T2
276,"Rapid digitization, uneven cybersecurity know-how, and growing cybercriminal syndicates in the region have challenged law enforcement and prosecutors.",T2
277,A high-school student is tackling the overlooked risk of AI-generated satellite imagery that could mislead governments and emergency responders.,T0
278,"The key elements in a security operations center's strategy map align closely to the swim/bike/run events in a triathlon. SOCs, like triathletes, perform well when their &quot;inputs&quot; are strong.",T0
279,"But media reports described the attack as causing major disruption to PDVSA, the state-owned oil and natural gas company.",T8
280,"Amazon detailed a long-running campaign by Russia against critical infrastructure organizations, particularly in the energy sector.",T0
281,"Urban VPN Proxy, which claims to protect users' privacy, collects data from conversations with ChatGPT, Claude, Gemini, Copilot, and other AI assistants.",T0
282,"New GPT Image 1.5 allows more detailed conversational image editing, for better or worse.",T0
283,"The extensions, available for Chromium browsers, harvest full AI conversations over months.",T0
284,Dictionary codifies the term that took hold in 2024 for low-quality AI-generated content.,T0
285,The weak RC4 for administrative authentication has been a hacker holy grail for decades.,T2
286,"Shenzhen-based Picea Robotics, its lender and primary supplier, will acquire all of iRobot’s shares.",T1
287,"""The vast majority of Codex is built by Codex,"" OpenAI told us about its new AI coding agent writing code.",T0
288,Company claims new AI model tops Gemini and matches humans on 70% of work tasks.,T0
289,"Three-year deal lets users create AI videos of Mickey Mouse, Darth Vader, and more.",T0
290,Company raises its capital expenditure forecast as it doubles down on AI infrastructure bet.,T1
291,"Devstral 2 model scores 72% on industry benchmark, nearing proprietary rivals.",T8
292,“Abandonment” offers rare chance to reclaim one of tech’s most recognized brands.,T6
293,"Facebook agrees to change ""pay or consent"" model after talks with European Commission.",T10
294,Defendants were convicted of similar crimes a decade ago. How were they cleared again?,T2
295,Open source React executes malicious code with malformed HTML—no authentication needed.,T2
296,"Report: Microsoft declared ""the era of AI agents"" in May, but enterprise customers aren't buying.",T0
297,"Researchers say there's more to the network, which has operated for 14 years.",T0
298,"Three years after Google sounded alarm bells over ChatGPT, the tables have turned.",T0
299,New research offers clues about why some prompt injection attacks may succeed.,T2
300,"Product development, internal operations among teams expected to be hit hardest.",T11
301,"Several companies are selling crypto stockpiles in effort to fund share buybacks, shore up stock prices.",T9
302,"As ordered reported by the House Committee on Foreign Affairs on December 3, 2025",T14
303,"As ordered reported by the House Committee on Foreign Affairs on December 3, 2025",T14
304,"As ordered reported by the House Committee on Foreign Affairs on December 3, 2025",T14
305,"As ordered reported by the House Committee on Foreign Affairs on December 3, 2025",T14
306,"CBO announces what to expect in the coming weeks as the agency begins the new calendar year with a series of reports that offers updated insights into the nation's demographic trends, economic outlook, and budgetary conditions.",T3
307,"As ordered reported by the Senate Committee on Commerce, Science, and Transportation on October 21, 2025",T14
308,"As ordered reported by the Senate Committee on Commerce, Science, and Transportation on October 21, 2025",T14
309,"As introduced in the House of Representatives on December 12, 2025",T14
310,"As reported by the House Committee on the Judiciary on December 12, 2025",T14
311,The Majority Leader of the House of Representatives announces bills that will be considered under suspension of the rules in that chamber. CBO estimates the effects of those bills on direct spending and revenues.,T14
312,"CBO finds that maintenance for Navy destroyers and amphibious warfare ships has often taken longer and required more labor than planned. Those delays affect the fleet's readiness and reflect aging ships, late inspections, and other factors.",T13
313,"As reported by the House Committee on Energy and Commerce on October 3, 2025",T14
314,"Rules Committee Print 119-16, As Posted on the Website of the House Committee on Rules on December 7, 2025",T14
315,"The federal budget deficit totaled $439 billion in October and November 2025, the first two months of fiscal year 2026, CBO estimates. That amount is $185 billion less than the deficit recorded during the same period last fiscal year.",T3
316,"As ordered reported by the House Committee on Oversight and Government Reform on December 2, 2025",T14
317,"As ordered reported by the House Committee on Oversight and Government Reform on 
December 2, 2025",T14
318,"As ordered reported by the House Committee on Oversight and Government Reform on December 2, 2025",T14
319,"As ordered reported by the House Committee on Oversight and Government Reform on 
December 2, 2025",T14
320,"Our FRED graph above shows one of the all-star statistics for the US economy: industrial production. It&#8217;s a compelling data series for at least two reasons. It measures something people can relate to—the production of tangible stuff. The data are &#8230; <a href=""https://fredblog.stlouisfed.org/2025/12/us-industrial-production/"">Continue reading <span class=""meta-nav"">&#8594;</span></a>",T13
