id,text,topic_id
0,“I am 66 years old and have been retired for about a year and a half.”,T2
1,"“Can someone who has not been found legally incompetent, but who has a history of delusions, make decisions regarding property?”",T2
2,"There are structural tailwinds favoring silver, plus potential export restrictions by the U.S. and China that could tighten the stretched physical market even further.",T5
3,Kylie Jenner is offloading her Los Angeles concrete megamansion for $48 million after finishing building her sprawling Hidden Hills property.,T5
4,"“Property Brothers” star Jonathan Scott and actress Zooey Deschanel, who got engaged in 2023, have decked the halls of their sprawling Los Angeles home.",T0
5,Giant tech companies are closing the year with a flurry of deals as they position for further advances in artificial intelligence.,T0
6,Lululemon founder and large shareholder Chip Wilson is looking to restore investor faith in the yoga-gear maker by changing the makeup of the board of directors.,T0
7,"Prices for some everyday home items may be about to get more expensive, as U.S. tariff rates on imports of certain furniture and kitchen cabinets are set to rise beginning Thursday.",T1
8,“She is an intelligent and responsible individual.”,T2
9,“I’m almost 50 years old. Enough is enough. I am exhausted by it.”,T2
10,U.S. productivity slows down in fourth quarter while unit labor costs accelerate,T1
11,Beyond to buy rights to Buy Buy Baby brand and reunite it with Bed Bath & Beyond,T0
12,Amazon says it had best-ever Thanksgiving Holiday week with record sales and number of items sold,T9
13,U.S. stock futures and bond yields drop on reports Putin has updated nuclear doctrine,T4
14,Charter Communications announces buyout deal for Liberty Broadband at terms above its previous proposal,T0
15,General Motors unveils new all-electric Cadillac called the Vistiq with 300-mile range,T9
16,Vestas Wind Systems stock slumps as company says margins to be at low end of guidance,T5
17,Burberry shares rise on report Moncler could bid for it,T5
18,Kazatomprom reports 17% increase in production during the third quarter,T5
19,Anheuser-Busch InBev shares slip as sales come up shy of estimates,T5
20,Wingstop’s stock slides 12% after profit falls short of estimates,T5
21,Novartis hikes sales and profit guidance for the year,T5
22,Plus500 says it will meet expectations after quarterly revenue climbs 11%,T5
23,Trainline boosts guidance for the second time this year,T5
24,Barclays reports 18% profit rise as it lifts income guidance,T5
25,"London Stock Exchange Group says income grew, led by Tradeweb",T3
26,"The energy firm sells a $1bn stake in its technology arm Kraken, paving the way for its demerger.",T7
27,Betty Brown says she is accepting the honour on behalf of all the victims of the scandal.,T2
28,"The star joins Taylor Swift, Rihanna, Bruce Springsteen and her husband Jay-Z with 10-figure fortunes.",T0
29,"The draft regulations are aimed to address concerns around chatbots, which have surged in popularity in recent months.",T8
30,"Locals say job losses, stagnant investment and a recovering economy have defined the past decade.",T1
31,The pilot project is even giving staff free money to help pay to do activities with their friends.,T2
32,The Civil Aviation Authority reckons up to half a million people in the UK may be impacted by its new requirements.,T10
33,The upmarket cinema chain faces a leadership shake-up weeks after it cut its revenue forecasts.,T0
34,Research from the motoring group also finds that only one in four claims results in a payout.,T9
35,HS2 CEO Mark Wild advises the government that the 2029/2033 opening schedule is not achievable.,T13
36,Dexter Original Sin actor Patrick Gibson will star as the British spy when the game releases on 27 May.,T12
37,Three young Britons explain why they are building their futures overseas.,T10
38,"The medieval David I silver coin, discovered in a wooded area in Midlothian, has been dated to the second half of the 1130s.",T3
39,Figures suggest the surge in post-Christmas shoppers was the strongest in a decade.,T1
40,New rules mean that tenant pubs owned by bigger breweries can now sell a guest beer made by a small independent producer.,T6
41,Elon Musk says Tesla's automated software will allow its passengers to text in certain conditions.,T8
42,"Trade unionist Paul Nowak says he wants to see the ""closest possible"" economic relationship with the EU.",T14
43,The huge embroidery will be covered under the government's indemnity scheme when it travels to the UK.,T10
44,"Imran Ahmed was among five people accused of seeking to ""coerce"" US firms into censoring free speech.",T7
45,Finding greener ways to keep giant new data centres cool is a challenge.,T0
46,Mexican Senator Armando Rios Piter told CNN that he plans to introduce a bill this week that would stop Mexican purchases of American corn.,T11
47,The days of plugging in an iPhone to charge won't last forever.,T4
48,"Nandan Nilekani, co-founder of one of India's biggest outsourcing companies, says an H-1B visa crackdown would ultimately hurt the U.S.",T4
49,The market is at all-time highs and many say Trump is the reason. But stocks were rallying when investors thought Hillary Clinton would win. Janet Yellen and the Fed may deserve more of the credit for the market's move.,T4
50,Apple stock is less than $1 away from its all-time high amid renewed optimism for the iPhone.,T4
51,President-elect Donald Trump focuses his criticism of NAFTA on Mexico. But Canada and America have a rocky trade history too.,T1
52,"Verizon has decided to bring back unlimited data plans. But while that's great for its subscribers, it's awful news for investors. It's another sign of how brutally competitive the telecom business is. And it's hurting Verizon's stock.",T0
53,The price of crude oil has more than doubled over the past year after bottoming out at $26 per barrel in February 2016.,T4
54,The automaker announced Monday that its first official venture in the oil-rich Middle East will be in the United Arab Emirates.,T0
55,Uber's top rival in India has some unsolicited advice for the U.S. startup: Go local.,T0
56,"Apple CEO Tim Cook wants the tech industry to take action against ""fake news"" stories that are polluting the web.",T2
57,"Sears Holdings, the company that owns retail stores Sears and Kmart, said this weekend that it would remove 31 Trump-branded items from its website.",T9
58,"Universal Biopack makes packaging that it sells to restaurants and manufacturers. But rather than plastic, it uses a mixture of bamboo and cassava.",T9
59,"Nike on Sunday launched a star-studded short film titled ""Equality"" that coincides with Black History Month.",T0
60,"Treasury secretary pick Steven Mnuchin is an executive producer on Warner Bros.' ""The Lego Batman Movie,"" which pulled in an estimated $55.6 million from U.S. audiences during its opening weekend.",T8
61,"It may seem like a recurring nightmare, but Greece is in danger of running out of money again.",T4
62,"Shenzhen, China’s top tech hub, plans to roll out what it calls “full-suite, full-time” adoption of artificial intelligence (AI) across households and businesses over the next five years – a move analysts say could position the city at the forefront of the country’s intensifying tech race with the United States.
The local government announced the goal on Monday in a new policy paper on Shenzhen’s 15th five-year plan, the socio-economic blueprint covering the years 2026 to 2030. The document...",T8
63,"A Hong Kong property manager has been sentenced to 18 years in prison after bilking a housing estate out of HK$61.1 million over a decade by inflating his reimbursement claims tenfold with the addition of a zero to issued cheques.
The High Court on Tuesday found that Wong Wai-lung, who gambled all the money away, deserved a deterrent sentence for acting in gross breach of the trust placed in him as the person in charge of overseeing the chequebooks and financial documents of Choi Ming Court in...",T2
64,"Hollywood star George Clooney has become French, along with his wife Amal Alamuddin Clooney and eight-year-old ⁠twins Alexander and Ella, an official decree on Monday showed.
The publication, in France’s government gazette, confirms an ambition Clooney alluded to early in December, when he hailed French privacy laws that keep his family shielded from paparazzi.
“I love the French culture, your language, even if I’m still bad at it after 400 days of courses,” the 64-year-old actor told RTL radio...",T0
65,"As a near-weekly flier, Qyira Yusri is attuned to the rising menace of in-flight theft, mainly by Chinese gangs targeting flights across Asia to pilfer cash, credit cards and luxury handbags stored in overhead compartments.
She checks everything twice before boarding, puts aside her passport and phone and only places carry-on luggage overhead in her eye line.
For the 30-year-old, whose next flight to Bangkok from Malaysia will be her 55th in a work-packed year, a healthy dose of paranoia...",T7
66,"Tetsuzo Fuwa, a former chairman of the Japanese Communist Party (JCP) who was considered its “theoretical pillar”, died on Tuesday, according to party sources. He was 95.
Fuwa, whose real name was Kenjiro Ueda, joined the JCP in 1947 when he was a high school student and served as the director of the party think tank, the Social Sciences Institute, after stepping down as chairman in January 2006.
He quit his post as the party’s top executive due to old age.
The Tokyo native worked as a secretary...",T2
67,"Five Hong Kong taxi drivers have been arrested for allegedly attempting to defraud an online ride-hailing platform during relief efforts in the aftermath of the Tai Po fire.
Police said on Tuesday that the five drivers, aged 29 to 40, were arrested a day earlier after the force launched an investigation in response to a police report from the platform’s operator.
In the aftermath of last month’s fire at Wang Fuk Court, the platform had launched a “free ride” initiative for people affected by the...",T7
68,"China’s top diplomat Wang Yi on Tuesday called for a new paradigm for engagement with the United States, emphasising the need for stable, cooperative ties while firmly defending what he described as China’s core interests, particularly regarding Taiwan.
During a speech in Beijing, Foreign Minister Wang also accused Japanese Prime Minister Sanae Takaichi of “openly challenging” Chinese territorial sovereignty after she suggested last month that a potential Taiwan conflict could threaten Japan’s...",T2
69,"A woman undertaker in China has trended on social media thanks to the stark contrast between her good looks and her job of dealing with the dead.
Pan Meili, in her 30s, has been embalming bodies for 15 years since she graduated from the Changsha Social Work College. She majored in funeral services.
Pan works at a funeral service franchise in Qingdao, eastern Shandong province, and has served 15,000 families so far, the Xiaoxiang Morning Herald reported.

She attracted public attention after she...",T2
70,"Malaysia’s opposition was thrown into fresh uncertainty on Tuesday by the surprise resignation of its coalition chairman, former prime minister Muhyiddin Yassin, capping months of internal bickering over leadership with less than two years left before national polls must be held.
Muhyiddin, who formed the Malay nationalist Perikatan Nasional (PN) coalition in 2020 while he was still in power, made his announcement after rumours swirled overnight that he had bowed to pressure from coalition...",T2
71,"Sun Hung Kai Properties (SHKP), Hong Kong’s largest developer, has priced the next batch of units on offer at its massive Sierra Sea residential project about 5 per cent higher than previous phases, signalling a welcome improvement in the city’s housing market.
The 148 units in Phase 2A of the development in Sai Sha Wan, Sai Kung, were priced from HK$3.43 million (US$440,961), with an average discounted price of HK$10,968 per square foot, according to sales documents released on Tuesday.
The...",T2
72,"The death of a senior public works official alleged to have played a central role in the billion-peso flood-control scandal in the Philippines has cast fresh doubt over the future of a months-long corruption probe, with investigators now facing questions over lost testimony and compromised evidence.
Legal analysts say the investigations now risk unravelling altogether, warning that the probe is “in peril” after the loss of a figure seen as pivotal to understanding how alleged budget manipulation...",T7
73,"From Khalil Fong to “Benz Hung” Hui Shiu-hung and Charles Ho Tsu-kwok, Hong Kong bade farewell to notable figures remembered for soul-stirring melodies, unforgettable screen moments, steadfast public service, transformative business visions and simple creations that sparked joy across generations.
As the year comes to an end, the Post looks back at the extraordinary lives the city lost in 2025.
Khalil Fong
Singer-songwriter Khalil Fong, born in Hawaii in 1983 to an American-Chinese father and a...",T2
74,"India has overtaken Japan as the world’s fourth-largest economy – and officials hope to pass Germany within three years, the government’s end-of-year economic review calculates.
Official confirmation however depends on data due in 2026 when final annual gross domestic product figures are released, with the International Monetary Fund (IMF) suggesting India will cross over Japan next year.
“India is among the world’s fastest-growing major economies and is well-positioned to sustain this...",T4
75,"Looking back on 2025, we may be justified in calling it an annus horribilis for the world. There seems to be no end to the bad news: the war in Ukraine, the destruction of Gaza, the terror attack in Australia and the significant economic and political setbacks faced by many nations in Asia and across the world.
All these paint a rather grim picture. However, there is more than a glimmer of hope on the horizon. International science cooperation has strengthened significantly this year, in spite...",T10
76,"A residential site originally earmarked for a pilot scheme allowing private developers to build subsidised homes will instead be allocated to Hong Kong’s second-largest public housing provider, marking the latest setback for the initiative aimed at boosting the supply of affordable flats.
The government said on Tuesday that the site in Tung Chung, originally designated for the Private Subsidised Sale Flat Pilot Scheme, would be handed over to the Hong Kong Housing Society.
The announcement...",T2
77,"Hong Kong’s education authorities have commended schools for making significant progress in fostering patriotism among students over the last academic year as compared with the past, with national education now steadily woven into daily teaching and learning.
The report, released on Monday, also highlighted teachers’ stronger grasp of national security education, enabling them to guide students on its significance amid the threats and challenges confronting mainland China.
The Education Bureau’s...",T2
78,"About 300,000 Hong Kong residents will be offered free hepatitis B screenings early next year, as the city aims to meet a set of international goals to eliminate the disease as a public health threat by 2030.
The screening scheme will run in parallel with authorities’ other measures to tackle hepatitis, as Hong Kong launched its viral hepatitis action plan for the next five years.
“We can say that fighting hepatitis means tackling liver cancer at its root,” Dr Bonnie Wong Chun-kwan, a consultant...",T2
79,"A Hong Kong charity providing free lifelong care for people with severe disabilities will move to a new home next year and offer an even wider array of support, thanks to money from the Operation Santa Claus (OSC) annual fundraising drive.
The Home of Loving Faithfulness (HOLF) said it would offer speech, physical, occupational, art, music and play-based therapies to improve the lives of its 17 residents.
The home’s residents range from aged seven to 74 and have mild to severe intellectual and...",T2
80,"As Asia counts the cost of one of the world’s most expensive years for weather disasters, aid groups and scientists are warning that poorer countries face even greater risks ahead unless global emissions are cut and spending shifts from disaster response to prevention.
Asia accounted for four of the world’s six costliest climate-related disasters in 2025, according to a report by Christian Aid released this month, underlining how heavily the region is being hit by floods, storms and extreme...",T10
81,"China has unveiled new legislation to promote ethnic unity and the use of standard Chinese, warning of legal penalties for those who obstruct the use of the national language and linking its approach with national security policy.
A draft Law on Promoting Ethnic Unity and Progress underwent its second review by the Standing Committee of the National People’s Congress (NPC), the country’s top legislative body, last week and will be open for public consultation until January 25.
Meanwhile, the...",T2
82,So-called continuation vehicles set to account for a fifth of sales by the sector in 2025,T9
83,The US president’s ‘liberation day’ tariffs spooked markets but the global trading system has proved to be resilient,T1
84,The industry seeks to defend itself after Trump administration proposal to redesignate its status,T10
85,US administration has other ways to hit trading partners with duties,T9
86,Lawyers awarded hefty December payouts in battle to hire and retain high performers,T2
87,Attack targeting separatists set to deepen tensions between kingdom and Gulf neighbour,T2
88,Swiss private banks report rising demand from Asian family offices and rich individuals to book assets in Europe,T6
89,Mark Zuckerberg is pouring billions of dollars into artificial intelligence,T8
90,"Software giant faces intense competition from Alphabet, Amazon and start-ups",T0
91,"U.S. stocks were mostly lower, with the Nasdaq leading declines as makers of AI infrastructure suffered steep falls, many in the double digits. Nvidia was down 16%.",T4
92,"Gold settled 1.4% lower, down two of the past three sessions, and silver fell 2.5%, down three of the past four sessions.",T5
93,"Panic fueling the selloff of Nvidia, Broadcom and other tech giants is overblown.",T0
94,"Gain insight on Experian, SoFi Technologies and more in the latest Market Talks covering Financial Services.",T10
95,"Arabica coffee prices hit a record level, as traders digested the withdrawal of President Trump’s threats to impose tariffs and economic sanctions on Colombia.",T4
96,The Yen and Swiss Franc were stronger against the dollar as investors sought safe havens after Chinese start-up DeepSeek’s new AI model hit U.S. tech stocks.,T4
97,U.S. natural gas futures fell after weekend updates took some of the chill out of early February weather forecasts.,T4
98,QXO is taking its offer directly to shareholders after being rebuffed on several occasions.,T10
99,Maverick Natural Resources has operations in Texas and Oklahoma.,T9
100,"There are some new wrinkles, especially for those who sell things online or bought an EV.",T0
101,Companies with good payouts are now the hottest bet in China markets.,T9
102,The 10-year U.S. Treasury yield fell and ING said the the long end of the Treasury curve will continue trading at higher yields even as Trump hasn’t delivered anything to shock markets so far.,T4
103,Oil edged lower in early trade as Goldman Sachs said the latest round of U.S. sanctions against Russia haven’t had a significant impact on the country’s oil exports.,T4
104,"There is little sign of crimped demand for equities among individual investors, who remain bullish after two years of blockbuster gains.",T10
105,Check out the stocks Heard on the Street writers favor in their eighth annual stock-picking contest.,T5
106,The real costs of owning a house in neighborhoods that are vulnerable to flooding and wildfires are becoming clearer.,T14
107,"Venture-capital firms are bringing AI and dealmaking to accounting, property management and other unglamorous fields.",T0
108,"Recent court cases reveal how middlemen are facilitating a booming trade, eluding a crackdown.",T10
109,The story of home affordability in the U.S. told from a single front porch.,T14
110,The president has told Bank of America and JPMorgan Chase to stop cutting conservatives off from doing business.,T9
111,"Tesla quarterly deliveries seen falling as lack of tax credits, competition sap demand",T9
112,Stocks poised for strong end to year; silver stabilises after slump,T5
113,India stocks lower at close of trade; Nifty 50 down 0.01%,T4
114,"European shares climb to record as banks, commodities lead charge",T5
115,"Exclusive-China mandates 50% domestic equipment rule for chipmakers, sources say",T9
116,Meta to buy Chinese founded startup Manus to boost advanced AI,T8
117,Law firm Cleary Gottlieb hires Alsheimer for activism practice,T2
118,"Factbox-From OpenAI to Nvidia, firms channel billions into AI infrastructure as demand booms",T8
119,Russia says state-owned stake in gold producer UGC to be put up for public auction soon,T5
120,EM Asia ex-China markets see $19.72B outflows through November,T4
121,FX market steady amid year-end lull; Fed minutes eyed,T4
122,BofA revises USD/KRW forecast amid government intervention,T4
123,U.S. dollar is once again under  pressure from trend followers: BofA,T4
124,"Kremlin says Ukraine should withdraw troops from Donbas, and a Putin-Trump call expected soon",T9
125,FX market steady amid thin year-end volumes; won extends climb on govt support,T4
126,"Czech 2025 budget likely to be in deeper deficit than targeted, new minister says",T14
127,U.S. dollar gains in thin trading while FX traders remain focused on Japan,T4
128,Yen extends recovery as Japan flags possible FX intervention,T4
129,U.S. dollar falls ahead of key data; yen surges on intervention threat,T4
130,"USD/JPY: Intervention risk could increase in January, BofA says",T4
131,Deutsche Bank forecasts S&P 500 to hit 7000 by end of 2025,T4
132,"Trump's tariffs, Fed minutes, Rumble's Bitcoin buy - what's moving markets",T4
133,Bitcoin price today: slips to $94k as risk appetite sours on Trump tariff threat,T5
134,2025 macro outlook for the US is 'murky at best' says Deutsche Bank,T14
135,Trump says he will impose additional 10% tariffs on China over drug inflow,T1
136,"Asia stocks fall after Trump threatens tariffs, Japan's Nikkei leads losses",T4
137,"S&P 500 positioning levels at record highs, pullback risks rise, Citi warns",T5
138,"Analyst calls Bitcoin 'global bubble', could soar to infinity",T5
139,Stock market today: Dow hits record as Trump's pick for Treasury stokes optimism,T4
140,Jump in Tesla stock mostly driven by 'animal spirits/momentum' says UBS,T5
141,Federal Reserve Board announces approval of the application by National Bank Holdings Corporation,T11
142,"Federal Reserve Board publishes its biennial report on debit card transactions, which summarizes information collected from large debit card issuers and payment card networks",T11
143,"Federal Reserve Board requests public input on “payment account,” which eligible financial institutions could use for the limited purpose of clearing and settling their payments",T11
144,Federal Reserve Board publishes first of several staff manuals for the supervision of the largest and most complex banks,T11
145,Federal Reserve Board withdraws 2023 policy statement and issues new policy statement regarding the treatment of certain Board-supervised banks that facilitates responsible innovation,T11
146,"Federal Reserve Board announces termination of enforcement actions with The Goldman Sachs Group, Inc. and Metropolitan Commercial Bank",T11
147,Agencies announce dollar thresholds for smaller loan exemption from appraisal requirements for higher-priced mortgage loans,T6
148,Agencies announce dollar thresholds for applicability of truth in lending and consumer leasing rules for consumer credit and lease transactions,T6
149,"Federal Reserve Board announces approval of application by Banco BTG Pactual S.A., its parent holding companies, and subsidiary, BTG Pactual Bancorp, LLC",T11
150,"Federal Reserve Board announces approval of application by The PNC Financial Services Group, Inc.",T11
151,Federal Reserve Board announces reappointment of Reserve Bank presidents and first vice presidents,T11
152,"Federal Reserve Board announces termination of enforcement actions with Credit Suisse Group AG, Credit Suisse AG, Credit Suisse Holdings (USA), Inc., Credit Suisse AG, New York Branch, and JPMorgan Chase &amp; Co.",T11
153,Federal Reserve Board and Federal Open Market Committee release economic projections from the December 9-10 FOMC meeting,T14
154,Federal Reserve Board issues enforcement action with former employee of Synovus Bank,T11
155,"Federal Reserve Board requests public input on the impact of potential strategic changes to check services provided by the Fed, as well as check usage and preferences",T11
156,"Federal Reserve Board announces pricing, effective January 1, 2026, for payment services the Federal Reserve Banks provide to banks and credit unions",T11
157,Federal Reserve Board issues enforcement action with former employee of First Financial Bank,T11
158,"Federal Reserve Board announces approval of application by Steel Newco, Inc",T11
159,"Minutes of the Board's discount rate meetings on October 6, October 20, and October 29, 2025",T13
160,"Bill Gurley, who published a new book on how to find your dream job, said that disengaged workers are the result of the ""career industrial complex.""",T10
