id,text,topic_id
324,"The government shutdown affected economic data collection The 43-day lapse in congressional appropriations, which began on October 1 and lasted until November 12, 2025, has been the longest on record. Without funds to pay for employee salaries and business operations, &#8230; <a href=""https://fredblog.stlouisfed.org/2026/01/a-blank-space-missing-and-imputed-economic-data/"">Continue reading <span class=""meta-nav"">&#8594;</span></a>",T13
325,"The FRED Blog has discussed how the daily operations of the Federal Reserve Banks and, specifically, the New York Fed generally maintain the effective federal funds rate within the target range set by the Federal Open Market Committee (FOMC). As &#8230; <a href=""https://fredblog.stlouisfed.org/2025/12/tracking-recent-financial-market-conditions/"">Continue reading <span class=""meta-nav"">&#8594;</span></a>",T11
326,"Every December, retailers hire a large number of extra workers to keep up with holiday demand. Our FRED graph above shows a clear seasonal spike in the number of retail employees at the end of the year, as stores bring &#8230; <a href=""https://fredblog.stlouisfed.org/2025/12/tis-the-seasonal-a-look-at-seasonal-retail-workers/"">Continue reading <span class=""meta-nav"">&#8594;</span></a>",T10
327,"Our FRED graph above shows one of the all-star statistics for the US economy: industrial production. It&#8217;s a compelling data series for at least two reasons. It measures something people can relate to—the production of tangible stuff. The data are &#8230; <a href=""https://fredblog.stlouisfed.org/2025/12/us-industrial-production/"">Continue reading <span class=""meta-nav"">&#8594;</span></a>",T10
328,"In a previous FRED blog post, we discussed the Summary of Economic Projections (SEP) released by the FOMC this past September. In this post, we  again use ALFRED to compare the latest projections released in December 2025 with several of &#8230; <a href=""https://fredblog.stlouisfed.org/2025/12/fomc-summary-of-economic-projections-december-2025/"">Continue reading <span class=""meta-nav"">&#8594;</span></a>",T10
329,"All Federal Reserve Banks operate within a specific geographic area—called a district. The Cleveland Fed is in the Fourth District of the Federal Reserve System, which covers Ohio and parts of Pennsylvania, Kentucky, and West Virginia. The Cleveland Fed&#8217;s Survey &#8230; <a href=""https://fredblog.stlouisfed.org/2025/12/cleveland-fed-data-on-regional-economic-conditions/"">Continue reading <span class=""meta-nav"">&#8594;</span></a>",T14
330,"What’s really happening in US manufacturing? In our FRED graph above, we compare labor productivity for all workers in the manufacturing sector alongside the share of manufacturing employment in total US nonfarm employment since 1987. The graph tells a compelling &#8230; <a href=""https://fredblog.stlouisfed.org/2025/12/manufacturing-employment-and-productivity/"">Continue reading <span class=""meta-nav"">&#8594;</span></a>",T10
331,"In 2025, many US households reported a surge in electricity prices. According to the producer price index (PPI) for residential electric power, these prices have gone up by 7% between January and August 2025. This rise in prices can be &#8230; <a href=""https://fredblog.stlouisfed.org/2025/12/the-divergence-of-electricity-and-natural-gas-prices/"">Continue reading <span class=""meta-nav"">&#8594;</span></a>",T8
332,"In our <a href=""https://libertystreeteconomics.newyorkfed.org/2026/01/disability-in-the-labor-market-employment-and-participation/"">previous post</a> we learned that, in general, people with disabilities participate in the labor market at significantly lower rates, and that they are much more likely to be unemployed. Despite these patterns, we found that the labor force participation of workers with disabilities rose noticeably following the pandemic. A relevant question then is how earnings of workers with disabilities compare with workers without disabilities. In this companion post we investigate differences in weekly earnings for workers with and without disabilities. We find that workers with disabilities earn considerably less than workers without disabilities. Additionally, with few exceptions, their earnings have remained roughly constant in real terms since the pre-pandemic period.",T10
333,"Among people in prime working age (25-54), around 7 percent have a disability of some kind. In this set of companion posts, we will examine how prime-aged workers with disabilities have fared in the labor market compared to the year prior to the pandemic. In this first post, we will show that people with disabilities are far less likely to be employed than people without disabilities, with both lower labor force participation and higher unemployment playing a role. We will also show that although employment rates of people with disabilities are very low, they have risen rapidly during the post-pandemic period, largely because of rising labor force participation. Our results are consistent with an increased prevalence of work from home (WFH) arrangements in the post-COVID period differentially benefiting people with disabilities.",T10
334,"Good measures of labor market tightness are essential to predict wage inflation and to calibrate monetary policy. In an <a href=""https://libertystreeteconomics.newyorkfed.org/2024/10/a-new-indicator-of-labor-market-tightness-for-predicting-wage-inflation/"">October 2024 post</a>, we introduced a new indicator of labor market tightness and showed that it tracked wage inflation best out of a broad range of tightness measures. In this post, we update our index through 2025 and show that it also <em>forecasts</em> future wage inflation best both in and out of sample. In addition, we highlight availability of the index as a <a href=""https://www.newyorkfed.org/research/labor-market-tightness"">new regularly updated feature</a> on the New York Fed's website.",T10
335,"The European Union has been an early adopter of carbon policies, with the introduction of the EU Emissions Trading System (ETS) in 2005. This scheme sets a common price for carbon and is applied to the most polluting manufacturing sectors. By increasing the cost of emissions-intensive production, the system incentivizes firms to decrease their use of fossil fuels. However, as we show in a <a href=""https://libertystreeteconomics.newyorkfed.org/2026/01/what-can-undermine-a-carbon-tax/"">companion post</a>, the policy’s impact was moderated by firms increasing their reliance on high-emissions imports. To eliminate this workaround, the EU will expand the ETS to imports in 2026, through the Carbon Border Adjustment Mechanism (CBAM). The CBAM will essentially put a tariff on imported goods based on their carbon content. Our <a href=""https://www.newyorkfed.org/research/staff_reports/sr1136"">recent work</a> provides a quantitative analysis of how the ETS and CBAM affect firms’ supply choice decisions, and the resulting changes in domestic prices and emissions.<br />",T3
336,"Several countries have implemented a carbon tax or cap-and-trade system to establish high carbon prices and create a disincentive for the use of fossil fuels. Essentially, the tax encourages firms to substitute toward low carbon emission energy. Costs also rise for firms down the supply chain that use production inputs with high-emission content, so the total impact of a carbon tax can be large. In practice, however, firms also have an incentive to find an offset to a carbon tax. In this post, based on our <a href=""https://www.newyorkfed.org/research/staff_reports/sr1136"">recent work</a>, we present evidence of one such adaptation strategy. We show that French firms increased their imports of high-emission inputs from suppliers outside the European Union’s cap-and-trade system, known as the EU Emissions Trading System (EU ETS), reducing the effectiveness of this approach to cutting carbon emissions—an adaptation strategy that leads to “carbon leakage.” To help stop this leakage, the EU is implementing a ""carbon tariff"" in 2026, which is the topic of a <a href=""https://libertystreeteconomics.newyorkfed.org/2026/01/what-is-a-carbon-tariff-and-why-is-the-eu-imposing-one/"">companion po",T3
337,"Why do some entrepreneurs drive economic growth while others do not? This piece discusses <a href=""https://www.nber.org/papers/w33766"">new work </a>that studies entrepreneurs using a comprehensive dataset from Denmark. We study who becomes an entrepreneur, along with their hiring and business decisions, and find that a distinct minority are “transformative.” These individuals, who generate disproportionate productivity gains, tend to have high IQ scores, be well-educated, and hire technical (R&#38;D) workers. The data support the idea of productivity growth being driven by the symbiotic relationship between transformative entrepreneurs and R&#38;D workers. For policymakers, the lesson is that when an economy has more R&#38;D workers and transformative entrepreneurs, they sustain higher long-run productivity growth.",T10
338,"Each year brings a new set of economic challenges: In 2025, major areas of focus included tariffs and trade tensions, as well as the financial pressures facing younger adults. New York Fed economists contributed insightful research on both topics—and readers took notice. In fact, all five of the year’s most-read posts on <em>Liberty Street Economics</em> analyzed aspects of these issues. Read on to see how the restoration of student loan data to credit reports affected borrowers’ credit scores, whether the costs of a college degree are still worth it, how businesses are responding to higher tariffs, and why the U.S. runs a trade deficit.<br />",T10
339,"Call Reports are regulatory filings in which commercial banks report their assets, liabilities, income, and other information. They are one of the most-used data sources in banking and finance. In this post, we describe a <a href=""https://www.newyorkfed.org/research/banking_research/balance-sheets-income-statements"">new dataset</a> made available on the Federal Reserve Bank of New York’s website that contains time-consistent balance sheets and income statements for commercial banks in the United States from 1959 to 2025.",T6
340,"Banks must extract useful signals of a potential borrower's quality from a large set of possibly informative characteristics when making lending decisions. A model that speaks to how banks specialize in lending to an industry in order to better extract signals from data, can potentially be applied to a number of real-world scenarios. In this post, we apply lessons from such a model to a topic of timely relevance in economics: job market recommendation letters. Institutions looking to hire new economists must evaluate PhD applicants based on limited and often noisy signals of future performance, including letters of recommendation from these applicants’ advisors or co-authors. Using insights from our model, we argue that the value of these letters depends on who reads them.",T6
341,"Why does the banking industry remain prone to large and costly disruptions despite being so heavily regulated? Is there a need for more regulation, less regulation, or simply different regulation? Our <a href=""https://www.newyorkfed.org/research/staff_reports/sr1155.html"">recent Staff Report</a> combines insights from academic research in economics, finance, and accounting to provide a deeper understanding of the challenges involved in designing and implementing bank regulation, as well as opportunities for future exploration. This post focuses on the regulation of bank capital, but the ideas are applicable more broadly.",T6
342,"This post presents an update of the economic forecasts generated by the Federal Reserve Bank of New York’s dynamic stochastic general equilibrium (DSGE) model. We describe very briefly our forecast and its change since <a href=""https://libertystreeteconomics.newyorkfed.org/2025/09/the-new-york-fed-dsge-model-forecast-september-2025/"" rel=""noreferrer noopener"" target=""_blank"">September 2025</a>. To summarize, growth in 2025 is expected to be stronger than in September due to a lower projected path of the policy rate, as well as higher productivity. Inflation projections are higher in 2025 because of cost-push shocks, which capture the effects of tariffs. The model’s predictions for the short-run real natural rate of interest (or r*) in 2025 have decreased relative to September.",T8
343,"Following the recent passage of <a href=""https://www.congress.gov/bill/119th-congress/senate-bill/1582"" rel=""noreferrer noopener"" target=""_blank"">legislation in the U.S.</a>, payment stablecoins seem to be on the brink of wider-scale adoption and explosive growth in market capitalization. In this post, we contend that the driving factor is not their proximity to digital cash instruments, but rather how they are transferred—via global, open-access, peer-to-peer systems, or “permissionless blockchains,” for short.",T7
344,"There has been a lot of interest in firms’ pricing decisions in the past few years—both during the inflation surge of 2021-23 and in the more recent rounds of tariff increases. In this post, we let firms speak for themselves about what factors they consider when adjusting prices in response to various shocks. The analysis is based on an ongoing research project, joint with the Atlanta and Cleveland Federal Reserve Banks, on how businesses set prices and the extent of passthrough of cost increases. In particular, we leverage the qualitative portion of the study based on open-ended interviews with senior decision-makers on how they approach pricing decisions in their firms. Rather than a uniform approach, a very nuanced picture emerges of businesses trying to balance competing objectives while keeping an eye on demand conditions for their products as well as on their direct competitors’ behavior in the market.",T8
345,"A <a href=""https://libertystreeteconomics.newyorkfed.org/2012/10/is-us-monetary-policy-seasonal/"" rel=""noreferrer noopener"" target=""_blank"">2012 <em>Liberty Street Economics</em> post</a> noted that U.S. monetary policy exhibits a surprising degree of seasonal behavior: over the 1987-2008 period, the Federal Reserve was much more likely to lower interest rates (or abstain from raising rates) in the first month of each quarter than in the two subsequent months. Thirteen years later, we revisit that analysis to investigate whether the seasonal pattern in monetary policy still holds today, in the wake of a rate hiking cycle, a pandemic, a surge in inflation, and a second round of rate hikes. We find that the pattern has indeed continued; however, unlike in the earlier sample period, it can be completely explained by the timing of the FOMC calendar.",T8
346,"In a <a href=""https://libertystreeteconomics.newyorkfed.org/u-s-banks-have-developed-a-significant-nonbank-footprint"">previous post</a>, we documented how, over the past five decades, the typical U.S. bank has evolved from an entity mainly focused on deposit taking and loan making to a more diversified conglomerate also incorporating a variety of nonbank activities. In this post, we show that an important driver of the evolution of this new organizational form is the desire of banks to efficiently manage liquidity needs.<br />",T6
347,"<br />In light of the rapid growth of nonbank financial institutions (NBFIs), many have argued that bank-led financial intermediation is on the decline, based on the traditional notion that banks operate to take in deposits and make loans. However, we argue that deposit-taking and loan-making have not accurately characterized U.S. banking operations in recent decades. Instead, as we propose in this post, absent regulatory restrictions, banks naturally expand their boundaries to include NBFI subsidiaries. A significant component of the growth of NBFIs has in fact taken place <em>inside </em>the boundaries of banking firms.",T6
348,"In 2025, the Federal Reserve has cut interest rates, trade policy has shifted abruptly, and economic policy uncertainty has increased. How have these developments affected the functioning of the key U.S. Treasury securities market? In this post, we return to some familiar metrics to assess the recent behavior of Treasury market liquidity. We find that liquidity briefly worsened around the April 2025 tariff announcements but that its relation to Treasury volatility has been similar to what it was in the past.",T8
349,"Bank failures and distress can be costly to the economy, causing losses to creditors and reducing the flow of credit and other financial intermediation services. Thus, there is significant value in being able to identify “at risk” banks in a timely and accurate way. In a <a href=""https://libertystreeteconomics.newyorkfed.org/2025/09/economic-capital-a-new-measure-of-bank-solvency/"" rel=""noreferrer noopener"" target=""_blank"">previous post</a>, we presented a new solvency metric, Economic Capital, and showed how solvency risks in the U.S. banking industry have evolved over time according to this measure. In this post, we continue to draw on our recent <a href=""https://www.newyorkfed.org/research/staff_reports/sr1144.html"" rel=""noreferrer noopener"" target=""_blank"">Staff Report</a> to present analysis showing that Economic Capital identifies failing banks earlier and more accurately than more conventional solvency measures.",T6
350,"As in previous years, we provide in this post an update on the vulnerability of the U.S. banking system based on four analytical models that capture different aspects of this vulnerability. We use data through 2025:Q2 for our analysis, and also discuss how the vulnerability measures have changed since our last update <a href=""https://libertystreeteconomics.newyorkfed.org/2024/11/banking-system-vulnerability-2024-update/?_ppp=6960e497ee"">one year ago</a>.",T6
351,"After the Great Financial Crisis, the European Central Bank (ECB) extended its monetary policy toolbox to include the use of long-term loans to banks at interest rates close to zero or even negative. These central bank interventions were aimed at supporting the transmission of expansionary monetary policy and likely played a crucial role in bolstering the financial stability of the euro area, namely by reducing the chance of bank runs. However, quantitative evidence on the effects of these interventions on financial stability remains scant. In this post, we quantify the effectiveness of central bank lending programs in supporting financial stability through the lens of a novel structural model discussed in this <a href=""https://papers.ssrn.com/sol3/papers.cfm?abstract_id=3708226"">paper</a>.",T6
352,The manager’s primary direct-origination platform’s senior unsecured notes and credit facility are now rated investment grade.,T6
353,"Full-year data for 2025 shows a resilient fundraising landscape. Also, UK's House of Lords criticises Treasury ""passivity"" over private credit. Here's today's brief for our valued subscribers only.",T9
354,The firm reached its hard-cap for BSP Real Estate Opportunistic Debt Fund II with 29 months of time logged fundraising on the road.,T6
355,The appointee joins from rival firm FWD following the previous incumbent Phil Joubert’s move from AIA to Oaktree Capital Management last year.,T12
356,"The senior secured fund, the manager's largest private credit vehicle, has already committed $3.2 billion",T6
357,"Asset-backed strategy seeks to provide exposure to residential, corporate and hard asset-backed loans.",T6
358,Manager sees an inflection point for infra lending via CLOs that marks a turn away from the banks.,T6
359,The sale is expected to be the first in what could be a series of fund stakes offerings by the sovereign fund as it works to manage its portfolio.,T4
360,"Fundraising hit a new record in 2025, but only just!",T9
361,Alternative managers have an expanded arsenal compared with the last time public markets soured on BDCs.,T4
362,Kraken-backed SPAC files for $250 million initial public offering,T5
363,"Has the iPhone moment arrived for Michael Saylor’s preferred stock ""Stretch"" at Strategy",T4
364,Ukraine blocks Polymarket in wider online gambling crackdown,T5
365,"JPMorgan sees Fed's next move an interest-rate increase, crypto bulls talk about cuts",T9
366,21Shares' bitcoin and gold exchange-traded product debuts on London Stock Exchange,T4
367,XRP rises 1% as traders look for the next breakout catalyst,T2
368,"Traders sell ether, solana and XRP rallies; monero tops $640",T2
369,Former 'bitcoin mayor' Eric Adams faces $3 million rugpull allegation after issuing NYC Token,T7
370,"Stablecoin-rewards compromise, DeFi protections lead new Senate market structure bill",T7
371,Federal judge temporarily halts Tennessee's bid to shut down Kalshi sports contracts,T7
372,"Bitcoin stalls near $90,000 while traders buy altcoins: Asia Morning Briefing",T4
373,"Agriculture version of crypto market structure bill markup delayed to end of January, chair says",T7
374,"Charles Hoskinson slams Trump’s crypto policy as 'extractive,' warns of industry fallout",T5
375,"Bitcoin stalls below $92,000 as privacy coins rally; crypto miners surge on Meta AI news",T4
376,Senator Lummis offers DeFi protections bill as broader market structure draft nears,T7
377,Staking goes mainstream: what 2026 could look like for ether investors,T4
378,"CFTC to tap Tyler Winklevoss, other crypto CEOs as first members of innovation panel",T5
379,Crypto infrastructure firm Bakkt jumps 17% on deeper stablecoin payments push with new deal,T4
380,"<p>※この記事は自動翻訳されています。正確な内容につきましては原文をご参照ください。 2025年、暗号資産分野で国家主導の活動が顕著に増加し、不正なオンチェーン・エコシステム成熟の新たな段階を迎えました。ここ数年で暗号資産犯罪の状況はますますプロフェッショナル化しており、不正組織は現在、国際的な犯罪ネットワークが商品やサービスを調達し、不正に得た暗号資産を洗浄するための大規模なオンチェーンインフラを運営しています。こうした状況を背景に、国家も同じプロフェッショナルなサービス事業者を利用したり、制裁回避のために独自インフラを構築したりして、この領域へ参入しています。サイバー犯罪者や組織犯罪グループ向けに構築された不正な暗号資産サプライチェーンに国家が加わることで、行政機関やコンプライアンス・セキュリティチームは、消費者保護と国家安全保障の両面でこれまでになく重大なリスクに直面しています。 これらの現象やその他の動向はオンチェーン上でどのように表れているのでしょうか？データと全体的なトレンドを見ていきましょう。 当社のデータによると、不正な暗号資産アドレスが2025年に受け取った金額は少なくとも1,540億ドルに達しました。これは前年比で162%の増加であり、主に制裁対象となった主体が受け取った金額の694%という劇的な増加が要因です。仮に制裁対象の受領額が前年と同水準だった場合でも、2025年は暗号資産犯罪の記録的な年となるほど、ほぼ全ての不正カテゴリで活動が増加しました。この数字は、現時点で特定できている不正アドレスに基づいた下限値であることを必ずご留意ください。[1] これら不正取引量は、依然として暗号資産経済全体（主に正規取引）と比べて小規模です。全暗号資産取引量に占める不正取引の割合は2024年からわずかに増加しましたが、1%未満にとどまっています。[2] また、暗号資産犯罪で利用されるアセットの種類にも継続的な変化が見られます。下図のチャートをご参照ください。 ここ数年、ステーブルコインが不正取引の大半を占めており、現在では不正取引ボリューム全体の84%を占めています。これは、ステーブルコインが持つ実用的な利点（国境を越えた送金の容易さ、低いボラティリティ、広い用途）により、暗号資産エコシステム全体でも利用が拡大しているトレンドと一致しています。 以下では、2025年の暗号資産犯罪を特徴づけ、今後も注目すべき4つの主要トレンドを詳しく見ていきます。 国家主導型脅威による過去最高の取引量：北朝鮮による過去最大規模の窃盗、ロシアのA7A5トークンによる大規模制裁回避 2025年も盗難資金はエコシステムにとって大きな脅威であり、北朝鮮関連のハッカーだけで20億ドルを盗み出しました。特に2月のBybitへの攻撃は、暗号資産史上最大のデジタル強奪事件となり、",T3
381,"<p>In 2025, we tracked a notable rise in nation-state activity in crypto, marking the latest phase in the maturation of&#8230;</p>
<p>The post <a href=""https://www.chainalysis.com/blog/2026-crypto-crime-report-introduction/"">Crypto Crime Reaches Record High in 2025 as Nation‑State Sanctions Evasion Moves On‑Chain at Scale</a> appeared first on <a href=""https://www.chainalysis.com"">Chainalysis</a>.</p>",T5
