id,text,topic_id
163,"OpenAI CEO Sam Altman helped usher in the AI age. Now, he's doing everything he can to keep OpenAI ahead.",T0
164,"Welcome to the personal bankruptcy from hell. How billionaire Miles Guo hijacked the court system, creating years of chaos for creditors.",T7
165,"Scott DeRue oversees The Ironman Group, which hosts the Ironman Triathlon Series, City2Surf, the Epic Series mountain bike races, and other events.",T14
166,"Pokémon cards, valued for their rarity and condition, are attracting collectors, gamers, and investors seeking profit.",T9
167,Target CEO Michael Fiddelke arrived in the top job with skeptics wondering if he would make the necessary changes to get the retailer back on track.,T14
168,"Mallory Contois says quitting two stable tech jobs, including her dream COO role, allowed her to build a six-figure business and portfolio career.",T0
169,"Salary data shows how much Instacart paid corporate tech workers in 2025, with some engineers earning up to $380,000. See which roles earn the most.",T3
170,Anthropic CEO Dario Amodei says he's trying to keep Anthropic growing at a 10x pace while holding the line on safety.,T0
171,"Side hustle culture has exploded in America. Entrepreneurs say its never been easier to start something, but succeeding is another story.",T1
172,"Three generations of a Maryland family formed a ""family compound."" Multigenerational living is a growing trend amid the rising cost of living.",T1
173,It's not just the government and private companies. Some wealthy individuals are pledging to give money to American children's' Trump Accounts.,T9
174,"MrBeast is looking for a ""head of TikTok."" This new hire will be tasked with ""setting the TikTok strategy"" and scaling his presence on the app.",T0
175,"Gen Z is driving a loyalty boom in restaurants, pushing brands to deliver faster, frictionless digital rewards.",T0
176,"What we can learn from the flood of ""why I quit"" letters from researchers at Anthropic, OpenAI, and xAI.",T0
177,"A Gen Zer's startup drained her savings to $200, so she joined Meta. She shared why she left Big Tech three years later.",T0
178,Peter Navarro says the White House may force Big Tech to cover electricity and grid costs tied to AI data centers.,T0
179,FCA and Esma could learn from each other on how to cut industry compliance costs,T1
180,Capital distributions drag CET1 lower as higher RWAs also bite,T6
181,"Competition among carriers drives down premiums, despite increasing frequency and severity of attacks",T7
182,Stochastic approaches and calibration speed improve established models in credit and equity,T1
183,Emerging Asia posts $46bn outflow as other EMDE regions expand,T4
184,Briefing and Q&amp;A aims to clarify how firms should report data ahead of RTS adoption,T3
185,Friction-free foreign exchange is the prize offered by stablecoins such as Tether and USDC. But the prize remains elusive,T11
186,Official says proposals receiving push-back on one-size-fits-all approach and limited netting benefits,T1
187,"The authors analyze the interest rate risk in the banking book regulations, arguing that financial institutions must develop robust models for forecasting demand deposit balances while adhering to regulatory guidelines.",T10
188,Also: Loan collusion clobbers South Korean banks; AML fails at Saxo Bank and Santander. Data by ORX News,T7
189,Receiver swap notional climbs to €68bn as bank guards NII,T11
190,The Swiss fund already runs an artificial intelligence model factory and a team of agentic credit analysts,T1
191,FX SpotStream’s move into rates seen as both fee-saver and potential boost to streaming execution,T11
192,Banks to miss out on any capital relief from gentler scenario,T10
193,Implied spreads were elevated to start 2026. Realised levels have been “almost unprecedented”,T2
194,"Kinexys digital platform speeds cross-currency, cross-entity client payments",T11
195,Criticised loans hit five-year high following $1.3bn portfolio expansion,T1
196,Lawyers hail return to a “more orthodox territorial approach” to regulating the market,T1
197,Industry warns tougher haircut regulation could restrict market capacity as debt issuance rises,T10
198,"After a year of just 181,000 new jobs, January’s 131,000 increase in the U.S. workforce was surprisingly positive. Ben Casselman, The New York Times’ chief economic correspondent, explains the numbers.",T3
199,"Labor force participation for women with small children continues to float above prepandemic levels, thanks to flexible work setups — and rising costs.",T3
200,"Research from the New York Fed confirms that U.S. companies and consumers are bearing tariff costs, despite the president’s assertions otherwise.",T2
201,European leaders have been compelled to address the possibility of once-remote risks to the financial networks and technology that undergird their economies.,T9
202,It sounds a bit kooky to promise a whole city from scratch. But it has been done before — and might just help solve the housing crisis.,T1
203,What to know about the better-than-expected report.,T3
204,Trump plans to nominate a ‘data nerd’ to lead Bureau of Labor Statistics.,T0
205,Leaders across industries from airlines to packaged foods have said a growing divide between lower-income and wealthy consumers is changing their businesses.,T9
206,"Economists have noticed that betting markets like Kalshi and Polymarket are pretty good at predicting not just political events but economic data, too.",T2
207,"January’s jobs data, released on Wednesday, bolstered expectations that the Federal Reserve will hold interest rates steady for longer than previously expected.",T3
208,Annual revisions show that employers added far fewer jobs in 2024 and 2025 than previously estimated.,T3
209,"The economy added substantially more jobs than expected last month, as more people entered the labor force and wages grew.",T3
210,Four Trump allies have been a driving force behind the administration’s efforts to rollback a key climate regulation.,T9
211,"Sixteen elected treasury officials, all Democrats, wrote to President Trump to say ICE crackdowns are bad for business and tax revenues: “People must feel safe to go to work.”",T9
212,"In a country roiled by political upheaval recently, retiring the longtime currency, the lev, prompted some concern about inflation but little other angst.",T4
213,"Experts are reaching to divine the president’s approach to global policy and economics, with one theory seeing antecedents in centuries-old dynastic rule.",T9
214,"From markets to spending to debt, usually reliable indicators that forecast where the economy is headed are proving deeply fallible.",T2
215,"The report, scheduled for Friday, would have provided data on job growth, unemployment and wages in January.",T3
216,"Immigration raids have scared off customers and workers, a pattern repeated in other cities where federal officials have arrived in force.",T8
217,President Trump announced Kevin Warsh as his nominee to succeed Jerome H. Powell as chair of the Federal Reserve. Our reporter Colby Smith explains why the choice matters for the economy.,T2
218,"Owners spent nearly $1.5 billion last year on racehorses, a big increase over 2024. A new tax provision allows them to immediately deduct the full cost of the purchase.",T4
219,"A standoff over the security of Taiwan has led to a steep decline in the number of Chinese visitors to Japan, which is heavily dependent on the tourists.",T4
220,"Warner Bros. Discovery had agreed to sell itself to Netflix, but its contract allows it to pursue offers that may lead to a superior deal.",T7
221,Manufacturers will no longer get a credit toward vehicle emissions standards by installing engines that automatically stop at red lights.,T2
222,Some of Washington’s diplomatic outposts in Asia are raising millions for events to mark the 250th independence anniversary. One ambassador offered to sing and dance.,T7
223,"Warner Bros. spent an estimated $80 million on the R-rated romance, directed by Emerald Fennell, not including hefty marketing costs.",T9
224,"As venture capital funding pours into start-ups large and small, more firms are pitching themselves as the next big thing.",T1
225,"Fractured politics, disruptive technologies and a distrust in institutions are making it harder to focus on the traditional tasks of growing sales and profits.",T9
226,A commercial about a lost dog being reunited with his family ignited concerns that a “Search Party” feature posed privacy risks. Ring parted ways with the tech company Flock Safety.,T0
227,"The DHS is flooding social media companies with administrative subpoenas to identify accounts that are protesting ICE. Social media companies have pushed back but are largely complying. Our tech reporter, Sheera Frenkel, explains.",T14
228,"As their stocks tank, software makers are rebranding themselves as A.I. innovators. Sparkle emojis are everywhere, but some efforts have been more successful than others.",T0
229,"A.I. translation has become a huge industry, but how accurate is it? Our tech reporter, Kashmir Hill, explores its successes and failures through a couple who relies on of A.I. translation to communicate.",T0
230,"As Congress leaves town without funding their department, airport security officers wonder, “How many more times am I going to be able to do this?”",T13
231,Problems at detention centers operated by CoreCivic extend far beyond recent measles outbreaks.,T8
232,"Grana Padano cheese is trying to capture some of the international spotlight on Italy, appearing on billboards and social media — and in high-protein muffins for athletes.",T11
233,The artificial intelligence frenzy is creating personal fortunes rarely seen in modern technology and changing people’s attitudes about fairness and money in relationships.,T0
234,"More than a decade into Beijing’s push for self sufficiency, Chinese firms are producing fewer, lower-performing chips than their foreign competitors.",T9
235,"The department has sent Google, Meta and other companies hundreds of subpoenas for information on accounts that track or comment on Immigration and Customs Enforcement, officials and tech workers said.",T14
236,Solid jobs data and a soft inflation reading for January are welcome news for President Trump. But the bigger economic picture is less encouraging.,T3
237,President Trump’s effort to get Kevin M. Warsh confirmed as the next Federal Reserve chair has been complicated by a criminal investigation into Jerome H. Powell.,T2
238,Supervisor jobs were once ascendant in the United States. But they have cropped up all over our lists of the hardest-hit jobs.,T3
239,The term is shaping the political conversation like never before as wages struggle to keep up with cost increases.,T2
240,Supervisor jobs were once ascendant in the United States. But they have cropped up all over our lists of the hardest-hit jobs.,T3
241,The term is shaping the political conversation like never before as wages struggle to keep up with cost increases.,T2
242,"For the past week, the massive ""Internet of Things"" (IoT) botnet known as Kimwolf has been disrupting the The Invisible Internet Project (I2P), a decentralized, encrypted communications network designed to anonymize and secure online communications. I2P users started reporting disruptions in the network around the same time the Kimwolf botmasters began relying on it to evade takedown attempts against the botnet's control servers.",T8
243,"Microsoft today released updates to fix more than 50 security holes in its Windows operating systems and other software, including patches for a whopping six ""zero-day"" vulnerabilities that attackers are already exploiting in the wild.",T8
244,"A prolific data ransom gang that calls itself Scattered Lapsus ShinyHunters (SLSH) has a distinctive playbook when it seeks to extort payment from victim firms: Harassing, threatening and even swatting executives and their families, all while notifying journalists and regulators… <span class=""read-more""><a href=""https://krebsonsecurity.com/2026/02/please-dont-feed-the-scattered-lapsus-shiny-hunters/"">Read More &#187;</a></span>",T14
245,"The cybercriminals in control of Kimwolf -- a disruptive botnet that has infected more than 2 million devices -- recently shared a screenshot indicating they'd compromised the control panel for Badbox 2.0, a vast China-based botnet powered by malicious software that comes pre-installed on many Android TV streaming boxes. Both the FBI and Google say they are hunting for the people behind Badbox 2.0, and thanks to bragging by the Kimwolf botmasters we may now have a much clearer idea about that.",T8
246,"A new Internet-of-Things botnet called Kimwolf has spread to more than 2 million devices, forcing infected systems to participate in massive distributed denial-of-service (DDoS) attacks and to relay other malicious and abusive Internet traffic. Kimwolf's ability to scan the local networks of compromised systems for other IoT devices to infect makes it a sobering threat to organizations, and new research reveals Kimwolf is surprisingly prevalent in government and corporate networks.",T8
247,"Microsoft today issued patches to plug at least 113 security holes in its various Windows operating systems and supported software. Eight of the vulnerabilities earned Microsoft's most-dire ""critical"" rating, and the company warns that attackers are already exploiting one of the bugs fixed today.",T8
248,"Our first story of 2026 revealed how a destructive new botnet called Kimwolf rapidly grew to infect more than two million devices by mass-compromising a vast number of unofficial Android TV streaming boxes. Today, we'll dig through digital clues left behind by the hackers, network operators, and cybercrime services that appear to have benefitted from Kimwolf's spread.",T8
249,"The story you are reading is a series of scoops nestled inside a far more urgent Internet-wide security advisory. The vulnerability at issue has been exploited for months already, and it's time for a broader awareness of the threat. The short version is that everything you thought you knew about the security of the internal network behind your Internet router probably is now dangerously out of date.",T8
250,"KrebsOnSecurity.com celebrates its 16th anniversary today! A huge ""thank you"" to all of our readers -- newcomers, long-timers and drive-by critics alike. Your engagement this past year here has been tremendous and truly a salve on a handful of dark days. Happily, comeuppance was a strong theme running through our coverage in 2025, with a primary focus on entities that enabled complex and globally-dispersed cybercrime services.",T8
251,"The Trump administration has pursued a staggering range of policy pivots this past year that threaten to weaken the nation’s ability and willingness to address a broad spectrum of technology challenges, from cybersecurity and privacy to countering disinformation, fraud and corruption. These shifts, along with the president’s efforts to restrict free speech and freedom of the press, have come at such a rapid clip that many readers probably aren’t even aware of them all.",T0
252,Zscaler's acquisition of SquareX comes as competitors like CrowdStrike and Palo Alto Networks are also investing in secure browser technologies.,T14
253,"Threat actors are exploiting security gaps to weaponize Windows drivers and terminate security processes in targeted networks, and there may be no easy fixes in sight.",T8
254,"Espionage groups from China, Russia and other nations burned at least two dozen zero-days in edge devices in attempts to infiltrate defense contractors' networks.",T8
255,"As AI deployments scale and start to include packs of agents autonomously working in concert, organizations face a naturally amplified attack surface.",T0
256,"It's time to phase out the &quot;patch and pray&quot; approach, eliminate needless public interfaces, and enforce authentication controls, one expert says.",T8
257,The AI-powered product delivers expert-grade malware analysis and reverse engineering in minutes.,T8
258,"Drawing on years of adversary tradecraft, SpecterOps experts work alongside customers to analyze and eliminate attack paths, protect critical assets, and stay ahead of emerging threats.",T8
259,Men should take extra care on Valentine’s Day because they are nearly twice as likely as women to fall victim to romance scams.,T9
260,"Microsoft uncovered AI recommendation poisoning in 31 companies across 14 industries, and turnkey tools make it trivially easy to pull off.",T0
261,Green Blood Group steals personal records and biometric data of the West African nation's nearly 20 million residents.,T14
262,"In moving away from traditional banks to focus on Web3 companies, the threat actor is leveraging LLMs, deepfakes, legitimate platforms, and ClickFix.",T14
263,CISOs should focus on harnessing and securing AI and building new skills among their people. Vision and change management can transform security.,T0
264,How a platform engineering team embeds supply chain security into infrastructure without slowing developers.,T8
265,Organizations remain reluctant to address the fact that AI can dangerously expose business operations as well as personal data.,T0
266,"Organizations can improve their climate footprints by optimizing two specific cybersecurity protections, without incurring added risks.",T8
267,"Only Taiwan made the top 10 list of governments, effectively blocking the threat-ridden protocol, but overall, the region lagged in curbing Telnet traffic.",T7
268,Organizations that have exposed their instances of Web Help Desk to the public Internet have inadvertently made them prime targets for attackers.,T8
269,"With access to SIM, location data, and a preview of recent SMSes, attackers have everything they need for account takeover or targeted social engineering.",T14
270,"Three of those zero-days are security feature bypass flaws, which give attackers a way to slip past built-in protections in multiple Microsoft products.",T8
271,"Ironically, security by obscurity has helped prevent dangerous OT attacks in recent years. It won't be that way forever.",T8
272,OpenAI's new GPT‑5.3‑Codex‑Spark is 15 times faster at coding than its predecessor.,T0
273,Distillation technique lets copycats mimic Gemini at a fraction of the development cost.,T0
274,"ClickFix bait, combined with advanced Castleloader malware, is installing Lumma ""at scale.""",T8
275,Zoë Hitzig resigned on the same day OpenAI began testing ads in its chatbot.,T0
276,"The $20,000 experiment compiled a Linux kernel but needed deep human management.",T0
277,Incident is at least the third time the exchange has been targeted by thieves.,T14
278,Claude Opus 4.6 and OpenAI Frontier pitch a future of supervising AI agents.,T0
279,"Sam Altman calls AI competitor ""dishonest"" and ""authoritarian"" in lengthy post on X.",T0
280,Publishers are rolling out more aggressive defenses.,T8
281,The window to patch vulnerabilities is shrinking rapidly.,T8
282,ChatGPT competitor comes out swinging with Super Bowl ad mocking AI product pitches.,T0
283,Some semi-unhinged musings on where LLMs fit into my life—and how I'll keep using them.,T14
284,Two AI giants shake market confidence after investment fails to materialize.,T6
285,"We don't need self-replicating AI models to have problems, just self-replicating prompts.",T0
286,Suspected China-state hackers used update infrastructure to deliver backdoored version.,T8
287,"Moltbook lets 32,000 AI bots trade jokes, tips, and complaints about humans.",T0
288,Ars spoke to several software devs about AI and found enthusiasm tempered by unease.,T0
289,Settlement comes more than 6 years after Gary DeMercurio and Justin Wynn's ordeal began.,T7
290,"We have no proof that AI models suffer, but Anthropic acts like they might for training purposes.",T0
291,"As reported by the Senate Committee on Foreign Relations on February 10, 2026",T13
292,"As ordered reported by the Senate Committee on Energy and Natural Resources on December 17, 2025",T13
293,"As reported by the House Committee on Education and Workforce on February 10, 2026",T13
294,"As reported by the House Committee on Energy and Commerce on February 4, 2026",T13
295,"As ordered reported by the House Committee on Oversight and Government Reform on February 4, 2026",T13
296,"As ordered reported by the House Committee on Oversight and Government Reform on February 4, 2026",T13
297,"As ordered reported by the House Committee on Oversight and Government Reform on February 4, 2026",T13
298,"As ordered reported by the House Committee on Oversight and Government Reform on December 2, 2025",T13
299,"As ordered reported by the House Committee on Transportation and Infrastructure on December 18, 2025",T13
300,"As passed by the House of Representatives on December 1, 2025",T13
301,"As ordered reported by the House Committee on Transportation and Infrastructure on January 21, 2026",T13
302,"As ordered reported by the House Committee on the Judiciary on January 8, 2026",T13
303,"CBO highlights its key findings about the outlook for the economy as described in ""The Budget and Economic Outlook: 2026 to 2036.""",T2
304,"CBO's Director, Phillip Swagel, briefs members of the press on the current budget and economic outlook.",T2
305,"CBO's Director, Phillip Swagel, discusses the current budget and economic outlook and highlights the effects of the 2025 reconciliation act, higher tariffs, and lower immigration on CBO's baseline budget and economic projections.",T2
306,"In CBO's projections, the federal budget deficit in fiscal year 2026 is $1.9 trillion, and federal debt rises to 120 percent of GDP in 2036. Economic growth strengthens in 2026 and moderates in later years.",T3
307,"As ordered reported by the Senate Committee on Commerce, Science, and Transportation on July 30, 2025",T13
308,"As ordered reported by the House Committee on Education and Workforce on January 8, 2026",T13
309,CBO provides information about how the agency estimates the effects of changes in permitting requirements on private investment.,T2
310,"The federal budget deficit totaled $696 billion in the first four months of fiscal year 2026, CBO estimates. That amount is $143 billion less than the deficit recorded during the same period last fiscal year.",T3
311,"The title of this post may have reminded you that you need to buy some chocolate for some event in a couple of days. If you do, you may also notice that chocolate has become quite expensive. If you already &#8230; <a href=""https://fredblog.stlouisfed.org/2026/02/why-is-chocolate-so-expensive/"">Continue reading <span class=""meta-nav"">&#8594;</span></a>",T11
312,"On February 5, 2026, the Bureau of Economic Analysis released their 2024 real GDP breakdown at the county level. Here are some highlights from the data set, some of which are shown in the FRED map above: As noted above, &#8230; <a href=""https://fredblog.stlouisfed.org/2026/02/real-gdp-by-county-2024-rev/"">Continue reading <span class=""meta-nav"">&#8594;</span></a>",T3
313,"FRED recently added 7 data series about the business conditions and outlook of upstream oil and gas energy firms headquartered in the 11th Federal Reserve District. In industry lingo, upstream refers to oil and gas exploration and production and the &#8230; <a href=""https://fredblog.stlouisfed.org/2026/02/oil-and-gas-firms/"">Continue reading <span class=""meta-nav"">&#8594;</span></a>",T2
314,"In a recent FRED Blog post, we discussed how confidence intervals show the level of certainty about the accuracy of an estimate. In short: Wider confidence intervals signal more uncertainty. Also, larger survey sample sizes increase the statistical accuracy of &#8230; <a href=""https://fredblog.stlouisfed.org/2026/02/confidence-intervals-and-sampling-variation/"">Continue reading <span class=""meta-nav"">&#8594;</span></a>",T3
315,"The US Census Bureau collects data and reports on the poverty level each year. Their statistical definition of poverty has to do with the affordability of food. As they describe, the Office of Management and Budget’s Directive 14 sets a &#8230; <a href=""https://fredblog.stlouisfed.org/2026/01/food-affordability-and-estimated-poverty/"">Continue reading <span class=""meta-nav"">&#8594;</span></a>",T3
316,"On January 23, 2026, the Bureau of Economic Analysis released real GDP data for all US states for the third quarter of 2025. The FRED map above shows the percentage change growth rates from the previous quarter: Light yellow denotes &#8230; <a href=""https://fredblog.stlouisfed.org/2026/01/real-gdp-growth-by-state-third-quarter-2025/"">Continue reading <span class=""meta-nav"">&#8594;</span></a>",T3
317,"On January 7, 2026, the Bureau of Labor Statistics released the third quarter data for total nonfarm employees at the state and metro levels in 2025. These numbers are being released a little later than usual due to the government &#8230; <a href=""https://fredblog.stlouisfed.org/2026/01/state-and-metro-employment-third-quarter-2025/"">Continue reading <span class=""meta-nav"">&#8594;</span></a>",T3
318,"The scale of US international trade as a share of the entire US economy peaked around 2011. Since then, US international trade has moderated. In this post, we look at how this moderation affected international goods exports from the top &#8230; <a href=""https://fredblog.stlouisfed.org/2026/01/the-current-ranking-of-top-exporting-us-states/"">Continue reading <span class=""meta-nav"">&#8594;</span></a>",T2
