id,text,topic_id
163,"A longtime HR pro says AI is making everyone's résumé look the same, when it can provide job seekers with so much more value.",T4
164,"From Ohio to Georgia to California, here are the billionaires who are running for their state's top office.",T3
165,"The US economy grew 2.2% in 2025 while job creation stalled, exacerbating inequality in a ""K-shaped economy"" scenario.",T9
166,"When a startup founder allowed an employee's dog to start coming to the office, she had no idea he would become their biggest productivity hack.",T7
167,"Layoffs are often stressful. Find out what to do if you lose your job, including financial strategies and tips for effective networking.",T8
168,A typical job search now lasts almost three months. Many Americans aren't financially prepared for that.,T9
169,We compared the prices of Costco's Kirkland Signature items with matching Sam's Club Member's Mark items to see which is the better deal.,T8
170,A management consultant who decided to quit his six-figure job after reading Brené Brown's 'Dare to Lead' shares the lessons he learned.,T7
171,"For years, English majors were mocked as useless. Now, AI is giving them some momentum in the job market, while computer science grads get disrupted.",T4
172,"Claude Code's creator said Anthropic's AI tool can use a computer like a human, and people are just starting to get a sense of its power.",T4
173,"David Ronca's cancer battle reshaped his career, including at Netflix. He learned to prioritize work-life balance and intentional productivity.",T7
174,"As politicians can't ignore data centers anymore, everyone from Bernie Sanders to Ron DeSantis is turning against them.",T3
175,"Donald Trump weighed in amid negotiations over the Warner Bros. deal, saying Netflix should fire Susan Rice from its board ""or pay the consequences.""",T12
176,Centerview Partners has reached a settlement with a former analyst just before a trial was set to begin over its grueling 100-hour workweeks.,T7
177,"While in New Delhi on Friday, OpenAI CEO Sam Altman said ""there will come a time"" for orbital data centers, but it won't be anytime soon.",T14
178,Residents cheered when a New Jersey city decided to remove data centers from its redevelopment plan. Data centers are now a flash point in many towns.,T3
179,A mom explains how everyday car rides became the most meaningful way to stay connected to her son as he entered his tween years.,T7
180,Spanish bank becomes 19th dealer on multi-bank SPV issuer amid rising investor interest,T11
181,"Marketable funding jumps 38% in Q4, reaching a four-year high",T2
182,"Dedicated teams vary wildly in size, while ownership is shared among risk, sustainability and the business",T1
183,"This paper puts forward an analytical, faster and accurate approximation to compute cheapest-to-deliver discount curves for multi-currency collateral.",T11
184,The authors investigate the projected Euler–Maruyama method for solving the Cox–Ingersoll–Ross model.,T1
185,The authors develop a homogenization measurement method from the perspectives of return rates and Sharpe ratios based on data from 421 active quantitative funds in China from January 2015 to March 2024.,T1
186,Derivatives and bonds venues would become subject to centralised supervision,T1
187,"Risk.net’s latest benchmarking exercise shows banks confronting decades-long exposures, while grappling with political headwinds, limited resources and data gaps",T11
188,"View interactive charts from Risk.net’s 43-bank study, covering climate governance, physical and transition risks, stress-testing, technology, and regulation",T1
189,"Trade processing chair blames budget constraints, testing and unease over operational risk ahead of settlement move",T13
190,"The authors investigate hedge fund performance in China with a Markov regime-switching model, showing differences between between economic expansion and recession phases.",T1
191,"The authors apply exceedance-based validation techniques often used for VaR model validation the the validation of ES models, showing such an application to be feasible.",T11
192,"Survey reveals that traders are grappling with daily volatility, while technology outranks liquidity&nbsp;as the top market structure concern",T2
193,SOFR OIS volumes slipped to almost half of fed funds activity during September repo spikes,T6
194,"New wholesaler has assembled a team of market-makers to compete with Citadel, IMC/Dash and Jane Street",T3
195,"UK bank logged five backtesting exceptions in 2025, keeping model in penalty band",T11
196,Inelasticity and illiquidity prolong the effects of flows; risk management needs to take this into account,T1
197,"The authors apply a subordinated Lévy process for the purpose of measuring and managing financial risks
in cryptocurrency markets.",T1
198,Buy side warns UK attempt to ease Mifir burden may miss target; dealers aren’t happy either,T3
199,Stakes in private companies. Handshake deals with chief executives. The president’s economic policy has drifted far from principles that long defined the Republican Party. Is it capitalism at all?,T0
200,"The president seems as intent on tariffs as ever and argues that his trade agenda is succeeding, despite little evidence to support it",T0
201,"Even after the Supreme Court invalidated many of the president’s levies, foreign leaders and executives assume that U.S. tariffs are here to stay, in one form or another.",T0
202,"Some companies could decide to temper price increases, but the effect would take time to materialize.",T8
203,The Supreme Court’s decision to invalidate many of President Trump’s tariffs raised questions about what would become of agreements struck with major U.S. trading partners.,T0
204,President Trump was the first to invoke the International Emergency Economic Powers Act of 1977 to set tariffs on imported goods from more than 100 countries.,T0
205,"Gross domestic product expanded at a 1.4 percent annual rate in the last quarter of the year, hit by the effects of the government shutdown.",T9
206,"Data released Thursday by the Census Bureau showed the overall trade deficit with the world narrowed, the result of an expanding trade surplus in services. The trade deficit in goods was the highest on record.",T9
207,U.S. officials are threatening major changes to a trade agreement with Mexico and Canada that could upend the way business is done and leave Canada on the outs.,T13
208,"Barring a rapid deterioration in the labor market or a significant cooling of inflation, the Federal Reserve appears poised for an extended hold.",T11
209,"Jamieson Greer, a low-key lawyer from a working-class background, is rewriting the rules of the global economy at the president’s behest.",T0
210,"After a year of just 181,000 new jobs, January’s 131,000 increase in the U.S. workforce was surprisingly positive. Ben Casselman, The New York Times’ chief economic correspondent, explains the numbers.",T9
211,"Labor force participation for women with small children continues to float above prepandemic levels, thanks to flexible work setups — and rising costs.",T9
212,"Research from the New York Fed confirms that U.S. companies and consumers are bearing tariff costs, despite the president’s assertions otherwise.",T0
213,European leaders have been compelled to address the possibility of once-remote risks to the financial networks and technology that undergird their economies.,T1
214,It sounds a bit kooky to promise a whole city from scratch. But it has been done before — and might just help solve the housing crisis.,T8
215,What to know about the better-than-expected report.,T11
216,Trump plans to nominate a ‘data nerd’ to lead Bureau of Labor Statistics.,T4
217,Leaders across industries from airlines to packaged foods have said a growing divide between lower-income and wealthy consumers is changing their businesses.,T8
218,"Economists have noticed that betting markets like Kalshi and Polymarket are pretty good at predicting not just political events but economic data, too.",T1
219,Countries that under the threat of tariffs made commitments like enormous investment pledges face the reality that they may have been better off waiting.,T13
220,"Plus, what to do when your job interviewer spouts off on things better left unsaid.",T4
221,Stakes in private companies. Handshake deals with chief executives. The president’s economic policy has drifted far from principles that long defined the Republican Party. Is it capitalism at all?,T0
222,"“A lot of interesting things happening in the city involve how people get around,” said Stefanos Chen, a Metro reporter and lifelong bus aficionado.",T7
223,"Workers at NewYork-Presbyterian/Columbia hospital voted for a contract with raises and layoff protections, meaning more than 4,000 nurses will return.",T9
224,A major winter storm on Sunday and Monday is expected to bring delays and cancellations across much of the Northeast.,T1
225,"The president seems as intent on tariffs as ever and argues that his trade agenda is succeeding, despite little evidence to support it",T0
226,"Nation’s largest bank, in response to a lawsuit filed by the president, confirmed his longstanding complaint about “debanking.”",T14
227,The move signaled that the president would press ahead with steep global import taxes despite the legal setback from the Supreme Court.,T0
228,The Supreme Court’s ruling on the president’s tariffs has jolted Washington and the business world. Here’s what to watch next.,T0
229,"Tech giants, including Meta and Alphabet, are spending lavishly on splashy billboard ads, courting on-the-fence politicians and bulking up their ranks of lobbyists.",T4
230,India’s prime minister acceded to many of President Trump’s demands under pressure of heavy tariffs. It would be awkward to reject them now.,T0
231,"The storied Los Angeles retailer, once recognized as an arbiter of West Coast style, has been acquired by the mass-market brand Aritzia.",T3
232,"Dan Ariely, a behavioral scientist at Duke, sought out the convicted sex offender for his research. Their yearslong correspondence suggests it wasn’t all business.",T4
233,"The exemption was shut down last year by President Trump based, in part, on the same legal grounds as the tariffs that were invalidated by the Supreme Court.",T0
234,"Even after the Supreme Court invalidated many of the president’s levies, foreign leaders and executives assume that U.S. tariffs are here to stay, in one form or another.",T0
235,"Some companies could decide to temper price increases, but the effect would take time to materialize.",T8
236,The justices struck down a central piece of President Trump’s agenda. What does that mean?,T12
237,The Trump administration says it could take years and additional litigation for importers to get their money back.,T13
238,The Supreme Court’s ruling against many of President Trump’s tariffs cheered executives who set to work seeking refunds on their duties.,T0
239,Organizers promise 1 million tickets for $28 each. But people who remember 1984 aren’t sure these Olympics will feel as accessible.,T7
240,"Some senior officials resisted the decision to approve the major military spending increase, people familiar with the matter said.",T8
241,"Trump increased the rate of a new global tariff to 15 percent, vowing to work around the ruling that invalidated his emergency tariffs.",T0
242,"An orphaned monkey in Japan has captured hearts, flooding the zoo with visitors and boosting sales for the plush toy that has been a comfort to him.",T7
243,"Homeownership, which is so central to the American Dream, remains an unequal and financially frustrating experience for Black families.",T8
244,The ruling deals a major blow to his signature economic policy and represents a stinging political setback.,T0
245,Trump sets collision course with congressional Republicans on tariffs,T0
246,"President Donald Trump, asked if the Supreme Court justices who struck down his ability to impose...",T12
247,Trump reaffirms tariffs that are central to his drug-price cuts,T0
248,"Trump imposes new 10% global tariff, replacing levies rejected by high court",T0
249,"The decision may not lead to immediate price drops for consumers, despite the potential for refunds and changes to trade policies.",T8
250,President Donald Trump said there isn’t a clear answer as to whether billions in tariff revenue...,T0
251,President Donald Trump said Friday that in response to the Supreme Court striking down his sweeping...,T12
252,"The U.S. economy experienced a slowdown in 2025, with the rate of GDP growth dropping because of tariffs and a government shutdown.",T9
253,Tariff ruling will likely upend Trump’s foreign policy strategy,T0
254,President Donald Trump briefly hinted at the next steps he plans to take in response to...,T12
255,President Donald Trump opened his news conference Friday afternoon by lashing out at Supreme Court justices...,T12
256,"64 percent of Americans disapprove of Trump’s handling of tariffs, poll finds",T0
257,"Without specifically noting the Supreme Court’s decision, House Speaker Mike Johnson (R-Louisiana) defended President Donald Trump’s...",T12
258,Organizers promise 1 million tickets for $28 each. But people who remember 1984 aren’t sure these Olympics will feel as accessible.,T7
259,"Some senior officials resisted the decision to approve the major military spending increase, people familiar with the matter said.",T8
260,"Trump increased the rate of a new global tariff to 15 percent, vowing to work around the ruling that invalidated his emergency tariffs.",T0
261,"An orphaned monkey in Japan has captured hearts, flooding the zoo with visitors and boosting sales for the plush toy that has been a comfort to him.",T7
262,"Homeownership, which is so central to the American Dream, remains an unequal and financially frustrating experience for Black families.",T8
263,The ruling deals a major blow to his signature economic policy and represents a stinging political setback.,T0
264,Trump sets collision course with congressional Republicans on tariffs,T0
265,"President Donald Trump, asked if the Supreme Court justices who struck down his ability to impose...",T12
266,Trump reaffirms tariffs that are central to his drug-price cuts,T0
267,"Trump imposes new 10% global tariff, replacing levies rejected by high court",T0
268,"The decision may not lead to immediate price drops for consumers, despite the potential for refunds and changes to trade policies.",T8
269,President Donald Trump said there isn’t a clear answer as to whether billions in tariff revenue...,T0
270,President Donald Trump said Friday that in response to the Supreme Court striking down his sweeping...,T12
271,"The U.S. economy experienced a slowdown in 2025, with the rate of GDP growth dropping because of tariffs and a government shutdown.",T9
272,Tariff ruling will likely upend Trump’s foreign policy strategy,T0
273,President Donald Trump briefly hinted at the next steps he plans to take in response to...,T12
274,President Donald Trump opened his news conference Friday afternoon by lashing out at Supreme Court justices...,T12
275,"64 percent of Americans disapprove of Trump’s handling of tariffs, poll finds",T0
276,"Without specifically noting the Supreme Court’s decision, House Speaker Mike Johnson (R-Louisiana) defended President Donald Trump’s...",T12
277,"Most phishing websites are little more than static copies of login pages for popular online destinations, and they are often quickly taken down by anti-abuse activists and security firms. But a stealthy new phishing-as-a-service offering lets customers sidestep both of these pitfalls: It uses cleverly disguised links to load the target brand's real website, and then acts as a relay between the target and the legitimate site -- forwarding the victim's username, password and multi-factor authentication (MFA) code to the legitimate site and returning its responses.",T5
278,"For the past week, the massive ""Internet of Things"" (IoT) botnet known as Kimwolf has been disrupting the The Invisible Internet Project (I2P), a decentralized, encrypted communications network designed to anonymize and secure online communications. I2P users started reporting disruptions in the network around the same time the Kimwolf botmasters began relying on it to evade takedown attempts against the botnet's control servers.",T5
279,"Microsoft today released updates to fix more than 50 security holes in its Windows operating systems and other software, including patches for a whopping six ""zero-day"" vulnerabilities that attackers are already exploiting in the wild.",T5
280,"A prolific data ransom gang that calls itself Scattered Lapsus ShinyHunters (SLSH) has a distinctive playbook when it seeks to extort payment from victim firms: Harassing, threatening and even swatting executives and their families, all while notifying journalists and regulators… <span class=""read-more""><a href=""https://krebsonsecurity.com/2026/02/please-dont-feed-the-scattered-lapsus-shiny-hunters/"">Read More &#187;</a></span>",T5
281,"The cybercriminals in control of Kimwolf -- a disruptive botnet that has infected more than 2 million devices -- recently shared a screenshot indicating they'd compromised the control panel for Badbox 2.0, a vast China-based botnet powered by malicious software that comes pre-installed on many Android TV streaming boxes. Both the FBI and Google say they are hunting for the people behind Badbox 2.0, and thanks to bragging by the Kimwolf botmasters we may now have a much clearer idea about that.",T5
282,"A new Internet-of-Things botnet called Kimwolf has spread to more than 2 million devices, forcing infected systems to participate in massive distributed denial-of-service (DDoS) attacks and to relay other malicious and abusive Internet traffic. Kimwolf's ability to scan the local networks of compromised systems for other IoT devices to infect makes it a sobering threat to organizations, and new research reveals Kimwolf is surprisingly prevalent in government and corporate networks.",T5
283,"Microsoft today issued patches to plug at least 113 security holes in its various Windows operating systems and supported software. Eight of the vulnerabilities earned Microsoft's most-dire ""critical"" rating, and the company warns that attackers are already exploiting one of the bugs fixed today.",T5
284,"Our first story of 2026 revealed how a destructive new botnet called Kimwolf rapidly grew to infect more than two million devices by mass-compromising a vast number of unofficial Android TV streaming boxes. Today, we'll dig through digital clues left behind by the hackers, network operators, and cybercrime services that appear to have benefitted from Kimwolf's spread.",T5
285,"The story you are reading is a series of scoops nestled inside a far more urgent Internet-wide security advisory. The vulnerability at issue has been exploited for months already, and it's time for a broader awareness of the threat. The short version is that everything you thought you knew about the security of the internal network behind your Internet router probably is now dangerously out of date.",T5
286,"KrebsOnSecurity.com celebrates its 16th anniversary today! A huge ""thank you"" to all of our readers -- newcomers, long-timers and drive-by critics alike. Your engagement this past year here has been tremendous and truly a salve on a handful of dark days. Happily, comeuppance was a strong theme running through our coverage in 2025, with a primary focus on entities that enabled complex and globally-dispersed cybercrime services.",T5
287,Researchers say threat actors wielded the sophisticated — and unfortunately named — toolkit to target high-value networks for React2Shell exploitation.,T5
288,"Microsoft Copilot recently summarized and leaked user emails; but any AI agent will go above and beyond to complete assigned tasks, even breaking through their carefully designed guardrails.",T4
289,"After two years of finding flaws in AI infrastructure, two Wiz researchers advise security pros to worry less about prompt injection and more about vulnerabilities.",T5
290,"The slower pace of upgrades has the unintended impact of creating a haven for attackers, especially for initial access brokers and ransomware gangs.",T5
291,"As scaled-down circuits with limited functions redefine computing for AI systems and autonomous vehicles, their flexibility demands new approaches to safeguard critical infrastructure.",T4
292,"The malicious version of Cline's npm package — 2.3.0 — was downloaded more than 4,000 times before it was removed.",T5
293,A user-friendly PhaaS tool beats standard methods for detecting phishing attacks by live-proxying legitimate login sites.,T5
294,Unprotected cloud data sends the wrong signal at a time when the emirate's trying to attract investors and establish itself as a global financial center.,T6
295,"Reused passwords, a lack of network segmentation, and poor sanitization processes make the Internet of Things' attack surfaces more dangerous.",T5
296,"Survey underscores the reality that scammers follow &quot;scalable opportunities and low friction,&quot; rather than rich targets that tend to be better protected.",T4
297,"A convincing presale site for phony &quot;Google Coin&quot; features an AI assistant that engages victims with a slick sales pitch, funneling payment to attackers.",T4
298,"CVE-2026-2329 allows unauthenticated root-level access to SMB phone infrastructure, so attackers can intercept calls, commit toll fraud, and impersonate users.",T5
299,How I realized what I was taught to about threat intelligence was missing something crucial.,T4
300,"A China-related attacker has exploited the vendor flaw since mid-2024, allowing it to move laterally, maintain persistent access, and deploy malware.",T5
301,"Discover a strategic approach to govern scraping risks, balance security with business growth, and safeguard intellectual capital from automated data harvesting.",T4
302,"After detecting a zero-day attack, the country's effective response was attributed to the tight relationship between its government and private industry.",T13
303,"Keenadu downloads payloads that hijack browser searches, commit ad fraud, and execute other actions without user knowledge.",T5
304,"Russia-aligned groups are probable culprits behind the wiper attacks against renewable energy farms, a manufacturer, and a heating and power plant.",T4
305,"Remote monitoring and management (RMM) software offers hackers multiple benefits, including stealth, persistence, and operational efficiency.",T5
306,ClickFix campaigns have adapted to the latest defenses with a new technique to trick users into infecting their own machines with malware.,T5
307,"Contrary to what password managers say, a server compromise can mean game over.",T5
308,"Broadcom's ""strategy was never to keep every customer,"" CloudBolt report says.",T3
309,OpenAI's new GPT‑5.3‑Codex‑Spark is 15 times faster at coding than its predecessor.,T4
310,Distillation technique lets copycats mimic Gemini at a fraction of the development cost.,T4
311,"ClickFix bait, combined with advanced Castleloader malware, is installing Lumma ""at scale.""",T5
312,Zoë Hitzig resigned on the same day OpenAI began testing ads in its chatbot.,T4
313,"The $20,000 experiment compiled a Linux kernel but needed deep human management.",T4
314,Incident is at least the third time the exchange has been targeted by thieves.,T7
315,Claude Opus 4.6 and OpenAI Frontier pitch a future of supervising AI agents.,T4
316,"Sam Altman calls AI competitor ""dishonest"" and ""authoritarian"" in lengthy post on X.",T4
317,Publishers are rolling out more aggressive defenses.,T5
318,The window to patch vulnerabilities is shrinking rapidly.,T5
319,ChatGPT competitor comes out swinging with Super Bowl ad mocking AI product pitches.,T4
320,Some semi-unhinged musings on where LLMs fit into my life—and how I'll keep using them.,T5
321,Two AI giants shake market confidence after investment fails to materialize.,T3
322,"We don't need self-replicating AI models to have problems, just self-replicating prompts.",T4
323,Suspected China-state hackers used update infrastructure to deliver backdoored version.,T5
324,"Moltbook lets 32,000 AI bots trade jokes, tips, and complaints about humans.",T4
325,Ars spoke to several software devs about AI and found enthusiasm tempered by unease.,T4
326,"As introduced in the House of Representatives on February 13, 2026",T10
327,"As ordered reported by the Senate Committee on Veterans’ Affairs on July 30, 2025",T10
328,The 2025 reconciliation act included a wide range of provisions that affect policies governing federal revenues and spending. This working paper describes the key methods that CBO used to estimate the law's macroeconomic effects.,T9
329,"As reported by the House Committee on the Judiciary on January 27, 2026",T10
330,"As reported by the House Committee on Natural Resources on January 14, 2026",T10
331,"As ordered reported by the House Committee on Science, Space, and Technology on June 11, 2025",T10
332,"As reported by the Senate Committee on Agriculture, Nutrition, and Forestry on October 27, 2025",T10
333,"As ordered reported by the House Committee on Transportation and Infrastructure on January 21, 2026",T10
334,"As ordered reported by the House Committee on Transportation and Infrastructure on December 18, 2025",T10
335,The Majority Leader of the House of Representatives announces bills that will be considered under suspension of the rules in that chamber. CBO estimates the effects of those bills on direct spending and revenues.,T10
336,"As ordered reported by the Senate Committee on Energy and Natural Resources on December 17, 2025",T10
