id,text,topic_id
0,"Adidas shares stumbled on Tuesday, with the apparel maker’s stock the worst out of Europe’s top 600 stocks, after a brokerage issued a rare double-downgrade.",T5
1,"“She would be responsible for taxes and insurance, which should be manageable.”",T12
2,"Deglobalization has evolved from an abstract concept to a harsh reality and portfolio managers must increase weightings of alternative investments to reflect the new paradigm, argues these researchers.",T6
3,"Plaza initially put the four-bedroom, 5.5-bathroom home on the market in September, eight months after Baena died by suicide at the age of 47 inside the home.",T13
4,"AMD CEO Lisa Su delivered a CES keynote that highlighted cost benefits, memory improvements, a shift toward real-world AI — and an insatiable demand for compute power.",T2
5,United now seeks  its seventh full-time manager since the legendary Alex Ferguson retired in 2013.,T14
6,"Shares of Under Armour Inc. got a boost after hours on Monday after Fairfax Financial Holdings continued to build up a large stake in the athleisure giant, whose stock has struggled over the past year.",T5
7,"Novo Nordisk’s wildly successful obesity medicine is now available as a pill, making it the first GLP-1 pill for weight loss in the U.S.",T6
8,"The early ratings for Versant are in — with shares of the new owner of cable television stalwarts like CNBC, USA Network and the recently rebranded MS NOW (formerly MSNBC) tumbling 13% on their first day of trading.",T5
9,How a full-page newspaper advertisement in 1987 became American foreign policy.,T4
10,U.S. productivity slows down in fourth quarter while unit labor costs accelerate,T7
11,Beyond to buy rights to Buy Buy Baby brand and reunite it with Bed Bath & Beyond,T6
12,Amazon says it had best-ever Thanksgiving Holiday week with record sales and number of items sold,T14
13,U.S. stock futures and bond yields drop on reports Putin has updated nuclear doctrine,T11
14,Charter Communications announces buyout deal for Liberty Broadband at terms above its previous proposal,T6
15,General Motors unveils new all-electric Cadillac called the Vistiq with 300-mile range,T6
16,Vestas Wind Systems stock slumps as company says margins to be at low end of guidance,T5
17,Burberry shares rise on report Moncler could bid for it,T0
18,Kazatomprom reports 17% increase in production during the third quarter,T5
19,Anheuser-Busch InBev shares slip as sales come up shy of estimates,T5
20,Wingstop’s stock slides 12% after profit falls short of estimates,T5
21,Novartis hikes sales and profit guidance for the year,T5
22,Plus500 says it will meet expectations after quarterly revenue climbs 11%,T5
23,Trainline boosts guidance for the second time this year,T5
24,Barclays reports 18% profit rise as it lifts income guidance,T5
25,"London Stock Exchange Group says income grew, led by Tradeweb",T0
26,The food giant discovered some batches of SMA infant and follow-on formula could lead to vomiting,T6
27,"Festive trading at the retailer beat expectations, but rising unemployment is expected to weigh on demand this year.",T10
28,"The move is part of the government's new road safety strategy, which plans to reform driving laws in Britain.",T14
29,The SMMT warned of a growing gap between consumer demand and the government's ambitions for EVs.,T14
30,The firm plans to deploy the technology at the same plant that was involved in a huge immigration raid in 2025.,T2
31,Indian farmers are turning to butterfly pea flower which is in demand for its bright blue colour.,T6
32,"The firms' owner said ""alarming"" low Christmas trading left both in a ""vulnerable"" position",T5
33,"The account placed a $32,000 wager just before Trump announced the Venezuelan leader was in US custody.",T4
34,The chip giant is looking for ways to move the AI revolution beyond software and into physical products.,T2
35,"Millions of people have returned to the iconic online game to farm, go on quests and fight big bosses.",T1
36,Elon Musk's social media platform has warned users not to use Grok to generate illegal content.,T1
37,Investors bet the action may open opportunities to tap the country's oil wealth.,T4
38,"Sir Keir Starmer has given details of his plans for a ""Brexit reset"". What could it mean for the UK?",T14
39,"Soft drinks, chocolate, pizzas and ice creams will be targeted in the UK government's plan.",T14
40,Donald Trump has said that American oil firms will invest billions to produce oil in Venezuela.,T4
41,Sciences Po Saint-Germain near Paris trains current French secret agents and potential new recruits.,T1
42,Career coaches and leaders share practical advice for managing anxiety and overload after the break.,T12
43,"The plushies bring ""emotional value"" to Chinese youth navigating economic uncertainty.",T8
44,Attracting younger workers into the defence industry can be challenging.,T2
45,The pilot project is even giving staff free money to help pay to do activities with their friends.,T12
46,Mexican Senator Armando Rios Piter told CNN that he plans to introduce a bill this week that would stop Mexican purchases of American corn.,T9
47,The days of plugging in an iPhone to charge won't last forever.,T1
48,"Nandan Nilekani, co-founder of one of India's biggest outsourcing companies, says an H-1B visa crackdown would ultimately hurt the U.S.",T11
49,The market is at all-time highs and many say Trump is the reason. But stocks were rallying when investors thought Hillary Clinton would win. Janet Yellen and the Fed may deserve more of the credit for the market's move.,T5
50,Apple stock is less than $1 away from its all-time high amid renewed optimism for the iPhone.,T11
51,President-elect Donald Trump focuses his criticism of NAFTA on Mexico. But Canada and America have a rocky trade history too.,T4
52,"Verizon has decided to bring back unlimited data plans. But while that's great for its subscribers, it's awful news for investors. It's another sign of how brutally competitive the telecom business is. And it's hurting Verizon's stock.",T2
53,The price of crude oil has more than doubled over the past year after bottoming out at $26 per barrel in February 2016.,T4
54,The automaker announced Monday that its first official venture in the oil-rich Middle East will be in the United Arab Emirates.,T6
55,Uber's top rival in India has some unsolicited advice for the U.S. startup: Go local.,T6
56,"Apple CEO Tim Cook wants the tech industry to take action against ""fake news"" stories that are polluting the web.",T1
57,"Sears Holdings, the company that owns retail stores Sears and Kmart, said this weekend that it would remove 31 Trump-branded items from its website.",T14
58,"Universal Biopack makes packaging that it sells to restaurants and manufacturers. But rather than plastic, it uses a mixture of bamboo and cassava.",T6
59,"Nike on Sunday launched a star-studded short film titled ""Equality"" that coincides with Black History Month.",T8
60,"Treasury secretary pick Steven Mnuchin is an executive producer on Warner Bros.' ""The Lego Batman Movie,"" which pulled in an estimated $55.6 million from U.S. audiences during its opening weekend.",T2
61,"It may seem like a recurring nightmare, but Greece is in danger of running out of money again.",T11
62,"BBC journalists have reportedly been instructed not to describe America’s abduction of Venezuelan leader Nicolas Maduro as a “kidnapping”, according to a British newspaper columnist.
The editorial instruction was unveiled by Owen Jones on Monday, a commentator with more than a million followers on a social media platform. Jones said a memo from BBC management had been passed to him.
According to an image Jones uploaded with his post, the guidelines told BBC’s journalists to use “captured” when...",T4
63,"Indonesian beauty doctor and social media influencer Richard Lee has been named a suspect in a criminal case following a complaint by a fellow content creator, as their long-running feud moved from online platforms into a police station.
Jakarta police confirmed on Tuesday that Lee was designated a suspect in a case involving alleged violations of health regulations and consumer protection laws, stemming from a report lodged by Samira Farahnaz – known online as “Dokter Detektif” or Doktif – in...",T1
64,"Indonesia’s long-delayed overhaul of its criminal justice system took effect last week, with the government hailing the “historic” change that would usher in a “more humane” era of law enforcement, even as rights groups warn they could further narrow space for dissent and private life.
The new Criminal Code and revised Criminal Procedure Code came into force on Friday, ending decades of debate over how to replace Dutch-era statutes that officials said no longer reflected Indonesian society.
It...",T1
65,"India’s competition watchdog has found market leaders Tata Steel, JSW Steel, state-run SAIL and 25 other firms breached antitrust law by colluding on steel selling prices, ‍a confidential document shows, putting the companies and their executives at risk of hefty fines.
The Competition Commission of India (CCI) has also held 56 top executives, including JSW’s billionaire Managing Director Sajjan Jindal, Tata Steel CEO T.V. Narendran and four former SAIL chairpersons, liable for price collusion...",T6
66,"A traditional custom in northern China known as “hiding from the lanterns” requires that newly married women leave their husband’s home and avoid the groom’s family lantern on their first Lantern Festival after marriage.
In China, lanterns are commonly seen as symbols of light and hope.
However, during the Lantern Festival, celebrated on the fifteenth day of the first month in the lunar calendar, they become a taboo for newly married women in some areas.

In a tradition popularly known as...",T6
67,"The death toll in violence surrounding protests in Iran has risen to at least 35 people, activists said Tuesday, as the country’s theocracy acknowledged the unrest in one western province where security forces reportedly raided a hospital.
The figure came from the US-based Human Rights Activists News Agency, which said more than 1,200 people have been detained in the protests, which have been ongoing for more than a week.
It said 29 protesters, four children and two members of Iran’s security...",T7
68,"A site on northwest Lantau Island is likely to be chosen for a French aeronautical services company to build a factory that will house Hong Kong’s first aircraft dismantling business, the Post has learned.
Sources said on Tuesday that the site at To Kau Wan was deemed suitable because of its proximity to Hong Kong International Airport and convenient access to existing infrastructure, including roads and a pier that could accommodate barges.
The area is currently being used to temporarily store...",T8
69,"Morgan Stanley upgraded Hong Kong’s property sector to “attractive”, noting that an all-round improvement in the city’s economy and a policy-driven recovery will continue to push prices higher this year.
The US investment bank forecast home prices to rise around 10 per cent in 2026, with further gains expected in 2027, pointing out that the ongoing rebound marks the start of a new upcycle.
“We expect all three sub-segments – Hong Kong residential prices, Central office rents and retail rents –...",T8
70,"As Japanese employers search for new ways to retain workers amid the country’s labour shortages and declining birth rate, some are embracing an unconventional addition to their benefits packages: corporate-only dating apps.
The services, which allow employees to meet partners from other vetted companies, are being presented less as lifestyle perks than as tools to address long-standing imbalances in the workplace, where single staff often shoulder heavier and less visible burdens.
“Single...",T6
71,"Hong Kong’s innovation and technology minister has cancelled his trip to the United States, just four hours after the government announced his three-day itinerary for the visit.
In a statement issued at 4.20pm on Tuesday, the government said that Secretary for Innovation, Technology and Industry Sun Dong had cancelled his visit to the US, without explaining the reason behind the decision.
An insider told the Post that Sun, together with the delegation he was leading to the US, had not yet...",T14
72,"China’s car industry is expected to stagnate this year as it tries to catch its breath after years of growth. New energy vehicles (NEVs) are likely to continue increasing their market share but growth will be much lower than in recent years, with the penetration rate reaching around 60 per cent.
“Involution” was the major theme last year, and despite efforts by the government and manufacturers, the situation is unlikely to improve until the second half of the year, due to a tepid economy and a...",T14
73,"Hesai Group, the world’s largest maker of vehicle lidar sensors, has struck a partnership with US chip giant Nvidia to help develop an autonomous driving platform, as the Shanghai-based firm pushes its global expansion to serve more international marques.
Hesai said on Tuesday that its light detection and ranging sensors – which use laser beams to measure distances to objects – would be supplied to support Nvidia’s Drive Hyperion platform, which is designed to meet the level 4 (L4) self-driving...",T2
74,"China has banned the export of products with both commercial and military applications to end users linked to the Japanese military amid a protracted diplomatic row between Beijing and Tokyo.
Effective immediately, the export of these items – known as “dual-use” goods – to those entities for military purposes, or for any other purpose that would “contribute to enhancing Japan’s military capabilities,” is prohibited, China’s Ministry of Commerce announced on Tuesday.
While dual-use items are...",T6
75,"Hong Kong police are searching for two suspects who allegedly assaulted a homeless man with a standing floor sign and set fire to objects at a public stairwell in the early hours of Tuesday.
A security guard alerted police about a stairwell fire under a footbridge in Tsz Wan Shan at 3.49am. Arriving officers found an injured 74-year-old man at the scene.
A source familiar with the matter told the Post the victim was a street sleeper.
The man told officers that two men in black clothing had...",T8
76,"Washington’s abduction of Venezuelan leader Nicolas Maduro last week has been characterised by many – including US President Donald Trump – as an attempt to gain control over the South American nation’s oil industry.
But analysts said the crisis was also about Washington’s need to secure access to critical minerals – and that other resource-rich nations should be on guard.
In addition to its vast oil reserves, Venezuela has significant deposits of an array of precious metals and other valuable...",T4
77,"In the wake of last weekend’s US military action in Venezuela, the US news media got something it has seldom heard from the Trump administration: a “thank you”.
Secretary of State Marco Rubio credited news organisations that had learned in advance about last Saturday’s strike that led to the capture of Venezuelan President Nicolas Maduro with not putting the mission in jeopardy by publicly reporting on it before it happened.
Rubio’s acknowledgement was particularly noteworthy because US Defence...",T4
78,"Tai Po district councillors have urged the government to expedite rebuilding plans and offer Wang Fuk Court residents a range of rehousing options after Hong Kong’s deadliest fire in decades, as officials pledged to weigh the pros and cons of each proposal.
At the first meeting of Tai Po District Council since the fire on November 26, all 22 members attended, including Peggy Wong Pik-kiu, who has come under heavy scrutiny for advising the owners’ corporation of the housing estate on its HK$330...",T8
79,"China’s top real estate developers continue to shrink, according to industry data.
The number of mainland property developers achieving annual contracted sales of at least 100 billion yuan (US$14 billion) dropped to just 10 in 2025 from a peak of 43 in 2020, research firm China Real Estate Information Corporation (CRIC) said in a report on Sunday.
Among the top 10 developers, only one, China Jinmao Holdings, reported year-on-year growth in sales, according to CRIC.
The ranks of developers in the...",T8
80,"Chinese investment bank Citic Securities took the top position for overall investment banking fees in Asia-Pacific, excluding Japan, in 2025, driven by its strong business performance in bond and initial public offering (IPO) underwriting, according to a report released on Wednesday by the London Stock Exchange Group (LSEG).
The Beijing-based brokerage generated US$1.45 billion in investment banking fees during the last year, accounting for 5.8 per cent of the total Asia-Pacific investment...",T8
81,"China’s ideology chief has again called on propaganda officials to focus on the economy, as the country grapples with a slowdown, high unemployment and weak consumer demand.
Cai Qi, a member of the Politburo Standing Committee, told a national meeting of publicity department heads in Beijing on Monday that “a good start should be set” for the next five-year plan, state news agency Xinhua reported.
The country’s new blueprint for social and economic development has officially begun and runs until...",T8
82,Armed militias patrol the streets and journalists arrested as government crackdown on dissent widens,T1
83,GOP leaders play down prospect of long-term US involvement after briefing from top officials,T10
84,The European groups continued to supply the Latin American country after the US dialled up economic pressure on Caracas,T4
85,Venezuela’s opposition leader weighs when to return — and whether to mobilise her supporters,T4
86,"From diplomatic passports to palace meets, US indictment traces how Maduro allegedly built trafficking career",T4
87,Oil-rich Venezuela has been a springboard for Beijing’s geopolitical and economic interests in Latin America,T4
88,US companies tapped to sponsor USA House in Swiss village during conference for global elite,T11
89,"Fresh from his Venezuela adventure, US president shows no sign of backing down on Arctic island",T4
90,Founder Pavel Durov’s efforts to distance the messaging app from Moscow collide with sanctions reality,T1
91,Rome and Italian group look for a solution ahead of US ban on Chinese-backed car software and hardware,T6
92,"U.S. stocks were mostly lower, with the Nasdaq leading declines as makers of AI infrastructure suffered steep falls, many in the double digits. Nvidia was down 16%.",T11
93,"Gold settled 1.4% lower, down two of the past three sessions, and silver fell 2.5%, down three of the past four sessions.",T11
94,"Panic fueling the selloff of Nvidia, Broadcom and other tech giants is overblown.",T2
95,"Gain insight on Experian, SoFi Technologies and more in the latest Market Talks covering Financial Services.",T12
96,"Arabica coffee prices hit a record level, as traders digested the withdrawal of President Trump’s threats to impose tariffs and economic sanctions on Colombia.",T11
97,The Yen and Swiss Franc were stronger against the dollar as investors sought safe havens after Chinese start-up DeepSeek’s new AI model hit U.S. tech stocks.,T11
98,U.S. natural gas futures fell after weekend updates took some of the chill out of early February weather forecasts.,T11
99,QXO is taking its offer directly to shareholders after being rebuffed on several occasions.,T5
100,Maverick Natural Resources has operations in Texas and Oklahoma.,T9
101,"There are some new wrinkles, especially for those who sell things online or bought an EV.",T6
102,Companies with good payouts are now the hottest bet in China markets.,T8
103,The 10-year U.S. Treasury yield fell and ING said the the long end of the Treasury curve will continue trading at higher yields even as Trump hasn’t delivered anything to shock markets so far.,T10
104,Oil edged lower in early trade as Goldman Sachs said the latest round of U.S. sanctions against Russia haven’t had a significant impact on the country’s oil exports.,T11
105,"There is little sign of crimped demand for equities among individual investors, who remain bullish after two years of blockbuster gains.",T5
106,Check out the stocks Heard on the Street writers favor in their eighth annual stock-picking contest.,T0
107,The real costs of owning a house in neighborhoods that are vulnerable to flooding and wildfires are becoming clearer.,T7
108,"Venture-capital firms are bringing AI and dealmaking to accounting, property management and other unglamorous fields.",T2
109,"Recent court cases reveal how middlemen are facilitating a booming trade, eluding a crackdown.",T14
110,The story of home affordability in the U.S. told from a single front porch.,T7
111,The president has told Bank of America and JPMorgan Chase to stop cutting conservatives off from doing business.,T13
112,"Bernstein upgrades Thales, TKMS; downgrades BAE Systems, Dassault",T8
113,"Goldman sees modest gains for European equities, lifts STOXX 600 target",T5
114,Trigano shares fall over 2% after Q1 sales miss estimates,T5
115,India stocks lower at close of trade; Nifty 50 down 0.27%,T11
116,"Mystery trader garners $400,000-plus windfall on Maduroâ€™s capture",T0
117,Swiss Marketplace Group shares jump over 12% after Price Supervisor agreement,T0
118,Novo launches Wegovy weight-loss pill for sale in US,T6
119,Explainer-How regulators globally are softening capital rules for banks,T3
120,"Factbox-Governments, regulators increase scrutiny of DeepSeek",T1
121,FX market muted as dollar steadies from Venezuela shock,T4
122,Bank of America sees dollar weakness ahead as bearish signals persist,T11
123,"Hungary still aiming for US backstop after first attempt fizzles, Orban says",T4
124,Venezuela’s Maduro capture hits oil prices; CAD and NOK fall,T4
125,Asia FX weakens as markets digest Venezuela action; yen falls past rate hike talk,T11
126,Investors and economists react to US capture of Venezuela’s Maduro,T4
127,UK factories pick up a bit of speed but outlook worries remain,T14
128,Dollar edges higher to open the year as trading activity returns,T11
129,Dollar set for steepest annual decline in eight years,T11
130,South Korea’s FX authorities sell $1.745 billion in Q3 to support won,T8
131,Deutsche Bank forecasts S&P 500 to hit 7000 by end of 2025,T10
132,"Trump's tariffs, Fed minutes, Rumble's Bitcoin buy - what's moving markets",T11
133,Bitcoin price today: slips to $94k as risk appetite sours on Trump tariff threat,T0
134,2025 macro outlook for the US is 'murky at best' says Deutsche Bank,T10
135,Trump says he will impose additional 10% tariffs on China over drug inflow,T11
136,"Asia stocks fall after Trump threatens tariffs, Japan's Nikkei leads losses",T11
137,"S&P 500 positioning levels at record highs, pullback risks rise, Citi warns",T5
138,"Analyst calls Bitcoin 'global bubble', could soar to infinity",T0
139,Stock market today: Dow hits record as Trump's pick for Treasury stokes optimism,T11
140,Jump in Tesla stock mostly driven by 'animal spirits/momentum' says UBS,T0
141,"Minutes of the Federal Open Market Committee, December 9–10, 2025",T9
142,Agencies release annual asset-size thresholds under Community Reinvestment Act regulations,T3
143,Federal Reserve Board announces approval of the application by National Bank Holdings Corporation,T3
144,"Federal Reserve Board publishes its biennial report on debit card transactions, which summarizes information collected from large debit card issuers and payment card networks",T3
145,"Federal Reserve Board requests public input on “payment account,” which eligible financial institutions could use for the limited purpose of clearing and settling their payments",T3
146,Federal Reserve Board publishes first of several staff manuals for the supervision of the largest and most complex banks,T3
147,Federal Reserve Board withdraws 2023 policy statement and issues new policy statement regarding the treatment of certain Board-supervised banks that facilitates responsible innovation,T3
148,"Federal Reserve Board announces termination of enforcement actions with The Goldman Sachs Group, Inc. and Metropolitan Commercial Bank",T3
149,Agencies announce dollar thresholds for smaller loan exemption from appraisal requirements for higher-priced mortgage loans,T3
150,Agencies announce dollar thresholds for applicability of truth in lending and consumer leasing rules for consumer credit and lease transactions,T3
151,"Federal Reserve Board announces approval of application by Banco BTG Pactual S.A., its parent holding companies, and subsidiary, BTG Pactual Bancorp, LLC",T3
152,"Federal Reserve Board announces approval of application by The PNC Financial Services Group, Inc.",T3
153,Federal Reserve Board announces reappointment of Reserve Bank presidents and first vice presidents,T3
154,"Federal Reserve Board announces termination of enforcement actions with Credit Suisse Group AG, Credit Suisse AG, Credit Suisse Holdings (USA), Inc., Credit Suisse AG, New York Branch, and JPMorgan Chase &amp; Co.",T3
155,Federal Reserve Board and Federal Open Market Committee release economic projections from the December 9-10 FOMC meeting,T13
156,Federal Reserve Board issues enforcement action with former employee of Synovus Bank,T3
157,"Federal Reserve Board requests public input on the impact of potential strategic changes to check services provided by the Fed, as well as check usage and preferences",T3
158,"Federal Reserve Board announces pricing, effective January 1, 2026, for payment services the Federal Reserve Banks provide to banks and credit unions",T3
