id,text,topic_id
159,"Walmart's entry into groceries, and supermarkets' reaction, sent some shoppers to Whole Foods, co-founder John Mackey said.",T9
160,Powell described the move as a part of a broader effort to pressure the central bank on monetary policy.,T12
161,"A joint letter from the heads of 10 central banks called Powell a ""respected colleague held in the highest regard by all who have worked with him.""",T12
162,US retailers like Nordstrom Rack and Aldi are expanding in 2026 as store openings outpace closures so far.,T2
163,"Are you smarter than a high schooler? Take this 12th-grade economics quiz on capitalism, socialism, and market systems.",T10
164,The criminal investigation into Fed Chair Jerome Powell is likely to further complicate Donald Trump's timeline for naming his replacement.,T12
165,"Career coach Andrea Wasserman stresses how important it is to resist the urge to ""wait and see."" Get started now preparing for career advancement.",T4
166,"After months on hold, PE firms moved fast &mdash; and recruiters say the delay produced more prepared candidates when on-cycle finally returned.",T4
167,"Matthew Landry, a nutrition researcher and dietitian, studies how what we eat can prevent heart attacks later in life.",T1
168,"Nick Fleisher advised Big Law at McKinsey. Now the investor behind Harvey is backing his legal AI startup, Sandstone.",T12
169,"Americans' debt loads are at record highs, resurfacing a decadeslong debate on how to prevent companies from maximizing profit at consumers' expense.",T9
170,"Americans love trying to upgrade their brains &mdash; one scoop, zap, or gaming session at a time",T0
171,"Even people who don't use credit cards pay more for everyday goods because merchants raise prices to cover card fees, said Klarna's CEO.",T9
172,"An app asking ""Are you dead?"" has gone viral in China, sparking debate about loneliness and the risks of living alone.",T1
173,"""I have become indifferent to food. I still love it. I still love it. But I'm not in any way obsessed about it,"" Oprah Winfrey said.",T1
174,"The 46th Separate Air Mobile Brigade showcased a ""new way of capture"" for enemy drones that seems to use a line or cord to fight quadcopters.",T1
175,"Jerome Powell says the criminal investigation centers on a June Senate hearing, where he got into a heated exchange over the Fed's renovation plans.",T12
176,President Donald Trump said that tech companies must pay for their own data centers without spiking utility bills for American households.,T1
177,"When Kris LeBoutillier's mom got older and her health declined, she wanted him closer to home. ""Haven't you been in Singapore long enough?,"" she asked him.",T1
178,"See all Eric Clapton 2026 tour dates across Europe. Find out where to buy tickets, how much they cost, and what to expect from the guitar legend's live shows.",T8
179,"Model teams hold the reins, but some argue AI is an enterprise risk",T0
180,Counterparty Radar: Pimco cut $4.6bn of EUR/USD puts in Q3 amid changing stance on dollar direction,T3
181,December growth contrasts with broader FCM retrenchment from October peak,T8
182,J.P. Morgan wins Best user interface innovation thanks to its Beta One portfolio solution,T5
183,Mark McMillan to oversee e-trading and sales activities in newly created role,T7
184,"Dealers may welcome digital-era rewiring to free up collateral movement, but tokenisation will obscure metrics",T7
185,"Extra loss flags will allow banks to track transversal risks like geopolitics and AI, say experts",T6
186,"Plan would expand own-capital tranches deployed alongside member contributions at LCH, Ice and LME",T6
187,"Across 46 firms, asset-liability management is usually housed in treasury, but formal remits and staffing allocations differ sharply",T6
188,Banks and asset managers should be proactive in adopting quantum-safe strategies,T6
189,UK lender still weakest against required minimums but widens buffers from prior exercise,T6
190,Venezuela op boosts risk reversals as investors look to protect carry trades,T1
191,Start-up exchange will launch perpetual futures Clob in Q1 after AFM nod,T4
192,"Clearing rates fall in US as UK, Europe and Canada push higher",T8
193,Some bankers fear EU regulatory push on CSRBB has done little to improve risk management,T6
194,"Extending the influential CreditRisk+ model for portfolio credit risk modeling, the authors propose adding a continuous-time extension to the model.",T6
195,This paper discusses challenges in economic forecasting and model misspecification errors faced by financial institutions implementing the CECL allowance methodology and its impact on model risk and bias in CECL projections.,T8
196,"The authors investigate current and proposed cyber risk reporting requirement and describe the
data gaps that remain before discussing how a better and harmonized cyber incident data collection rule could improve cybersecurity.",T0
197,"AI, strained governments, inflated private assets: risky bets have become hard to avoid",T4
198,Cover 2 liquidation scenario wipes out more than half of default fund,T6
199,White House officials have explored a vast array of ideas as the president looks to unfurl a housing affordability plan at an economic conference this month.,T13
200,The president appears skeptical about Americans’ concerns. How will voters respond?,T1
201,"The deal would cut tariffs and include a commitment from Taiwanese Semiconductor Manufacturing Corporation, the island’s chip giant, to build more manufacturing plants in the United States.",T3
202,"As economists pointed to some of the president’s policies to explain the latest Labor Department data, White House aides sought to make the case for optimism in the new year.",T13
203,"The agreement represents a push for deeper global cooperation, in contrast to the United States’ turning to coercion in its dealings with other countries.",T1
204,"For the central bank to lower interest rates again, officials will likely need to see more notable signs that unemployment is rising.",T13
205,"The unemployment rate fell in December, but job growth across 2025 was the lowest in five years.",T10
206,"Nicolai Tangen wanted to raise the profile of Norway’s $2.1 trillion oil fund and change corporate behavior, but he may have helped embroil it in a geopolitical tangle.",T5
207,"The monthly trade deficit continued to shrink in October after President Trump imposed sweeping tariffs on imports, the latest data showed.",T8
208,"This year, for the first time, more workers will live in states with a minimum wage of at least $15 per hour than in states with the federal minimum of $7.25.",T10
209,"A larger proportion of new cars are being bought by affluent Americans as prices and interest rates for auto loans climb, analysts said.",T9
210,"A new study found that the court’s Republican appointees voted for the wealthier side in cases 70 percent of the time in 2022, up from 45 percent in 1953.",T9
211,"Steep import taxes have raised prices and affected U.S. businesses, but not quite as much as expected. A new report offers some reasons.",T8
212,"Many Americans can take advantage of President Trump’s deduction on auto loan interest, but the tax break will provide only modest savings.",T9
213,"The administration has downplayed concerns — from mass job losses, to a potential financial bubble — as President Trump cheers soaring stock prices and faster growth.",T1
214,The latest vessel to be targeted by the United States in its pressure campaign on Venezuela was sending distress signals as it headed northeast from the Caribbean into the Atlantic.,T1
215,Economists say that a typical middle-class family today is richer than one in the 1960s. Americans in their 20s and 30s don’t believe it.,T13
216,"A reordering of the rules of trade, set on top of transformational change in technology, demographics and climate, is remaking jobs, politics and lives.",T3
217,"Data collection issues skewed the latest Consumer Price Index report, economists warned, clouding the picture for the Federal Reserve as it also grapples with a cooling labor market.",T8
218,"Companies that already have operations in the country stand to benefit, but those that have profited from a standoff between Caracas and Washington could lose out.",T1
219,White House officials have explored a vast array of ideas as the president looks to unfurl a housing affordability plan at an economic conference this month.,T13
220,"Her reimagining of “CBS Evening News” is under heavy scrutiny, and even became a punchline on her own network on Sunday at the Golden Globes.",T1
221,"Psilocybin-assisted therapy is legal in three states, but access has so far been limited and expensive.",T0
222,"State media, embracing the gaming phrase “kill line,” is asserting China’s political superiority over the United States, deflecting focus on China’s own economic challenges.",T1
223,The Labor Department is investigating a complaint alleging misconduct by Secretary Lori Chavez-DeRemer.,T12
224,"The Federal Reserve is likely to hold interest rates steady when it meets at the end of the month, keeping tensions high with President Trump.",T9
225,The president appears skeptical about Americans’ concerns. How will voters respond?,T1
226,"The Justice Department’s probe into whether Jerome H. Powell, the chair of the Federal Reserve, lied about renovations to the central bank’s headquarters has raised alarms.",T12
227,"After receiving a diagnosis of terminal cancer, he used his experience in public relations to draw attention to the skyrocketing cost of medication.",T4
228,"The justices heard arguments over whether oil companies sued by Louisiana could move the cases from state to federal court, a venue thought to be friendlier to corporate interests.",T7
229,"The deal would cut tariffs and include a commitment from Taiwanese Semiconductor Manufacturing Corporation, the island’s chip giant, to build more manufacturing plants in the United States.",T3
230,The announcement was the latest in a series of increasingly aggressive actions by Paramount to buy Warner Bros.,T1
231,"The Justice Department’s decision to open up a criminal investigation of Jerome H. Powell, the chair of the Federal Reserve, is a major escalation in the pressure campaign against the central bank to cut interest rates.",T12
232,"Stocks and U.S. Treasuries were relatively unchanged on Monday, a sign investors don’t see an immediate threat to the economy.",T8
233,"A criminal investigation into Jay Powell, the Federal Reserve chair, may be the most consequential attack yet on the central bank’s political independence.",T12
234,A British regulator said it had started a formal investigation into Mr. Musk’s chatbot over the spread of illegal images.,T0
235,"The European Commission allowed carmakers to volunteer limits on their imports from China instead of paying tariffs, an arrangement that could help Volkswagen.",T3
236,"The combination of the two small, budget airlines comes as low-cost carriers have struggled with high costs and competition.",T2
237,More large donations from wealthy Silicon Valley figures are expected as they try to marshal opposition to a proposed ballot measure that would impose a new tax on billionaires.,T9
238,"New data is expected to show that U.S. inflation rose in December, closing out a year of stubbornly high prices complicated by tariffs and a government shutdown.",T8
239,"The Trump administration has tried to eliminate funding for the U.S. Agency for Global Media, which oversees VOA. Appropriators in Congress have had other ideas.",T1
240,"It’s not clear how the inquiry into Federal Reserve Chair Jerome Powell was approved, but housing regulator Bill Pulte met with President Donald Trump at Mar-a-Lago, and shared a prop resembling a “wanted poster” he had made up featuring Powell.",T12
241,New York City nurses went on strike over staffing levels and health benefits at key hospitals.,T10
242,"Here are the fastest-growing and fastest-shrinking jobs over the years, based on information from the Census Bureau’s Current Population Survey.",T10
243,The Fed confirmed it received subpoenas related to Senate testimony of the Federal Reserve’s Jerome Powell about renovations to the headquarters.,T12
244,The U.S. housing market recently reached a key milestone that could lead to some easing.,T13
245,"New data is expected to show that U.S. inflation rose in December, closing out a year of stubbornly high prices complicated by tariffs and a government shutdown.",T8
246,"The Trump administration has tried to eliminate funding for the U.S. Agency for Global Media, which oversees VOA. Appropriators in Congress have had other ideas.",T1
247,"It’s not clear how the inquiry into Federal Reserve Chair Jerome Powell was approved, but housing regulator Bill Pulte met with President Donald Trump at Mar-a-Lago, and shared a prop resembling a “wanted poster” he had made up featuring Powell.",T12
248,New York City nurses went on strike over staffing levels and health benefits at key hospitals.,T10
249,"Here are the fastest-growing and fastest-shrinking jobs over the years, based on information from the Census Bureau’s Current Population Survey.",T10
250,The Fed confirmed it received subpoenas related to Senate testimony of the Federal Reserve’s Jerome Powell about renovations to the headquarters.,T12
251,The U.S. housing market recently reached a key milestone that could lead to some easing.,T13
252,"Our first story of 2026 revealed how a destructive new botnet called Kimwolf rapidly grew to infect more than two million devices by mass-compromising a vast number of unofficial Android TV streaming boxes. Today, we'll dig through digital clues left behind by the hackers, network operators, and cybercrime services that appear to have benefitted from Kimwolf's spread.",T0
253,"The story you are reading is a series of scoops nestled inside a far more urgent Internet-wide security advisory. The vulnerability at issue has been exploited for months already, and it's time for a broader awareness of the threat. The short version is that everything you thought you knew about the security of the internal network behind your Internet router probably is now dangerously out of date.",T0
254,"KrebsOnSecurity.com celebrates its 16th anniversary today! A huge ""thank you"" to all of our readers -- newcomers, long-timers and drive-by critics alike. Your engagement this past year here has been tremendous and truly a salve on a handful of dark days. Happily, comeuppance was a strong theme running through our coverage in 2025, with a primary focus on entities that enabled complex and globally-dispersed cybercrime services.",T0
255,"The Trump administration has pursued a staggering range of policy pivots this past year that threaten to weaken the nation’s ability and willingness to address a broad spectrum of technology challenges, from cybersecurity and privacy to countering disinformation, fraud and corruption. These shifts, along with the president’s efforts to restrict free speech and freedom of the press, have come at such a rapid clip that many readers probably aren’t even aware of them all.",T1
256,"Direct navigation -- the act of visiting a website by manually typing a domain name in a web browser -- has never been riskier: A new study finds the vast majority of ""parked"" domains -- mostly expired or dormant domain names, or common misspellings of popular websites -- are now configured to redirect visitors to sites that foist scams and malware.",T0
257,"Microsoft today pushed updates to fix at least 56 security flaws in its Windows operating systems and supported software. This final Patch Tuesday of 2025 tackles one zero-day bug that is already being exploited, as well as two publicly disclosed vulnerabilities.",T0
258,A sprawling academic cheating network turbocharged by Google Ads that has generated nearly $25 million in revenue has curious connections to a Kremlin-connected oligarch whose Russian university builds drones for Russia's war against Ukraine.,T0
259,"China-based phishing groups blamed for non-stop scam SMS messages about a supposed wayward package or unpaid toll fee are promoting a new offering, just in time for the holiday shopping season: Phishing kits for mass-creating fake but convincing e-commerce websites that convert customer payment card data into mobile wallets from Apple and Google. Experts say these same phishing groups also are now using SMS lures that promise unclaimed tax refunds and mobile rewards points.",T5
260,"A prolific cybercriminal group that calls itself ""Scattered LAPSUS$ Hunters"" made headlines regularly this year by stealing data from and publicly mass extorting dozens of major corporations. But the tables seem to have turned somewhat for ""Rey,"" the moniker chosen by the technical operator and public face of the hacker group: Earlier this week, Rey confirmed his real life identity and agreed to an interview after KrebsOnSecurity tracked him down and contacted his father.",T0
261,"On the surface, the Superbox media streaming devices for sale at retailers like BestBuy and Walmart may seem like a steal: They offer unlimited access to more than 2,200 pay-per-view and streaming services like Netflix, ESPN and Hulu, all for a one-time fee of around $400. But security experts warn these TV boxes require intrusive software that forces the user's network to relay Internet traffic for others, traffic that is often tied to cybercrime activity such as advertising fraud and account takeovers.",T1
262,Massive data dump reveals real identities and details of administrators and members of the notorious hacker forum.,T0
263,Researchers detailed a souped-up version of the GoBruteforcer botnet that preys on servers with weak credentials and AI-generated configurations.,T0
264,"No matter what new laws or regulations make the cut for 2026, it's clear that compliance challenges will persist and federal legislation will be limited.",T11
265,"A state-sponsored threat group tracked as &quot;Kimsuky&quot; sent QR-code-filled phishing emails to US and foreign government agencies, NGOs, and academic institutions.",T0
266,Hexnode Moves into Endpoint Security With Hexnode XDR,T0
267,"A total of 91,403 sessions targeted public LLM endpoints to find leaks in organizations' use of AI and map an expanding attack surface.",T0
268,"Deepfakes are becoming more realistic and more popular. Luckily, defenders are still ahead in the arms race.",T1
269,"Cybercriminal cryptocurrency transactions totaled billions in 2025, with activity from sanctioned countries like Russia and Iran causing the largest jump.",T5
270,"The notorious state-sponsored group relies on basic techniques that are highly effective, often delivering greater ROI than more complex malware-heavy operations.",T0
271,The CrowdStrike-SGNL deal underscores how identity security has become a critical component of enterprise cybersecurity as companies add cloud services and deploy AI-driven tools.,T0
272,"Exploitation of CVE-2025-37164 can enable remote code execution on HPE's IT infrastructure management platform, leading to devastating consequences.",T0
273,Threat actors ripped off a legitimate AI-powered Chrome extension in order to harvest ChatGPT and DeepSeek data before sending it to a C2 server.,T0
274,The &quot;ZombieAgent&quot; exploit makes use of ChatGPT's long-term memory and advanced capabilities.,T0
275,Here are the top cloud security trends I'm seeing in my crystal ball for the New Year — particularly arming us for AI adoption.,T0
276,Hackers are attacking a critical zero-day flaw in unsupported D-Link DSL routers to run arbitrary commands.,T0
277,Microsoft said that Office 365 tenants with weak configurations and who don't have strict anti-spoofing protection enabled are especially vulnerable.,T0
278,"Cyber's role in the US raid on Venezuela remains a question, though President Trump alluded to &quot;certain expertise&quot; in shutting down the power grid in Caracas.",T0
279,"Pro-Russian group NoName057(16) uses a custom denial-of-service tool to mobilize volunteers and disrupt government, media, and institutional sites tied to Ukraine and the West.",T0
280,An emerging threat actor that goes by &quot;Zestix&quot; used an assortment of infostealers to obtain credentials and breach file-sharing instances of approximately 50 enterprises.,T0
281,"Scattered Lapsus$ Hunters, also known as ShinyHunters, were drawn in using a realistic, yet mostly fake, dataset.",T0
282,AI Overviews provided false liver test information experts called alarming.,T0
283,New feature will allow users to link medical and wellness records to AI chatbot.,T0
284,Will LLMs ever be able to stamp out the root cause of these attacks? Possibly not.,T0
285,Californians can now submit demands requiring 500 brokers to delete their data.,T5
286,The past year has seen plenty of hacks and outages. Here are the ones topping the list.,T0
287,"In a year where lofty promises collided with inconvenient research, would-be oracles became software tools.",T0
288,"A serious data breach has occurred, but Ars users have nothing to worry about.",T0
289,"GPS jamming has gotten cheap and easy, but there are potential solutions.",T0
290,"From compression tricks to multi-agent teamwork, here's what makes them tick.",T0
291,"New GPT Image 1.5 allows more detailed conversational image editing, for better or worse.",T0
292,"The extensions, available for Chromium browsers, harvest full AI conversations over months.",T0
293,Dictionary codifies the term that took hold in 2024 for low-quality AI-generated content.,T0
294,The weak RC4 for administrative authentication has been a hacker holy grail for decades.,T0
295,"Shenzhen-based Picea Robotics, its lender and primary supplier, will acquire all of iRobot’s shares.",T4
296,"""The vast majority of Codex is built by Codex,"" OpenAI told us about its new AI coding agent writing code.",T0
297,Company claims new AI model tops Gemini and matches humans on 70% of work tasks.,T0
298,"Three-year deal lets users create AI videos of Mickey Mouse, Darth Vader, and more.",T0
299,Company raises its capital expenditure forecast as it doubles down on AI infrastructure bet.,T2
300,"Devstral 2 model scores 72% on industry benchmark, nearing proprietary rivals.",T2
301,“Abandonment” offers rare chance to reclaim one of tech’s most recognized brands.,T4
302,"As ordered reported by the House Committee on Education and Workforce on January 8, 2026",T11
303,"As ordered reported by the House Committee on Foreign Affairs on December 3, 2025",T11
304,"As ordered reported by the House Committee on Foreign Affairs on December 3, 2025",T11
305,"The federal budget deficit totaled $601 billion in the first quarter of fiscal year 2026, the CBO estimates.",T13
306,"CBO provides details about its latest projections of the economy through 2028. Those projections were finalized on December 3, 2025.",T10
307,"As amended by amendment no. 1 and published in the Congressional Record, Vol. 171, No. 191 (November 12, 2025, p. H4668)",T11
308,"Presentation by Eric Labs, an analyst in CBO's National Security Division, at the Bank of America Defense Outlook and Commercial Aerospace Forum 2026.",T1
309,"As posted on the website of the House Committee on Rules on January 5, 2026",T11
310,"In CBO's projections, the U.S. population grows from 349 million people in 2026 to 364 million in 2056, and the average age rises. Starting in 2030, annual deaths exceed annual births, and net immigration accounts for all population growth.",T10
311,"As ordered reported by the House Committee on Oversight and Government Reform on December 2, 2025",T11
312,The Majority Leader of the House of Representatives announces bills that will be considered under suspension of the rules in that chamber. CBO estimates the effects of those bills on direct spending and revenues.,T11
313,CBO provides details about how health insurance spending is measured in the agency's Distribution of Household Income report series.,T13
314,"As reported by the House Committee on Small Business on December 12, 2025",T11
315,"As reported by the Senate Committee on Agriculture, Nutrition, and Forestry on October 27, 2025",T11
316,"As ordered reported by the House Committee on Education and Workforce on September 17, 2025",T11
317,"As ordered reported by the House Committee on Natural Resources on July 23, 2025",T11
318,"As reported by the House Committee on Energy and Commerce on October 3, 2025",T11
319,"As reported by the Senate Committee on Health, Education, Labor, and Pensions on September 8, 2025",T11
320,"As ordered reported by the House Committee on Natural Resources on July 23, 2025",T11
321,"As reported by the House Committee on Energy and Commerce on December 30, 2025",T11
322,"Mortgage loans allow households to buy a home or to borrow money against the value of a home they already own. With mortgage loans, the real estate is offered as collateral, a payback guarantee for the lender. Our FRED graph &#8230; <a href=""https://fredblog.stlouisfed.org/2026/01/what-can-mortgage-loans-do/"">Continue reading <span class=""meta-nav"">&#8594;</span></a>",T9
323,"When the US Census conducts the monthly Current Population Survey on behalf of the Bureau of Labor Statistics (BLS), it asks households more than 200 questions about their employment status. One of those questions is “Do you currently want a &#8230; <a href=""https://fredblog.stlouisfed.org/2026/01/who-wants-a-job-now/"">Continue reading <span class=""meta-nav"">&#8594;</span></a>",T10
