id,text,topic_id
373,"<p>※この記事は自動翻訳されています。正確な内容につきましては原文をご参照ください。 要約 主に東南アジアを拠点とする人身売買の疑いがあるサービスへの暗号資産の資金フローは、2025年に85%増加し、特定されたサービス全体で数億ドル規模に達しました。 Telegramベースの「インターナショナルエスコート」サービスは、中国語圏のマネーロンダリングネットワーク（CMLN）や担保プラットフォームと高度に統合されており、トランザクションの約半数が10,000ドルを超えています。 分析により、東南アジアの人身売買組織のグローバルな展開が明らかになり、南北アメリカ、ヨーロッパ、オーストラリアなど各地から多額の暗号資産が流入しています。 児童性的虐待コンテンツ（CSAM）ネットワークはサブスクリプション型モデルへと進化し、サディスティックなオンライン過激主義（SOE）コミュニティとの重複が増加しています。また、米国のインフラを戦略的に利用している点は、高度な運営計画を示唆しています。 現金取引とは異なり、暗号資産が本質的に持つ透明性は、法執行機関やコンプライアンスチームが人身売買の活動を検知、追跡、阻止するための前例のない機会を生み出しています。 暗号資産と人身売買の疑いがある活動の交差は2025年にさらに深刻化し、特定されたサービス全体のトランザクション総額は数億ドルに達し、前年比（YoY）85%の増加となりました。この金額は、これらの犯罪がもたらす人的被害を大幅に過小評価しています。真のコストは、送金された金額ではなく、影響を受けた人々の命で測られるべきものです。 人身売買の疑いがあるサービスへの暗号資産の資金フローの急増は、孤立した現象ではなく、東南アジアを拠点とする詐欺コンパウンド、オンラインカジノやギャンブルサイト、そして主にTelegramを通じて運営される中国語圏のマネーロンダリング（CMLN）および担保ネットワークの成長と密接に連動しています。これらすべてが、グローバルな影響力を持つ急速に拡大する現地の不正エコシステムを形成しています。痕跡を残さない現金取引とは異なり、ブロックチェーン技術の透明性は、これらの活動に対する前例のない可視性を提供し、従来の決済手段では不可能であった検知と阻止のための独自の機会を生み出しています。 当社の分析では、暗号資産を利用した人身売買の疑いがある活動を以下の4つの主要カテゴリに分類して追跡しています。 「インターナショナルエスコート」サービス：人身売買の疑いがあるTelegramベースのサービス 「労働者斡旋」エージェント：詐欺コンパウンドへの誘拐や強制労働を仲介するTelegramベースのサービス 売春ネットワーク：搾取的な性的サービスネットワークの疑いがあるもの 児童性的虐待コンテンツ（CSAM）の販売者：CSAM",T7
374,"<p>TL;DR Cryptocurrency flows to suspected human trafficking services, largely based in Southeast Asia, grew 85% in 2025, reaching a scale&#8230;</p>
<p>The post <a href=""https://www.chainalysis.com/blog/crypto-human-trafficking-2026/"">Cryptocurrency Flows to Suspected Human Trafficking Services Surge 85% Year-over-Year</a> appeared first on <a href=""https://www.chainalysis.com"">Chainalysis</a>.</p>",T12
375,"<p>Chainalysis is excited to announce upgraded support for Stellar, one of the longest-running blockchains in the ecosystem. Founded in 2014,&#8230;</p>
<p>The post <a href=""https://www.chainalysis.com/blog/stellar-automatic-token-support-february-2026/"">Chainalysis Upgrades Support for Stellar with Automatic Token Support</a> appeared first on <a href=""https://www.chainalysis.com"">Chainalysis</a>.</p>",T12
376,"<p>We’re excited to announce that MegaETH builders can now access Hexagate, the Chainalysis Web3 security solution that delivers real-time threat&#8230;</p>
<p>The post <a href=""https://www.chainalysis.com/blog/hexagate-supports-megaeth-ecosystem-smart-contract-security/"">Chainalysis Hexagate Supports MegaETH Ecosystem with Real-Time Smart Contract Security Detection</a> appeared first on <a href=""https://www.chainalysis.com"">Chainalysis</a>.</p>",T14
377,"<p>Crypto doesn’t wait for your next scheduled course Crypto and crime are moving faster than most training programs can keep&#8230;</p>
<p>The post <a href=""https://www.chainalysis.com/blog/new-chainalysis-academy-2026/"">Meet the New Chainalysis Academy: Where Learning Becomes Mastery</a> appeared first on <a href=""https://www.chainalysis.com"">Chainalysis</a>.</p>",T12
378,"<p>This week, Chainalysis welcomes Sebastien Giroux as the company’s Chief Financial Officer. As a key member of the leadership team,&#8230;</p>
<p>The post <a href=""https://www.chainalysis.com/blog/sebastien-giroux-cfo-chainalysis/"">Sebastien Giroux Joins Chainalysis as Chief Financial Officer</a> appeared first on <a href=""https://www.chainalysis.com"">Chainalysis</a>.</p>",T14
379,"<p>Stablecoins are no longer a theoretical innovation. They are now operating as production-grade financial infrastructure, supporting real-time settlement, cross-border payments,&#8230;</p>
<p>The post <a href=""https://www.chainalysis.com/blog/stablecoins-issuing-partnering-integrating/"">How Banks Should Engage with Stablecoins: Issue, Partner, or Integrate</a> appeared first on <a href=""https://www.chainalysis.com"">Chainalysis</a>.</p>",T11
380,"<p>TL;DR OFAC designated two UK-registered crypto exchanges, Zedcex and Zedxion, for operating in Iran&#8217;s financial sector and processing cryptocurrency transactions&#8230;</p>
<p>The post <a href=""https://www.chainalysis.com/blog/ofac-designates-iranian-crypto-exchanges-january-2026/"">OFAC Designates Iranian-Linked Crypto Exchanges in First-Ever Action Targeting Digital Asset Firms in Iran’s Financial Sector</a> appeared first on <a href=""https://www.chainalysis.com"">Chainalysis</a>.</p>",T12
381,"<p>The fight over CLARITY has always been sold as a battle for rules, a way to finally give the U.S. crypto market a clean lane to run in. That story still matters. The past week made something else clearer: the legislation is becoming a proxy war over who gets to pay Americans for holding digital [&#8230;]</p>
<p>The post <a href=""https://cryptoslate.com/clarity-act-is-turning-into-a-proxy-war-over-who-pays-americans-for-holding-digital-dollars/"">CLARITY Act is turning into a proxy war over who pays Americans for holding “digital dollars”</a> appeared first on <a href=""https://cryptoslate.com"">CryptoSlate</a>.</p>",T11
382,"<p>Tokenized US Treasuries are close to $11 billion, but the chain war is shifting from issuance to distribution and utility. Where yield tokens actually sit, how often they move, and whether they plug into stablecoin settlement and collateral workflows are what matters. Last week, XRP Ledger (XRPL) got two signals that it's trying to matter [&#8230;]</p>
<p>The post <a href=""https://cryptoslate.com/xrpl-holds-63-of-this-t-bill-token-supply-but-barely-any-of-the-trading-and-thats-a-problem/"">XRPL holds 63% of this T-bill token supply but barely any of the trading, and that’s a problem</a> appeared first on <a href=""https://cryptoslate.com"">CryptoSlate</a>.</p>",T11
383,"<p>Cboe wants to bring back all-or-nothing options, a contract that pays a fixed amount if a condition is met and pays zero if it isn't. While that might sound like a small product refresh, the timing makes it hard to ignore. Prediction markets have trained a new retail reflex: turn a belief into a number [&#8230;]</p>
<p>The post <a href=""https://cryptoslate.com/cboe-wants-yes-no-options-back-can-wall-street-sell-odds/"">Wall Street is desperate to copy crypto&#8217;s prediction markets as Cboe files for “Yes/No” options</a> appeared first on <a href=""https://cryptoslate.com"">CryptoSlate</a>.</p>",T5
384,"<p>Bitcoin’s February drop to about $60,000 was the kind of single-day panic people will remember as a bottom. But the more accurate reading of this washout is harder and more useful: this cycle quit in stages, and the sellers rotated. A Feb. 10 report from Checkonchain framed the move as a capitulation event that arrived [&#8230;]</p>
<p>The post <a href=""https://cryptoslate.com/bitcoin-hit-60000-because-two-different-groups-finally-surrendered-on-chain-data-shows-who-blinked/"">Bitcoin hit $60,000 because two different groups finally surrendered — on-chain data shows who blinked</a> appeared first on <a href=""https://cryptoslate.com"">CryptoSlate</a>.</p>",T5
385,"<p>Crypto winter has a branding problem. The phrase makes it sound like the chain goes quiet, wallets stop moving, and the whole machine turns cold. However, the cleanest proof of retail pulling back rarely lives on-chain. The people who vanish first aren’t the power users bridging stables into DeFi or the long-term holders shuffling coins [&#8230;]</p>
<p>The post <a href=""https://cryptoslate.com/crypto-winter-shows-up-in-broker-earnings-not-on-chain/"">Robinhood’s $221 million crypto revenue drop shows crypto winter isn’t on chain and retail already moved</a> appeared first on <a href=""https://cryptoslate.com"">CryptoSlate</a>.</p>",T11
386,"<p>Bitcoin derivative traders are increasingly positioning for further downside rather than a clean bounce as the leading cryptocurrency continues to trade in a tight range below $70,000. According to CryptoSlate's data, BTC price bottomed at $65,092 during the last 24 hours but has since recovered to $66,947 as of press time. This continues a weeklong [&#8230;]</p>
<p>The post <a href=""https://cryptoslate.com/bitcoin-has-three-paths-next-and-derivatives-traders-are-loading-up-on-the-one-that-hurts-the-most-people/"">Bitcoin shorts just hit their most extreme level in years as BTC defiantly holds above $70k</a> appeared first on <a href=""https://cryptoslate.com"">CryptoSlate</a>.</p>",T5
387,"<p>On Feb. 12, RippleX, Ripple's development arm, announced that Token Escrow is now live on the XRP Ledger’s (XRPL) mainnet. The change, labeled Token Escrow (XLS-85), extends conditional locking and release to trustline-based tokens (IOUs) and Multi-Purpose Tokens (MPTs). This expands the network’s escrow function beyond XRP to cover issued assets used for stablecoins and [&#8230;]</p>
<p>The post <a href=""https://cryptoslate.com/xrpls-token-escrow-targets-regulatory-friendly-blockchain-use/"">Token Escrow on XRPL could force new XRP demand, but only if this adoption hurdle breaks</a> appeared first on <a href=""https://cryptoslate.com"">CryptoSlate</a>.</p>",T11
388,"<p>Gold back over $5,000 is a market tell: fear is back. Tether just paid $150 million for the last mile. By taking ~12% of Gold.com and integrating XAU₮, Tether is buying distribution, so a USDT holder can reach for gold without leaving the crypto payment loop Gold is trading above $5,000 an ounce again, and [&#8230;]</p>
<p>The post <a href=""https://cryptoslate.com/tether-150m-gold-com-deal-aims-to-make-tokenized-gold-a-mainstream-hedge/"">Tether quietly stacked 27 tons of gold, now it’s wiring $150M to sell it to crypto users</a> appeared first on <a href=""https://cryptoslate.com"">CryptoSlate</a>.</p>",T11
389,"<p>Bitcoin’s slide toward $60,000 came with the usual noise from exchanges, but the sheer size of the panic was evident somewhere else. Options tied to BlackRock’s iShares Bitcoin Trust (IBIT) traded about 2.33 million contracts in a single trading day, a record that arrived right as price was at its most unstable. At the same [&#8230;]</p>
<p>The post <a href=""https://cryptoslate.com/this-is-what-wall-street-crypto-looks-like-ibit-options-went-vertical-as-bitcoin-hit-60k-intraday/"">This is what “Wall Street crypto” looks like: IBIT options went vertical as Bitcoin hit $60k intraday</a> appeared first on <a href=""https://cryptoslate.com"">CryptoSlate</a>.</p>",T5
390,"<p>Within a span of weeks in early 2026, a cluster of senior crypto operators announced they were stepping back or switching domains. Akshay BD, who spent five years building Solana's ecosystem, posted a &#8220;life update&#8221; saying he was &#8220;grateful to pass the torch.&#8221; Anthony Rose, a zkSync executive, announced he was &#8220;moving on&#8221; after four [&#8230;]</p>
<p>The post <a href=""https://cryptoslate.com/crypto-enters-a-16-day-danger-zone-as-top-crypto-operators-rotate-into-ai/"">Bitcoin is at risk of a talent drain because AI just created 1.3 million jobs</a> appeared first on <a href=""https://cryptoslate.com"">CryptoSlate</a>.</p>",T12
391,"<p style=""float: right; margin: 0 0 10px 15px; width: 240px;""><img alt=""Binance denies report on Iran-linked sanctions breaches and investigator firings"" class=""type:primaryImage"" src=""https://images.cointelegraph.com/images/528_aHR0cHM6Ly9zMy5jb2ludGVsZWdyYXBoLmNvbS91cGxvYWRzLzIwMjYtMDIvMDE5YzY1YWItMzI3Yy03OTRkLTlmOTgtYjQ0ZjJmMTNiMDFjLmpwZw==.jpg"" /></p><p>Binance said an internal review with external counsel found no sanctions violations and that it continues to meet its regulatory obligations under monitoring and oversight.</p>",T12
392,"<p style=""float: right; margin: 0 0 10px 15px; width: 240px;""><img alt=""$75K or bearish 'regime shift?' Five things to know in Bitcoin this week"" class=""type:primaryImage"" src=""https://images.cointelegraph.com/images/528_aHR0cHM6Ly9zMy5jb2ludGVsZWdyYXBoLmNvbS91cGxvYWRzLzIwMjUtMTIvMDE5YjAyZGUtMzhjZi03OWFlLWEwMjAtNmY5N2RjOTFmZTdk.jpg"" /></p><p>Bitcoin market analysis focused on liquidations and the wick to $59,000 for signs of the next significant BTC price move on lower time frames.</p>",T5
393,"<p style=""float: right; margin: 0 0 10px 15px; width: 240px;""><img alt=""Crypto funds log fourth week of outflows at $173M as BTC dips below $70K"" class=""type:primaryImage"" src=""https://images.cointelegraph.com/images/528_aHR0cHM6Ly9zMy5jb2ludGVsZWdyYXBoLmNvbS91cGxvYWRzLzIwMjYtMDIvMDE5YzY1YzYtNDliOS03MWY5LWFmNjMtNGZkYTc1YTkxMjExLmpwZw==.jpg"" /></p><p>Crypto funds saw $173 million outflows last week as Bitcoin and Ether slipped, while XRP and Solana bucked the trend across global markets.</p>",T5
394,"<p style=""float: right; margin: 0 0 10px 15px; width: 240px;""><img alt=""Willy Woo warns quantum risk is eroding Bitcoin’s edge over gold"" class=""type:primaryImage"" src=""https://images.cointelegraph.com/images/528_aHR0cHM6Ly9zMy5jb2ludGVsZWdyYXBoLmNvbS91cGxvYWRzLzIwMjYtMDIvMDE5YzNmNDEtNzU1MS03ZjlhLTgyNmUtNjUxNmU5NTA1YmEwLmpwZw==.jpg"" /></p><p>Onchain analyst Willy Woo says markets are starting to price in the quantum threat, putting 4 million “lost” BTC and a 12‑year valuation uptrend versus gold into question.</p>",T5
395,"<p style=""float: right; margin: 0 0 10px 15px; width: 240px;""><img alt=""OKX secures EU payment license to expand stablecoin services"" class=""type:primaryImage"" src=""https://images.cointelegraph.com/images/528_aHR0cHM6Ly9zMy5jb2ludGVsZWdyYXBoLmNvbS91cGxvYWRzLzIwMjYtMDIvMDE5YzY1OGYtYTU2Ni03Y2I3LWIyOTgtMDVjZjI0YzFiNWJkLmpwZw==.jpg"" /></p><p>OKX secured a Malta payment institution license to support EU-compliant stablecoin services, including OKX Pay and the OKX Card.</p>",T12
396,"<p style=""float: right; margin: 0 0 10px 15px; width: 240px;""><img alt=""Animoca Brands secures Dubai crypto license to expand services in Middle East"" class=""type:primaryImage"" src=""https://images.cointelegraph.com/images/528_aHR0cHM6Ly9zMy5jb2ludGVsZWdyYXBoLmNvbS91cGxvYWRzLzIwMjYtMDIvMDE5YzY1NGQtMjdkOS03Mzc5LThkZWUtMjhkZmFjODg0YWM0LmpwZw==.jpg"" /></p><p>Dubai’s regulator approved the license on Feb. 5, allowing Animoca Brands to target institutional and qualified investors under the oversight of Dubai’s VARA.</p>",T12
397,"<p style=""float: right; margin: 0 0 10px 15px; width: 240px;""><img alt=""Bitcoin down 22%, could it be the worst Q1 since 2018?"" class=""type:primaryImage"" src=""https://images.cointelegraph.com/images/528_aHR0cHM6Ly9zMy5jb2ludGVsZWdyYXBoLmNvbS91cGxvYWRzLzIwMjYtMDEvMDE5YzBkMGUtZWRlNC03ZDNkLWE1NGEtM2I1OGI1ZDRiNGVkLmpwZw==.jpg"" /></p><p>If Bitcoin posts a loss at the end of this month, it will also mark Bitcoin’s first time ending both January and February in the red.</p>",T5
398,"<p style=""float: right; margin: 0 0 10px 15px; width: 240px;""><img alt=""Russians move $129B in crypto yearly ‘outside our attention’: Official"" class=""type:primaryImage"" src=""https://images.cointelegraph.com/images/528_aHR0cHM6Ly9zMy5jb2ludGVsZWdyYXBoLmNvbS91cGxvYWRzLzIwMjYtMDIvMDE5YzY0ODktNjEwNS03MWMyLWFiYmItNDdjMmJlNTAwMmUxLmpwZw==.jpg"" /></p><p>Russia’s deputy finance minister says around 50 billion rubles worth of crypto changes hands daily, calling for crypto market regulation. </p>",T5
399,"<p style=""float: right; margin: 0 0 10px 15px; width: 240px;""><img alt=""Kevin O’Leary wins $2.8M defamation suit against Ben Armstrong"" class=""type:primaryImage"" src=""https://images.cointelegraph.com/images/528_aHR0cHM6Ly9zMy5jb2ludGVsZWdyYXBoLmNvbS91cGxvYWRzLzIwMjYtMDIvMDE5YzY0NjAtOWExNy03MmViLWFlMGUtODE3YTdiZWMxMDcwLmpwZw==.jpg"" /></p><p>A Miami federal judge has entered a default judgment against Ben Armstrong, who failed to respond to Kevin O’Leary’s complaint accusing him of defamation.</p>",T7
400,"<p style=""float: right; margin: 0 0 10px 15px; width: 240px;""><img alt=""Aave founder pitches $50T ‘abundance asset’ boom to drive DeFi"" class=""type:primaryImage"" src=""https://images.cointelegraph.com/images/528_aHR0cHM6Ly9zMy5jb2ludGVsZWdyYXBoLmNvbS91cGxvYWRzLzIwMjYtMDIvMDE5YzY0M2QtZmFmNS03NDg2LTgxYTQtY2VhMmM0OTNjNWM1LmpwZw==.jpg"" /></p><p>Aave Labs CEO Stani Kulechov said onchain lending could help accelerate the development of solar, energy storage and robotics by putting money behind “future-proof” assets.</p>",T12
401,"<p style=""float: right; margin: 0 0 10px 15px; width: 240px;""><img alt=""Strategy to equitize convertible debt over 3-6 years: Saylor"" class=""type:primaryImage"" src=""https://images.cointelegraph.com/images/528_aHR0cHM6Ly9zMy5jb2ludGVsZWdyYXBoLmNvbS91cGxvYWRzLzIwMjYtMDIvMDE5YzY0NGUtZDk2Yy03ZjVjLWFmNTctZGY5MGQxMTY0YzdiLmpwZw==.jpg"" /></p><p>The world’s largest digital asset treasury plans to convert $6 billion in bond debt to equity, claiming that it could survive an 88% Bitcoin crash.</p>",T12
402,"<p style=""float: right; margin: 0 0 10px 15px; width: 240px;""><img alt=""Grayscale seeks to convert Aave trust into ETF on NYSE Arca"" class=""type:primaryImage"" src=""https://images.cointelegraph.com/images/528_aHR0cHM6Ly9zMy5jb2ludGVsZWdyYXBoLmNvbS91cGxvYWRzLzIwMjYtMDIvMDE5YzYzODMtOWZhNy03ZmJiLWE5N2YtMmJlOWY1NzRjOWViLmpwZw==.jpg"" /></p><p>Grayscale joins Bitwise in filing to launch a standalone Aave product in the US, betting that Wall Street has retained its appetite for altcoins.</p>",T12
403,"<p style=""float: right; margin: 0 0 10px 15px; width: 240px;""><img alt=""TradFi giant Apollo enters crypto lending  arena via Morpho deal"" class=""type:primaryImage"" src=""https://images.cointelegraph.com/images/528_aHR0cHM6Ly9zMy5jb2ludGVsZWdyYXBoLmNvbS91cGxvYWRzLzIwMjYtMDIvMDE5YzYzODgtNTRiMC03MzhiLWIzNTYtNDM1ODQ3YTYyYWZkLmpwZw==.jpg"" /></p><p>The $940 billion asset manager will collaborate on DeFi lending infrastructure and could acquire up to 90 million MORPHO tokens. </p>",T12
404,"<p style=""float: right; margin: 0 0 10px 15px; width: 240px;""><img alt=""Solution worse than problem? Adam Back opposes BIP-110 Ordinals fix"" class=""type:primaryImage"" src=""https://images.cointelegraph.com/images/528_aHR0cHM6Ly9zMy5jb2ludGVsZWdyYXBoLmNvbS91cGxvYWRzLzIwMjYtMDIvMDE5YzYzNTAtZWMyOC03NzExLTllZTMtNzBkNGNkNGMwMThhLmpwZw==.jpg"" /></p><p>Blockstream’s  Adam Back said BIP-110 could be used to freeze user funds, but the proposal’s creator argues that safeguards are in place to prevent that.</p>",T12
405,"<p style=""float: right; margin: 0 0 10px 15px; width: 240px;""><img alt=""CZ says lack of onchain privacy is holding back crypto payments"" class=""type:primaryImage"" src=""https://images.cointelegraph.com/images/528_aHR0cHM6Ly9zMy5jb2ludGVsZWdyYXBoLmNvbS91cGxvYWRzLzIwMjYtMDIvMDE5YzYyY2YtODAwMi03ZjcyLThlOTEtNzg1NzQ3YzI1ZTQ5LmpwZw==.jpg"" /></p><p>Transparency, which is a hallmark feature of most cryptocurrencies, is likely one of the biggest hurdles to mass adoption, the Binance founder said.</p>",T12
406,"<p style=""float: right; margin: 0 0 10px 15px; width: 240px;""><img alt=""Michael Saylor signals another Bitcoin buy amid market rout"" class=""type:primaryImage"" src=""https://images.cointelegraph.com/images/528_aHR0cHM6Ly9zMy5jb2ludGVsZWdyYXBoLmNvbS91cGxvYWRzLzIwMjUtMTIvMDE5YWZmOTctOTNhYS03YTA1LTg1NGQtZjVmNmVmNTQ5OGNm.jpg"" /></p><p>The purchase will mark week 12 of consecutive buys by Strategy, which continues accumulating BTC despite a sharp decline in the company's stock price.</p>",T5
407,"<p style=""float: right; margin: 0 0 10px 15px; width: 240px;""><img alt=""Here’s what happened in crypto today"" class=""type:primaryImage"" src=""https://images.cointelegraph.com/images/528_aHR0cHM6Ly9zMy5jb2ludGVsZWdyYXBoLmNvbS91cGxvYWRzLzIwMjYtMDIvMDE5YzY1OTItMjUzZC03YjkzLWE5MGEtM2RkOWYzOGM1MTYyLmpwZw==.jpg"" /></p><p>Need to know what happened in crypto today? Here is the latest news on daily trends and events impacting Bitcoin price, blockchain, DeFi, NFTs, Web3 and crypto regulation.</p>",T5
408,"<p style=""float: right; margin: 0 0 10px 15px; width: 240px;""><img alt=""Study suggests WLFI could act as an ‘early warning signal’ in crypto"" class=""type:primaryImage"" src=""https://images.cointelegraph.com/images/528_aHR0cHM6Ly9zMy5jb2ludGVsZWdyYXBoLmNvbS91cGxvYWRzLzIwMjYtMDEvMDE5YmRiMTctYzBiMC03ZmJlLTgwNWUtYThhODhhZDJjYjRjLmpwZw==.jpg"" /></p><p>Trump-linked WLFI dropped more than five hours before a $6.9 billion crypto liquidation event, raising questions about early market stress signals.</p>",T5
409,"<p style=""float: right; margin: 0 0 10px 15px; width: 240px;""><img alt=""Mirae Asset agrees to buy 92% stake in Korean exchange Korbit for $93M"" class=""type:primaryImage"" src=""https://images.cointelegraph.com/images/528_aHR0cHM6Ly9zMy5jb2ludGVsZWdyYXBoLmNvbS91cGxvYWRzLzIwMjYtMDIvMDE5YzYwYzYtMGI0OC03MTUyLWJiNDMtZjM0Mjc1M2NlMDVjLmpwZw==.jpg"" /></p><p>Mirae Asset Consulting agreed to acquire a 92.06% controlling stake in South Korean crypto exchange Korbit for about $93 million in cash.</p>",T12
410,"<p style=""float: right; margin: 0 0 10px 15px; width: 240px;""><img alt=""Senators ask Bessent to probe $500M UAE stake in Trump-linked WLFI"" class=""type:primaryImage"" src=""https://images.cointelegraph.com/images/528_aHR0cHM6Ly9zMy5jb2ludGVsZWdyYXBoLmNvbS91cGxvYWRzLzIwMjYtMDIvMDE5YzYwNzAtNzkyYy03NDQyLWIyYjAtZWNhZTBkOTU0OTc1LmpwZw==.jpg"" /></p><p>Elizabeth Warren and Andy Kim call on Treasury’s Scott Bessent to review a UAE-backed investment in the Trump-linked crypto firm over national security concerns.</p>",T12
