id,text,topic_id
388,"<p>Chainalysis, the blockchain data platform, today announced an extension of its partnership with long-time customer and partner, BVNK, to integrate&#8230;</p>
<p>The post <a href=""https://www.chainalysis.com/blog/bvnk-partnership-powering-compliance-self-hosted-digital-asset-payments/"">Chainalysis and BVNK Extend Partnership to Power Compliance in Self-Hosted Digital Asset Payments</a> appeared first on <a href=""https://www.chainalysis.com"">Chainalysis</a>.</p>",T7
389,"<p>TL;DR We estimate $17B was stolen in crypto scams and fraud in 2025 — as impersonation scams show massive 1400%&#8230;</p>
<p>The post <a href=""https://www.chainalysis.com/blog/crypto-scams-2026/"">Record $17 Billion Estimated Stolen in Crypto Scams and Fraud in 2025 as Impersonation Tactics and AI Enablement Surge</a> appeared first on <a href=""https://www.chainalysis.com"">Chainalysis</a>.</p>",T6
390,"<p>※この記事は自動翻訳されています。正確な内容につきましては原文をご参照ください。 2025年、暗号資産分野で国家主導の活動が顕著に増加し、不正なオンチェーン・エコシステム成熟の新たな段階を迎えました。ここ数年で暗号資産犯罪の状況はますますプロフェッショナル化しており、不正組織は現在、国際的な犯罪ネットワークが商品やサービスを調達し、不正に得た暗号資産を洗浄するための大規模なオンチェーンインフラを運営しています。こうした状況を背景に、国家も同じプロフェッショナルなサービス事業者を利用したり、制裁回避のために独自インフラを構築したりして、この領域へ参入しています。サイバー犯罪者や組織犯罪グループ向けに構築された不正な暗号資産サプライチェーンに国家が加わることで、行政機関やコンプライアンス・セキュリティチームは、消費者保護と国家安全保障の両面でこれまでになく重大なリスクに直面しています。 これらの現象やその他の動向はオンチェーン上でどのように表れているのでしょうか？データと全体的なトレンドを見ていきましょう。 当社のデータによると、不正な暗号資産アドレスが2025年に受け取った金額は少なくとも1,540億ドルに達しました。これは前年比で162%の増加であり、主に制裁対象となった主体が受け取った金額の694%という劇的な増加が要因です。仮に制裁対象の受領額が前年と同水準だった場合でも、2025年は暗号資産犯罪の記録的な年となるほど、ほぼ全ての不正カテゴリで活動が増加しました。この数字は、現時点で特定できている不正アドレスに基づいた下限値であることを必ずご留意ください。[1] これら不正取引量は、依然として暗号資産経済全体（主に正規取引）と比べて小規模です。全暗号資産取引量に占める不正取引の割合は2024年からわずかに増加しましたが、1%未満にとどまっています。[2] また、暗号資産犯罪で利用されるアセットの種類にも継続的な変化が見られます。下図のチャートをご参照ください。 ここ数年、ステーブルコインが不正取引の大半を占めており、現在では不正取引ボリューム全体の84%を占めています。これは、ステーブルコインが持つ実用的な利点（国境を越えた送金の容易さ、低いボラティリティ、広い用途）により、暗号資産エコシステム全体でも利用が拡大しているトレンドと一致しています。 以下では、2025年の暗号資産犯罪を特徴づけ、今後も注目すべき4つの主要トレンドを詳しく見ていきます。 国家主導型脅威による過去最高の取引量：北朝鮮による過去最大規模の窃盗、ロシアのA7A5トークンによる大規模制裁回避 2025年も盗難資金はエコシステムにとって大きな脅威であり、北朝鮮関連のハッカーだけで20億ドルを盗み出しました。特に2月のBybitへの攻撃は、暗号資産史上最大のデジタル強奪事件となり、",T4
391,"<p>In 2025, we tracked a notable rise in nation-state activity in crypto, marking the latest phase in the maturation of&#8230;</p>
<p>The post <a href=""https://www.chainalysis.com/blog/2026-crypto-crime-report-introduction/"">Crypto Crime Reaches Record High in 2025 as Nation‑State Sanctions Evasion Moves On‑Chain at Scale</a> appeared first on <a href=""https://www.chainalysis.com"">Chainalysis</a>.</p>",T6
392,"<p>TL;DR Perpetual futures are cryptocurrency derivatives that have no expiration date and use funding rates to keep prices aligned with&#8230;</p>
<p>The post <a href=""https://www.chainalysis.com/blog/perpetual-futures/"">An Introduction to Perpetual Futures</a> appeared first on <a href=""https://www.chainalysis.com"">Chainalysis</a>.</p>",T7
393,"<p>In the last year alone, IRS-CI identified more than $10 billion in financial crime, executed over 1400 warrants, seized hundreds&#8230;</p>
<p>The post <a href=""https://www.chainalysis.com/blog/how-irs-ci-follows-the-crypto-ep-176/"">How IRS-CI Follows The Crypto: Podcast Ep. 176</a> appeared first on <a href=""https://www.chainalysis.com"">Chainalysis</a>.</p>",T6
394,"<p>※この記事は自動翻訳されています。正確な内容につきましては原文をご参照ください。 暗号資産に関する規制の動きを追っていると、2024年12月の状況が、すでにかなり前のことのように感じられます。たった12か月前と比べても、現在の世界全体の政策環境は大きく変化しました。変化のスピードは非常に速く、その勢いが弱まる兆しはほとんどありません。 そこで2026年に入る前に、2025年に起きた主な規制の変更点を振り返ります。グローバル全体の流れ、地域ごとの動き、そして2026年に特に注目されるトピックについて整理します。より詳しい背景や分析は、チェイナリシス Road to Crypto Regulation シリーズと2025 Geography of Cryptocurrency Reportをご覧ください。 世界の視点から見る、デジタル資産政策「5つの大きな流れ」 1. 規制導入の進捗と、運用段階での摩擦・課題 ここ数年、各国・地域で、デジタル資産を対象とする包括的な規制枠組みの整備が進んできました。進み具合に差はあったものの、全体としては大きな前進が見られました。ただし、その進展は国や地域により不均一でした。 2025年になり、「法律を作る段階」から「実際に運用・実装する段階」に移行すると、その実装プロセス自体が、立法（法律を作ること）と同じくらい、政治的にも実務的にも複雑であることが明らかになりました。 EU ではMiCA（Markets in&#8230;</p>
<p>The post <a href=""https://www.chainalysis.com/blog/2025-crypto-regulatory-round-up-japanese/"">2025年暗号資産規制の総括と今後の論点</a> appeared first on <a href=""https://www.chainalysis.com"">Chainalysis</a>.</p>",T4
395,"<p>Bitcoin miners entered early 2026 in a familiar but increasingly unforgiving setup: network hashrate is slipping from late-2025 highs, difficulty is adjusting on a delay, and power costs remain the hard constraint that decides which fleets stay online and which go dark. The result is a market that can look resilient on the surface, especially [&#8230;]</p>
<p>The post <a href=""https://cryptoslate.com/bitcoins-hashrate-continues-to-fall-as-this-price-spike-doesnt-convince-miners-to-turn-machines-back-on/"">Bitcoin&#8217;s hashrate continues to fall as the price spike doesn&#8217;t convince miners to turn machines back on</a> appeared first on <a href=""https://cryptoslate.com"">CryptoSlate</a>.</p>",T0
396,"<p>The era of the crypto industry being seen as a two-asset town is officially over at the world’s largest derivatives marketplace. On Jan. 15, CME Group announced plans to launch futures contracts for Cardano (ADA), Chainlink (LINK), and Stellar (XLM) on Feb. 9, pending regulatory review. This move represents a calculated signal from the Chicago-based [&#8230;]</p>
<p>The post <a href=""https://cryptoslate.com/cmes-bold-bet-on-cardano-chainlink-and-stellar-futures/"">Crypto futures legitimized by CME with Cardano, Chainlink, and Stellar addition, but retail traders face a massive catch</a> appeared first on <a href=""https://cryptoslate.com"">CryptoSlate</a>.</p>",T7
397,"<p>The US crypto industry believed it stood on the precipice of securing the regulatory legitimacy it has pursued for a decade, but the political ground has suddenly shifted beneath it. On Jan. 14, Sen. Tim Scott, the chair of the Senate Banking Committee, postponed a vote on the Digital Asset Market Clarity Act. This delay [&#8230;]</p>
<p>The post <a href=""https://cryptoslate.com/coinbase-veto-clarity-act-crypto-regulation-delay/"">The US government just caved to a crypto exchange pulling support for legislation that changes everything for investors</a> appeared first on <a href=""https://cryptoslate.com"">CryptoSlate</a>.</p>",T7
398,"<p>The consensus that Bitcoin has matured into “digital gold” faces a new fracture line on Wall Street, one that has little to do with daily price volatility and everything to do with the distant future of computing. Two prominent strategists named Wood are currently offering diametrically opposed roadmaps to global allocators for the world’s largest [&#8230;]</p>
<p>The post <a href=""https://cryptoslate.com/bitcoins-quantum-death-sentence-is-causing-a-wall-street-rift-but-the-fix-is-already-hidden-in-the-code/"">Bitcoin’s &#8220;quantum&#8221; death sentence is causing a Wall Street rift, but the fix is already hidden in the code</a> appeared first on <a href=""https://cryptoslate.com"">CryptoSlate</a>.</p>",T0
399,"<p>Bitcoin developer, Jameson Lopp, posted a simple observation days after CoinGecko published its 2025 dead coins report. The timing crystallized a tension that's shaped crypto since the first Bitcoin fork. Token issuance has always been abundant, as spinning up a new coin takes minutes, not months. But CoinGecko's latest dataset turned the &#8220;anyone can launch&#8221; [&#8230;]</p>
<p>The post <a href=""https://cryptoslate.com/why-a-record-13m-crypto-projects-are-now-dead-as-bitcoin-critics-still-claim-anyone-can-launch-a-token/"">Why a record 13M crypto projects are now dead as Bitcoin critics still claim “anyone can launch a token”</a> appeared first on <a href=""https://cryptoslate.com"">CryptoSlate</a>.</p>",T0
400,"<p>Copper hit a new record high this week as crypto traders focused on the surge in silver and gold. However, copper's rise could actually shift the rate path that underpins the market’s liquidity narrative. The all-time high for copper is now around $6.06 per pound as of Wednesday, Jan. 14. Futures activity has tracked the [&#8230;]</p>
<p>The post <a href=""https://cryptoslate.com/forget-silver-coppers-ai-fueled-explosion-exposes-a-higher-for-longer-trap-that-most-crypto-traders-are-ignoring/"">Forget silver, Copper’s AI-fueled explosion exposes a &#8220;higher for longer&#8221; trap that most crypto traders are ignoring</a> appeared first on <a href=""https://cryptoslate.com"">CryptoSlate</a>.</p>",T0
401,"<p>Bitcoin (BTC) nearly touched $98,000 overnight before settling around $96,000, up roughly 5.5% over recent sessions. The rally reignited a familiar question: is this the setup for a sustained move above $100,000, or another fragile push built on thin order books and positioning games? Glassnode's latest analysis reveals a nuanced picture, where mechanical positioning drove [&#8230;]</p>
<p>The post <a href=""https://cryptoslate.com/bitcoin-nearly-touched-98k-but-an-order-book-signal-suggests-the-move-to-100k-might-backfire/"">Bitcoin just touched a critical price point but this order book signal suggests the move to $100k might backfire</a> appeared first on <a href=""https://cryptoslate.com"">CryptoSlate</a>.</p>",T0
402,"<p>X revised its developer API policies to ban applications that financially reward users for posting, and enforcement has already begun. Nikita Bier, who joined X's product team after selling his social app tbh to Meta, framed the move as part of a broader effort to reduce low-quality engagement and told displaced builders that X would [&#8230;]</p>
<p>The post <a href=""https://cryptoslate.com/discord-is-suddenly-locking-down-servers-for-the-same-alarming-reason-x-just-purged-these-crypto-developers/"">Discord is suddenly locking down servers for the same alarming reason X just purged these crypto developers</a> appeared first on <a href=""https://cryptoslate.com"">CryptoSlate</a>.</p>",T2
403,"<p>Institutional investment managers increased their allocations to US spot Bitcoin exchange-traded funds (ETFs) during the fourth quarter of 2025, despite the asset suffering a sharp price correction that shaved nearly a quarter off its market value. The divergence between rising share counts and falling asset values presents a complex picture of institutional behavior during a period [&#8230;]</p>
<p>The post <a href=""https://cryptoslate.com/why-wall-street-refuses-to-sell-bitcoin-and-actually-bought-way-more-even-while-losing-25-of-its-value/"">Why Wall Street refuses to sell Bitcoin &#8211; and actually bought way more &#8211; even while losing 25% of its value</a> appeared first on <a href=""https://cryptoslate.com"">CryptoSlate</a>.</p>",T0
404,"<p>SEC Chair Paul Atkins told Fox Business in December that he expects US financial markets to move on-chain &#8220;in a couple of years.&#8221; The statement landed somewhere between prophecy and policy directive, especially coming from the architect of &#8220;Project Crypto,&#8221; the Commission's formal initiative to enable tokenized market infrastructure. However, what does &#8220;on-chain&#8221; mean when [&#8230;]</p>
<p>The post <a href=""https://cryptoslate.com/sec-chair-predicts-2-year-timeline-to-full-tokenization-but-the-real-12-6-trillion-opportunity-isnt-equities/"">SEC Chair predicts 2-year timeline to put US fully on chain but the real $12.6 trillion opportunity isn&#8217;t equities</a> appeared first on <a href=""https://cryptoslate.com"">CryptoSlate</a>.</p>",T7
405,"<p style=""float: right; margin: 0 0 10px 15px; width: 240px;""><img alt=""User loses $282M in one of the largest social engineering crypto heists"" class=""type:primaryImage"" src=""https://images.cointelegraph.com/images/528_aHR0cHM6Ly9zMy5jb2ludGVsZWdyYXBoLmNvbS91cGxvYWRzLzIwMjYtMDEvMDE5YmNiNDEtMGFlMy03YmYzLTg4OWMtZmFkZmMzYjE1OTYxLmpwZw==.jpg"" /></p><p>The crypto user was reportedly deceived by an attacker impersonating Trezor support, tricked into revealing their hardware wallet seed phrase.</p>",T2
406,"<p style=""float: right; margin: 0 0 10px 15px; width: 240px;""><img alt=""White House threatens to pull support for crypto bill after Coinbase standoff: Report"" class=""type:primaryImage"" src=""https://images.cointelegraph.com/images/528_aHR0cHM6Ly9zMy5jb2ludGVsZWdyYXBoLmNvbS91cGxvYWRzLzIwMjUtMDgvMDE5ODkwYTItMzUxZS03ZjhlLWE2N2ItOTA3NGI1ZTQ4MDk4.jpg"" /></p><p>Coinbase withdrew support for the CLARITY Act, warning the draft would restrict DeFi, ban tokenized equities and eliminate stablecoin rewards.</p>",T7
407,"<p style=""float: right; margin: 0 0 10px 15px; width: 240px;""><img alt=""ETH price hits $3.4K, but pro traders are not bullish yet: Here’s why"" class=""type:primaryImage"" src=""https://images.cointelegraph.com/images/528_aHR0cHM6Ly9zMy5jb2ludGVsZWdyYXBoLmNvbS91cGxvYWRzLzIwMjYtMDEvMDE5YmM4YzEtYWYxMy03ZTU4LTlhNzktNmEyNWEzMmEyZDAxLmpwZw==.jpg"" /></p><p>ETH price cooled down from its recent rally as US macroeconomic factors, reduced DApps activity and falling fees impact traders’ use of Ether derivatives.</p>",T0
408,"<p style=""float: right; margin: 0 0 10px 15px; width: 240px;""><img alt=""Sacrificing Ethereum’s values for mainstream adoption must stop now: Buterin"" class=""type:primaryImage"" src=""https://images.cointelegraph.com/images/528_aHR0cHM6Ly9zMy5jb2ludGVsZWdyYXBoLmNvbS91cGxvYWRzLzIwMjUtMTIvMDE5YjI2MzYtNGRkOC03N2Q3LTg4ZWUtNTA4NWNiYTBiZjc1LmpwZw==.jpg"" /></p><p>Vitalik Buterin wants improved private payments, easier running of full nodes, decentralized apps that don’t rely on centralized services, and more on-chain privacy.</p>",T7
409,"<p style=""float: right; margin: 0 0 10px 15px; width: 240px;""><img alt=""Here’s what happened in crypto today"" class=""type:primaryImage"" src=""https://images.cointelegraph.com/images/528_aHR0cHM6Ly9zMy5jb2ludGVsZWdyYXBoLmNvbS91cGxvYWRzLzIwMjUtMDYvMDE5Nzk0MjMtZWY4ZS03YzYwLWI5MzctYjlkZGY3NWZlOGFk.jpg"" /></p><p>Need to know what happened in crypto today? Here is the latest news on daily trends and events impacting Bitcoin price, blockchain, DeFi, NFTs, Web3 and crypto regulation.</p>",T0
410,"<p style=""float: right; margin: 0 0 10px 15px; width: 240px;""><img alt=""Crypto bank Anchorage Digital eyes $400M raise with IPO in sight: Report"" class=""type:primaryImage"" src=""https://images.cointelegraph.com/images/528_aHR0cHM6Ly9zMy5jb2ludGVsZWdyYXBoLmNvbS91cGxvYWRzLzIwMjYtMDEvMDE5YmM5OWQtMGI4MC03NGFlLWE5MDctMGY4NzQ5MTk0Y2M3LmpwZw==.jpg"" /></p><p>Being the first federally chartered bank, Anchorage is looking to become a leading stablecoin issuer in 2026, with plans to double the size of its stablecoin team this year.</p>",T7
411,"<p style=""float: right; margin: 0 0 10px 15px; width: 240px;""><img alt=""DOJ didn't sell Bitcoin forfeited from Samourai case: White House advisor"" class=""type:primaryImage"" src=""https://images.cointelegraph.com/images/528_aHR0cHM6Ly9zMy5jb2ludGVsZWdyYXBoLmNvbS91cGxvYWRzLzIwMjYtMDEvMDE5YmM5MjYtMGIxMi03MDIxLThhYmItYzlkMThjMGE0YThiLmpwZw==.jpg"" /></p><p>Selling the Bitcoin would have violated President Donald Trump’s Executive Order 14233, which mandates that any Bitcoin obtained through criminal or civil forfeiture “shall not be sold.”</p>",T7
412,"<p style=""float: right; margin: 0 0 10px 15px; width: 240px;""><img alt=""DeFi leaders voice concerns amid market structure bill‘s uncertain future"" class=""type:primaryImage"" src=""https://images.cointelegraph.com/images/528_aHR0cHM6Ly9zMy5jb2ludGVsZWdyYXBoLmNvbS91cGxvYWRzLzIwMjYtMDEvMDE5YmMyNTAtYmU1My03NThlLTk1MjktMTE3YTUyYmZkNzQzLmpwZw==.jpg"" /></p><p>Many in the industry expect it could be weeks before lawmakers on the Senate Banking Committee return to consider a markup for the CLARITY Act.</p>",T7
413,"<p style=""float: right; margin: 0 0 10px 15px; width: 240px;""><img alt=""Bull, base or bear? Three possible paths for crypto in 2026"" class=""type:primaryImage"" src=""https://images.cointelegraph.com/images/528_aHR0cHM6Ly9zMy5jb2ludGVsZWdyYXBoLmNvbS91cGxvYWRzLzIwMjYtMDEvMDE5YmM3MzctYWU3Mi03MjJjLWI3OTYtZjRiMWM4NWMzYzA2LmpwZw==.jpg"" /></p><p>In a recent interview, Aaron Arnold of Altcoin Daily broke down his crypto market outlook for 2026, drawing parallels with past market cycles and outlining bull, base and bear scenarios.</p>",T0
414,"<p style=""float: right; margin: 0 0 10px 15px; width: 240px;""><img alt=""Michael Saylor pushes back on criticism of Bitcoin treasury companies"" class=""type:primaryImage"" src=""https://images.cointelegraph.com/images/528_aHR0cHM6Ly9zMy5jb2ludGVsZWdyYXBoLmNvbS91cGxvYWRzLzIwMjYtMDEvMDE5YmM4MWMtNmQxNy03YTBjLTgyZWUtZGE3NWFlOGM0YTVhLmpwZw==.jpg"" /></p><p>Speaking on the What Bitcoin Did podcast, Strategy chairman Michael Saylor pushed back against criticism of companies issuing equity or debt to buy Bitcoin.</p>",T0
415,"<p style=""float: right; margin: 0 0 10px 15px; width: 240px;""><img alt=""Bitcoin spot traders lose ground as BTC bears defend $98K"" class=""type:primaryImage"" src=""https://images.cointelegraph.com/images/528_aHR0cHM6Ly9zMy5jb2ludGVsZWdyYXBoLmNvbS91cGxvYWRzLzIwMjYtMDEvMDE5YmM3ZWQtYzY3ZC03ZDNjLTlhMWItM2U5NTZmYjkyNTU5LmpwZw==.jpg"" /></p><p>Bitcoin’s rejection near $98,000 took place as spot traders ran out of energy and short-term investors harvested profits. Will bears defend the resistance level throughout the weekend?</p>",T0
416,"<p style=""float: right; margin: 0 0 10px 15px; width: 240px;""><img alt=""Crypto’s bank-like turn puts JPMorgan on edge"" class=""type:primaryImage"" src=""https://images.cointelegraph.com/images/528_aHR0cHM6Ly9zMy5jb2ludGVsZWdyYXBoLmNvbS91cGxvYWRzLzIwMjYtMDEvMDE5YmMyNzUtMTJmZi03OWE2LTg1OTAtYjQ3MTAwNWVhNDgxLmpwZw==.jpg"" /></p><p>Banks and crypto firms are converging fast, as yield-bearing stablecoins, ETF filings and tokenized markets test the boundaries of financial regulation.</p>",T7
417,"<p style=""float: right; margin: 0 0 10px 15px; width: 240px;""><img alt=""Goldman Sachs CEO says CLARITY Act ‘has a long way to go‘"" class=""type:primaryImage"" src=""https://images.cointelegraph.com/images/528_aHR0cHM6Ly9zMy5jb2ludGVsZWdyYXBoLmNvbS91cGxvYWRzLzIwMjYtMDEvMDE5YmM3ZDMtOTk3My03YTdkLTljNDYtMWU1MTIzMjUxZWRkLmpwZw==.jpg"" /></p><p>It's unclear when US lawmakers will return to address a market structure bill, but CEO David Solomon said Goldman Sachs was monitoring its progress for tokenization and stablecoins.</p>",T7
418,"<p style=""float: right; margin: 0 0 10px 15px; width: 240px;""><img alt=""US lender Newrez to accept crypto holdings in mortgage approval"" class=""type:primaryImage"" src=""https://images.cointelegraph.com/images/528_aHR0cHM6Ly9zMy5jb2ludGVsZWdyYXBoLmNvbS91cGxvYWRzLzIwMjUtMTEvMDE5YWJhOWYtMzdhOC03ZDBhLThmOTYtMmNmYzBjNGEwZjI3.jpg"" /></p><p>The new policy will allow borrowers to use Bitcoin, Ether, crypto ETFs and US dollar-backed stablecoins for asset verification and income estimates without liquidation.</p>",T7
419,"<p style=""float: right; margin: 0 0 10px 15px; width: 240px;""><img alt=""Bitcoin ETF inflows cross $1.8B: Will BTC respond with a rally to $100K?"" class=""type:primaryImage"" src=""https://images.cointelegraph.com/images/528_aHR0cHM6Ly9zMy5jb2ludGVsZWdyYXBoLmNvbS91cGxvYWRzLzIwMjYtMDEvMDE5YmM3NGItZTQ5YS03MWY3LThhYmItMzVhNmUzMTkyZDc3LmpwZw==.jpg"" /></p><p>Bitcoin ETF inflows have rebounded, but the total assets under management remains 24% below the all-time high, indicating the recovery has just started.</p>",T0
420,"<p style=""float: right; margin: 0 0 10px 15px; width: 240px;""><img alt=""Bitcoin rallies, ETF flows rebound as US crypto policy stalls: Finance Redefined"" class=""type:primaryImage"" src=""https://images.cointelegraph.com/images/528_aHR0cHM6Ly9zMy5jb2ludGVsZWdyYXBoLmNvbS91cGxvYWRzLzIwMjYtMDEvMDE5YmM2ZjEtODhhYi03MDc2LThiYTItYzhkOWFlZjQxYzMyLmpwZw==.jpg"" /></p><p>Bitcoin breached the $95,000 mark this week amid a wider market recovery, as investors digested regulatory delays to the much-awaited CLARITY Act in the US.</p>",T0
421,"<p style=""float: right; margin: 0 0 10px 15px; width: 240px;""><img alt=""Riot Platforms shares jump 11% after Bitcoin sale funds Texas deal"" class=""type:primaryImage"" src=""https://images.cointelegraph.com/images/528_aHR0cHM6Ly9zMy5jb2ludGVsZWdyYXBoLmNvbS91cGxvYWRzLzIwMjYtMDEvMDE5YmM3NmMtNTlmMS03MWYxLTkwYWYtYmM1ZTBmNGU2M2EzLmpwZw==.jpg"" /></p><p>The deal followed Riot announcing last week that it sold more than $160 million of its Bitcoin holdings as part of a strategy shift, to broaden use of its data centers.</p>",T0
422,"<p style=""float: right; margin: 0 0 10px 15px; width: 240px;""><img alt=""Price predictions 1/16: BTC, ETH, XRP, BNB, SOL, DOGE, ADA, XMR, BCH, LINK"" class=""type:primaryImage"" src=""https://images.cointelegraph.com/images/528_aHR0cHM6Ly9zMy5jb2ludGVsZWdyYXBoLmNvbS91cGxvYWRzLzIwMjYtMDEvMDE5YmM3OTYtMTJhOS03ODE4LWI5Y2EtNTI0YzViNWY5MTYyLmpwZw==.jpg"" /></p><p>The crypto market rally lost momentum as Bitcoin met resistance near $98,000, but technical charts suggest traders will actively buy dips to underlying support levels in altcoins and BTC.</p>",T0
423,"<p style=""float: right; margin: 0 0 10px 15px; width: 240px;""><img alt=""Bitcoin is now most undervalued versus gold: Will BTC price rebound?"" class=""type:primaryImage"" src=""https://images.cointelegraph.com/images/528_aHR0cHM6Ly9zMy5jb2ludGVsZWdyYXBoLmNvbS91cGxvYWRzLzIwMjYtMDEvMDE5YmM3MzUtYmE0Yi03OTViLTgyYjYtZjdhOTZhNmEzMDhiLmpwZw==.jpg"" /></p><p>BTC price surged nearly 150% after a similar BTC–gold undervaluation signal in late 2022, highlighting how extreme discounts have preceded major rallies.</p>",T0
424,"<p style=""float: right; margin: 0 0 10px 15px; width: 240px;""><img alt=""Bitcoin copying 2022 'bear market rally' despite 21% BTC price gains"" class=""type:primaryImage"" src=""https://images.cointelegraph.com/images/528_aHR0cHM6Ly9zMy5jb2ludGVsZWdyYXBoLmNvbS91cGxvYWRzLzIwMjYtMDEvMDE5YmM3NmItMDZmMi03ODNkLWIzM2QtNzY1M2ZiMjc2OWYwLmpwZw==.jpg"" /></p><p>Bitcoin market research warned that BTC faced another bear market in 2026 if it was unable to reclaim its yearly moving average.</p>",T0
