id,text,topic_id
162,Some gig workers say they're considering quitting due to lower earnings and the rise of self-driving cars. Take our survey to share your thoughts.,T6
163,MrBeast's former manager Reed Duchscher said we're unlikely to see mega stars break out as algorithms favor smaller creators who make niche content.,T1
164,"Amanda Luther, a BCG senior partner and managing director based in Austin, shares her routines for making it through the day.",T1
165,"Barbara Brown, 83, works as a yoga instructor at nursing homes in Richmond, Virginia. She said her work has been fulfilling, though she needs to work.",T10
166,"14-year-old Alby Churven founded Clovr. He told Business Insider his age gave him a ""wow factor"" but limits his ""legitimacy.""",T11
167,"Robotaxis have become subjects of virality as their presence grew in America this year. In 2026, they'll be taking over more US roads.",T1
168,"Private jets, Bugattis...and a pile of bills: Inside Floyd Mayweather's lavish, debt-filled post-boxing life",T7
169,"Japan's aging workforce, labor shortages, and government policies show how the country has adapted as 30% of its population is over 65.",T2
170,China's foreign ministry said the sanctioned firms and individuals would have their assets within China frozen.,T2
171,"I moved across the world for my husband and ended up a single mom. Years later, I met the love of my life when I least expected it.",T10
172,"Celebrating New Year's Eve on a solo trip to a new place, surrounded by strangers, set a positive tone for the year and reminded me I wasn't alone.",T10
173,"I left my kids &mdash; including a newborn &mdash; to see the Backstreet Boys in August. They're back at the Sphere, and I hope another mom is doing the same.",T6
174,Check out the pitch decks AI-powered advertising and marketing tech startups used to raise millions from venture capital firms.,T1
175,Luxury condos are offering resident-only dining as an exclusive amenity for added privacy and convenience.,T2
176,"Ree Drummond's cacio e pepe ravioli recipe has just a few ingredients and comes together quickly. I tried it, and now, it's my favorite easy dinner.",T10
177,"The most powerful news photos taken by Getty Images photographers in 2025 captured political unrest, natural disasters, and other major news events.",T6
178,"Counterparty Radar: Trades under three months make up nearly 60% of total positions, up from just a third in 2022",T7
179,Custom indexes eliminate energy and food prices to ease trading of stickier inflation trends,T0
180,"Batch processing and Excel files still pervade, with only one in four lenders planning tech upgrades",T4
181,Industry warns new capital requirements for securities firms are higher than other jurisdictions,T4
182,Shifts in monetary and fiscal policy are reshaping fixed income markets,T0
183,"In the ALM Benchmarking exercise, the majority of banks have no internal tests focusing on stress horizons of less than 30 days",T4
184,"Ability to absorb $19bn liquidation event marks a turning point in market’s maturity, says LMAX Group's Jenna Wright",T8
185,"Growing private credit worries helped drive losses, but fundamentals are said not to support that view",T4
186,Substitutability overtakes complexity at US bank for first time,T4
187,Catalysing network effects and expanding non-cash VM at scale,T8
188,"Risk.net’s guide to the world’s leading quant master’s programmes, with the top 25 schools ranked",T4
189,"View interactive charts from Risk.net’s 46-bank study, covering ALM governance, balance-sheet strategy, stress-testing, technology and regulation",T4
190,Liquidity and rate risks are as old as banking; but the 46 banks in our benchmarking study have different ways to manage them,T4
191,Brokers’ own resources are outpaced by customer funds,T8
192,"Lack of transparent price validation data for FX forwards and swaps is holding back buy side, Vanguard’s head of FX says",T13
193,Some members not ready to commit to 2026 start date; rival FICC enhances services,T12
194,"Helaba remains the most exposed among peers, with both residential and commercial books linked heavily to climate risks",T2
195,Current CRO Edward Fishwick will be head of research at BlackRock’s RQA group,T1
196,Sharp rise in uncollateralised buy-side hedges could restrict banks’ ability to take on positions,T4
197,"Many Americans can take advantage of President Trump’s deduction on auto loan interest, but the tax break will provide only modest savings.",T5
198,"The administration has downplayed concerns — from mass job losses, to a potential financial bubble — as President Trump cheers soaring stock prices and faster growth.",T0
199,The latest vessel to be targeted by the United States in its pressure campaign on Venezuela was sending distress signals as it headed northeast from the Caribbean into the Atlantic.,T7
200,Economists say that a typical middle-class family today is richer than one in the 1960s. Americans in their 20s and 30s don’t believe it.,T2
201,"A reordering of the rules of trade, set on top of transformational change in technology, demographics and climate, is remaking jobs, politics and lives.",T2
202,"Data collection issues skewed the latest Consumer Price Index report, economists warned, clouding the picture for the Federal Reserve as it also grapples with a cooling labor market.",T0
203,"With tariffs unpopular and prices still high, the White House has teased the promise of tariff rebates and large tax refunds next year.",T5
204,The Trump administration singled out European tech firms by name and promised economic consequences Tuesday unless the E.U. rolls back tech regulation and lawsuits.,T2
205,The Trump administration looked to recast elements of a dour jobs report Tuesday as a sign of strength.,T2
206,"A proposal to revise an E.U. law requiring carmakers to stop producing combustion engines by 2035 would offer some relief to automakers, but it sets back the region’s climate goals.",T6
207,"Employers added 64,000 jobs in November, according to data delayed by the government shutdown, but the unemployment rate rose to a four-year high of 4.6 percent.",T2
208,The U.S. government has paused a tech-focused trade pledge with Britain over broader disagreements about Britain’s digital regulations and food safety rules.,T2
209,California and New York are among the states arguing that the Trump administration’s decision to charge that fee for skilled foreign workers is illegal.,T5
210,Corporate tax revenue has quickly dipped since Republicans passed tax cuts this summer. But economists think these tax breaks might be worth it.,T5
211,Fed officials explained their opposition to the central bank’s decision this week to cut interest rates by a quarter of a percentage point.,T9
212,The monthly trade deficit fell to its lowest level in five years after the president’s imposition of sweeping global tariffs. But it’s unclear whether the trend will persist.,T5
213,The president continues to brush off an issue that he said he would solve in his first months in office. Some Democrats say he is making the same mistake as his predecessor.,T5
214,"The central bank’s decision to lower interest rates for a third straight meeting was highly contentious, reflecting an internal divide that will likely limit how much borrowing costs will fall next year.",T4
215,President Trump’s decision to allow Nvidia to sell its chips to China has raised questions about whether he is prioritizing short-term economic gain over long-term American security interests.,T5
216,Silicon Valley is again betting everything on a new technology. But the mania is not a reboot of the late-1990s frenzy.,T1
217,"The Trump administration’s efforts to reduce the foreign-born population are being felt in hospitals and soccer leagues and on Main Streets across the country, with hints of what’s to come.",T5
218,"Riding an endless wave of nostalgia, one company is exhuming the intellectual property of midcentury designers to create new audiences for forgotten work.",T1
219,"Whoever wins faces the daunting task of feeding the West African country’s poor and navigating the interests of global powers seeking critical minerals, analysts say.",T2
220,"To avoid the ripple effects of real-time adjustments to what was predicted to be up to nine inches of snow, the major airlines said they pre-emptively canceled flights.",T7
221,A new study suggests that distressed borrowers using a simpler bankruptcy process are succeeding — and that more people like them should try.,T4
222,The political polarization of battery-powered cars may have started when Toyota released its first hybrid model 25 years ago.,T6
223,"Plus, the long-lost art of the direct confrontation.",T6
224,The National Kidney Registry has matched thousands of kidney donors with recipients. It has also paid millions of dollars to a company owned by its founder.,T11
225,"Anthony Ramos loves hanging out with customers during busy days that may find him writing a new musical, catching a friend in a show or performing in his own.",T1
226,Records show how government departments played down residents’ warnings about corrupt practices and substandard materials that fueled the deadly blaze.,T2
227,"It’s uncertain whether the proposal will reach the statewide ballot in November, but some billionaires like Peter Thiel and Larry Page may be unwilling to take the risk.",T5
228,"Only five Sears stores remain in the country, with the end likely near for what was once the mightiest American retailer.",T2
229,"Artificial intelligence companies looking to raise funds are being made to pay lofty interest rates, as debt investors become cautious.",T1
230,Megacities in southern India are attracting enormous investments to help build artificial intelligence infrastructure to serve the world’s most data-hungry country.,T1
231,They increasingly see themselves as rank-and-file workers who have traditional gripes with their companies.,T2
232,"A “Shark Tank” investor, a supermarket magnate and even N.B.A. All-Stars make appearances in the table tennis comedy.",T1
233,"Chosen by a British TV station to give an “alternative” to the king’s speech, Jimmy Kimmel said it had been a great year for the U.S. “from a fascism perspective.”",T2
234,"Prominent business and government figures spread rumors about the attack on Brown University’s campus this month, reigniting questions about accountability in online discourse.",T6
235,"Many Americans can take advantage of President Trump’s deduction on auto loan interest, but the tax break will provide only modest savings.",T5
236,"Shares of Tesla have hit new highs on optimism about the company’s self-driving taxis. But experts say Tesla is far behind Waymo, which has a big head start.",T7
237,Who will President Donald Trump choose as the chair of the Federal Reserve?,T9
238,Businesses in vulnerable sectors found themselves caught between rising tariffs and beleaguered consumers.,T2
239,Who will President Donald Trump choose as the chair of the Federal Reserve?,T9
240,Businesses in vulnerable sectors found themselves caught between rising tariffs and beleaguered consumers.,T2
241,"The Trump administration has pursued a staggering range of policy pivots this past year that threaten to weaken the nation’s ability and willingness to address a broad spectrum of technology challenges, from cybersecurity and privacy to countering disinformation, fraud and corruption. These shifts, along with the president’s efforts to restrict free speech and freedom of the press, have come at such a rapid clip that many readers probably aren’t even aware of them all.",T6
242,"Direct navigation -- the act of visiting a website by manually typing a domain name in a web browser -- has never been riskier: A new study finds the vast majority of ""parked"" domains -- mostly expired or dormant domain names, or common misspellings of popular websites -- are now configured to redirect visitors to sites that foist scams and malware.",T11
243,"Microsoft today pushed updates to fix at least 56 security flaws in its Windows operating systems and supported software. This final Patch Tuesday of 2025 tackles one zero-day bug that is already being exploited, as well as two publicly disclosed vulnerabilities.",T14
244,A sprawling academic cheating network turbocharged by Google Ads that has generated nearly $25 million in revenue has curious connections to a Kremlin-connected oligarch whose Russian university builds drones for Russia's war against Ukraine.,T1
245,"China-based phishing groups blamed for non-stop scam SMS messages about a supposed wayward package or unpaid toll fee are promoting a new offering, just in time for the holiday shopping season: Phishing kits for mass-creating fake but convincing e-commerce websites that convert customer payment card data into mobile wallets from Apple and Google. Experts say these same phishing groups also are now using SMS lures that promise unclaimed tax refunds and mobile rewards points.",T11
246,"A prolific cybercriminal group that calls itself ""Scattered LAPSUS$ Hunters"" made headlines regularly this year by stealing data from and publicly mass extorting dozens of major corporations. But the tables seem to have turned somewhat for ""Rey,"" the moniker chosen by the technical operator and public face of the hacker group: Earlier this week, Rey confirmed his real life identity and agreed to an interview after KrebsOnSecurity tracked him down and contacted his father.",T14
247,"On the surface, the Superbox media streaming devices for sale at retailers like BestBuy and Walmart may seem like a steal: They offer unlimited access to more than 2,200 pay-per-view and streaming services like Netflix, ESPN and Hulu, all for a one-time fee of around $400. But security experts warn these TV boxes require intrusive software that forces the user's network to relay Internet traffic for others, traffic that is often tied to cybercrime activity such as advertising fraud and account takeovers.",T6
248,"In March 2024, Mozilla said it was winding down its collaboration with Onerep -- an identity protection service offered with the Firefox web browser that promises to remove users from hundreds of people-search sites -- after KrebsOnSecurity revealed Onerep's founder had created dozens of people-search services and was continuing to operate at least one of them. Sixteen months later, however, Mozilla is still promoting Onerep. This week, Mozilla announced their partnership with Onerep will officially end next month.",T11
249,An intermittent outage at Cloudflare on Tuesday briefly knocked many of the Internet's top destinations offline. Some affected Cloudflare customers were able to pivot away from the platform temporarily so that visitors could still access their websites. But security experts say doing so may have also triggered an impromptu network penetration test for organizations that have come to rely on Cloudflare to block many types of abusive and malicious traffic.,T14
250,"Microsoft this week pushed security updates to fix more than 60 vulnerabilities in its Windows operating systems and supported software, including at least one zero-day bug that is already being exploited. Microsoft also fixed a glitch that prevented some Windows 10 users from taking advantage of an extra year of security updates, which is nice because the zero-day flaw and other critical weaknesses patched today affect all versions of Windows, including Windows 10.",T14
251,"Patricia Voight, CISO at Webster Bank, shares her expertise on advancing cybersecurity careers, combating financial crimes, and championing diversity in a rapidly changing industry.",T1
252,"Developers are leaning more heavily on AI for code generation, but in 2026, the development pipeline and security need to be prioritized.",T1
253,"Take part in the new survey from Dark Reading and help uncover trends, challenges, and solutions shaping the future of application security.",T14
254,"Healthcare cyberattacks are on the rise, but industry organizations say the proposed changes to the security rules fall short of what's needed.",T14
255,"Its latest cybersecurity acquisition will help further ServiceNow's plans for autonomous cybersecurity, and building a security stack to proactively manage AI.",T1
256,"The tech giant has been beset by a deluge of state-sponsored North Korean operatives, showcasing the sheer scale of the IT worker scam problem.",T1
257,"Interpol said law enforcement across 19 countries made 574 arrests and recovered $3 million, against a backdrop of spiraling cybercrime in the region, including business email compromise, digital extortion, and ransomware schemes.",T11
258,"With attacks on the critical firewall vulnerability, WatchGuard joins a list of edge device vendors whose products have been targeted in recent weeks.",T14
259,"Telegram users in Uzbekistan are being targeted with Android SMS-stealer malware, and what's worse, the attackers are improving their methods.",T11
260,"The company suffered one sophisticated five-alarm campaign and one messy spray-and-pray attack, mere days apart.",T14
261,New China-aligned APT group is deploying Group Policy to sniff through government networks across Southeast Asia and Japan.,T10
262,"Reports of patients being cared for by unqualified home-care aides with fake identities continue to emerge, highlighting a need for more stringent identity authentication.",T11
263,"AI adds real value to cybersecurity today, but it cannot yet serve as a single security guardian. Here's how organizations can safely combine AI-driven analysis with deterministic rules and proven security practices.",T14
264,"North Korea shifted its strategy to patiently target &quot;bigger fish&quot; for larger payouts, using sophisticated methods to execute attacks at opportune times.",T6
265,"In the latest attacks against the vendor's SMA1000 devices, threat actors have chained a new zero-day flaw with a critical vulnerability disclosed earlier this year.",T14
266,&quot;Prince of Persia&quot; has rewritten the rules of persistence with advanced operational security and cryptographic communication with its command-and-control server.,T14
267,"Attackers are targeting admin accounts, and once authenticated, exporting device configurations including hashed credentials and other sensitive information.",T14
268,"Anthropic proves that LLMs can be fairly resistant to abuse. Most developers are either incapable of building safer tools, or unwilling to invest in doing so.",T1
269,The remote access Trojan lets an attacker remotely control a victim's phone and can generate malicious apps from inside the Play Store.,T14
270,"The future of cybersecurity means defending everywhere. Securing IoT, cloud, and remote work requires a unified edge-to-cloud strategy. (First in a three-part series.)",T14
271,"New GPT Image 1.5 allows more detailed conversational image editing, for better or worse.",T1
272,"The extensions, available for Chromium browsers, harvest full AI conversations over months.",T1
273,Dictionary codifies the term that took hold in 2024 for low-quality AI-generated content.,T1
274,The weak RC4 for administrative authentication has been a hacker holy grail for decades.,T14
275,"Shenzhen-based Picea Robotics, its lender and primary supplier, will acquire all of iRobot’s shares.",T7
276,"""The vast majority of Codex is built by Codex,"" OpenAI told us about its new AI coding agent writing code.",T1
277,Company claims new AI model tops Gemini and matches humans on 70% of work tasks.,T1
278,"Three-year deal lets users create AI videos of Mickey Mouse, Darth Vader, and more.",T1
279,Company raises its capital expenditure forecast as it doubles down on AI infrastructure bet.,T8
280,"Devstral 2 model scores 72% on industry benchmark, nearing proprietary rivals.",T7
281,“Abandonment” offers rare chance to reclaim one of tech’s most recognized brands.,T6
282,"Facebook agrees to change ""pay or consent"" model after talks with European Commission.",T3
283,Defendants were convicted of similar crimes a decade ago. How were they cleared again?,T6
284,Open source React executes malicious code with malformed HTML—no authentication needed.,T11
285,"Report: Microsoft declared ""the era of AI agents"" in May, but enterprise customers aren't buying.",T1
286,"Researchers say there's more to the network, which has operated for 14 years.",T1
287,"Three years after Google sounded alarm bells over ChatGPT, the tables have turned.",T1
288,New research offers clues about why some prompt injection attacks may succeed.,T14
289,"Product development, internal operations among teams expected to be hit hardest.",T1
290,"Several companies are selling crypto stockpiles in effort to fund share buybacks, shore up stock prices.",T7
291,"As ordered reported by the House Committee on Foreign Affairs on December 3, 2025",T12
292,"As ordered reported by the House Committee on Foreign Affairs on December 3, 2025",T12
293,"As ordered reported by the House Committee on Foreign Affairs on December 3, 2025",T12
294,"As ordered reported by the House Committee on Foreign Affairs on December 3, 2025",T12
295,"CBO announces what to expect in the coming weeks as the agency begins the new calendar year with a series of reports that offers updated insights into the nation's demographic trends, economic outlook, and budgetary conditions.",T0
296,"As ordered reported by the Senate Committee on Commerce, Science, and Transportation on October 21, 2025",T12
297,"As ordered reported by the Senate Committee on Commerce, Science, and Transportation on October 21, 2025",T12
298,"As introduced in the House of Representatives on December 12, 2025",T12
299,"As reported by the House Committee on the Judiciary on December 12, 2025",T12
300,The Majority Leader of the House of Representatives announces bills that will be considered under suspension of the rules in that chamber. CBO estimates the effects of those bills on direct spending and revenues.,T12
301,"CBO finds that maintenance for Navy destroyers and amphibious warfare ships has often taken longer and required more labor than planned. Those delays affect the fleet's readiness and reflect aging ships, late inspections, and other factors.",T5
302,"As reported by the House Committee on Energy and Commerce on October 3, 2025",T12
303,"Rules Committee Print 119-16, As Posted on the Website of the House Committee on Rules on December 7, 2025",T12
304,"The federal budget deficit totaled $439 billion in October and November 2025, the first two months of fiscal year 2026, CBO estimates. That amount is $185 billion less than the deficit recorded during the same period last fiscal year.",T5
305,"As ordered reported by the House Committee on Oversight and Government Reform on December 2, 2025",T12
306,"As ordered reported by the House Committee on Oversight and Government Reform on 
December 2, 2025",T12
307,"As ordered reported by the House Committee on Oversight and Government Reform on December 2, 2025",T12
308,"As ordered reported by the House Committee on Oversight and Government Reform on 
December 2, 2025",T12
309,"Every December, retailers hire a large number of extra workers to keep up with holiday demand. Our FRED graph above shows a clear seasonal spike in the number of retail employees at the end of the year, as stores bring &#8230; <a href=""https://fredblog.stlouisfed.org/2025/12/tis-the-seasonal-a-look-at-seasonal-retail-workers/"">Continue reading <span class=""meta-nav"">&#8594;</span></a>",T2
310,"Our FRED graph above shows one of the all-star statistics for the US economy: industrial production. It&#8217;s a compelling data series for at least two reasons. It measures something people can relate to—the production of tangible stuff. The data are &#8230; <a href=""https://fredblog.stlouisfed.org/2025/12/us-industrial-production/"">Continue reading <span class=""meta-nav"">&#8594;</span></a>",T2
311,"In a previous FRED blog post, we discussed the Summary of Economic Projections (SEP) released by the FOMC this past September. In this post, we  again use ALFRED to compare the latest projections released in December 2025 with several of &#8230; <a href=""https://fredblog.stlouisfed.org/2025/12/fomc-summary-of-economic-projections-december-2025/"">Continue reading <span class=""meta-nav"">&#8594;</span></a>",T0
312,"All Federal Reserve Banks operate within a specific geographic area—called a district. The Cleveland Fed is in the Fourth District of the Federal Reserve System, which covers Ohio and parts of Pennsylvania, Kentucky, and West Virginia. The Cleveland Fed&#8217;s Survey &#8230; <a href=""https://fredblog.stlouisfed.org/2025/12/cleveland-fed-data-on-regional-economic-conditions/"">Continue reading <span class=""meta-nav"">&#8594;</span></a>",T9
313,"What’s really happening in US manufacturing? In our FRED graph above, we compare labor productivity for all workers in the manufacturing sector alongside the share of manufacturing employment in total US nonfarm employment since 1987. The graph tells a compelling &#8230; <a href=""https://fredblog.stlouisfed.org/2025/12/manufacturing-employment-and-productivity/"">Continue reading <span class=""meta-nav"">&#8594;</span></a>",T2
314,"In 2025, many US households reported a surge in electricity prices. According to the producer price index (PPI) for residential electric power, these prices have gone up by 7% between January and August 2025. This rise in prices can be &#8230; <a href=""https://fredblog.stlouisfed.org/2025/12/the-divergence-of-electricity-and-natural-gas-prices/"">Continue reading <span class=""meta-nav"">&#8594;</span></a>",T0
