id,text,topic_id
322,"Every December, retailers hire a large number of extra workers to keep up with holiday demand. Our FRED graph above shows a clear seasonal spike in the number of retail employees at the end of the year, as stores bring &#8230; <a href=""https://fredblog.stlouisfed.org/2025/12/tis-the-seasonal-a-look-at-seasonal-retail-workers/"">Continue reading <span class=""meta-nav"">&#8594;</span></a>",T7
323,"Our FRED graph above shows one of the all-star statistics for the US economy: industrial production. It&#8217;s a compelling data series for at least two reasons. It measures something people can relate to—the production of tangible stuff. The data are &#8230; <a href=""https://fredblog.stlouisfed.org/2025/12/us-industrial-production/"">Continue reading <span class=""meta-nav"">&#8594;</span></a>",T7
324,"In a previous FRED blog post, we discussed the Summary of Economic Projections (SEP) released by the FOMC this past September. In this post, we  again use ALFRED to compare the latest projections released in December 2025 with several of &#8230; <a href=""https://fredblog.stlouisfed.org/2025/12/fomc-summary-of-economic-projections-december-2025/"">Continue reading <span class=""meta-nav"">&#8594;</span></a>",T13
325,"All Federal Reserve Banks operate within a specific geographic area—called a district. The Cleveland Fed is in the Fourth District of the Federal Reserve System, which covers Ohio and parts of Pennsylvania, Kentucky, and West Virginia. The Cleveland Fed&#8217;s Survey &#8230; <a href=""https://fredblog.stlouisfed.org/2025/12/cleveland-fed-data-on-regional-economic-conditions/"">Continue reading <span class=""meta-nav"">&#8594;</span></a>",T3
326,"What’s really happening in US manufacturing? In our FRED graph above, we compare labor productivity for all workers in the manufacturing sector alongside the share of manufacturing employment in total US nonfarm employment since 1987. The graph tells a compelling &#8230; <a href=""https://fredblog.stlouisfed.org/2025/12/manufacturing-employment-and-productivity/"">Continue reading <span class=""meta-nav"">&#8594;</span></a>",T7
327,"In 2025, many US households reported a surge in electricity prices. According to the producer price index (PPI) for residential electric power, these prices have gone up by 7% between January and August 2025. This rise in prices can be &#8230; <a href=""https://fredblog.stlouisfed.org/2025/12/the-divergence-of-electricity-and-natural-gas-prices/"">Continue reading <span class=""meta-nav"">&#8594;</span></a>",T9
328,"Gross domestic product (GDP) is the sum of all incomes distributed in a year, including disposable personal income (DPI). So, GDP and DPI are positively correlated. That is, they generally move in the same direction and follow each other closely. &#8230; <a href=""https://fredblog.stlouisfed.org/2025/12/why-did-gdp-and-personal-income-diverge-during-covid/"">Continue reading <span class=""meta-nav"">&#8594;</span></a>",T7
329,"The current softening in the labor market is hitting recent college graduates especially hard, suggesting the traditional college premium may be weakening. At least for quickly landing a job. In this post, we take a longer view of the unemployment &#8230; <a href=""https://fredblog.stlouisfed.org/2025/11/the-unemployment-gap-between-college-graduates-and-noncollege-workers/"">Continue reading <span class=""meta-nav"">&#8594;</span></a>",T7
330,"Why do some entrepreneurs drive economic growth while others do not? This piece discusses <a href=""https://www.nber.org/papers/w33766"">new work </a>that studies entrepreneurs using a comprehensive dataset from Denmark. We study who becomes an entrepreneur, along with their hiring and business decisions, and find that a distinct minority are “transformative.” These individuals, who generate disproportionate productivity gains, tend to have high IQ scores, be well-educated, and hire technical (R&#38;D) workers. The data support the idea of productivity growth being driven by the symbiotic relationship between transformative entrepreneurs and R&#38;D workers. For policymakers, the lesson is that when an economy has more R&#38;D workers and transformative entrepreneurs, they sustain higher long-run productivity growth.",T7
331,"Each year brings a new set of economic challenges: In 2025, major areas of focus included tariffs and trade tensions, as well as the financial pressures facing younger adults. New York Fed economists contributed insightful research on both topics—and readers took notice. In fact, all five of the year’s most-read posts on <em>Liberty Street Economics</em> analyzed aspects of these issues. Read on to see how the restoration of student loan data to credit reports affected borrowers’ credit scores, whether the costs of a college degree are still worth it, how businesses are responding to higher tariffs, and why the U.S. runs a trade deficit.<br />",T10
332,"Call Reports are regulatory filings in which commercial banks report their assets, liabilities, income, and other information. They are one of the most-used data sources in banking and finance. In this post, we describe a <a href=""https://www.newyorkfed.org/research/banking_research/balance-sheets-income-statements"">new dataset</a> made available on the Federal Reserve Bank of New York’s website that contains time-consistent balance sheets and income statements for commercial banks in the United States from 1959 to 2025.",T3
333,"Banks must extract useful signals of a potential borrower's quality from a large set of possibly informative characteristics when making lending decisions. A model that speaks to how banks specialize in lending to an industry in order to better extract signals from data, can potentially be applied to a number of real-world scenarios. In this post, we apply lessons from such a model to a topic of timely relevance in economics: job market recommendation letters. Institutions looking to hire new economists must evaluate PhD applicants based on limited and often noisy signals of future performance, including letters of recommendation from these applicants’ advisors or co-authors. Using insights from our model, we argue that the value of these letters depends on who reads them.",T3
334,"Why does the banking industry remain prone to large and costly disruptions despite being so heavily regulated? Is there a need for more regulation, less regulation, or simply different regulation? Our <a href=""https://www.newyorkfed.org/research/staff_reports/sr1155.html"">recent Staff Report</a> combines insights from academic research in economics, finance, and accounting to provide a deeper understanding of the challenges involved in designing and implementing bank regulation, as well as opportunities for future exploration. This post focuses on the regulation of bank capital, but the ideas are applicable more broadly.",T3
335,"This post presents an update of the economic forecasts generated by the Federal Reserve Bank of New York’s dynamic stochastic general equilibrium (DSGE) model. We describe very briefly our forecast and its change since <a href=""https://libertystreeteconomics.newyorkfed.org/2025/09/the-new-york-fed-dsge-model-forecast-september-2025/"" rel=""noreferrer noopener"" target=""_blank"">September 2025</a>. To summarize, growth in 2025 is expected to be stronger than in September due to a lower projected path of the policy rate, as well as higher productivity. Inflation projections are higher in 2025 because of cost-push shocks, which capture the effects of tariffs. The model’s predictions for the short-run real natural rate of interest (or r*) in 2025 have decreased relative to September.",T10
336,"Following the recent passage of <a href=""https://www.congress.gov/bill/119th-congress/senate-bill/1582"" rel=""noreferrer noopener"" target=""_blank"">legislation in the U.S.</a>, payment stablecoins seem to be on the brink of wider-scale adoption and explosive growth in market capitalization. In this post, we contend that the driving factor is not their proximity to digital cash instruments, but rather how they are transferred—via global, open-access, peer-to-peer systems, or “permissionless blockchains,” for short.",T3
337,"There has been a lot of interest in firms’ pricing decisions in the past few years—both during the inflation surge of 2021-23 and in the more recent rounds of tariff increases. In this post, we let firms speak for themselves about what factors they consider when adjusting prices in response to various shocks. The analysis is based on an ongoing research project, joint with the Atlanta and Cleveland Federal Reserve Banks, on how businesses set prices and the extent of passthrough of cost increases. In particular, we leverage the qualitative portion of the study based on open-ended interviews with senior decision-makers on how they approach pricing decisions in their firms. Rather than a uniform approach, a very nuanced picture emerges of businesses trying to balance competing objectives while keeping an eye on demand conditions for their products as well as on their direct competitors’ behavior in the market.",T10
338,"A <a href=""https://libertystreeteconomics.newyorkfed.org/2012/10/is-us-monetary-policy-seasonal/"" rel=""noreferrer noopener"" target=""_blank"">2012 <em>Liberty Street Economics</em> post</a> noted that U.S. monetary policy exhibits a surprising degree of seasonal behavior: over the 1987-2008 period, the Federal Reserve was much more likely to lower interest rates (or abstain from raising rates) in the first month of each quarter than in the two subsequent months. Thirteen years later, we revisit that analysis to investigate whether the seasonal pattern in monetary policy still holds today, in the wake of a rate hiking cycle, a pandemic, a surge in inflation, and a second round of rate hikes. We find that the pattern has indeed continued; however, unlike in the earlier sample period, it can be completely explained by the timing of the FOMC calendar.",T10
339,"In a <a href=""https://libertystreeteconomics.newyorkfed.org/u-s-banks-have-developed-a-significant-nonbank-footprint"">previous post</a>, we documented how, over the past five decades, the typical U.S. bank has evolved from an entity mainly focused on deposit taking and loan making to a more diversified conglomerate also incorporating a variety of nonbank activities. In this post, we show that an important driver of the evolution of this new organizational form is the desire of banks to efficiently manage liquidity needs.<br />",T3
340,"<br />In light of the rapid growth of nonbank financial institutions (NBFIs), many have argued that bank-led financial intermediation is on the decline, based on the traditional notion that banks operate to take in deposits and make loans. However, we argue that deposit-taking and loan-making have not accurately characterized U.S. banking operations in recent decades. Instead, as we propose in this post, absent regulatory restrictions, banks naturally expand their boundaries to include NBFI subsidiaries. A significant component of the growth of NBFIs has in fact taken place <em>inside </em>the boundaries of banking firms.",T3
341,"In 2025, the Federal Reserve has cut interest rates, trade policy has shifted abruptly, and economic policy uncertainty has increased. How have these developments affected the functioning of the key U.S. Treasury securities market? In this post, we return to some familiar metrics to assess the recent behavior of Treasury market liquidity. We find that liquidity briefly worsened around the April 2025 tariff announcements but that its relation to Treasury volatility has been similar to what it was in the past.",T10
342,"Bank failures and distress can be costly to the economy, causing losses to creditors and reducing the flow of credit and other financial intermediation services. Thus, there is significant value in being able to identify “at risk” banks in a timely and accurate way. In a <a href=""https://libertystreeteconomics.newyorkfed.org/2025/09/economic-capital-a-new-measure-of-bank-solvency/"" rel=""noreferrer noopener"" target=""_blank"">previous post</a>, we presented a new solvency metric, Economic Capital, and showed how solvency risks in the U.S. banking industry have evolved over time according to this measure. In this post, we continue to draw on our recent <a href=""https://www.newyorkfed.org/research/staff_reports/sr1144.html"" rel=""noreferrer noopener"" target=""_blank"">Staff Report</a> to present analysis showing that Economic Capital identifies failing banks earlier and more accurately than more conventional solvency measures.",T3
343,"As in previous years, we provide in this post an update on the vulnerability of the U.S. banking system based on four analytical models that capture different aspects of this vulnerability. We use data through 2025:Q2 for our analysis, and also discuss how the vulnerability measures have changed since our last update <a href=""https://libertystreeteconomics.newyorkfed.org/2024/11/banking-system-vulnerability-2024-update/?_ppp=6960e497ee"">one year ago</a>.",T3
344,"After the Great Financial Crisis, the European Central Bank (ECB) extended its monetary policy toolbox to include the use of long-term loans to banks at interest rates close to zero or even negative. These central bank interventions were aimed at supporting the transmission of expansionary monetary policy and likely played a crucial role in bolstering the financial stability of the euro area, namely by reducing the chance of bank runs. However, quantitative evidence on the effects of these interventions on financial stability remains scant. In this post, we quantify the effectiveness of central bank lending programs in supporting financial stability through the lens of a novel structural model discussed in this <a href=""https://papers.ssrn.com/sol3/papers.cfm?abstract_id=3708226"">paper</a>.",T3
345,"Every state in the country has a law permitting involuntary hospitalization if a person presents a danger to themselves or others as a result of mental illness. If a person reaches this high bar, the logic goes, they should be confined in a psychiatric hospital for treatment until they are stabilized. (The process is also sometimes called involuntary commitment, involuntary psychiatric hold, or sectioning.) Although there is no definitive national accounting, it is estimated that about 1.2 million involuntary psychiatric hospitalizations occur every year (<a href=""https://psychiatryonline.org/doi/10.1176/appi.ps.201900477"">Lee and Cohen 2021</a>). This puts the magnitude on par with the 1.2 million individuals imprisoned in state, federal, and military prisons every year (<a href=""https://bjs.ojp.gov/library/publications/prisoners-2021-statistical-tables"">Carson 2022</a>). In a new <a href=""https://www.newyorkfed.org/research/staff_reports/sr1158.html"">Staff Report</a>, we use data from Allegheny County, which includes Pittsburgh, to measure how psychiatric commitments are impacting an individual’s risk of danger to themselves or others, earnings, and housing.",T1
346,"Uncertainty is a key component of everyday economic decisions of consumers and, perhaps not surprisingly, it plays a central role in economic models. According to economic theory, forward-looking consumers rely on their expectations and perceived uncertainty when making economic decisions. Nevertheless, measuring the uncertainty that households actually perceive, and how it affects consumer behavior, is challenging. The probabilistic nature of the <a href=""https://www.newyorkfed.org/microeconomics/sce"" rel=""noreferrer noopener"" target=""_blank"">Survey of Consumer Expectations</a> enables us to make progress on this subject and to construct household-specific time-varying uncertainty. In our recent <a href=""https://www.newyorkfed.org/research/staff_reports/sr1148"" rel=""noreferrer noopener"" target=""_blank"">Staff Report</a>, we empirically show that the marginal propensity to consume (MPC) is increasing and concave in perceived uncertainty. This novel empirical evidence poses a challenge for the conventional consumption-savings model with incomplete markets.",T13
347,"In <a href=""https://libertystreeteconomics.newyorkfed.org/2024/09/end-of-month-liquidity-in-the-treasury-market/"" rel=""noreferrer noopener"" target=""_blank"">a 2024 post</a>, we showed that interdealer trading in benchmark U.S. Treasury notes and bonds concentrates on the last trading day of the month, likely due to passive investment funds’ turn-of-month portfolio rebalancing. In this post, we extend our trading activity analysis to the full range of Treasury securities and market segments. We find that trading is even more concentrated on the last trading day of the month for other types of Treasury securities and in the dealer-to-customer segment of the market, with trading volume in off-the-run Treasuries twice as high as on other days, on average.",T5
348,"Recently instituted rule amendments have initiated a large migration of dealer-to-client Treasury repurchase trades to central clearing. To date, the main avenue used to access central clearing is Sponsored Service, a clearing product that has, until now, received little attention. This post highlights the results from <a href=""https://www.newyorkfed.org/research/staff_reports/sr1140"">a recent Staff Report</a> which presents a deep dive into Sponsored Service. Here, we summarize the description of the institutional details of this service and its costs and benefits. We then document some basic facts on how market participants use this service, based on confidential data.",T6
349,"The term “exorbitant privilege” emerged in the 1960s to describe the advantages derived by the U.S. economy from the dollar’s status as the de facto global reserve currency. In this post, we examine the exorbitant privilege that accrued to the Netherlands in the eighteenth century, when the Dutch guilder enjoyed global <a href=""https://www.ijcb.org/journal/ijcb16q4a2.pdf"">reserve currency</a> status. We show how the private actions of financial institutions created and maintained this privilege, even in the absence of a central bank. While privilege benefited the Dutch financial system in many ways, it also laid the seeds of later financial crisis.",T3
350,Silver Point partner writes that serial acquirers can overstate growth and camouflage costs.,T6
351,"MetLife completes acquisition of PineBridge Investments. Also, Flashpoint wraps up latest growth debt fund. Here's today's brief for our valued subscribers only.",T6
352,"Credit managers have been experimenting with AI in 2025, with many expecting it will become an integral part of the private credit landscape in the near future.",T2
353,"The private asset-based finance market has been expanding rapidly and is now larger than all other private credit markets, with economic trends signalling it will grow even more quickly in 2026.",T12
354,Firms are bifurcating towards either serving large private equity-backed deals or looking at more niche specialist concerns in order to stand out in a competitive market.,T6
355,A crucial year for private debt could mark a turning point in its history.,T12
356,"The third vintage is more than halfway to its $5bn target fundraise, filings show.",T13
357,"Staff suggests there is potential for stress in private credit, amid higher default rates and potential for higher PIK.",T12
358,"Fund closed for growth debt investments in Asia-Pacific. Also, private credit unitranche spreads narrowing. Here's today's brief for our valued subscribers only.",T12
359,London-based manager’s new open-ended global interval fund focuses on synthetic risk transfer and capital relief.,T6
360,U.S. national debt reaches new high of $38.5 trillion,T10
361,"Infinex revises fundraising structure, replaces $5 million raise plan with fair allocation model",T6
362,Here’s why bitcoin and major tokens are seeing a strong start to 2026,T0
363,XRP rockets 11% to nearly $2.40 as Ripple-linked ETFs see highest trading volumes,T0
364,Sui outperforms bitcoin and ether as Mysten Labs promotes privacy tech,T8
365,Dogecoin 2x ETF tops early 2026 leaderboard as DOGE prints V-shaped rebound,T0
366,"XRP's 9% surge leads crypto as bitcoin climbs to 6-week high near $95,000",T0
367,"A few Republicans have crypto's destiny in their hands at the SEC, CFTC",T8
368,Famed Coinbase backer Fred Wilson predicts 2026 UX pivot for crypto,T0
369,"Filecoin surges 6%, outperforms wider crypto markets",T0
370,"Tom Lee calls for new bitcoin record in January, while warning of a volatile 2026",T0
371,BNB token ticks higher as technical upgrades frame tight price compression,T0
372,Goldman Sachs sees regulation driving next wave of institutional crypto adoption,T3
373,Robinhood leaning into advanced traders as crypto volatility reshapes user behavior,T0
374,Bitcoin rally masks fragile liquidity as spot volumes hit year-long lows,T0
375,"Bitcoin eyes $94,000 as crypto prices manage early U.S. gains for second straight session",T0
376,Japan’s finance minister says she supports crypto trading at stock exchanges,T8
377,Crypto traders can now speculate on housing prices through Polymarket,T0
378,"Starknet back online after four-hour outage, warns some transactions may be affected",T1
379,"<p>In the last year alone, IRS-CI identified more than $10 billion in financial crime, executed over 1400 warrants, seized hundreds&#8230;</p>
<p>The post <a href=""https://www.chainalysis.com/blog/how-irs-ci-follows-the-crypto-ep-176/"">How IRS-CI Follows The Crypto: Podcast Ep. 176</a> appeared first on <a href=""https://www.chainalysis.com"">Chainalysis</a>.</p>",T8
380,"<p>※この記事は自動翻訳されています。正確な内容につきましては原文をご参照ください。 暗号資産に関する規制の動きを追っていると、2024年12月の状況が、すでにかなり前のことのように感じられます。たった12か月前と比べても、現在の世界全体の政策環境は大きく変化しました。変化のスピードは非常に速く、その勢いが弱まる兆しはほとんどありません。 そこで2026年に入る前に、2025年に起きた主な規制の変更点を振り返ります。グローバル全体の流れ、地域ごとの動き、そして2026年に特に注目されるトピックについて整理します。より詳しい背景や分析は、チェイナリシス Road to Crypto Regulation シリーズと2025 Geography of Cryptocurrency Reportをご覧ください。 世界の視点から見る、デジタル資産政策「5つの大きな流れ」 1. 規制導入の進捗と、運用段階での摩擦・課題 ここ数年、各国・地域で、デジタル資産を対象とする包括的な規制枠組みの整備が進んできました。進み具合に差はあったものの、全体としては大きな前進が見られました。ただし、その進展は国や地域により不均一でした。 2025年になり、「法律を作る段階」から「実際に運用・実装する段階」に移行すると、その実装プロセス自体が、立法（法律を作ること）と同じくらい、政治的にも実務的にも複雑であることが明らかになりました。 EU ではMiCA（Markets in&#8230;</p>
<p>The post <a href=""https://www.chainalysis.com/blog/2025-crypto-regulatory-round-up-japanese/"">2025年暗号資産規制の総括と今後の論点</a> appeared first on <a href=""https://www.chainalysis.com"">Chainalysis</a>.</p>",T13
381,"<p>For observers of crypto regulation, December 2024 feels like a long time ago. The global policy landscape today looks markedly&#8230;</p>
<p>The post <a href=""https://www.chainalysis.com/blog/2025-crypto-regulatory-round-up/"">2025 Crypto Regulatory Round-Up: What Changed and What’s Ahead</a> appeared first on <a href=""https://www.chainalysis.com"">Chainalysis</a>.</p>",T8
382,"<p>TL;DR AI and blockchain technologies are converging to create autonomous financial systems where AI provides the decision-making layer and blockchain&#8230;</p>
<p>The post <a href=""https://www.chainalysis.com/blog/ai-and-crypto-agentic-payments/"">The Convergence of AI and Cryptocurrency: From Digital Transactions to Agentic Payments</a> appeared first on <a href=""https://www.chainalysis.com"">Chainalysis</a>.</p>",T2
383,"<p>Following the Money is a Q&#38;A series that spotlights how Chainalysis customers use our products in the real world —&#8230;</p>
<p>The post <a href=""https://www.chainalysis.com/blog/following-the-money-with-chainalysis-clement-santerre-meria/"">Following the Money with Chainalysis: 9 Questions for Clément Santerre</a> appeared first on <a href=""https://www.chainalysis.com"">Chainalysis</a>.</p>",T8
