id,text,topic_id
374,<p>※この記事は自動翻訳されています。正確な内容につきましては原文をご参照ください。 暗号資産サービスから2025年上半期だけで21億7000万ドル以上が盗まれるなど、分散型金融（DeFi）およびWeb3プロトコルをハッカー、運用上の不具合、ガバナンス攻撃、金融的な不正から守ることがこれまで以上に急務となっています。これには、積極的な予防、データセキュリティ基盤、ツール整備、エコシステム全体での連携への継続的な投資が必要です。 統一された防御体制：チェーン・開発者・エンドユーザーの保護 当社はエコシステムを強化するため、ブロックチェーン財団と連携し、チェーン自体のセキュリティ強化だけでなく、各ネットワーク上でプロトコルを構築する開発者に特化したHexagateの無料提供も行っています。 Hexagateとは？リアルタイムのオンチェーンセキュリティレイヤー Hexagateはオンチェーン環境向けのランタイムセキュリティプラットフォームで、進行中の攻撃を検知し、損失が発生する前にチームが対策を講じられるよう支援します。従来のサイバーセキュリティがサーバーやクラウドを守るのに対し、Hexagateはスマートコントラクト、トランザクション、オンチェーン資産を守る、従来型ツールがカバーできない領域のためのソリューションです。 &#160; チェーン向け：インフラ一貫性の確保 チェーンのセキュリティ担当者は、インフラやトレジャリーの保護という重要かつ複雑なミッションに直面しています。主要なブロックチェーンでは、エンドツーエンドのオンチェーンセキュリティ確保のためにHexagateを導入し、以下のような保護を実現しています。 リアルタイム脅威インテリジェンス：新たな攻撃ベクトルを即座に把握 エコシステム全体のモニタリング：オンチェーン活動を包括的に監視 ウォレット侵害検知：運用ウォレットやトレジャリーウォレットの侵害を早期に特定 リスク自動低減：エクスプロイトを未然に防ぎ、ブロックチェーンネットワークの健全性を維持するツール 当社は、Base、Avalanche、Plasma、MegaETH、Polygon、Cronos、Immutableなど、業界のリーダーと提携できていることを誇りに思います。 開発者向け：無料AI搭載プロトコル保護 Web3プロトコルの構築には多大な労力がかかります。開発者は、プロダクトの革新、優れたユーザー体験、持続可能なトークノミクス、効率的なオンボーディング、大規模なスケーリングなど、複雑な課題のバランスを常に求められます。 しかし、その全ての基盤となるのがセキュリティです。セキュリティは最も重要かつ困難なフロンティアであり、1件のエクスプロイトが甚大な経済的損失やユーザーの信頼喪失に直結します。 ブロックチェーン財団との戦略的パートナーシッ,T1
375,"<p>※この記事は自動翻訳されています。正確な内容につきましては原文をご参照ください。 要約 北朝鮮のハッカーが2025年に暗号資産を20.2億ドル盗み、前年比51%増加、累計被害総額は67.5億ドルに到達。攻撃件数は減少傾向。 北朝鮮は、IT労働者を暗号資産サービス内部に配置したり、経営層を標的とした高度ななりすまし手法を用いるなど、少ない件数で巨額の盗難を実現している。 北朝鮮は、中国語系のマネーロンダリングサービスやブリッジサービス、ミキシングプロトコルを好んで利用し、大規模な窃盗後は約45日間で資金洗浄を完了させる傾向がある。 2025年、個人ウォレットの侵害は15万8,000件に急増し、被害者は8万人に達したが、被害総額（7億1,300万ドル）は2024年から減少した。 分散型金融（DeFi）における預かり資産（TVL）は増加したが、2024～2025年のハッキング被害額は抑制されており、セキュリティ対策の強化が効果を発揮している可能性が示唆される。 暗号資産エコシステムは2025年も厳しい1年となり、盗難被害額は増加傾向が続きました。当社の分析からは、暗号資産盗難のパターンが変化していることが明らかになり、主な変化は以下の4点です。北朝鮮（DPRK）が依然として最大の脅威であること、中央集権型サービスへの個別攻撃が深刻化していること、個人ウォレットの被害が急増していること、そして分散型金融（DeFi）ハッキングのトレンドが従来と異なる動きを見せていることです。 これらの傾向はデータから明確に読み取れ、さまざまなプラットフォームや被害者層で暗号資産盗難の様相が大きく変化していることが分かります。デジタルアセットの普及が進み、資産価値が新たな高みに到達する中で、進化するセキュリティ脅威を理解することがますます重要となっています。 全体像：2025年に34億ドル以上が盗難被害 2025年1月から12月初旬までの間に、暗号資産業界では34億ドル超の盗難被害が発生しました。そのうち、2月のBybitへの攻撃だけで15億ドルを占めています。 この総額の背後では、盗難の構成にも重要な変化が見られます。個人ウォレットの侵害による被害割合は大きく増加し、2022年の全体の7.3％から2024年には44％に拡大。2025年はBybit事件の影響が大きくなければ37％になっていたと考えられます。 一方、中央集権型サービスでは秘密鍵のハッキングによる巨額損失が発生しています。こうしたプラットフォームは豊富なリソースと専門のセキュリティチームを有していますが、根本的なセキュリティ課題により依然として脆弱です。発生頻度は低いものの（以下のグラフ参照）、一度発生すると規模が非常に大きく、2025年第1四半期の損失の88％を占めました。 盗難被害額が高止まりしていることは、一部",T1
376,"<p>TL;DR North Korean hackers stole $2.02 billion in cryptocurrency in 2025, a 51% year-over-year increase, pushing their all-time total to&#8230;</p>
<p>The post <a href=""https://www.chainalysis.com/blog/crypto-hacking-stolen-funds-2026/"">North Korea Drives Record $2 Billion Crypto Theft Year, Pushing All-Time Total to $6.75 Billion</a> appeared first on <a href=""https://www.chainalysis.com"">Chainalysis</a>.</p>",T7
377,"<p>The end of year holiday season may be a time of celebration, but for fraudsters, it’s open season. Cybercriminals take&#8230;</p>
<p>The post <a href=""https://www.chainalysis.com/blog/follow-the-fraud-how-to-protect-your-customers-this-holiday-season/"">Follow the Fraud: How to Protect Your Customers this Holiday Season</a> appeared first on <a href=""https://www.chainalysis.com"">Chainalysis</a>.</p>",T7
378,"<p>※この記事は自動翻訳されています。正確な内容につきましては原文をご参照ください。 このたび、Chainalysis のソリューションが AWS Marketplace にて提供開始となりましたので、お知らせいたします。AWS Marketplace は、Amazon Web Services（AWS）上で稼働するパートナー企業各社が提供するソフトウェア製品が多数掲載されたデジタルカタログで、ソフトウェアの検索・評価・購入・導入をスムーズに行うことができます。 また、Chainalysis は AWS ISV Accelerate Program にも参加しています。同プログラムは、AWS 上で稼働または AWS と統合するソフトウェアソリューションを提供する&#8230;</p>
<p>The post <a href=""https://www.chainalysis.com/blog/chainalysis-solutions-available-on-aws-marketplace-japanese/"">Chainalysis のソリューションが Amazon Web Services（AWS）Marketplace で提供開始</a> appeared first on <a href=""https://www.chainalysis.com"">Chainalysis</a>.</p>",T1
379,"<p>Bitcoin's tape over the past 24 hours looked engineered for crypto investors, as BTC surpassed the $90,000 threshold in the early hours of Dec. 29, only to give back those gains less than 12 hours later. Traders like TedPillows posted clown emojis alongside charts showing repeated peaks and troughs, while CryptoSeth called it &#8220;fraud commodity&#8221; [&#8230;]</p>
<p>The post <a href=""https://cryptoslate.com/bitcoins-violent-crash-cries-multi-billion-dollar-manipulation-as-on-chain-data-catches-one-market-maker-red-handed/"">Violent Bitcoin crash cries &#8220;multi-billion dollar manipulation&#8221; as on-chain data catches market maker dumping</a> appeared first on <a href=""https://cryptoslate.com"">CryptoSlate</a>.</p>",T3
380,"<p>XRP is ending 2025 with one of the most paradoxical profiles in the crypto market, thanks to record-breaking institutional inflows colliding with one of the weakest price charts. According to CoinShares data, XRP investment products attracted approximately $70.2 million in net new money in the final trading week of December. This pushed its monthly inflow [&#8230;]</p>
<p>The post <a href=""https://cryptoslate.com/xrp-is-quietly-forming-a-spring-loaded-supply-setup-that-frustrated-retail-traders-are-completely-ignoring/"">XRP is quietly forming a &#8220;spring-loaded&#8221; supply setup that frustrated retail traders are completely ignoring</a> appeared first on <a href=""https://cryptoslate.com"">CryptoSlate</a>.</p>",T3
381,"<p>This week started with a sensational screenshot shared across hundreds of breathless posts on X, and a claim designed to hit every financial nerve ending at once. A “systemically important” US bank, a silver margin call, liquidation by the exchange in the middle of the night, the Federal Reserve allegedly “forced” to pump billions into [&#8230;]</p>
<p>The post <a href=""https://cryptoslate.com/major-us-bank-blows-up-from-silver-trade-headlines-hide-the-675m-margin-shock-currently-hitting-traders/"">“Major US bank blows up from Silver trade” headlines hide the $675M margin shock currently hitting traders</a> appeared first on <a href=""https://cryptoslate.com"">CryptoSlate</a>.</p>",T3
382,"<p>Analyst and creator of the &#8216;Bitcoin Quantile Model,' Plan C, just posted a bundle of charts that pushed back on the idea of repeating cycle playbooks as Bitcoin trades around $87,661. The set frames a macro mix where business-cycle gauges remain weak while hard assets, led by gold, retain demand. That combination can change the [&#8230;]</p>
<p>The post <a href=""https://cryptoslate.com/bitcoin-traders-betting-on-cycle-history-are-risking-the-biggest-financial-mistake-of-the-decade/"">Bitcoin analyst warns of &#8220;biggest financial mistake of the decade&#8221; for those still using this common theory</a> appeared first on <a href=""https://cryptoslate.com"">CryptoSlate</a>.</p>",T3
383,"<p>Bitcoin traded near $86,800 on Monday morning after reversing its Sunday move above $90,000, as crude oil rose and gold fell. The 30-minute Bitcoin-U.S. dollar chart from TradingView shows BTC peaking around $90,000 before sliding into the U.S. morning. We saw West Texas Intermediate crude up about 1.77%, gold down about 1.74%, and a U.S. [&#8230;]</p>
<p>The post <a href=""https://cryptoslate.com/bitcoin-just-lost-90000-and-a-quiet-surge-in-energy-markets-suggests-the-pain-isnt-over/"">Bitcoin just lost $90,000, and a quiet surge in energy markets suggests the pain isn’t over</a> appeared first on <a href=""https://cryptoslate.com"">CryptoSlate</a>.</p>",T4
384,"<p>Bitmain cut prices on Bitcoin mining rigs on Dec. 23 after miner revenue per unit of hashrate fell in November. The discounts, which extend to current-generation hydro and immersion products, are landing in a cycle in which Bitcoin’s price strength has not translated into the kind of mining-margin expansion that previously drove hardware scarcity and [&#8230;]</p>
<p>The post <a href=""https://cryptoslate.com/bitmain-just-slashed-mining-rig-prices-proving-the-markets-oldest-bitcoin-rule-is-officially-dead/"">Bitmain just slashed mining rig prices, proving the market’s oldest “Bitcoin rule” is officially dead</a> appeared first on <a href=""https://cryptoslate.com"">CryptoSlate</a>.</p>",T3
385,"<p>A single corporate treasury has effectively hijacked Ethereum’s validator mechanics, executing a billion-dollar maneuver that has flipped the network’s flow data from a steady exodus to a sudden traffic jam. For the first time in six months, the queue to stake ETH, locking up tokens to secure the blockchain in exchange for yield, significantly outstrips [&#8230;]</p>
<p>The post <a href=""https://cryptoslate.com/ethereums-massive-6-month-record-staking-queue-looks-bullish-but-one-corporate-giant-is-secretly-distorting-the-real-signal/"">Ethereum’s record staking queue looks bullish, but one corporate giant is secretly distorting the real signal</a> appeared first on <a href=""https://cryptoslate.com"">CryptoSlate</a>.</p>",T3
386,"<p>Bitcoin miners produced block 929,699 on Dec. 27. What if that was the signal for a New Year’s moment, rather than our traditional calendar? The pitch is that block height, the ordered count of blocks every full node can verify, can act as a calendar layer for a market that trades and settles across jurisdictions. [&#8230;]</p>
<p>The post <a href=""https://cryptoslate.com/what-if-bitcoin-blocks-signaled-the-new-year-it-creates-global-unity-but-traps-every-holder-in-a-tax-nightmare/"">New Year&#8217;s Eve based on BTC block time not astronomy &#8211; introducing Universal Bitcoin Time</a> appeared first on <a href=""https://cryptoslate.com"">CryptoSlate</a>.</p>",T3
387,"<p>Coinbase said a former customer support agent was arrested in India as investigators probe a breach tied to insider bribery and customer data theft. Chief Executive Officer Brian Armstrong said on Dec. 27 that the arrest involved a former support agent and thanked Hyderabad Police for assistance in the ongoing investigation. The update puts attention [&#8230;]</p>
<p>The post <a href=""https://cryptoslate.com/coinbase-reveals-arrest-in-the-355-million-insider-extortion-scheme-that-targeted-nearly-70000-customers/"">Coinbase claims arrest in the $355 million insider extortion scheme that targeted nearly 70,000 customers</a> appeared first on <a href=""https://cryptoslate.com"">CryptoSlate</a>.</p>",T7
388,"<p>Ethereum’s 2026 roadmap centers on two tracks: expanding rollup data capacity through blobs while pushing base-layer execution higher through gas limit changes. Those gas limit changes depend on validators moving from re-executing blocks to verifying ZK execution proofs. The first track is already anchored by Fusaka, which shipped Dec. 3, 2025. Fusaka Fusaka sets up [&#8230;]</p>
<p>The post <a href=""https://cryptoslate.com/ethereums-2026-roadmap-includes-a-validator-risk-that-is-bigger-than-you-think-to-deliver-the-massive-throughput-gains/"">Ethereum’s 2026 roadmap includes this validator risk that&#8217;s bigger than you think</a> appeared first on <a href=""https://cryptoslate.com"">CryptoSlate</a>.</p>",T3
389,"<p style=""float: right; margin: 0 0 10px 15px; width: 240px;""><img alt=""Lighter’s LIT tokenomics split DeFi as Polymarket bets top $74M"" src=""https://images.cointelegraph.com/images/528_aHR0cHM6Ly9zMy5jb2ludGVsZWdyYXBoLmNvbS91cGxvYWRzLzIwMjUtMDkvMDE5OTU5ZjItYjRhMy03NmNkLTlkYjUtNzczN2UzYjczY2Q4.jpg"" /></p><p>Lighter’s LIT token launch sparked debate over insider ownership, while prediction markets and whale trades revealed divided expectations around valuation.</p>",T3
390,"<p style=""float: right; margin: 0 0 10px 15px; width: 240px;""><img alt=""Bitcoin’s $90K rejection: Is BTC's digital gold narrative losing to bonds?"" src=""https://images.cointelegraph.com/images/528_aHR0cHM6Ly9zMy5jb2ludGVsZWdyYXBoLmNvbS91cGxvYWRzLzIwMjUtMTIvMDE5YWY0NDQtNDdkYi03MWFiLThhM2UtZWMyZjQyNmE5YjRj.jpg"" /></p><p>Bitcoin's recovery relied on a shift toward the ""digital gold"" narrative, but global growth risks and strong equity markets have delayed that breakout.</p>",T3
391,"<p style=""float: right; margin: 0 0 10px 15px; width: 240px;""><img alt=""$11B Bitcoin whale sells $330M ETH, opens massive $748M longs in top cryptos"" src=""https://images.cointelegraph.com/images/528_aHR0cHM6Ly9zMy5jb2ludGVsZWdyYXBoLmNvbS91cGxvYWRzLzIwMjUtMTIvMDE5YjZlNWQtMTY4Ni03YzRmLWE0OWItMmVlYTQ2N2ViOWI5LmpwZw==.jpg"" /></p><p>An $11 billion Bitcoin whale is betting hundreds of millions of dollars on price increases of Bitcoin, Ether and Solana, while ""smart money"" traders remain net short on leading tokens.</p>",T3
392,"<p style=""float: right; margin: 0 0 10px 15px; width: 240px;""><img alt=""Spot XRP ETFs maintain 29-day inflow streak despite turbulent December"" src=""https://images.cointelegraph.com/images/528_aHR0cHM6Ly9zMy5jb2ludGVsZWdyYXBoLmNvbS91cGxvYWRzLzIwMjUtMTIvMDE5YjZlOGQtYjNkMS03NmJhLTk3OTctODM4ODIyZDQyYWRhLmpwZw==.jpg"" /></p><p>US-listed XRP ETFs continued to draw steady inflows through December, even as Bitcoin and Ether funds posted sharp monthly outflows.</p>",T3
393,"<p style=""float: right; margin: 0 0 10px 15px; width: 240px;""><img alt=""Metaplanet adds $450M in late-December buys, ending 2025 above 35,000 BTC"" src=""https://images.cointelegraph.com/images/528_aHR0cHM6Ly9zMy5jb2ludGVsZWdyYXBoLmNvbS91cGxvYWRzLzIwMjUtMTIvMDE5YjZlNDgtMmJmNy03OTFkLWI4ZTktYzU3ZDYwMzhmMzk5LmpwZw==.jpg"" /></p><p>Metaplanet added 4,279 BTC to take its treasury to 35,102 BTC, as its Bitcoin Income Generation business beat forecasts.</p>",T3
394,"<p style=""float: right; margin: 0 0 10px 15px; width: 240px;""><img alt=""Store of value demand, regulatory clarity to drive 2026 bull market: Grayscale"" src=""https://images.cointelegraph.com/images/528_aHR0cHM6Ly9zMy5jb2ludGVsZWdyYXBoLmNvbS91cGxvYWRzLzIwMjUtMDcvMDE5ODJmNjQtMGRkYy03NWUyLWFmNGUtNjZhNzU2NmY4ZGY4.jpg"" /></p><p>Grayscale said macro pressure and clearer US regulations are setting the stage for crypto’s next bull market in 2026.</p>",T3
395,"<p style=""float: right; margin: 0 0 10px 15px; width: 240px;""><img alt=""Rep Waters demands SEC oversight hearing about its approach to crypto"" src=""https://images.cointelegraph.com/images/528_aHR0cHM6Ly9zMy5jb2ludGVsZWdyYXBoLmNvbS91cGxvYWRzLzIwMjUtMTIvMDE5YjZkNWYtNWRkZC03OTg3LTlhYzgtODJhZjU3MGJjMDIyLmpwZw==.jpg"" /></p><p>Democrat Maxine Waters demands an SEC oversight hearing after the agency dropped major cases against Coinbase, Binance, and other crypto firms.</p>",T7
396,"<p style=""float: right; margin: 0 0 10px 15px; width: 240px;""><img alt=""Bitcoin long-term hodlers finally halt selloff as ETH whales accumulate"" src=""https://images.cointelegraph.com/images/528_aHR0cHM6Ly9zMy5jb2ludGVsZWdyYXBoLmNvbS91cGxvYWRzLzIwMjUtMTIvMDE5YjZkNTQtMGVkMC03ZDY0LTkzNjctMjc3ZmMyMjg4ZmE2LmpwZw==.jpg"" /></p><p>Bitcoin selling pressure from long time hodlers is finally abating and Ether whales are adding to their holdings. Markets remain bearish, however.</p>",T3
397,"<p style=""float: right; margin: 0 0 10px 15px; width: 240px;""><img alt=""Iranian protests over currency collapse show why Bitcoin's needed: Bitwise CEO"" src=""https://images.cointelegraph.com/images/528_aHR0cHM6Ly9zMy5jb2ludGVsZWdyYXBoLmNvbS91cGxvYWRzLzIwMjUtMTIvMDE5YjZkNjgtZTY1Zi03MTcyLTk2NGMtOGI0MzM2YTU1NTE5LkpQRw==.jpg"" /></p><p>Widespread protests took place in Iran’s capital after the rial slid to record lows, prompting Bitwise CEO Hunter Horsley to argue Bitcoin could help Iranians protect their savings.</p>",T3
398,"<p style=""float: right; margin: 0 0 10px 15px; width: 240px;""><img alt=""Is Bitcoin’s 4-year cycle broken — and if so, where to next?"" src=""https://images.cointelegraph.com/images/528_aHR0cHM6Ly9zMy5jb2ludGVsZWdyYXBoLmNvbS91cGxvYWRzLzIwMjUtMTIvMDE5YjRlNmItZDY3NC03YTZmLThiZDQtY2UxMjE1NGRhZjRiLmpwZw==.jpg"" /></p><p>Analysts are split on whether Bitcoin’s typical four-year cycle has ended in 2025, with institutional ETFs and regulatory shifts cited as key factors.</p>",T3
399,"<p style=""float: right; margin: 0 0 10px 15px; width: 240px;""><img alt=""Australia’s search ID goes into force, Ireland lobbies to ban anonymity"" src=""https://images.cointelegraph.com/images/528_aHR0cHM6Ly9zMy5jb2ludGVsZWdyYXBoLmNvbS91cGxvYWRzLzIwMjUtMTIvMDE5YjZjODEtODk4Ni03ZDRkLTgxYjQtYjg1ZTdiNDY5Njg3LmpwZw==.jpg"" /></p><p>America has recently taken steps to dissuade foreign governments from censoring US-based platforms, including the proposed GRANITE Act and sanctions against five EU officials.</p>",T7
400,"<p style=""float: right; margin: 0 0 10px 15px; width: 240px;""><img alt=""ZachXBT links fake Coinbase support scam to $2M in losses"" src=""https://images.cointelegraph.com/images/528_aHR0cHM6Ly9zMy5jb2ludGVsZWdyYXBoLmNvbS91cGxvYWRzLzIwMjUtMTIvMDE5YjZjNjktM2EzMS03Y2FiLTg5ZWUtMWI4ODA3NGI0ZTAwLmpwZw==.jpg"" /></p><p>An Investigation from ZachXBT traced the suspect through posts gloating on social media and Telegram activity.</p>",T7
401,"<p style=""float: right; margin: 0 0 10px 15px; width: 240px;""><img alt=""Tech giant to launch crypto wallet, fintech L1s will bomb: Dragonfly exec."" src=""https://images.cointelegraph.com/images/528_aHR0cHM6Ly9zMy5jb2ludGVsZWdyYXBoLmNvbS91cGxvYWRzLzIwMjUtMTIvMDE5YWY4MDctOGIxNy03NTZhLWIyN2QtMTczN2QyY2Q4YzUx.jpg"" /></p><p>Dragonfly’s Haseeb Qureshi predicts Big Tech and Fortune 100 companies will start building in crypto in 2026, but that corporate L1s will fail to challenge Ethereum and Solana.</p>",T7
402,"<p style=""float: right; margin: 0 0 10px 15px; width: 240px;""><img alt=""Here’s what happened in crypto today"" src=""https://images.cointelegraph.com/images/528_aHR0cHM6Ly9zMy5jb2ludGVsZWdyYXBoLmNvbS91cGxvYWRzLzIwMjUtMDYvMDE5Nzk0MjMtZWY4ZS03YzYwLWI5MzctYjlkZGY3NWZlOGFk.jpg"" /></p><p>Need to know what happened in crypto today? Here is the latest news on daily trends and events impacting Bitcoin price, blockchain, DeFi, NFTs, Web3 and crypto regulation.</p>",T3
403,"<p style=""float: right; margin: 0 0 10px 15px; width: 240px;""><img alt=""Onchain perpetual futures drive surge in crypto derivatives activity"" src=""https://images.cointelegraph.com/images/528_aHR0cHM6Ly9zMy5jb2ludGVsZWdyYXBoLmNvbS91cGxvYWRzLzIwMjUtMTIvMDE5YjJjMWItYjc2Yi03M2VjLTkxMzgtYzE3Yzg1M2FhZjUyLmpwZw==.jpg"" /></p><p>According to Coinbase researcher David Duong, decentralized platforms and shifting trader behavior have pushed perpetual futures into a more central market role.</p>",T3
404,"<p style=""float: right; margin: 0 0 10px 15px; width: 240px;""><img alt=""Flow scraps rollback plan after pushback over decentralization, security"" src=""https://images.cointelegraph.com/images/528_aHR0cHM6Ly9zMy5jb2ludGVsZWdyYXBoLmNvbS91cGxvYWRzLzIwMjUtMTIvMDE5YjZiOTgtZjJmNC03ZWYyLWE0MjAtMDA0YTM5MTg0Yzc3LmpwZw==.jpg"" /></p><p>Recovery of assets from a $3.9 million exploit of the Flow blockchain isn't guaranteed, but many users responded positively to a change in the remediation plan.</p>",T3
405,"<p style=""float: right; margin: 0 0 10px 15px; width: 240px;""><img alt=""Tokenized stocks have ‘stablecoin moment’ as market cap hits $1.2B"" src=""https://images.cointelegraph.com/images/528_aHR0cHM6Ly9zMy5jb2ludGVsZWdyYXBoLmNvbS91cGxvYWRzLzIwMjUtMTIvMDE5YjZiN2QtZTAzNC03MjYyLWExMzAtNDIyNjk3NzAzM2M3LmpwZw==.jpg"" /></p><p>Tokenized stocks have surged to a $1.2 billion market, with insiders comparing their growth to stablecoins and DeFi’s early boom in 2020.</p>",T3
406,"<p style=""float: right; margin: 0 0 10px 15px; width: 240px;""><img alt=""South Korean lawmaker faces scrutiny over family ties to crypto exchange: Report"" src=""https://images.cointelegraph.com/images/528_aHR0cHM6Ly9zMy5jb2ludGVsZWdyYXBoLmNvbS91cGxvYWRzLzIwMjUtMTIvMDE5YjZhYzUtYmI3Ny03ZTM1LWJjYzItOGI3NjQyMTQ5MzBiLmpwZw==.jpg"" /></p><p>A key lawmaker overseeing financial institutions reportedly sought to secure a job for one of his sons at a crypto exchange while raising concerns about a competitor.</p>",T7
407,"<p style=""float: right; margin: 0 0 10px 15px; width: 240px;""><img alt=""Strategy’s latest 2025 Bitcoin purchase caps active year of accumulation"" src=""https://images.cointelegraph.com/images/528_aHR0cHM6Ly9zMy5jb2ludGVsZWdyYXBoLmNvbS91cGxvYWRzLzIwMjUtMTIvMDE5YjZhZjktODk5Ni03MjY1LWEwN2UtOTMxYTgwMTcyZTdkLmpwZw==.jpg"" /></p><p>The purchase lifts the company’s total Bitcoin holdings to 672,497 BTC and ranks among its smaller acquisitions this year compared with earlier multibillion-dollar buys.</p>",T3
408,"<p style=""float: right; margin: 0 0 10px 15px; width: 240px;""><img alt=""Why Luke Gromen is fading Bitcoin while staying bullish on debasement"" src=""https://images.cointelegraph.com/images/528_aHR0cHM6Ly9zMy5jb2ludGVsZWdyYXBoLmNvbS91cGxvYWRzLzIwMjUtMTIvMDE5YjZiNjEtMzBmMS03MGYwLWE2ZTctYTJhYjIwY2MyMGIyLmpwZw==.jpg"" /></p><p>Luke Gromen still backs debasement but is trimming Bitcoin risk as BTC lags gold, trends weaken and quantum headlines weigh on sentiment.</p>",T3
