id,text,topic_id
161,"PE firms respected Dimon's on-cycle recruiting moratorium in 2025. When the clock strikes midnight on Jan 1, it seems the practice might ramp back up.",T0
162,"Antoine Wade said everyone has the same amount of time in a day to learn about AI tools, and in this moment, everyone is competing.",T8
163,"Jared Isaacman, an astronaut and high-school dropout-turned-billionaire, has been confirmed as the new head of NASA.",T0
164,Business Insider researched over 20 new dating apps that want to help you find love.,T8
165,"Warren Buffett became a meme, built a cash mountain, and rocked the business world by announcing his retirement in 2025.",T0
166,"Jim Franck, 81, works as a homebuilder in Oregon and until recently, worked out of financial necessity. He said he has no plans to stop his risky job.",T0
167,"Google's AI told me to make pizza with glue in 2024, so I tried it. Zing! But this year, Google got the last laugh. AI overviews are pretty good.",T8
168,"From Disney's $1 billion bet on OpenAI to a wave of blockbuster acquihires, these deals reshaped the tech industry in 2025.",T0
169,It was a frenzied year in venture capital when founders with the kernel of an idea able to command huge valuations. But some VCs think the good times won't last.,T0
170,"The NYC government has begun accepting applications from homeowners who want to build an ADU, including a backyard tiny home, on their property.",T11
171,"Disney's streaming viewership share has barely budged in years. The company has plans to get engagement growth going again, though.",T0
172,"Rodin Roohipour is a 15-year-old interested in tech and venture capital. To learn about the industry, he cold emails business leaders for advice.",T0
173,FaZe Clan's influencer exodus exposes a key risk for creator-economy companies that rely directly on talent to make money.,T0
174,Doctors are seeing colon cancer in people in their 20s and 30s. New research suggests it starts in infancy.,T10
175,"Starbucks CEO Brian Niccol said a fictional café &mdash; Central Perk from ""Friends"" &mdash; guided his vision of what his stores should look like.",T0
176,A Ryanair flight to Tenerife returned to Birmingham after the plane encountered turbulence. Several passengers were injured.,T10
177,"He said this management layer drives good company culture, which is crucial for bottom-line growth.",T0
178,"Bubble or no bubble, AI won't have just one winner, says Jeffrey Katzenberg.",T8
179,"Thieves impersonated a legitimate carrier and nabbed the lobster shipment headed for Costco stores in Illinois and Minnesota CEO, Dylan Rexing said.",T7
180,"American Express leads with risk density over 70%, ahead of Capital One and Truist",T6
181,Actively managed strategies wait in the wings after systematic approach nets Calamos $500m,T5
182,"Instant settlement brings its own risks but doesn’t need to be the default, writes BridgePort’s Soriano",T6
183,CCP hits new margin record for second consecutive quarter,T3
184,Analysts say clearing meltdown bolsters case for futures-for-futures exchange with FMX,T4
185,"ALM Benchmarking research finds wide divergence in liquidity risk appetites, even among large lenders",T6
186,"Counterparty Radar: Trades under three months make up nearly 60% of total positions, up from just a third in 2022",T5
187,Custom indexes eliminate energy and food prices to ease trading of stickier inflation trends,T1
188,"Batch processing and Excel files still pervade, with only one in four lenders planning tech upgrades",T6
189,Industry warns new capital requirements for securities firms are higher than other jurisdictions,T6
190,Shifts in monetary and fiscal policy are reshaping fixed income markets,T1
191,"In the ALM Benchmarking exercise, the majority of banks have no internal tests focusing on stress horizons of less than 30 days",T6
192,"Ability to absorb $19bn liquidation event marks a turning point in market’s maturity, says LMAX Group's Jenna Wright",T6
193,"Growing private credit worries helped drive losses, but fundamentals are said not to support that view",T6
194,Substitutability overtakes complexity at US bank for first time,T6
195,Catalysing network effects and expanding non-cash VM at scale,T14
196,"Risk.net’s guide to the world’s leading quant master’s programmes, with the top 25 schools ranked",T6
197,"View interactive charts from Risk.net’s 46-bank study, covering ALM governance, balance-sheet strategy, stress-testing, technology and regulation",T6
198,Liquidity and rate risks are as old as banking; but the 46 banks in our benchmarking study have different ways to manage them,T6
199,Brokers’ own resources are outpaced by customer funds,T10
200,"Many Americans can take advantage of President Trump’s deduction on auto loan interest, but the tax break will provide only modest savings.",T1
201,"The administration has downplayed concerns — from mass job losses, to a potential financial bubble — as President Trump cheers soaring stock prices and faster growth.",T9
202,The latest vessel to be targeted by the United States in its pressure campaign on Venezuela was sending distress signals as it headed northeast from the Caribbean into the Atlantic.,T2
203,Economists say that a typical middle-class family today is richer than one in the 1960s. Americans in their 20s and 30s don’t believe it.,T1
204,"A reordering of the rules of trade, set on top of transformational change in technology, demographics and climate, is remaking jobs, politics and lives.",T10
205,"Data collection issues skewed the latest Consumer Price Index report, economists warned, clouding the picture for the Federal Reserve as it also grapples with a cooling labor market.",T1
206,"With tariffs unpopular and prices still high, the White House has teased the promise of tariff rebates and large tax refunds next year.",T1
207,The Trump administration singled out European tech firms by name and promised economic consequences Tuesday unless the E.U. rolls back tech regulation and lawsuits.,T9
208,The Trump administration looked to recast elements of a dour jobs report Tuesday as a sign of strength.,T9
209,"A proposal to revise an E.U. law requiring carmakers to stop producing combustion engines by 2035 would offer some relief to automakers, but it sets back the region’s climate goals.",T10
210,"Employers added 64,000 jobs in November, according to data delayed by the government shutdown, but the unemployment rate rose to a four-year high of 4.6 percent.",T1
211,The U.S. government has paused a tech-focused trade pledge with Britain over broader disagreements about Britain’s digital regulations and food safety rules.,T9
212,California and New York are among the states arguing that the Trump administration’s decision to charge that fee for skilled foreign workers is illegal.,T1
213,Corporate tax revenue has quickly dipped since Republicans passed tax cuts this summer. But economists think these tax breaks might be worth it.,T1
214,Fed officials explained their opposition to the central bank’s decision this week to cut interest rates by a quarter of a percentage point.,T11
215,The monthly trade deficit fell to its lowest level in five years after the president’s imposition of sweeping global tariffs. But it’s unclear whether the trend will persist.,T1
216,The president continues to brush off an issue that he said he would solve in his first months in office. Some Democrats say he is making the same mistake as his predecessor.,T9
217,"The central bank’s decision to lower interest rates for a third straight meeting was highly contentious, reflecting an internal divide that will likely limit how much borrowing costs will fall next year.",T11
218,President Trump’s decision to allow Nvidia to sell its chips to China has raised questions about whether he is prioritizing short-term economic gain over long-term American security interests.,T9
219,Silicon Valley is again betting everything on a new technology. But the mania is not a reboot of the late-1990s frenzy.,T0
220,"Chinese panels are now so affordable that businesses and families are snapping them up, slashing their bills and challenging utilities.",T9
221,Katherine Maher has taken an unyielding approach to NPR’s biggest battles — which has sometimes put her at odds with her colleagues in public media.,T10
222,"Marquee names all, they found international fame in the arts, politics, the sciences and beyond.",T0
223,"Installed as an outsider, he engineered a comeback, shifting the company’s focus from a waning mainframe computer business toward consulting and services.",T0
224,"Just like past tech booms, the latest frenzy has produced a group of billionaires — at least on paper — from smaller start-ups.",T0
225,Mr. Hassett’s evolution from conservative economist to defender of the president’s economic agenda has raised questions about how he would lead the central bank.,T14
226,The company monitors passenger feedback for risky driver behavior. Some accused of serious sexual assault had prior records of complaints.,T7
227,A growing body of research shows how pressure from overbearing coaches and parents is stunting children’s emotional well-being and leading to injuries.,T10
228,"Companies like Phoenix Tailings, which recently began producing metal in New Hampshire, are using new processing methods to compete with Chinese suppliers.",T9
229,"On a stopover in Saudi Arabia, the writer strolls along the corniche, lingers over coffee and explores the historic heart of this city on the Red Sea.",T2
230,"Under the shift, which Google said would eventually be rolled out to all users, old addresses would remain active. Messages and services would not be lost.",T8
231,"The Trump administration’s efforts to reduce the foreign-born population are being felt in hospitals and soccer leagues and on Main Streets across the country, with hints of what’s to come.",T10
232,"Riding an endless wave of nostalgia, one company is exhuming the intellectual property of midcentury designers to create new audiences for forgotten work.",T0
233,"Whoever wins faces the daunting task of feeding the West African country’s poor and navigating the interests of global powers seeking critical minerals, analysts say.",T2
234,"To avoid the ripple effects of real-time adjustments to what was predicted to be up to nine inches of snow, the major airlines said they pre-emptively canceled flights.",T9
235,A new study suggests that distressed borrowers using a simpler bankruptcy process are succeeding — and that more people like them should try.,T6
236,The political polarization of battery-powered cars may have started when Toyota released its first hybrid model 25 years ago.,T9
237,"Plus, the long-lost art of the direct confrontation.",T2
238,The National Kidney Registry has matched thousands of kidney donors with recipients. It has also paid millions of dollars to a company owned by its founder.,T2
239,"Anthony Ramos loves hanging out with customers during busy days that may find him writing a new musical, catching a friend in a show or performing in his own.",T0
240,"Armed with a quorum and GOP majority, Chair Andrea Lucas is pressing new priorities — such as dismantling DEI — that criticis say have turned the agency’s mission “on its head.”",T13
241,"One woman’s gender-swap experiment quadrupled her reach on the career platform, underscoring concerns about gender stereotypes and algorithmic bias.",T10
242,"Armed with a quorum and GOP majority, Chair Andrea Lucas is pressing new priorities — such as dismantling DEI — that criticis say have turned the agency’s mission “on its head.”",T13
243,"One woman’s gender-swap experiment quadrupled her reach on the career platform, underscoring concerns about gender stereotypes and algorithmic bias.",T10
244,"KrebsOnSecurity.com celebrates its 16th anniversary today! A huge ""thank you"" to all of our readers -- newcomers, long-timers and drive-by critics alike. Your engagement this past year here has been tremendous and truly a salve on a handful of dark days. Happily, comeuppance was a strong theme running through our coverage in 2025, with a primary focus on entities that enabled complex and globally-dispersed cybercrime services.",T12
245,"The Trump administration has pursued a staggering range of policy pivots this past year that threaten to weaken the nation’s ability and willingness to address a broad spectrum of technology challenges, from cybersecurity and privacy to countering disinformation, fraud and corruption. These shifts, along with the president’s efforts to restrict free speech and freedom of the press, have come at such a rapid clip that many readers probably aren’t even aware of them all.",T7
246,"Direct navigation -- the act of visiting a website by manually typing a domain name in a web browser -- has never been riskier: A new study finds the vast majority of ""parked"" domains -- mostly expired or dormant domain names, or common misspellings of popular websites -- are now configured to redirect visitors to sites that foist scams and malware.",T12
247,"Microsoft today pushed updates to fix at least 56 security flaws in its Windows operating systems and supported software. This final Patch Tuesday of 2025 tackles one zero-day bug that is already being exploited, as well as two publicly disclosed vulnerabilities.",T12
248,A sprawling academic cheating network turbocharged by Google Ads that has generated nearly $25 million in revenue has curious connections to a Kremlin-connected oligarch whose Russian university builds drones for Russia's war against Ukraine.,T2
249,"China-based phishing groups blamed for non-stop scam SMS messages about a supposed wayward package or unpaid toll fee are promoting a new offering, just in time for the holiday shopping season: Phishing kits for mass-creating fake but convincing e-commerce websites that convert customer payment card data into mobile wallets from Apple and Google. Experts say these same phishing groups also are now using SMS lures that promise unclaimed tax refunds and mobile rewards points.",T7
250,"A prolific cybercriminal group that calls itself ""Scattered LAPSUS$ Hunters"" made headlines regularly this year by stealing data from and publicly mass extorting dozens of major corporations. But the tables seem to have turned somewhat for ""Rey,"" the moniker chosen by the technical operator and public face of the hacker group: Earlier this week, Rey confirmed his real life identity and agreed to an interview after KrebsOnSecurity tracked him down and contacted his father.",T12
251,"On the surface, the Superbox media streaming devices for sale at retailers like BestBuy and Walmart may seem like a steal: They offer unlimited access to more than 2,200 pay-per-view and streaming services like Netflix, ESPN and Hulu, all for a one-time fee of around $400. But security experts warn these TV boxes require intrusive software that forces the user's network to relay Internet traffic for others, traffic that is often tied to cybercrime activity such as advertising fraud and account takeovers.",T0
252,"In March 2024, Mozilla said it was winding down its collaboration with Onerep -- an identity protection service offered with the Firefox web browser that promises to remove users from hundreds of people-search sites -- after KrebsOnSecurity revealed Onerep's founder had created dozens of people-search services and was continuing to operate at least one of them. Sixteen months later, however, Mozilla is still promoting Onerep. This week, Mozilla announced their partnership with Onerep will officially end next month.",T12
253,An intermittent outage at Cloudflare on Tuesday briefly knocked many of the Internet's top destinations offline. Some affected Cloudflare customers were able to pivot away from the platform temporarily so that visitors could still access their websites. But security experts say doing so may have also triggered an impromptu network penetration test for organizations that have come to rely on Cloudflare to block many types of abusive and malicious traffic.,T12
254,"With a new year upon us, software and cybersecurity experts disagree on the utility of software bill of materials — in theory, SBOMs are great, but in practice, they're a mess.",T12
255,"2025 included a number of monumental threats, from the global attacks of Salt Typhoon to dangerous vulnerabilities like React2Shell.",T10
256,"Patricia Voight, CISO at Webster Bank, shares her expertise on advancing cybersecurity careers, combating financial crimes, and championing diversity in a rapidly changing industry.",T12
257,"Developers are leaning more heavily on AI for code generation, but in 2026, the development pipeline and security need to be prioritized.",T8
258,"Take part in the new survey from Dark Reading and help uncover trends, challenges, and solutions shaping the future of application security.",T12
259,"Healthcare cyberattacks are on the rise, but industry organizations say the proposed changes to the security rules fall short of what's needed.",T12
260,"Its latest cybersecurity acquisition will help further ServiceNow's plans for autonomous cybersecurity, and building a security stack to proactively manage AI.",T12
261,"The tech giant has been beset by a deluge of state-sponsored North Korean operatives, showcasing the sheer scale of the IT worker scam problem.",T2
262,"Interpol said law enforcement across 19 countries made 574 arrests and recovered $3 million, against a backdrop of spiraling cybercrime in the region, including business email compromise, digital extortion, and ransomware schemes.",T7
263,"With attacks on the critical firewall vulnerability, WatchGuard joins a list of edge device vendors whose products have been targeted in recent weeks.",T12
264,"Telegram users in Uzbekistan are being targeted with Android SMS-stealer malware, and what's worse, the attackers are improving their methods.",T7
265,"The company suffered one sophisticated five-alarm campaign and one messy spray-and-pray attack, mere days apart.",T12
266,New China-aligned APT group is deploying Group Policy to sniff through government networks across Southeast Asia and Japan.,T2
267,"Reports of patients being cared for by unqualified home-care aides with fake identities continue to emerge, highlighting a need for more stringent identity authentication.",T2
268,"AI adds real value to cybersecurity today, but it cannot yet serve as a single security guardian. Here's how organizations can safely combine AI-driven analysis with deterministic rules and proven security practices.",T12
269,"North Korea shifted its strategy to patiently target &quot;bigger fish&quot; for larger payouts, using sophisticated methods to execute attacks at opportune times.",T2
270,"In the latest attacks against the vendor's SMA1000 devices, threat actors have chained a new zero-day flaw with a critical vulnerability disclosed earlier this year.",T12
271,Dark Reading Confidential Episode 13: Developers are exposing their organizations' most sensitive information; our guests explain why it's happening and how to stop it.,T7
272,&quot;Prince of Persia&quot; has rewritten the rules of persistence with advanced operational security and cryptographic communication with its command-and-control server.,T12
273,"Attackers are targeting admin accounts, and once authenticated, exporting device configurations including hashed credentials and other sensitive information.",T12
274,"New GPT Image 1.5 allows more detailed conversational image editing, for better or worse.",T8
275,"The extensions, available for Chromium browsers, harvest full AI conversations over months.",T8
276,Dictionary codifies the term that took hold in 2024 for low-quality AI-generated content.,T8
277,The weak RC4 for administrative authentication has been a hacker holy grail for decades.,T12
278,"Shenzhen-based Picea Robotics, its lender and primary supplier, will acquire all of iRobot’s shares.",T0
279,"""The vast majority of Codex is built by Codex,"" OpenAI told us about its new AI coding agent writing code.",T8
280,Company claims new AI model tops Gemini and matches humans on 70% of work tasks.,T8
281,"Three-year deal lets users create AI videos of Mickey Mouse, Darth Vader, and more.",T8
282,Company raises its capital expenditure forecast as it doubles down on AI infrastructure bet.,T0
283,"Devstral 2 model scores 72% on industry benchmark, nearing proprietary rivals.",T8
284,“Abandonment” offers rare chance to reclaim one of tech’s most recognized brands.,T0
285,"Facebook agrees to change ""pay or consent"" model after talks with European Commission.",T2
286,Defendants were convicted of similar crimes a decade ago. How were they cleared again?,T7
287,Open source React executes malicious code with malformed HTML—no authentication needed.,T12
288,"Report: Microsoft declared ""the era of AI agents"" in May, but enterprise customers aren't buying.",T8
289,"Researchers say there's more to the network, which has operated for 14 years.",T8
290,"Three years after Google sounded alarm bells over ChatGPT, the tables have turned.",T8
291,New research offers clues about why some prompt injection attacks may succeed.,T12
292,"Product development, internal operations among teams expected to be hit hardest.",T0
293,"Several companies are selling crypto stockpiles in effort to fund share buybacks, shore up stock prices.",T3
294,"As ordered reported by the House Committee on Foreign Affairs on December 3, 2025",T13
295,"As ordered reported by the House Committee on Foreign Affairs on December 3, 2025",T13
296,"As ordered reported by the House Committee on Foreign Affairs on December 3, 2025",T13
297,"As ordered reported by the House Committee on Foreign Affairs on December 3, 2025",T13
298,"CBO announces what to expect in the coming weeks as the agency begins the new calendar year with a series of reports that offers updated insights into the nation's demographic trends, economic outlook, and budgetary conditions.",T14
299,"As ordered reported by the Senate Committee on Commerce, Science, and Transportation on October 21, 2025",T13
300,"As ordered reported by the Senate Committee on Commerce, Science, and Transportation on October 21, 2025",T13
301,"As introduced in the House of Representatives on December 12, 2025",T13
302,"As reported by the House Committee on the Judiciary on December 12, 2025",T13
303,The Majority Leader of the House of Representatives announces bills that will be considered under suspension of the rules in that chamber. CBO estimates the effects of those bills on direct spending and revenues.,T13
304,"CBO finds that maintenance for Navy destroyers and amphibious warfare ships has often taken longer and required more labor than planned. Those delays affect the fleet's readiness and reflect aging ships, late inspections, and other factors.",T1
305,"As reported by the House Committee on Energy and Commerce on October 3, 2025",T13
306,"Rules Committee Print 119-16, As Posted on the Website of the House Committee on Rules on December 7, 2025",T13
307,"The federal budget deficit totaled $439 billion in October and November 2025, the first two months of fiscal year 2026, CBO estimates. That amount is $185 billion less than the deficit recorded during the same period last fiscal year.",T1
308,"As ordered reported by the House Committee on Oversight and Government Reform on December 2, 2025",T13
309,"As ordered reported by the House Committee on Oversight and Government Reform on 
December 2, 2025",T13
310,"As ordered reported by the House Committee on Oversight and Government Reform on December 2, 2025",T13
311,"As ordered reported by the House Committee on Oversight and Government Reform on 
December 2, 2025",T13
312,"The FRED Blog has discussed how the daily operations of the Federal Reserve Banks and, specifically, the New York Fed generally maintain the effective federal funds rate within the target range set by the Federal Open Market Committee (FOMC). As &#8230; <a href=""https://fredblog.stlouisfed.org/2025/12/tracking-recent-financial-market-conditions/"">Continue reading <span class=""meta-nav"">&#8594;</span></a>",T11
313,"Every December, retailers hire a large number of extra workers to keep up with holiday demand. Our FRED graph above shows a clear seasonal spike in the number of retail employees at the end of the year, as stores bring &#8230; <a href=""https://fredblog.stlouisfed.org/2025/12/tis-the-seasonal-a-look-at-seasonal-retail-workers/"">Continue reading <span class=""meta-nav"">&#8594;</span></a>",T1
314,"Our FRED graph above shows one of the all-star statistics for the US economy: industrial production. It&#8217;s a compelling data series for at least two reasons. It measures something people can relate to—the production of tangible stuff. The data are &#8230; <a href=""https://fredblog.stlouisfed.org/2025/12/us-industrial-production/"">Continue reading <span class=""meta-nav"">&#8594;</span></a>",T1
315,"In a previous FRED blog post, we discussed the Summary of Economic Projections (SEP) released by the FOMC this past September. In this post, we  again use ALFRED to compare the latest projections released in December 2025 with several of &#8230; <a href=""https://fredblog.stlouisfed.org/2025/12/fomc-summary-of-economic-projections-december-2025/"">Continue reading <span class=""meta-nav"">&#8594;</span></a>",T1
316,"All Federal Reserve Banks operate within a specific geographic area—called a district. The Cleveland Fed is in the Fourth District of the Federal Reserve System, which covers Ohio and parts of Pennsylvania, Kentucky, and West Virginia. The Cleveland Fed&#8217;s Survey &#8230; <a href=""https://fredblog.stlouisfed.org/2025/12/cleveland-fed-data-on-regional-economic-conditions/"">Continue reading <span class=""meta-nav"">&#8594;</span></a>",T11
