id,text,topic_id
0,“I am 66 years old and have been retired for about a year and a half.”,T2
1,"“We’re both teachers, with a combined gross income of $210,000.”",T2
2,"“I guess he thought no one would notice. It came in a gift bag, and it looked expensive.”",T2
3,Quantum stocks are where AI was five years ago — and the science actually works.,T1
4,"Sports betting is fueling today’s gambling surge, and young men are the industry’s bullseye.",T7
5,Powerful “Big Ag” — not small farmers and ranchers or even tariffs — is the root cause of the food-affordability crisis.,T2
6,These budgeting tips can ease your financial worries.,T4
7,"The latest stage in the remote work vs. in-office debate sees people arguing on TikTok and Reddit over whether to take a remote job paying $120K, or a fully in-office gig that earns $240K a year.",T6
8,Sportsbooks have been having a tough year — but the Paul-Joshua fight was a good night for the house.,T6
9,You have until Dec. 31 to take your required distribution. Consider this your wake-up call.,T12
10,U.S. productivity slows down in fourth quarter while unit labor costs accelerate,T5
11,Beyond to buy rights to Buy Buy Baby brand and reunite it with Bed Bath & Beyond,T6
12,Amazon says it had best-ever Thanksgiving Holiday week with record sales and number of items sold,T7
13,U.S. stock futures and bond yields drop on reports Putin has updated nuclear doctrine,T0
14,Charter Communications announces buyout deal for Liberty Broadband at terms above its previous proposal,T6
15,General Motors unveils new all-electric Cadillac called the Vistiq with 300-mile range,T7
16,Vestas Wind Systems stock slumps as company says margins to be at low end of guidance,T8
17,Burberry shares rise on report Moncler could bid for it,T13
18,Kazatomprom reports 17% increase in production during the third quarter,T8
19,Anheuser-Busch InBev shares slip as sales come up shy of estimates,T8
20,Wingstop’s stock slides 12% after profit falls short of estimates,T8
21,Novartis hikes sales and profit guidance for the year,T8
22,Plus500 says it will meet expectations after quarterly revenue climbs 11%,T8
23,Trainline boosts guidance for the second time this year,T8
24,Barclays reports 18% profit rise as it lifts income guidance,T8
25,"London Stock Exchange Group says income grew, led by Tradeweb",T13
26,Elon Musk says Tesla's automated software will allow its passengers to text in certain conditions.,T6
27,"Although shoppers are still bargain-hunting, fewer people headed to the high streets and shopping centres compared with last year.",T2
28,"Trade unionist Paul Nowak says he wants to see the ""closest possible"" economic relationship with the EU.",T5
29,The huge embroidery will be covered under the government's indemnity scheme when it travels to the UK.,T13
30,"Imran Ahmed was among five people accused of seeking to ""coerce"" US firms into censoring free speech.",T6
31,Passengers travelling on Christmas Eve are forecast to be the highest on record.,T7
32,BP has sold a 65% stake in its motor lubricant arm Castrol to US-based investment firm Stonepeak.,T13
33,Family feuds and strategic change are redefining who holds power inside the Murdoch empire.,T2
34,Strong consumer spending helps the US economy grow at a faster rate than expected.,T5
35,"David Jones believes it will permit too many risks, but the government calls it a proportionate approach.",T5
36,The government has now said it will lift the intended threshold from £1m to £2.5m.,T8
37,"Denise Coates, the founder and chief executive of Bet365, is consistently one of Britain's highest-paid bosses.",T1
38,The Trump administration bans five people who have called for tech regulation from entering the country.,T2
39,The adverts for prescription-only drugs showed healthcare professionals impersonating the British retailer.,T11
40,Mr and Mrs Wadley's 19-year-old son has asthma and cannot come home for Christmas due to mould all over the walls.,T6
41,Donald Trump is due to name a new leader of the Federal Reserve at a tricky moment.,T9
42,The firm’s chief security officer said North Koreans tried to apply for remote working IT jobs using stolen or fake identities.,T11
43,Finding greener ways to keep giant new data centres cool is a challenge.,T1
44,The festive events help to put cities on the map and attract millions of tourists.,T6
45,Introducing robots and automation to the food industry involves extra hurdles.,T6
46,Mexican Senator Armando Rios Piter told CNN that he plans to introduce a bill this week that would stop Mexican purchases of American corn.,T12
47,The days of plugging in an iPhone to charge won't last forever.,T0
48,"Nandan Nilekani, co-founder of one of India's biggest outsourcing companies, says an H-1B visa crackdown would ultimately hurt the U.S.",T0
49,The market is at all-time highs and many say Trump is the reason. But stocks were rallying when investors thought Hillary Clinton would win. Janet Yellen and the Fed may deserve more of the credit for the market's move.,T0
50,Apple stock is less than $1 away from its all-time high amid renewed optimism for the iPhone.,T8
51,President-elect Donald Trump focuses his criticism of NAFTA on Mexico. But Canada and America have a rocky trade history too.,T5
52,"Verizon has decided to bring back unlimited data plans. But while that's great for its subscribers, it's awful news for investors. It's another sign of how brutally competitive the telecom business is. And it's hurting Verizon's stock.",T6
53,The price of crude oil has more than doubled over the past year after bottoming out at $26 per barrel in February 2016.,T0
54,The automaker announced Monday that its first official venture in the oil-rich Middle East will be in the United Arab Emirates.,T6
55,Uber's top rival in India has some unsolicited advice for the U.S. startup: Go local.,T6
56,"Apple CEO Tim Cook wants the tech industry to take action against ""fake news"" stories that are polluting the web.",T6
57,"Sears Holdings, the company that owns retail stores Sears and Kmart, said this weekend that it would remove 31 Trump-branded items from its website.",T2
58,"Universal Biopack makes packaging that it sells to restaurants and manufacturers. But rather than plastic, it uses a mixture of bamboo and cassava.",T10
59,"Nike on Sunday launched a star-studded short film titled ""Equality"" that coincides with Black History Month.",T6
60,"Treasury secretary pick Steven Mnuchin is an executive producer on Warner Bros.' ""The Lego Batman Movie,"" which pulled in an estimated $55.6 million from U.S. audiences during its opening weekend.",T7
61,"It may seem like a recurring nightmare, but Greece is in danger of running out of money again.",T0
62,"Hong Kong’s finance chief has struck an upbeat tone about the city’s economic outlook for 2026, while forecasting that growth this year will accelerate to 3.2 per cent, surpassing earlier projections.
Financial Secretary Paul Chan Mo-po said the optimistic outlook was mainly supported by anticipated growth in mainland China and Asia along with interest rate cuts.
“Looking ahead to next year, Hong Kong’s economy is expected to maintain its positive momentum. The market generally anticipates that...",T7
63,"Brigitte Bardot, the French actress who set the standard for a generation of female sex symbols in the 1960s and devoted her later life to animal rights, has died. She was 91.
Agence France-Presse reported her death on Sunday, citing a statement from her foundation that didn’t provide details.
The archetype of beauty to millions of men, Bardot spawned an era of curvy, pouting, insouciant actresses with her role as a self-assured small-town sexpot in And God Created Woman (1956). Throughout the...",T10
64,"Saudi Arabia has pledged to boost investments in America to nearly US$1 trillion, but according to analysts Riyadh could struggle to meet that target.
Rather, they said the pledge – announced when Crown Prince Mohammed bin Salman visited Washington last month – was more about the “political display” than a binding commitment.
It was an increase to the US$600 billion that was promised in May, when US President Donald Trump visited Riyadh.
The latest pledge comes as the rivalry intensifies between...",T5
65,"A paralysed Chinese man who can move only one finger and one toe has successfully developed a smart farm control system and founded a start-up.
The determination of Li Xia, who is reliant on a ventilator, has deeply moved countless people across China.
Li, 36, from Chongqing in southwestern China, was diagnosed with muscular dystrophy at the age of five. He was forced to drop out of school in the fifth grade.
Since then, studying kept him going.

He was most fascinated by physics and computer...",T10
66,"More than 650 Hongkongers on group tours to Taiwan have been confirmed safe following a 6.7-magnitude earthquake late on Saturday, while other travellers from the city have recalled feeling frightened as buildings swayed “from side to side”.
The Hong Kong Observatory said the earthquake occurred at 11.05pm in Taiwan, with the epicentre located about 70km (43.5 miles) southeast of Taipei and at a focal depth of 60km.
The forecaster also received more than 100 local reports of tremors lasting...",T10
67,"More than 4,000 elementary, middle and high schools across South Korea have shut their doors as the country’s student population shrinks, new data shows.
According to the Ministry of Education’s latest figures, revealed on Sunday by Representative Jin Sun-mee of the ruling Democratic Party of Korea, 4,008 schools under 17 regional education offices nationwide have closed so far as student numbers continue to decline.
Junior schools account for most closures, with 3,674 shut down permanently,...",T10
68,"Three more top-ranking Chinese officers have been expelled from the national legislature, becoming the latest to fall foul of an anti-corruption campaign sweeping through the military.
The Standing Committee of the National People’s Congress said on Saturday that it had expelled Wang Renhua, head of the Central Military Commission’s Political and Legal Affairs Committee; Zhang Hongbing, political commissar of the People’s Armed Police (PAP); and Wang Peng, director of the CMC’s training...",T10
69,"Hong Kong’s Starry Lee Wai-king has said her roles as a delegate to the National People’s Congress (NPC) Standing Committee and at the Legislative Council do not conflict, but she has stopped short of revealing whether she will run for the latter’s presidency.
Lee, a member of China’s top legislative body, on Sunday held off giving a definitive reply about whether she would seek election as Legco president.
Details would be clearer during the presidency’s nomination period, after the newly...",T10
70,"US President Donald Trump last month signed an executive order for the “Genesis Mission”, a national campaign to use artificial intelligence (AI) to boost scientific breakthroughs. In the opening section, the mission is explicitly described as “comparable in urgency and ambition to the Manhattan Project”.
The comparison is compelling, but also misleading. At first glance, the order evokes the image of America in the 1940s, muscular and confident, mobilising the whole nation to end World War II....",T1
71,"Hong Kong authorities are preparing to launch a special channel next year to allow sensitive mainland Chinese biological samples and data to cross an “innovation cooperation zone” between the city and Shenzhen, a minister has said.
Secretary for Innovation, Technology and Industry Sun Dong said in a television programme on Sunday that authorities had already clearly defined the scope of specific genetic resources and sensitive information to be permitted.
“I believe we will roll out these...",T1
72,"In the heart of Algeria’s Sahara Desert, Chinese state-owned giant China Railway Construction Corporation (CRCC) has completed laying track on the PK330 Bridge, a final and critical link in a new railway designed to unlock the nation’s mineral wealth.
The 6km (3.7-mile) bridge is part of the 950km railway linking the Gara Djebilet iron ore deposit in southwestern Tindouf province to the industrial hub of Bechar in the northeast.
It was the “most technically demanding railway engineering feat...",T7
73,"As the Philippines wraps up a tumultuous year punctuated by colourful barbs thrown across warring political houses, an ongoing corruption scandal surrounding flood control projects threatens to derail President Ferdinand Marcos Jnr’s administration.
Externally, Manila has been embroiled all year in a long-standing territorial row with Beijing in the South China Sea that shows no signs of waning, while also gearing up for the hot seat as next year’s chair of the Association of Southeast Asian...",T10
74,"A group of suspense-novel-loving Chinese school pupils smeared chalk dust on the combination lock of a safe in their classroom to unlock it and retrieve their mobile phones.
Despite being disciplined by the school, many netizens were left amused and praised their creativity.
A disciplinary notice issued by the secondary school in Shenzhen, Guangdong province, southern China, on December 10, has gone viral online.
It said that on November 14, a pupil surnamed Tian from Class 13, Grade 10, had...",T10
75,"The piercing pop-pop of pickleball paddles starts before sunrise and ends after midnight at dozens of newly built courts across Hanoi, as residents relish one of Vietnam’s fastest-growing sports – or rage at the noise it makes.
The initial craze saw more people in Vietnam pick up a paddle per capita than anywhere else in Asia, according to one survey.
Now unwitting spectators are yelling fault, filing noise complaints and petitions to curb playing hours that have left authorities in a pickle.
In...",T10
76,"China’s ultra-wealthy are quietly parking their private jets offshore to sidestep tougher compliance rules at home, while corporate executives are downgrading to commercial flights, analysts say, as economic headwinds hit the country’s business aircraft fleet.
Aircraft owned by affluent Chinese nationals are said to be increasingly resurfacing in hubs such as Singapore and Japan, while more billionaires and corporate executives are turning to first-class commercial cabins or timeshare jet...",T2
77,"China’s top diplomat Wang Yi is set to host the foreign ministers of Cambodia and Thailand to “consolidate” the new ceasefire deal between the Southeast Asian countries.
The trilateral gathering, to be held Sunday and Monday, marks Beijing’s latest effort to cement its role as an international mediator and secure a lasting peace deal in the deadly border clash between the two neighbours.
At Wang’s invitation, his Cambodian counterpart Prak Sokhonn and Thai Foreign Minister Sihasak Phuangketkeow...",T10
78,"Russian ‌President Vladimir Putin said Ukraine was in no hurry for peace ‍and if it did not want to resolve their conflict peacefully, Moscow would accomplish all its goals by force.
Putin’s remarks on Saturday, carried by state news agency Tass, followed a vast ⁠Russian drone and missile attack that prompted Ukrainian President Volodymyr Zelensky to say Russia was showing its wish to continue the war while Kyiv wanted peace.
Zelensky is to meet US President Donald Trump in Florida on Sunday to...",T2
79,"The newlywed owners of a Shiba Inu dog famous online for its adorable smile, which was poisoned to death in a village in eastern China, have been accused of cashing in on its death.
The six-year-old canine, Peppa, had been raised by the couple since it was three months old.
It died recently after its owners took it to their hometown in rural Shandong province for a honeymoon, where it ate poison-tainted food on the road.
The dog has a combined half a million followers on several mainland social...",T10
80,"Singapore’s Workers’ Party (WP) on Sunday said that its party cadres have requested a special conference to be held and that the party’s top decision-making body – the Central Executive Committee (CEC) – will be “following up on the request”.
WP’s statement comes after party secretary general Pritam Singh’s conviction for lying to a parliamentary committee, with the matter set to be discussed in parliament on January 12 next year.
More than 20 cadres have signed a letter calling for the special...",T10
81,"It was a year defined by war with Cambodia, but also the unravelling of cyber scams around Thailand’s borders, the rise and demise of political dynasties and another period of musical chairs in the prime minister’s office.
There was also national mourning with the death of Queen Mother Sirikit, a towering figure over recent Thai history, and the omnipresence of Lalisa Manobal – or Lisa of South Korean girl group Blackpink – who rapped, acted, gyrated and produced content that seized the...",T10
82,ABS issues bring in badly needed money but some assets are of uncertain quality,T8
83,"Jakarta and its sprawling environs’ 42mn inhabitants are now the most populous conurbation, according to the UN",T10
84,"First, tech companies usurped the meaning of ‘friends’ and ‘connection’ — now they are coming for ‘companionship’",T1
85,Volunteering has declined along with religion — it needs a revival,T10
86,"Rate of increase in output expected to slow despite Berlin’s fiscal push, FT survey finds",T5
87,Tariff deals with the US have bought time but investment momentum is elsewhere,T5
88,Demographers warn new births to hit lowest level since records began in 1899 as population crisis deepens,T5
89,Eleanor McCain wants C$1bn for stake in company but family members dispute her price,T13
90,Beirut is cracking down on traffickers who enjoyed impunity for decades. But the roots of their illicit empires run deep,T10
91,"U.S. stocks were mostly lower, with the Nasdaq leading declines as makers of AI infrastructure suffered steep falls, many in the double digits. Nvidia was down 16%.",T0
92,"Gold settled 1.4% lower, down two of the past three sessions, and silver fell 2.5%, down three of the past four sessions.",T3
93,"Panic fueling the selloff of Nvidia, Broadcom and other tech giants is overblown.",T7
94,"Gain insight on Experian, SoFi Technologies and more in the latest Market Talks covering Financial Services.",T6
95,"Arabica coffee prices hit a record level, as traders digested the withdrawal of President Trump’s threats to impose tariffs and economic sanctions on Colombia.",T0
96,The Yen and Swiss Franc were stronger against the dollar as investors sought safe havens after Chinese start-up DeepSeek’s new AI model hit U.S. tech stocks.,T0
97,U.S. natural gas futures fell after weekend updates took some of the chill out of early February weather forecasts.,T0
98,QXO is taking its offer directly to shareholders after being rebuffed on several occasions.,T7
99,Maverick Natural Resources has operations in Texas and Oklahoma.,T2
100,"There are some new wrinkles, especially for those who sell things online or bought an EV.",T6
101,Companies with good payouts are now the hottest bet in China markets.,T7
102,The 10-year U.S. Treasury yield fell and ING said the the long end of the Treasury curve will continue trading at higher yields even as Trump hasn’t delivered anything to shock markets so far.,T0
103,Oil edged lower in early trade as Goldman Sachs said the latest round of U.S. sanctions against Russia haven’t had a significant impact on the country’s oil exports.,T0
104,"There is little sign of crimped demand for equities among individual investors, who remain bullish after two years of blockbuster gains.",T8
105,Check out the stocks Heard on the Street writers favor in their eighth annual stock-picking contest.,T7
106,The real costs of owning a house in neighborhoods that are vulnerable to flooding and wildfires are becoming clearer.,T2
107,"Venture-capital firms are bringing AI and dealmaking to accounting, property management and other unglamorous fields.",T1
108,"Recent court cases reveal how middlemen are facilitating a booming trade, eluding a crackdown.",T2
109,The story of home affordability in the U.S. told from a single front porch.,T2
110,The president has told Bank of America and JPMorgan Chase to stop cutting conservatives off from doing business.,T5
111,Best Two Energy Stocks to Buy Now According to WarrenAI,T7
112,"Brazil’s former President Bolsonaro has surgery to treat hiccups, wife says",T5
113,Russia stocks lower at close of trade; MOEX Russia Index unchanged,T0
114,Breaking down Nvidia’s unusual $20 billion deal with Groq,T7
115,Where will the S&P 500 be in 2026? Here’s the updated analyst consensus,T7
116,Analysis-Waymo’s San Francisco outage raises doubts over robotaxi readiness during crises,T1
117,Target shares gain as activist investor reportedly builds big stake,T7
118,"S&P 500 at 8,000, gold at $5,400, Tesla to double: Here are top trades for 2026",T7
119,U.S. dollar gains in thin trading while FX traders remain focused on Japan,T0
120,Yen extends recovery as Japan flags possible FX intervention,T0
121,U.S. dollar falls ahead of key data; yen surges on intervention threat,T0
122,"USD/JPY: Intervention risk could increase in January, BofA says",T0
123,Dollar falls after weekly gains; yen intervention in focus,T0
124,Dollar edges higher; set for weekly loss after soft inflation data,T0
125,"EUR/CHF and USD/CHF price forecast for 2026, as per UBS",T0
126,Sterling holds ground as BoE signals caution on rate cuts,T8
127,Asia FX steady after soft US CPI fuels Fed cut bets; BOJ hikes rates as expected,T0
128,Dollar edges up ahead of CPI release; European central banks in spotlight,T0
129,Deutsche Bank forecasts S&P 500 to hit 7000 by end of 2025,T0
130,"Trump's tariffs, Fed minutes, Rumble's Bitcoin buy - what's moving markets",T7
131,Bitcoin price today: slips to $94k as risk appetite sours on Trump tariff threat,T13
132,2025 macro outlook for the US is 'murky at best' says Deutsche Bank,T5
133,Trump says he will impose additional 10% tariffs on China over drug inflow,T5
134,"Asia stocks fall after Trump threatens tariffs, Japan's Nikkei leads losses",T0
135,"S&P 500 positioning levels at record highs, pullback risks rise, Citi warns",T8
136,"Analyst calls Bitcoin 'global bubble', could soar to infinity",T13
137,Stock market today: Dow hits record as Trump's pick for Treasury stokes optimism,T0
138,Jump in Tesla stock mostly driven by 'animal spirits/momentum' says UBS,T7
139,Federal Reserve Board announces approval of the application by National Bank Holdings Corporation,T9
140,"Federal Reserve Board publishes its biennial report on debit card transactions, which summarizes information collected from large debit card issuers and payment card networks",T9
141,"Federal Reserve Board requests public input on “payment account,” which eligible financial institutions could use for the limited purpose of clearing and settling their payments",T9
142,Federal Reserve Board publishes first of several staff manuals for the supervision of the largest and most complex banks,T9
143,Federal Reserve Board withdraws 2023 policy statement and issues new policy statement regarding the treatment of certain Board-supervised banks that facilitates responsible innovation,T9
144,"Federal Reserve Board announces termination of enforcement actions with The Goldman Sachs Group, Inc. and Metropolitan Commercial Bank",T9
145,Agencies announce dollar thresholds for smaller loan exemption from appraisal requirements for higher-priced mortgage loans,T4
146,Agencies announce dollar thresholds for applicability of truth in lending and consumer leasing rules for consumer credit and lease transactions,T4
147,"Federal Reserve Board announces approval of application by Banco BTG Pactual S.A., its parent holding companies, and subsidiary, BTG Pactual Bancorp, LLC",T9
148,"Federal Reserve Board announces approval of application by The PNC Financial Services Group, Inc.",T9
149,Federal Reserve Board announces reappointment of Reserve Bank presidents and first vice presidents,T9
150,"Federal Reserve Board announces termination of enforcement actions with Credit Suisse Group AG, Credit Suisse AG, Credit Suisse Holdings (USA), Inc., Credit Suisse AG, New York Branch, and JPMorgan Chase &amp; Co.",T9
151,Federal Reserve Board and Federal Open Market Committee release economic projections from the December 9-10 FOMC meeting,T9
152,Federal Reserve Board issues enforcement action with former employee of Synovus Bank,T9
153,"Federal Reserve Board requests public input on the impact of potential strategic changes to check services provided by the Fed, as well as check usage and preferences",T9
154,"Federal Reserve Board announces pricing, effective January 1, 2026, for payment services the Federal Reserve Banks provide to banks and credit unions",T9
155,Federal Reserve Board issues enforcement action with former employee of First Financial Bank,T9
156,"Federal Reserve Board announces approval of application by Steel Newco, Inc",T9
157,"Minutes of the Board's discount rate meetings on October 6, October 20, and October 29, 2025",T12
158,"Free streamers like YouTube have gained viewers, while growth at paid services like Disney+ and Netflix has slowed.",T6
159,"Top retail startups raised over $390 million in 2025 as Gopuff, Stickerbox, and Koala Health innovated in AI, e-commerce, and pet health.",T7
160,"Four tech professionals, from an early career engineer to a former senior director of GenAI at Meta, said getting your hands dirty was important for breaking into the AI industry.",T1
161,"""I use it, despite the fact that I think it's going to destroy us,"" one Democratic senator told Business Insider.",T5
