id,text,topic_id
0,What Wall Street doesn’t tell you about the long-term return on your investments.,T1
1,"“Most people don’t blow up their budget because they’re careless,” one financial planner said. It happens because they neglect this critical detail.",T8
2,Tax refunds are projected to be larger on average — and Americans are thinking hard about how to spend them.,T9
3,"Frequent flyers who hold a United Airlines co-branded credit or debit card can soon earn up to twice as many miles as noncardholders, effectively rewarding the airline’s biggest spenders.",T11
4,Expenses that made sense during your peak earning years can drain your resources once you stop working.,T8
5,The Social Security Administration requires 40 credits to qualify for benefits and calculates your benefit using your highest 35 years of earnings.,T9
6,More young workers are being nudged into these tailored 401(k) accounts. Should you make the switch?,T8
7,Some Medicare Advantage plans have been quitting unprofitable markets and trimming extra benefits,T8
8,Subverting the conventional wisdom that the only stock exposure you need is in the broad indexes.,T2
9,"“I have $650,000 in investments, $250,000 in life insurance and about $150,000 equity in my home.”",T8
10,U.S. productivity slows down in fourth quarter while unit labor costs accelerate,T9
11,Beyond to buy rights to Buy Buy Baby brand and reunite it with Bed Bath & Beyond,T3
12,Amazon says it had best-ever Thanksgiving Holiday week with record sales and number of items sold,T8
13,U.S. stock futures and bond yields drop on reports Putin has updated nuclear doctrine,T1
14,Charter Communications announces buyout deal for Liberty Broadband at terms above its previous proposal,T3
15,General Motors unveils new all-electric Cadillac called the Vistiq with 300-mile range,T3
16,Vestas Wind Systems stock slumps as company says margins to be at low end of guidance,T2
17,Burberry shares rise on report Moncler could bid for it,T2
18,Kazatomprom reports 17% increase in production during the third quarter,T8
19,Anheuser-Busch InBev shares slip as sales come up shy of estimates,T2
20,Wingstop’s stock slides 12% after profit falls short of estimates,T2
21,Novartis hikes sales and profit guidance for the year,T1
22,Plus500 says it will meet expectations after quarterly revenue climbs 11%,T1
23,Trainline boosts guidance for the second time this year,T1
24,Barclays reports 18% profit rise as it lifts income guidance,T2
25,"London Stock Exchange Group says income grew, led by Tradeweb",T2
26,"After most of his tariffs were outlawed on Friday, Trump announced new global tariffs of 10% - which he says he has now increased to 15%.",T0
27,If you think the Supreme Court ruling heralds a return to pre-Trump business as usual - think again.,T12
28,A cross-party committee will also look into the appointment and accountability of UK trade envoys.,T10
29,"Wingstop, Burger King, and others have walked away from an industry commitment to avoid using fast-growing chickens",T8
30,"The government took in more from tax receipts than expected, official data suggests.",T9
31,"India's mango farmers are being urged to innovate as climate change makes cultivation ""unpredictable"".",T8
32,Global Counsel's clients cut ties with the firm over Lord Mandelson's links with sex offender Jeffrey Epstein.,T7
33,The scheme will seek to take inspiration from Ukraine's drone manufacturing programme.,T4
34,Quentin Griffiths co-founded Asos in 2000 and remained a significant shareholder after leaving the firm five years later.,T3
35,Continuing strong sales from online jewellers after a recent spike in gold prices also helped drive the increase.,T8
36,"Overall the economy grew 2.2% last year, holding up despite pressures from changes to tariff and immigration policy.",T9
37,"His associate said the music industry was ""related to P"", a way Epstein apparently often referred to women.",T7
38,"Baroness Kidron tells the BBC the PM has being ""late to the party"" in regulating social media.",T5
39,The entertainment giant's revenue surged last year as 159 million fans attended its concerts.,T7
40,The agency released a critical report that puts the Starliner incident at same mistake level assigned to the fatal Columbia and Challenger shuttle disasters.,T11
41,Clips of Deadpool and other film characters have sparked alarm within Hollywood over copyright infringement.,T12
42,Washington will set a 19% tariff on most Indonesian goods in exchange for lower trade barriers for US goods,T0
43,The US bought more goods than it sold in 2025 as the White House attempts to reverse the flow.,T9
44,Savvy bill payers shopping around for fixed-tariff energy deals also dented earnings at British Gas.,T10
45,Road users say headlight glare is an issue - but experts warn a solution might not be straightforward.,T3
46,Mexican Senator Armando Rios Piter told CNN that he plans to introduce a bill this week that would stop Mexican purchases of American corn.,T10
47,The days of plugging in an iPhone to charge won't last forever.,T1
48,"Nandan Nilekani, co-founder of one of India's biggest outsourcing companies, says an H-1B visa crackdown would ultimately hurt the U.S.",T13
49,The market is at all-time highs and many say Trump is the reason. But stocks were rallying when investors thought Hillary Clinton would win. Janet Yellen and the Fed may deserve more of the credit for the market's move.,T2
50,Apple stock is less than $1 away from its all-time high amid renewed optimism for the iPhone.,T2
51,President-elect Donald Trump focuses his criticism of NAFTA on Mexico. But Canada and America have a rocky trade history too.,T0
52,"Verizon has decided to bring back unlimited data plans. But while that's great for its subscribers, it's awful news for investors. It's another sign of how brutally competitive the telecom business is. And it's hurting Verizon's stock.",T3
53,The price of crude oil has more than doubled over the past year after bottoming out at $26 per barrel in February 2016.,T2
54,The automaker announced Monday that its first official venture in the oil-rich Middle East will be in the United Arab Emirates.,T3
55,Uber's top rival in India has some unsolicited advice for the U.S. startup: Go local.,T3
56,"Apple CEO Tim Cook wants the tech industry to take action against ""fake news"" stories that are polluting the web.",T12
57,"Sears Holdings, the company that owns retail stores Sears and Kmart, said this weekend that it would remove 31 Trump-branded items from its website.",T0
58,"Universal Biopack makes packaging that it sells to restaurants and manufacturers. But rather than plastic, it uses a mixture of bamboo and cassava.",T13
59,"Nike on Sunday launched a star-studded short film titled ""Equality"" that coincides with Black History Month.",T3
60,"Treasury secretary pick Steven Mnuchin is an executive producer on Warner Bros.' ""The Lego Batman Movie,"" which pulled in an estimated $55.6 million from U.S. audiences during its opening weekend.",T12
61,"It may seem like a recurring nightmare, but Greece is in danger of running out of money again.",T6
62,"Hong Kong recorded a 13 per cent surge in visitors from mainland China during the Lunar New Year holiday, with the influx boosting jewellery sales by 10 per cent during the period despite a sharp rise in gold prices.
Industry representatives said on Sunday that festive business had outperformed last year’s, though the recovery remained uneven across sectors and not always directly tied to the surge in mainland visitors.
Immigration figures showed 1.02 million mainlanders visited the city between...",T7
63,"A man has reported the loss of Pokemon trading cards worth about HK$8,000 (US$1,023) after a burglary at a shop in Hong Kong – the second reported criminal case involving the collectors’ items in two months.
Police said they received a report at about 2.50am on Sunday from a 25-year-old man that the 1,000 sq ft shop in Chung Mei Centre on Hing Yip Street, Kwun Tong, had been ransacked.
He also found that more than 10 security cameras had been sprayed with red paint.
An initial count indicated...",T7
64,"Some lucky Hong Kong fans of K-pop star G Dragon pocketed at least HK$320 (US$41) from the record HK$200 million Lunar New Year Mark Six draw after they chose lottery numbers he suggested.
G Dragon fans took to social media to share news of their earnings after the winning numbers were announced on Saturday.
During a fan meeting earlier this month in Seoul, the star was asked by a South Korean fan to name some lucky lottery numbers.
After glancing at a countdown timer for the segment at the...",T7
65,"Russia fired scores of missiles and drones at targets across Ukraine on Sunday, crashing into energy and rail infrastructure and residential buildings, just two days before the fourth anniversary of Russia’s invasion.
Journalists in Kyiv heard a series of blasts starting at around 4.00am, shortly after an air raid alert was issued, with the air force later widening the alert nationwide, citing the threat of missiles.
“Moscow continues to invest in strikes more than in diplomacy,” Ukrainian...",T4
66,"Sanju*, a foreign domestic helper of Nepalese ethnicity, never imagined her Hong Kong dream would turn into a nightmare.
The 34-year-old arrived in Hong Kong in 2023, driven by a simple wish to work in the city of her dreams. But she said her first employer paid her 30 per cent below the statutory minimum wage, allowed her only two hours of sleep a day, and gave her just three rest days over six months, during which she was only paid two months’ salary.
After six months, she was dismissed and...",T7
67,"Taiwan’s parliament is set to prioritise review of a disputed NT$1.25 trillion (US$40 billion) special defence budget bill when its new session begins on Tuesday, as pressure mounts from Washington.
But US President Donald Trump’s recent remarks about consulting Chinese President Xi Jinping on arms sales could complicate the debate, potentially giving Taipei’s opposition parties greater room to manoeuvre and reshape the final version of the bill, according to analysts.
The renewed push follows...",T7
68,"US software company OpenMind, according to founder and CEO Jan Liphardt, caused a commotion last year at a park in San Francisco where the firm shot a promotional video.
“A crowd of people came, children came running, cars stopped and the police came,” he said, because “there was a robot in the park”.
In an interview, Liphardt told the South China Morning Post that such a scenario would have been treated differently on the other side of the world. “If a [Unitree] G1 walked across the street in...",T4
69,"Relatives, colleagues and residents gathered in a county in central China on the weekend to pay tribute to six firefighters who died after putting out a blaze during the Chinese New Year holidays.
The firefighters were killed on Thursday afternoon when their truck ran off a cliff in Xinhua county, Hunan province, as they were returning from extinguishing a house fire in the hills.
A seventh firefighter in the truck was injured and transferred to a hospital in the capital city of Changsha that...",T7
70,"As political pressure on the US Federal Reserve intensifies in Washington, the reverberations are rippling across the globe. Gregory Peters, co-chief investment officer of fixed income at PGIM, has noted that bringing political pressure to bear on the Fed is an “own goal” – a self-inflicted shock that erodes confidence and is unlikely to deliver lower borrowing costs for the US.
This reassessment – marked by quiet “sell America” trades – is beginning to surface.
The damage extends far beyond...",T11
71,"The acquisition price for properties damaged in Hong Kong’s deadly Tai Po fire will be “far lower” if homeowners reject the government’s buy-back offer and authorities are forced to use legislation to acquire the remaining properties, a senior official has said.
Deputy Financial Secretary Michael Wong Wai-lun on Sunday dismissed claims that the government was using public funds to cover its responsibility for the Tai Po tragedy, following online criticism that taxpayers’ money was being used to...",T7
72,"A 34-year-old chef has been arrested for allegedly dripping an unknown liquid on three female pedestrians near Hong Kong’s Tai Wai MTR station in separate incidents during the Christmas and Lunar New Year holiday periods.
The first incident took place on Christmas morning, when a woman crossing a footbridge on Mei Tin Road felt liquid dripping on her hair and saw a man running away from her soon after.
Police arrested the man on suspicion of common assault on January 8 and later released him on...",T7
73,"Having electrified its highways, China is mobilising its shipbuilding prowess and battery giants such as CATL to overhaul some shipping fleets, betting that the revolution in green transport can float as well as it drives.
The shift towards clean energy underscores Beijing’s broader decarbonisation commitment – vowing to peak carbon emissions by 2030 and achieve neutrality by 2060. These goals have spurred substantial strides in renewable capacity installation, end-use revamps, new technology...",T13
74,"Young people in Japan are using artificial intelligence (AI) to make before-and-after cosmetic surgery photographs which look like they are two “different” versions of themselves in a single setting.
Data suggests the country is relatively relaxed about cosmetic procedures, but the latest trend is raising concerns about the effect it might have on youngsters.

According to the Japan Society of Aesthetic Plastic Surgery, the country logged about 3.3 million aesthetic medical procedures in 2022,...",T4
75,"The Australian frigate HMAS Toowoomba sailed through the Taiwan Strait on Friday and Saturday, monitored closely by the People’s Liberation Army, which remained on alert throughout the transit, according to a mainland Chinese media report.
The Global Times, a nationalist newspaper affiliated with the Communist Party mouthpiece People’s Daily, reported the vessel’s passage on Saturday, citing a Chinese military source.
Citing a military fan site that monitors airspace activities around the...",T7
76,"US envoy Steve Witkoff said on Saturday that President Donald Trump is questioning why Iran has not “capitulated” in the face of Washington’s military build-up aimed at pressuring them into a nuclear deal.
The United States and Iran this week resumed Oman-mediated talks in Geneva aimed at averting the possibility of military action, after Washington sent two aircraft carriers, jets and weaponry to the region to back its warnings.
In a Fox News interview with Trump’s daughter-in-law Lara, Witkoff...",T12
77,"Resorts are near capacity in Pattaya, Bangkok restaurants are doing a roaring trade and the strict time slots to visit the Louis Vuitton pop-up “hotel” in the Thai capital are fully booked.
As this year’s Lunar New Year holiday draws to a close, Thailand’s tourist businesses are totting up the receipts from what many hope will be an enduring rebound in Chinese visitors.
More than 30,000 Chinese visitors have arrived each day since the start of January. The Tourism Authority of Thailand (TAT)...",T7
78,"When an ibuprofen dance challenge went viral on the Chinese social media platform Douyin in late 2022 during the Covid-19 pandemic, shares of the country’s leading ibuprofen maker surged more than 200 per cent in two weeks.
Now profits at Shandong Xinhua Pharmaceutical are plunging, and it is not alone, as drug makers are hit by oversupply and weakening demand.
The net profit at Shandong Xinhua, a leading manufacturer and exporter of fever and pain medicines, including ibuprofen, fell 26 per...",T2
79,"Hong Kong must exercise fiscal prudence, carefully weighing social needs while maintaining adequate reserves to guard against unforeseen circumstances, the finance chief has said as he outlined the principles of the budget he will deliver on Wednesday.
Financial Secretary Paul Chan Mo-po on Sunday also revealed the purple cover for the 2026-27 budget, saying the colour symbolised Hong Kong’s strengthening economic momentum amid a volatile external environment.
The remarks came as the city braced...",T7
80,"US President Donald Trump said on Saturday he was sending a hospital boat to Greenland, an autonomous Danish territory that he has long coveted and threatened to seize by force.
Trump’s rhetoric has ratcheted up tensions between the United States and Denmark, while putting the global spotlight on the Arctic as he insists mineral-rich Greenland is vital for US and Nato security against Russia and China.
He said the boat would treat many “sick” people in Greenland, without providing any details on...",T12
81,"Hong Kong authorities froze HK$261 million (US$33.4 million) in suspected criminal proceeds linked to money laundering and drug trafficking last year, but experts say it may take as long as seven years for any of the funds to reach government coffers.
According to data from the Joint Financial Intelligence Unit, run by police and customs, HK$869 million in criminal proceeds was confiscated between 2018 and 2024, with the annual amount fluctuating from HK$284 million in 2018 to HK$18 million in...",T7
82,President attacks judges for a second day as he escalates levies from 10%,T12
83,Analysts say the risk of retaliation is likely to deter countries from seeking to backtrack on already agreed deals,T13
84,Country’s trade minister says bloc must be prepared to retaliate while Beijing warns of turmoil,T13
85,Groups unable to cash out while other forms of dealmaking have returned,T3
86,China and others have long been adept at using supply chains to their advantage — the EU should do the same,T13
87,AI is fuelling a surge in recorded work meetings that we need to think about more carefully,T4
88,Case brought by Kathryn Shiber fuelled debate about junior bankers’ working hours,T7
89,US president steps back into fight between streamer and Paramount Skydance to acquire Warner Bros Discovery,T12
90,"After a year of acrimony, rightwing activist Leo Brent Bozell III is charged with navigating the fraught relationship",T7
91,Diplomat tells Tucker Carlson it ‘would be fine’ if Israel took over a swath of the region,T12
92,"UG Solutions, which guarded aid distribution sites in enclave, seeks new business under Donald Trump’s ‘Board of Peace’ plan",T12
93,Gap between large moves in individual equities and subdued index performance hits highest since global financial crisis,T2
94,"U.S. stocks were mostly lower, with the Nasdaq leading declines as makers of AI infrastructure suffered steep falls, many in the double digits. Nvidia was down 16%.",T2
95,"Gold settled 1.4% lower, down two of the past three sessions, and silver fell 2.5%, down three of the past four sessions.",T2
96,"Panic fueling the selloff of Nvidia, Broadcom and other tech giants is overblown.",T3
97,"Gain insight on Experian, SoFi Technologies and more in the latest Market Talks covering Financial Services.",T3
98,"Arabica coffee prices hit a record level, as traders digested the withdrawal of President Trump’s threats to impose tariffs and economic sanctions on Colombia.",T0
99,The Yen and Swiss Franc were stronger against the dollar as investors sought safe havens after Chinese start-up DeepSeek’s new AI model hit U.S. tech stocks.,T1
100,U.S. natural gas futures fell after weekend updates took some of the chill out of early February weather forecasts.,T1
101,QXO is taking its offer directly to shareholders after being rebuffed on several occasions.,T3
102,Maverick Natural Resources has operations in Texas and Oklahoma.,T10
103,"There are some new wrinkles, especially for those who sell things online or bought an EV.",T3
104,Companies with good payouts are now the hottest bet in China markets.,T3
105,The 10-year U.S. Treasury yield fell and ING said the the long end of the Treasury curve will continue trading at higher yields even as Trump hasn’t delivered anything to shock markets so far.,T1
106,Oil edged lower in early trade as Goldman Sachs said the latest round of U.S. sanctions against Russia haven’t had a significant impact on the country’s oil exports.,T1
107,"There is little sign of crimped demand for equities among individual investors, who remain bullish after two years of blockbuster gains.",T2
108,Check out the stocks Heard on the Street writers favor in their eighth annual stock-picking contest.,T2
109,The real costs of owning a house in neighborhoods that are vulnerable to flooding and wildfires are becoming clearer.,T8
110,"Venture-capital firms are bringing AI and dealmaking to accounting, property management and other unglamorous fields.",T4
111,"Recent court cases reveal how middlemen are facilitating a booming trade, eluding a crackdown.",T7
112,The story of home affordability in the U.S. told from a single front porch.,T8
113,The president has told Bank of America and JPMorgan Chase to stop cutting conservatives off from doing business.,T13
114,How Switzerland is quietly pulling ahead of Europe in the AI race,T3
115,"Nvidia, software reports pose next tests for AI-sensitive stock market",T3
116,5 big analyst AI moves: Nvidia stock ’likely to outperform in 2H26’,T3
117,What eCommerce can teach us about the Software/AI transition,T4
118,China’s AI rally ignites as investors shrug off global disruption fears,T3
119,3 key earnings reports for this week to keep the AI trade alive,T3
120,Russia stocks lower at close of trade; MOEX Russia Index unchanged,T1
121,"Honeywell may walk away from Johnson Matthey catalyst deal, Bloomberg reports",T8
122,Is Chinaâ€™s currency undervalued? BCA Research weighs in.,T1
123,"Dollar slips after SCOTUS tariff ruling, but set for strongest week since November",T13
124,Asia FX steady before US inflation data; soft Japan CPI clouds BOJ outlook,T1
125,Dollar rises to near one-month high after Fed minutes hint at possible rate hikes,T1
126,"Asia FX falls, dollar firms on hawkish Fed mins; Aussie gains on strong jobs",T1
127,Dollar gains after latest Fed minutes hints at possible rate hikes,T1
128,South African rand forecast to strengthen further as UBS lowers USD/ZAR target,T1
129,"Asia FX muted in thin trade; kiwi drops on RBNZ rate hold, dovish tone",T1
130,Dollar firms ahead of data dump; sterling falls after quits rate hits 5-year high,T1
131,Deutsche Bank forecasts S&P 500 to hit 7000 by end of 2025,T1
132,"Trump's tariffs, Fed minutes, Rumble's Bitcoin buy - what's moving markets",T2
133,Bitcoin price today: slips to $94k as risk appetite sours on Trump tariff threat,T2
134,2025 macro outlook for the US is 'murky at best' says Deutsche Bank,T11
135,Trump says he will impose additional 10% tariffs on China over drug inflow,T0
136,"Asia stocks fall after Trump threatens tariffs, Japan's Nikkei leads losses",T1
137,"S&P 500 positioning levels at record highs, pullback risks rise, Citi warns",T1
138,"Analyst calls Bitcoin 'global bubble', could soar to infinity",T2
139,Stock market today: Dow hits record as Trump's pick for Treasury stokes optimism,T1
140,Jump in Tesla stock mostly driven by 'animal spirits/momentum' says UBS,T2
141,Federal Reserve Board announces approval of application by Fulton Financial Corporation,T14
142,"Federal Reserve Board announces it will hold a hybrid public outreach meeting on Thursday, March 26, as part of its review of regulations under the Economic Growth and Regulatory Paperwork Reduction Act (EGRPRA)",T14
143,"Minutes of the Federal Open Market Committee, January 27–28, 2026",T14
144,"Federal Reserve Board announces approval of application by Cooperativa de Ahorro y Credito Elga, Ltda.",T14
145,Federal Reserve Board issues enforcement action with former employee of Regions Bank,T14
146,Federal Reserve Board finalizes hypothetical scenarios for its annual stress test and votes to maintain the current stress test-related capital requirements until public feedback can be considered,T11
147,"Federal Reserve Board announces approval of application by Cornerstone Capital Bancorp, Inc.",T14
148,"Federal Reserve Board announces appointment of seven members, including four new members, to its Insurance Policy Advisory Committee (IPAC)",T14
149,"Federal Open Market Committee reaffirms its ""Statement on Longer-Run Goals and Monetary Policy Strategy""",T14
150,"Federal Reserve Board announces approval of application by Banco Inter, S.A.",T14
151,Federal Reserve Board issues enforcement action with former employee of PrimeLending,T14
152,Federal Reserve Board announces approval of application by Fifth Third Bancorp,T14
153,Agencies issue 2025 Shared National Credit Program report,T11
154,Federal Reserve Board announces the designation of the Chairs and Deputy Chairs of the 12 Federal Reserve Banks for 2026,T14
155,"Federal Reserve Board announces approval of application by Prosperity Bancshares, Inc.",T14
156,"Minutes of the Board's discount rate meeting on December 10, 2025",T10
157,Federal Reserve Board issues enforcement action with former employee of Regions Bank,T14
158,"Minutes of the Federal Open Market Committee, December 9–10, 2025",T10
159,Agencies release annual asset-size thresholds under Community Reinvestment Act regulations,T11
160,"Quang Hoang did Y Combinator twice: In 2016 for Birdly and in 2025 for Vybe. He said that his first experience was more ""family-style.""",T7
161,"Kindergarten at one New York City private school will top $75,000 next year. Here's why it's so expensive.",T9
162,The Marines' top Sergeant Major wants companies to start hiring more troops before they leave the military.,T8
