id,text,topic_id
162,"Kyle Elliott, a career coach for tech employees, told Business Insider clients can vent to the wrong people when they're dealing with a difficult boss.",T7
163,"Jim Rowley, Marine veteran and CEO of Crunch Fitness, stays in shape with Pilates and protein shakes on the road &mdash; and watches ""Survivor"" to unwind.",T5
164,"Trump posted screenshots of messages from Macron and NATO's chief, highlighting how private diplomacy &mdash; and work chats &mdash; can quickly become public.",T0
165,A millionaire in California shares why he supports the state's proposed billionaire wealth tax &mdash;&nbsp;and why he doesn't plan to move away.,T5
166,"President Donald Trump's tax bill may lead to larger refunds for many Americans in 2026, thanks to the IRS opting not to change withholding this year.",T2
167,An opulent 1907 estate overlooking New Jersey's Ramapo Mountains is for sale in a $1B bankruptcy. Its history is as alluring the house itself.,T5
168,Some parents are using Waymo robotaxis as personal chauffeurs for their kids &mdash;  even though it's against Waymo's and some state rules.,T7
169,"Harvey CEO Winston Weinberg said he's stagnated the times he doesn't ""have something that's really stressful"" every day.",T5
170,"Amplitude gave Business Insider the inside look at its AI overhaul, from acquisitions to efforts to increase staff adoption of AI coding assistants.",T7
171,"Trump is rolling out a slew of new ideas focused on ""affordability."" A lot of them sound like proposals from Zohran Mamdani or Bernie Sanders.",T5
172,"Robotaxi operators will need more real estate to charge and maintain their vehicles. Voltera, a Waymo partner, is one such company.",T9
173,"A severe winter storm has prompted US airlines to cancel flights, issue travel waivers, and advise passengers on refund and rebooking options.",T5
174,"""Retail feels totally different right now,"" one business owner said. ""We've got to do what we can,"" said another.",T8
175,Jamie Gavin takes external consulting role for LSEG’s non-cleared swaps platform,T6
176,Conflict over resources is reshaping markets in a way that goes beyond occasional risk premia,T8
177,Margin-to-notional ratio trails early regulatory estimates,T13
178,"Liquidity, accounting treatment and culture seen as impediments to wider use of swaptions, caps and floors",T8
179,Firms fear liquidity bifurcation as market transitions to new indexation formula,T8
180,"The authors highlight the motivations, benefits and challenges of central bank digital currency adoption in sub-Saharan Africa.",T1
181,S&amp;P Global Market Intelligence wins Market data provider of the year at the Risk Asia Awards 2025,T6
182,Re-entry comes after Basel III endgame proposals sparked capacity concerns among global clients,T6
183,"Risk Benchmarking study finds banks split three ways on policy mandates, with G-Sibs as likely as small regionals to assign ALM formal responsibility",T11
184,"$100bn threshold breach looms, but Fed’s Bowman plan could blunt impact",T3
185,"Top US bank regulator will prioritise risks that matter most, but they could prove hard to pinpoint",T11
186,Recalibration would push five banks out of category III and leave Synchrony and Flagstar below the large-bank line,T11
187,US regulatory filings show options Clob is expanding into linear instruments,T8
188,Plans for US Sef licence could address missing piece in defunct WeMatch swaps tie-up,T6
189,"Exchange operator fosters “breach mentality” to help prepare for business disruption, explains risk chief",T0
190,"Synchrony, Capital One and Amex face steep losses under Trump’s proposed 10% ceiling",T10
191,Last&nbsp;year’s US government shutdown upset inflation trades; an Isda band-aid helped but a longer-term fix is needed,T2
192,"Asset manager wanted to cut FX venues – and their fees – out of dealer relationships. Now, it only trades direct",T3
193,"The authors propose an application of Kelly et al's 2018 model combining regression-based betas with cross-sectional and time series elements, enhancing precision, reducing data needs, and simplifying multiregional models while effectively optimizing stock portfolios.",T2
194,Third-quarter spike contrasts with broad European declines,T8
195,"Andrew Ross Sorkin, editor at large of DealBook, describes how leaders at the World Economic Forum in Davos remain on edge after President Trump, for now, backed down from threats of using tariffs or military force to gain Greenland.",T10
196,The president’s quick reversal on tariffs over Greenland was another sign of his willingness to rip up the international order — even parts of it that he himself has made.,T10
197,"President Trump may be on the verge of having his authority on imposing tariffs curtailed, but that hasn’t slowed down his threats.",T4
198,"Dock workers are used to uncertainty, but nothing since the Great Recession of 2008 compares to what they have experienced this year.",T2
199,"Twin Falls needs immigrants, but the Trump administration has limited the refugee program to white South Africans.",T2
200,"If the Supreme Court rules against its tariffs, the Trump administration would begin replacing them immediately, said Jamieson Greer, the United States Trade Representative.",T4
201,The 3.3 percent rate for 2026 would match last year’s pace. Booming investment in artificial intelligence is buttressing global output.,T7
202,The tariffs will allow President Trump to take a cut of Nvidia’s chip sales to China while putting off a decision about imposing higher taxes on the chip industry.,T4
203,"If SpaceX, OpenAI and Anthropic go public, they will unleash gushers of cash for Silicon Valley and Wall Street.",T6
204,"Many indicators appear to suggest that the United States is growing despite tariffs, not because of them.",T4
205,"Under Bill Pulte, Fannie Mae and Freddie Mac have pulled away from efforts to help low-income people buy homes.",T5
206,"To assuage cost-weary voters and combat inflation, the president has resorted to a mix of threats and punishments, targeting companies and policymakers alike.",T4
207,"Beef, coffee and produce were among the items that surged in price, inflation data showed.",T4
208,Surging grocery prices were offset by lower increases for appliances and vehicles in the last such report before the Federal Reserve meets to debate interest rates.,T4
209,White House officials have explored a vast array of ideas as the president looks to unfurl a housing affordability plan at an economic conference this month.,T5
210,The president appears skeptical about Americans’ concerns. How will voters respond?,T4
211,"The deal would cut tariffs and include a commitment from Taiwanese Semiconductor Manufacturing Corporation, the island’s chip giant, to build more manufacturing plants in the United States.",T4
212,"As economists pointed to some of the president’s policies to explain the latest Labor Department data, White House aides sought to make the case for optimism in the new year.",T2
213,"Residents also oppose a data center the size of 18 Walmarts that is set to be built in pristine woodland outside Bessemer, Ala. “All this will be gone,” one said.",T6
214,Sales of beverages containing hemp-derived THC are rising as consumers look for the buzz without the booze. But a new federal law could push them off shelves.,T4
215,Prices for nearly every major U.S. crop are below what it costs to grow them. But a drop in rice prices means another blow to farmers in Mississippi’s agricultural belt.,T4
216,The abrupt change in direction came just weeks before the Olympic Games are set to begin in Italy.,T8
217,"The number of applicants has risen more than 40 percent over the last two years, despite new limits on student loans and uncertainty over how artificial intelligence will affect legal work.",T7
218,"The steady accumulation of snow and freezing rain and a rise in demand for electricity can cause problems long after the sky clears, energy experts said.",T5
219,"And, picking up the slack for a colleague with long Covid.",T5
220,U.S. trade policy has devastated the Canadian auto industry and pushed the country to reach an agreement that will make it easier for Chinese companies to sell cars there.,T4
221,"Amtrak says dynamic pricing has helped strengthen its finances, but travelers often grumble at the cost, especially for last-minute travel. Still, the train has a secret weapon: avoiding the airport.",T8
222,New York Fed inquiries about the cost of exchanging yen for dollars signaled to traders on Friday that the U.S. government might make a large purchase of the Japanese currency.,T10
223,"The agency says that victims of an investment offering involving Gemini Trust got their money back, though after a regulatory action brought by the New York attorney general.",T6
224,It will be the latest in at least half a dozen events that the breakaway league has held at Trump Organization resorts in the past four years.,T8
225,The changes came after the app’s Chinese parent company spun out an American entity to run TikTok in the United States.,T9
226,"Anonymous Content, a production company whose top investor is Laurene Powell Jobs’s Emerson Collective, has named Darren Walker as president and chief executive.",T9
227,Airlines are canceling hundreds of flights over the weekend in anticipation of frigid weather and ice and now across much of the country.,T5
228,"With tight business restrictions still in place, companies may find it challenging to even assess what opportunities exist for them in the South American nation.",T2
229,"Bookings to the island increased last year, and there are plans for two new airports. Threats from President Trump may change that.",T5
230,"Dropping rates more than conditions warrant would stimulate the economy in the short term but could lead to trouble, our columnist says.",T4
231,Older high-income workers who make contributions beyond the standard amount will have to put that extra money into a Roth 401(k). That may lower their take-home pay.,T2
232,"The president’s legal efforts against the Wall Street giant and Jamie Dimon, its chief executive, have put Corporate America on edge.",T5
233,"While the president has settled some suits, and judges have dismissed others, his court fights continue with the New York Times, the Wall Street Journal and other news outlets.",T5
234,"The U.S. is abandoning its role in the global economy, pursuing an “America First” approach that is causing a shift in the global economy.",T4
235,"Many taxpayers stand to collect larger refunds this year from the IRS, whether they itemize or not.",T2
236,Filers often look for creative ways to ease the tax burden. But these wild stories tap into the frustration many taxpayers feel about the inequities in the tax code.,T2
237,"Aldi, known for its no-frills selection and store-brand products, plans to have 3,200 U.S. stores through 2028.",T12
238,"Treasury Secretary Scott Bessent spent much of the past year quietly urging restraint as President Trump trained his fire on Fed Chair Powell. This week, Bessent joined the attack.",T4
239,"While the president has settled some suits, and judges have dismissed others, his court fights continue with the New York Times, the Wall Street Journal and other news outlets.",T5
240,"The U.S. is abandoning its role in the global economy, pursuing an “America First” approach that is causing a shift in the global economy.",T4
241,"Many taxpayers stand to collect larger refunds this year from the IRS, whether they itemize or not.",T2
242,Filers often look for creative ways to ease the tax burden. But these wild stories tap into the frustration many taxpayers feel about the inequities in the tax code.,T2
243,"Aldi, known for its no-frills selection and store-brand products, plans to have 3,200 U.S. stores through 2028.",T12
244,"Treasury Secretary Scott Bessent spent much of the past year quietly urging restraint as President Trump trained his fire on Fed Chair Powell. This week, Bessent joined the attack.",T4
245,"A new Internet-of-Things botnet called Kimwolf has spread to more than 2 million devices, forcing infected systems to participate in massive distributed denial-of-service (DDoS) attacks and to relay other malicious and abusive Internet traffic. Kimwolf's ability to scan the local networks of compromised systems for other IoT devices to infect makes it a sobering threat to organizations, and new research reveals Kimwolf is surprisingly prevalent in government and corporate networks.",T0
246,"Microsoft today issued patches to plug at least 113 security holes in its various Windows operating systems and supported software. Eight of the vulnerabilities earned Microsoft's most-dire ""critical"" rating, and the company warns that attackers are already exploiting one of the bugs fixed today.",T0
247,"Our first story of 2026 revealed how a destructive new botnet called Kimwolf rapidly grew to infect more than two million devices by mass-compromising a vast number of unofficial Android TV streaming boxes. Today, we'll dig through digital clues left behind by the hackers, network operators, and cybercrime services that appear to have benefitted from Kimwolf's spread.",T0
248,"The story you are reading is a series of scoops nestled inside a far more urgent Internet-wide security advisory. The vulnerability at issue has been exploited for months already, and it's time for a broader awareness of the threat. The short version is that everything you thought you knew about the security of the internal network behind your Internet router probably is now dangerously out of date.",T0
249,"KrebsOnSecurity.com celebrates its 16th anniversary today! A huge ""thank you"" to all of our readers -- newcomers, long-timers and drive-by critics alike. Your engagement this past year here has been tremendous and truly a salve on a handful of dark days. Happily, comeuppance was a strong theme running through our coverage in 2025, with a primary focus on entities that enabled complex and globally-dispersed cybercrime services.",T0
250,"The Trump administration has pursued a staggering range of policy pivots this past year that threaten to weaken the nation’s ability and willingness to address a broad spectrum of technology challenges, from cybersecurity and privacy to countering disinformation, fraud and corruption. These shifts, along with the president’s efforts to restrict free speech and freedom of the press, have come at such a rapid clip that many readers probably aren’t even aware of them all.",T7
251,"Direct navigation -- the act of visiting a website by manually typing a domain name in a web browser -- has never been riskier: A new study finds the vast majority of ""parked"" domains -- mostly expired or dormant domain names, or common misspellings of popular websites -- are now configured to redirect visitors to sites that foist scams and malware.",T0
252,"Microsoft today pushed updates to fix at least 56 security flaws in its Windows operating systems and supported software. This final Patch Tuesday of 2025 tackles one zero-day bug that is already being exploited, as well as two publicly disclosed vulnerabilities.",T0
253,A sprawling academic cheating network turbocharged by Google Ads that has generated nearly $25 million in revenue has curious connections to a Kremlin-connected oligarch whose Russian university builds drones for Russia's war against Ukraine.,T0
254,"China-based phishing groups blamed for non-stop scam SMS messages about a supposed wayward package or unpaid toll fee are promoting a new offering, just in time for the holiday shopping season: Phishing kits for mass-creating fake but convincing e-commerce websites that convert customer payment card data into mobile wallets from Apple and Google. Experts say these same phishing groups also are now using SMS lures that promise unclaimed tax refunds and mobile rewards points.",T14
255,Cybersecurity must shift from solely protecting systems to safeguarding human decision-making under uncertainty and system failures.,T0
256,Security researchers exploited dozens of vulnerabilities in vehicle infotainment systems and EV chargers during the latest Pwn2Own contest at Automotive World 2026.,T0
257,"Mass scanning is underway for CVE-2026-20045, which Cisco tagged as critical because successful exploitation could lead to a complete system takeover.",T0
258,"GCVE would enhance global collaboration, flexibility, and efficiency in tracking security flaws. Duplicate entries and a decentralization policy may create more chaos for defenders.",T0
259,The signs of an effective security culture are shifting as companies call on CISOs and security teams to raise their hands unabashedly.,T0
260,"Deployed across Australia and Europe, China's electric buses are vulnerable to cybercriminals and sport remote connectivity some worry the Chinese state could exploit.",T0
261,Automated infections of potentially fully patched FortiGate devices are allowing threat actors to steal firewall configuration files.,T0
262,"Concern is growing across Europe about relying on US cybersecurity companies, and Greenland takeover talk is eroding trust across the EU even further.",T0
263,"Cybersecurity professionals in Latin America are least likely to have faith in their countries' preparedness for cyberattacks on critical infrastructure, the World Economic Forum says.",T0
264,A spear-phishing campaign tied to the Democratic People's Republic of Korea (DPRK) uses trusted Microsoft infrastructure to avoid detection.,T0
265,"Dark Reading Confidential Episode 14: How curious, ethical problem solving can continue to serve as a guiding principle for an evolving cybersecurity sector.",T0
266,Web browser companies have put in substantial effort over the past three decades to strengthen the browser security stack against abuses. Agentic browsers are undoing all that work.,T0
267,"Once trust is granted to the repository's author, a malicious app executes arbitrary commands on the victim's system with no other user interaction.",T0
268,"The bait incudes plausible subject lines and credible messages, most likely thanks to attackers' use of large language models to craft them.",T0
269,"Researchers say the advanced framework was built almost entirely by agents, marking a significant evolution in the use of AI to develop wholly original malware.",T7
270,Hackers are already leveraging these over-permissioned programs to access the IT systems of major security vendors.,T0
271,"The attack consists of a NexShield malicious browser extension, a social engineering technique to crash the browser, and a Python-based RAT.",T0
272,The CRM vendor advised ignoring or deleting suspicious emails and said the attacks were not tied to any breach or software vulnerability.,T0
273,Familiar bugs in a popular open source framework for AI chatbots could give attackers dangerous powers in the cloud.,T7
274,The indirect prompt injection vulnerability allows an attacker to weaponize invites to circumvent Google's privacy controls and access private data.,T0
275,The onslaught includes LLMs finding bogus vulnerabilities and code that won't compile.,T0
276,"New policy requires ""buy for me"" AI tools and chatbots to obtain permission before accessing the platform.",T7
277,Even well-known services with millions of users are exposing sensitive data.,T0
278,The web's best guide to spotting AI writing has become a manual for hiding it.,T7
279,"Opinion: As software power tools, AI agents may make people busier than ever before.",T7
280,Reseller says Rackspace plans to charge it 706 percent more.,T6
281,Ads coming to free tier and new $8/month ChatGPT Go plan in US.,T6
282,Windows laggards still using the vulnerable hashing function: Your days are numbered.,T0
283,"Amid fears of bubble, world's top chipmaker TSMC says customers just keep asking for more.",T6
284,"Wikimedia Enterprise signs Microsoft, Meta, Amazon, Perplexity, and Mistral to API access deals.",T7
285,Exploit exfiltrating data from chat histories worked even after users closed chat windows.,T7
286,Indie music store says it wants fans to have confidence music was largely made by humans.,T7
287,"“General interest in AI PCs has been wavering for a while...""",T7
288,VoidLink includes an unusually broad and advanced array of capabilities.,T0
289,US defense secretary announces plans for integration despite recent controversies.,T13
290,Company responds to community concerns over electricity bills and water use.,T5
291,AI Overviews provided false liver test information experts called alarming.,T7
292,New feature will allow users to link medical and wellness records to AI chatbot.,T7
293,Will LLMs ever be able to stamp out the root cause of these attacks? Possibly not.,T0
294,Californians can now submit demands requiring 500 brokers to delete their data.,T6
295,"As ordered reported by the Senate Committee on Commerce, Science, and Transportation on June 25, 2025",T12
296,"CBO estimates the costs of federal credit programs in 2026 in two ways—following procedures prescribed by the Federal Credit Reform Act and using a fair-value approach, which measures the market value of the government's obligations.",T13
297,"As posted on the website of the House Committee on Rules on January 20, 2026",T12
298,"As posted on the website of the House Committee on Rules on January 20, 2026",T12
299,"As ordered reported by the Senate Committee on Commerce, Science, and Transportation 
on October 21, 2025",T12
300,"CBO examines the distribution of income—and of the means-tested transfers and federal taxes that affect it—from 1979 to 2022, placing particular emphasis on the distributions in 2022 and how they differed from those in 2019, 2020, and 2021.",T2
301,"As passed by the House of Representatives on January 12, 2026",T12
302,"As passed by the House of Representatives on January 12, 2026",T12
303,"In its June 2024 projections for fiscal year 2025, CBO underestimated revenues by 6 percent and outlays by 2 percent. The agency overestimated the federal budget deficit by 0.7 percent of GDP.",T2
304,"Presentation by Eric Labs, an analyst in CBO's National Security Division, at the 38th National Symposium of the Surface Navy Association.",T0
305,"As ordered reported by the House Committee on Oversight and Government Reform on December 2, 2025",T12
306,"As ordered reported by the House Committee on Energy and Commerce on December 3, 2025",T12
307,"CBO reports annually on programs whose authorizations of appropriations have already expired or will expire. This data file covers legislation enacted through September 30, 2025. A full report will be issued later this year.",T13
308,"As ordered reported by the House Committee on Energy and Commerce on December 3, 2025",T12
309,"As reported by the House Committee on Natural Resources on November 25,2025",T12
310,"Depending on how DoD implements the order to use the name ""Department of War,"" CBO estimates that costs could range from a few million dollars up to $125 million. A modest implementation of the name change would cost about $10 million.",T13
311,The Majority Leader of the House of Representatives announces bills that will be considered under suspension of the rules in that chamber. CBO estimates the effects of those bills on direct spending and revenues.,T12
312,"As posted on the website of the House Committee on Rules on January 11, 2026",T12
313,"As ordered reported by the House Committee on Education and Workforce on September 17, 2025",T12
314,"As ordered reported by the Senate Committee on Commerce, Science, and Transportation 
on October 21, 2025",T12
315,"On January 7, 2026, the Bureau of Labor Statistics released the third quarter data for total nonfarm employees at the state and metro levels in 2025. These numbers are being released a little later than usual due to the government &#8230; <a href=""https://fredblog.stlouisfed.org/2026/01/state-and-metro-employment-third-quarter-2025/"">Continue reading <span class=""meta-nav"">&#8594;</span></a>",T2
316,"The scale of US international trade as a share of the entire US economy peaked around 2011. Since then, US international trade has moderated. In this post, we look at how this moderation affected international goods exports from the top &#8230; <a href=""https://fredblog.stlouisfed.org/2026/01/the-current-ranking-of-top-exporting-us-states/"">Continue reading <span class=""meta-nav"">&#8594;</span></a>",T4
317,"Mortgage loans allow households to buy a home or to borrow money against the value of a home they already own. With mortgage loans, the real estate is offered as collateral, a payback guarantee for the lender. Our FRED graph &#8230; <a href=""https://fredblog.stlouisfed.org/2026/01/what-can-mortgage-loans-do/"">Continue reading <span class=""meta-nav"">&#8594;</span></a>",T13
318,"When the US Census conducts the monthly Current Population Survey on behalf of the Bureau of Labor Statistics (BLS), it asks households more than 200 questions about their employment status. One of those questions is “Do you currently want a &#8230; <a href=""https://fredblog.stlouisfed.org/2026/01/who-wants-a-job-now/"">Continue reading <span class=""meta-nav"">&#8594;</span></a>",T2
319,"The government shutdown affected economic data collection The 43-day lapse in congressional appropriations, which began on October 1 and lasted until November 12, 2025, has been the longest on record. Without funds to pay for employee salaries and business operations, &#8230; <a href=""https://fredblog.stlouisfed.org/2026/01/a-blank-space-missing-and-imputed-economic-data/"">Continue reading <span class=""meta-nav"">&#8594;</span></a>",T2
