id,text,topic_id
159,Federal Reserve Board issues enforcement action with former employee of First Financial Bank,T3
160,"AMD CEO Lisa Su says AI will soon need ""10 yottaflops"" of compute &mdash; a scale of computing power the world has never built before.",T2
161,"Daniela Amodei said AI has already surpassed humans in some areas, but adoption and real-world limits complicate the AGI debate.",T2
162,Fiona Fung said some of the best career advice she's gotten has been about how to receive feedback.,T12
163,Business Insider's AI Power List  highlights the most powerful people shaping artificial intelligence. See who's driving the next wave.,T2
164,"Getting fired from your job is hard, but there are certain steps you should take in the days and weeks following, just like you would after a layoff.",T7
165,Netflix staff engineer Anthony Goto said he's constantly asked by recent graduates how AI will change the industry.,T2
166,"As the cost of living rises for Americans, many are moving back in with their families.",T7
167,"From earlybird clubbing to cold brew cold plunges, young adults are turning to soft partying to cure loneliness without burnout or hangovers.",T12
168,"The health reporter Kim Schewitz used to recoil at the sight of healthy foods. Now, her habits make eating enough fruit, vegetables, and fiber easy.",T12
169,"A popular Chinese AI chatbot snapped at a user over a coding request, prompting an apology from its parent company Tencent.",T2
170,The push for tax collection comes as Russia's growth has slowed to a near standstill nearly four years after its full-scale invasion of Ukraine.,T10
171,"Kristen Bell and Cher, who were costars in 2010's ""Burlesque,"" said they got along well thanks to a shared sense of humor.",T12
172,"Companies' Venezuela operations would need a ""tremendous amount"" of investment, Trump said on Monday.",T4
173,"The ""Huberman Lab"" podcast host says good health comes down to ""intentionally high cortisol in the morning and intentionally low cortisol at night.""",T12
174,"Mamdani signed executive orders combating ""tricks and traps that drain money from New Yorkers.""",T4
175,"Here are the highlights from the world's largest technology trade show happening in Las Vegas, including a new Nvidia chip architecture.",T2
176,Homeland Security blasted Hilton after ICE agents had their reservations canceled at a Hampton Inn. Hilton said the hotel is independently owned.,T13
177,"Rod Stewart isn't done touring yet, and his 2026 US tour features cities such as Las Vegas, LA, Phoenix, and more. Here's where to find tickets.",T14
178,"Barry Pollack has a long track record of sensitive cases involving national security, and of defending corporate executives in criminal trials.",T1
179,"Small drones are ""the defining threat of our time,"" Brig. Gen. Ross said, requiring a layered defense network to stop them.",T2
180,Dealers split on whether levy is behind volume increases across SDPs,T5
181,Estimated largest payment obligation tops $40bn in Q3,T12
182,"Dealer-backed TP Icap venture aims to disrupt dominant trio of Bloomberg, MarketAxess and Tradeweb",T6
183,"Some EU subsidiaries included, but regulator control over cloud providers could still be limited",T12
184,"Automated data collection and cleaning helps corporates create better hedges and has cut unexplained P&amp;L moves by 87%, says vendor",T5
185,Set-asides run at elevated rate for yet another quarter,T5
186,KPMG survey of more than 90 banks reveals disagreement on how to treat liabilities and loans,T3
187,"New vice-chair seeks efficiency, but staff clear-out could hamper functions, say former regulators",T3
188,Futures-led surge signals firmer views on rate direction,T5
189,Markets proved resilient as Trump redefined US policies – but questions are piling up about 2026 and beyond,T10
190,Actively managed strategies wait in the wings after systematic approach nets Calamos $500m,T5
191,"Instant settlement brings its own risks but doesn’t need to be the default, writes BridgePort’s Soriano",T5
192,"American Express leads with risk density over 70%, ahead of Capital One and Truist",T5
193,CCP hits new margin record for second consecutive quarter,T5
194,Analysts say clearing meltdown bolsters case for futures-for-futures exchange with FMX,T11
195,"ALM Benchmarking research finds wide divergence in liquidity risk appetites, even among large lenders",T5
196,"Counterparty Radar: Trades under three months make up nearly 60% of total positions, up from just a third in 2022",T5
197,Custom indexes eliminate energy and food prices to ease trading of stickier inflation trends,T10
198,"Batch processing and Excel files still pervade, with only one in four lenders planning tech upgrades",T3
199,Industry warns new capital requirements for securities firms are higher than other jurisdictions,T12
200,"A larger proportion of new cars are being bought by affluent Americans as prices and interest rates for auto loans climb, analysts said.",T7
201,"A new study found that the court’s Republican appointees voted for the wealthier side in cases 70 percent of the time in 2022, up from 45 percent in 1953.",T7
202,"Steep import taxes have raised prices and affected U.S. businesses, but not quite as much as expected. A new report offers some reasons.",T10
203,"Many Americans can take advantage of President Trump’s deduction on auto loan interest, but the tax break will provide only modest savings.",T7
204,"The administration has downplayed concerns — from mass job losses, to a potential financial bubble — as President Trump cheers soaring stock prices and faster growth.",T10
205,The latest vessel to be targeted by the United States in its pressure campaign on Venezuela was sending distress signals as it headed northeast from the Caribbean into the Atlantic.,T4
206,Economists say that a typical middle-class family today is richer than one in the 1960s. Americans in their 20s and 30s don’t believe it.,T7
207,"A reordering of the rules of trade, set on top of transformational change in technology, demographics and climate, is remaking jobs, politics and lives.",T14
208,"Data collection issues skewed the latest Consumer Price Index report, economists warned, clouding the picture for the Federal Reserve as it also grapples with a cooling labor market.",T10
209,"With tariffs unpopular and prices still high, the White House has teased the promise of tariff rebates and large tax refunds next year.",T10
210,The Trump administration singled out European tech firms by name and promised economic consequences Tuesday unless the E.U. rolls back tech regulation and lawsuits.,T12
211,The Trump administration looked to recast elements of a dour jobs report Tuesday as a sign of strength.,T7
212,"A proposal to revise an E.U. law requiring carmakers to stop producing combustion engines by 2035 would offer some relief to automakers, but it sets back the region’s climate goals.",T14
213,"Employers added 64,000 jobs in November, according to data delayed by the government shutdown, but the unemployment rate rose to a four-year high of 4.6 percent.",T7
214,The U.S. government has paused a tech-focused trade pledge with Britain over broader disagreements about Britain’s digital regulations and food safety rules.,T14
215,California and New York are among the states arguing that the Trump administration’s decision to charge that fee for skilled foreign workers is illegal.,T4
216,Corporate tax revenue has quickly dipped since Republicans passed tax cuts this summer. But economists think these tax breaks might be worth it.,T10
217,Fed officials explained their opposition to the central bank’s decision this week to cut interest rates by a quarter of a percentage point.,T3
218,The monthly trade deficit fell to its lowest level in five years after the president’s imposition of sweeping global tariffs. But it’s unclear whether the trend will persist.,T10
219,The president continues to brush off an issue that he said he would solve in his first months in office. Some Democrats say he is making the same mistake as his predecessor.,T10
220,"The author and Trump antagonist Michael Wolff has his wife, Victoria, to thank for his latest chapter: lifestyle influencer. Now she’s becoming one, too.",T12
221,"Companies like Kairos Energy are building new types of reactors with the encouragement of the Trump administration, but their success is far from assured.",T9
222,"The reactions online revealed a Chinese society divided: Some saw what happened in Venezuela as a playbook for seizing Taiwan, while others warned about ideological rigidity.",T4
223,"The second-largest U.S. oil company, which kept pumping oil in the country after others left, could find it relatively easy to expand its operations if the political conditions there improve.",T4
224,"Executives debated whether to allow the corporation to lie dormant after federal funding ended last year, but decided against it.",T13
225,Mass flight cancellations during peak holiday travel season have forced travelers to miss school and work and to spend thousands on extended tropical vacations.,T14
226,"The energy sector of the S&amp;P 500 rose 2.7 percent on Monday, lifting the broader market.",T5
227,"A larger proportion of new cars are being bought by affluent Americans as prices and interest rates for auto loans climb, analysts said.",T7
228,"The U.S. seizure of Venezuela’s president has governments, executives and investors bracing for wide-reaching business and geopolitical fallout.",T4
229,"Beijing has lent billions to Caracas in recent decades, and the fate of money it is owed is in question after the ouster of Venezuela’s leader.",T4
230,"A new study found that the court’s Republican appointees voted for the wealthier side in cases 70 percent of the time in 2022, up from 45 percent in 1953.",T7
231,"It will take years and billions in investment to revitalize Venezuela’s oil industry, and energy producers will likely be cautious before stepping in.",T4
232,"The Trump administration is lifting regulations, and deal making is heating up. For Jamie Dimon, being JPMorgan Chase’s chief executive was more lucrative in 2025 than ever.",T13
233,"Travel loyalty programs are competing for customers with members-only experiences like backstage tours, exclusive dinners and access to V.I.P. areas.",T6
234,"After President Trump’s surprise ouster of Venezuela’s authoritarian leader, a team of New York Times editors set to work redoing the front page.",T4
235,"Colleen Keating, chief executive of Planet Fitness, wants them to do it in a “judgment-free zone.”",T12
236,"When it came to his film acting debut, the“Shark Tank” investor had some notes for the director Josh Safdie.",T2
237,The Federal Aviation Administration cited “safety-of-flight risks” in restricting the U.S.-controlled airspace as a result of the military operation in Venezuela.,T4
238,"Venezuela claims to have more than 300 billion barrels in the ground, but it is only producing about one million barrels a day.",T4
239,Here are the biggest unknowns the DealBook team will be watching as we cover business and the economy this year.,T10
240,Backlash over the proliferation of data centers has entered the national political conversation and could affect voters of all political persuasions in this year’s midterm elections.,T1
241,Lawmakers have little time to pass nine appropriations bills or another funding extension before the next shutdown deadline hits.,T13
242,President Donald Trump and congressional Republicans succeeded this summer in stripping federal funds from public media. Now the 58-year-old organization is gone.,T13
243,"Concepts about starter homes seem inconsistent with today’s prices and expansive floor plans, leaving many first-time homebuyers with few options.",T7
244,"According to data, malnutrition deaths have jumped in the United States, especially among those 85 and older. Here’s why the numbers suddenly started to rise.",T7
245,Backlash over the proliferation of data centers has entered the national political conversation and could affect voters of all political persuasions in this year’s midterm elections.,T1
246,Lawmakers have little time to pass nine appropriations bills or another funding extension before the next shutdown deadline hits.,T13
247,President Donald Trump and congressional Republicans succeeded this summer in stripping federal funds from public media. Now the 58-year-old organization is gone.,T13
248,"Concepts about starter homes seem inconsistent with today’s prices and expansive floor plans, leaving many first-time homebuyers with few options.",T7
249,"According to data, malnutrition deaths have jumped in the United States, especially among those 85 and older. Here’s why the numbers suddenly started to rise.",T7
250,"The story you are reading is a series of scoops nestled inside a far more urgent Internet-wide security advisory. The vulnerability at issue has been exploited for months already, and it's time for a broader awareness of the threat. The short version is that everything you thought you knew about the security of the internal network behind your Internet router probably is now dangerously out of date.",T1
251,"KrebsOnSecurity.com celebrates its 16th anniversary today! A huge ""thank you"" to all of our readers -- newcomers, long-timers and drive-by critics alike. Your engagement this past year here has been tremendous and truly a salve on a handful of dark days. Happily, comeuppance was a strong theme running through our coverage in 2025, with a primary focus on entities that enabled complex and globally-dispersed cybercrime services.",T1
252,"The Trump administration has pursued a staggering range of policy pivots this past year that threaten to weaken the nation’s ability and willingness to address a broad spectrum of technology challenges, from cybersecurity and privacy to countering disinformation, fraud and corruption. These shifts, along with the president’s efforts to restrict free speech and freedom of the press, have come at such a rapid clip that many readers probably aren’t even aware of them all.",T1
253,"Direct navigation -- the act of visiting a website by manually typing a domain name in a web browser -- has never been riskier: A new study finds the vast majority of ""parked"" domains -- mostly expired or dormant domain names, or common misspellings of popular websites -- are now configured to redirect visitors to sites that foist scams and malware.",T1
254,"Microsoft today pushed updates to fix at least 56 security flaws in its Windows operating systems and supported software. This final Patch Tuesday of 2025 tackles one zero-day bug that is already being exploited, as well as two publicly disclosed vulnerabilities.",T1
255,A sprawling academic cheating network turbocharged by Google Ads that has generated nearly $25 million in revenue has curious connections to a Kremlin-connected oligarch whose Russian university builds drones for Russia's war against Ukraine.,T1
256,"China-based phishing groups blamed for non-stop scam SMS messages about a supposed wayward package or unpaid toll fee are promoting a new offering, just in time for the holiday shopping season: Phishing kits for mass-creating fake but convincing e-commerce websites that convert customer payment card data into mobile wallets from Apple and Google. Experts say these same phishing groups also are now using SMS lures that promise unclaimed tax refunds and mobile rewards points.",T1
257,"A prolific cybercriminal group that calls itself ""Scattered LAPSUS$ Hunters"" made headlines regularly this year by stealing data from and publicly mass extorting dozens of major corporations. But the tables seem to have turned somewhat for ""Rey,"" the moniker chosen by the technical operator and public face of the hacker group: Earlier this week, Rey confirmed his real life identity and agreed to an interview after KrebsOnSecurity tracked him down and contacted his father.",T1
258,"On the surface, the Superbox media streaming devices for sale at retailers like BestBuy and Walmart may seem like a steal: They offer unlimited access to more than 2,200 pay-per-view and streaming services like Netflix, ESPN and Hulu, all for a one-time fee of around $400. But security experts warn these TV boxes require intrusive software that forces the user's network to relay Internet traffic for others, traffic that is often tied to cybercrime activity such as advertising fraud and account takeovers.",T2
259,"In March 2024, Mozilla said it was winding down its collaboration with Onerep -- an identity protection service offered with the Firefox web browser that promises to remove users from hundreds of people-search sites -- after KrebsOnSecurity revealed Onerep's founder had created dozens of people-search services and was continuing to operate at least one of them. Sixteen months later, however, Mozilla is still promoting Onerep. This week, Mozilla announced their partnership with Onerep will officially end next month.",T1
260,A memory leak security vulnerability allows unauthenticated attackers to extract passwords and tokens from MongoDB servers.,T1
261,"Two US citizens pleaded guilty to working as ALPHV/BlackCat ransomware affiliates in 2023, and both were previously employed by prominent security firms.",T1
262,"Recent attacks are targeting Next.js servers and pose a significant threat of cryptomining, botnet payloads, and other malicious activity to IoT networks and enterprises.",T1
263,"Cybersecurity experts discuss 2026 predictions, highlighting the rise of AI-driven threats, the shift to resilience over prevention, and the urgent need for advanced security measures to combat evolving risks",T2
264,"From securing supply chain defenses and MCPs across AI workflows to formal AI and quantum governance, experts share their wish lists for cyber safety in 2026.",T2
265,The April/May zero-day exploitations of Ivanti's mobile device management platform meant unprecedented pwning of thousands of orgs by a Chinese APT — and history will probably repeat itself.,T1
266,"What happens to all of those always-connected devices when the cloud goes down? Disruptions to sleep, school, and smart homes, just to name a few issues.",T1
267,"Agentic AI adoption and identity security risks, IGA expands in mid-market, SOC-identity team collaboration, and identity platform consolidation — this 2026 predictions post previews identity trends.",T2
268,"Concerns about an economic bubble bursting, along with doubts regarding return on investment, suggest the tide may be turning for the artificial intelligence industry.",T2
269,"The year ahead will see an intensified AI-driven cybersecurity arms race, with attackers leveraging autonomous malware and advanced AI technologies to outpace defenders, while security teams adopt increasingly sophisticated AI tools to combat evolving threats amidst growing vendor consolidation and platformization in the industry.",T2
270,An analysis of cyber-insurance claims data shows which cyber defenses actually work for policyholders. Here are six technologies that will pay off for companies in 2026.,T2
271,Dark Reading Confidential Episode 13: Developers are exposing their organizations' most sensitive information; our guests explain why it's happening and how to stop it.,T1
272,"With a new year upon us, software and cybersecurity experts disagree on the utility of software bill of materials — in theory, SBOMs are great, but in practice, they're a mess.",T1
273,"2025 included a number of monumental threats, from global nation-state attacks to a critical vulnerability under widespread exploitation.",T2
274,"Patricia Voight, CISO at Webster Bank, shares her expertise on advancing cybersecurity careers, combating financial crimes, and championing diversity in a rapidly changing industry.",T2
275,"Developers are leaning more heavily on AI for code generation, but in 2026 the development pipeline and security need to be prioritized.",T2
276,"Take part in the new survey from Dark Reading and help uncover trends, challenges, and solutions shaping the future of application security.",T1
277,"Healthcare cyberattacks are on the rise, but industry organizations say the proposed changes to the security rules fall short of what's needed.",T1
278,Its latest cybersecurity acquisition will help further ServiceNow's plans for autonomous cybersecurity and building a security stack to proactively manage AI.,T2
279,"The tech giant has been beset by a deluge of state-sponsored North Korean operatives, showcasing the sheer scale of the IT worker scam problem.",T1
280,Californians can now submit demands requiring 500 brokers to delete their data.,T8
281,The past year has seen plenty of hacks and outages. Here are the ones topping the list.,T1
282,"In a year where lofty promises collided with inconvenient research, would-be oracles became software tools.",T2
283,"A serious data breach has occurred, but Ars users have nothing to worry about.",T1
284,"GPS jamming has gotten cheap and easy, but there are potential solutions.",T1
285,"From compression tricks to multi-agent teamwork, here's what makes them tick.",T2
286,"New GPT Image 1.5 allows more detailed conversational image editing, for better or worse.",T2
287,"The extensions, available for Chromium browsers, harvest full AI conversations over months.",T2
288,Dictionary codifies the term that took hold in 2024 for low-quality AI-generated content.,T2
289,The weak RC4 for administrative authentication has been a hacker holy grail for decades.,T1
290,"Shenzhen-based Picea Robotics, its lender and primary supplier, will acquire all of iRobot’s shares.",T6
291,"""The vast majority of Codex is built by Codex,"" OpenAI told us about its new AI coding agent writing code.",T2
292,Company claims new AI model tops Gemini and matches humans on 70% of work tasks.,T2
293,"Three-year deal lets users create AI videos of Mickey Mouse, Darth Vader, and more.",T2
294,Company raises its capital expenditure forecast as it doubles down on AI infrastructure bet.,T2
295,"Devstral 2 model scores 72% on industry benchmark, nearing proprietary rivals.",T5
296,“Abandonment” offers rare chance to reclaim one of tech’s most recognized brands.,T6
297,"Facebook agrees to change ""pay or consent"" model after talks with European Commission.",T12
298,Defendants were convicted of similar crimes a decade ago. How were they cleared again?,T1
299,Open source React executes malicious code with malformed HTML—no authentication needed.,T1
300,"As ordered reported by the House Committee on Education and Workforce on September 17, 2025",T9
301,"As ordered reported by the House Committee on Natural Resources on July 23, 2025",T9
302,"As reported by the House Committee on Energy and Commerce on October 3, 2025",T9
303,"As reported by the Senate Committee on Health, Education, Labor, and Pensions on September 8, 2025",T9
304,"As ordered reported by the House Committee on Natural Resources on July 23, 2025",T9
305,"As reported by the House Committee on Energy and Commerce on December 30, 2025",T9
306,"As reported by the House Committee on Energy and Commerce on December 30, 2025",T9
307,Presentation by Jeffrey Kling and Heidi Williams at the 2026 Allied Social Science Associations (ASSA) Annual Meeting,T9
308,"As ordered reported by the House Committee on Foreign Affairs on December 3, 2025",T9
309,"As ordered reported by the House Committee on Foreign Affairs on December 3, 2025",T9
310,"As ordered reported by the House Committee on Foreign Affairs on December 3, 2025",T9
311,"As ordered reported by the House Committee on Foreign Affairs on December 3, 2025",T9
312,"CBO announces what to expect in the coming weeks as the agency begins the new calendar year with a series of reports that offers updated insights into the nation's demographic trends, economic outlook, and budgetary conditions.",T13
313,"As ordered reported by the Senate Committee on Commerce, Science, and Transportation on October 21, 2025",T9
314,"As ordered reported by the Senate Committee on Commerce, Science, and Transportation on October 21, 2025",T9
315,"As introduced in the House of Representatives on December 12, 2025",T9
316,"As reported by the House Committee on the Judiciary on December 12, 2025",T9
317,The Majority Leader of the House of Representatives announces bills that will be considered under suspension of the rules in that chamber. CBO estimates the effects of those bills on direct spending and revenues.,T9
318,"CBO finds that maintenance for Navy destroyers and amphibious warfare ships has often taken longer and required more labor than planned. Those delays affect the fleet's readiness and reflect aging ships, late inspections, and other factors.",T7
319,"As reported by the House Committee on Energy and Commerce on October 3, 2025",T9
320,"The government shutdown affected economic data collection The 43-day lapse in congressional appropriations, which began on October 1 and lasted until November 12, 2025, has been the longest on record. Without funds to pay for employee salaries and business operations, &#8230; <a href=""https://fredblog.stlouisfed.org/2026/01/a-blank-space-missing-and-imputed-economic-data/"">Continue reading <span class=""meta-nav"">&#8594;</span></a>",T13
321,"The FRED Blog has discussed how the daily operations of the Federal Reserve Banks and, specifically, the New York Fed generally maintain the effective federal funds rate within the target range set by the Federal Open Market Committee (FOMC). As &#8230; <a href=""https://fredblog.stlouisfed.org/2025/12/tracking-recent-financial-market-conditions/"">Continue reading <span class=""meta-nav"">&#8594;</span></a>",T3
