id,text,topic_id
321,"In a previous FRED blog post, we discussed the Summary of Economic Projections (SEP) released by the FOMC this past September. In this post, we  again use ALFRED to compare the latest projections released in December 2025 with several of &#8230; <a href=""https://fredblog.stlouisfed.org/2025/12/fomc-summary-of-economic-projections-december-2025/"">Continue reading <span class=""meta-nav"">&#8594;</span></a>",T3
322,"All Federal Reserve Banks operate within a specific geographic area—called a district. The Cleveland Fed is in the Fourth District of the Federal Reserve System, which covers Ohio and parts of Pennsylvania, Kentucky, and West Virginia. The Cleveland Fed&#8217;s Survey &#8230; <a href=""https://fredblog.stlouisfed.org/2025/12/cleveland-fed-data-on-regional-economic-conditions/"">Continue reading <span class=""meta-nav"">&#8594;</span></a>",T10
323,"What’s really happening in US manufacturing? In our FRED graph above, we compare labor productivity for all workers in the manufacturing sector alongside the share of manufacturing employment in total US nonfarm employment since 1987. The graph tells a compelling &#8230; <a href=""https://fredblog.stlouisfed.org/2025/12/manufacturing-employment-and-productivity/"">Continue reading <span class=""meta-nav"">&#8594;</span></a>",T13
324,"In 2025, many US households reported a surge in electricity prices. According to the producer price index (PPI) for residential electric power, these prices have gone up by 7% between January and August 2025. This rise in prices can be &#8230; <a href=""https://fredblog.stlouisfed.org/2025/12/the-divergence-of-electricity-and-natural-gas-prices/"">Continue reading <span class=""meta-nav"">&#8594;</span></a>",T3
325,"Gross domestic product (GDP) is the sum of all incomes distributed in a year, including disposable personal income (DPI). So, GDP and DPI are positively correlated. That is, they generally move in the same direction and follow each other closely. &#8230; <a href=""https://fredblog.stlouisfed.org/2025/12/why-did-gdp-and-personal-income-diverge-during-covid/"">Continue reading <span class=""meta-nav"">&#8594;</span></a>",T13
326,"The current softening in the labor market is hitting recent college graduates especially hard, suggesting the traditional college premium may be weakening. At least for quickly landing a job. In this post, we take a longer view of the unemployment &#8230; <a href=""https://fredblog.stlouisfed.org/2025/11/the-unemployment-gap-between-college-graduates-and-noncollege-workers/"">Continue reading <span class=""meta-nav"">&#8594;</span></a>",T13
327,"How do prices change over time? Prices tend to go up, especially over long periods. But some prices can increase much faster than others and some can even decrease. Over the past 40 years or so, price changes for goods &#8230; <a href=""https://fredblog.stlouisfed.org/2025/11/long-term-price-trends/"">Continue reading <span class=""meta-nav"">&#8594;</span></a>",T3
328,"The FRED Blog often discusses inflation—in particular, the consumer price index reported by the US Bureau of Labor Statistics. The CPI from the BLS measures the average change over time in the prices paid by urban consumers for a representative &#8230; <a href=""https://fredblog.stlouisfed.org/2025/11/the-harmonized-consumer-price-index/"">Continue reading <span class=""meta-nav"">&#8594;</span></a>",T3
329,"The FRED Blog has described key information about data contained in the “Notes” provided under each FRED graph. Today, to underscore, highlight, and emphasize that point, we offer another example. Our FRED graph above shows quarterly data of US gross &#8230; <a href=""https://fredblog.stlouisfed.org/2025/11/what-is-annualized-gdp/"">Continue reading <span class=""meta-nav"">&#8594;</span></a>",T13
330,"Banks must extract useful signals of a potential borrower's quality from a large set of possibly informative characteristics when making lending decisions. A model that speaks to how banks specialize in lending to an industry in order to better extract signals from data, can potentially be applied to a number of real-world scenarios. In this post, we apply lessons from such a model to a topic of timely relevance in economics: job market recommendation letters. Institutions looking to hire new economists must evaluate PhD applicants based on limited and often noisy signals of future performance, including letters of recommendation from these applicants’ advisors or co-authors. Using insights from our model, we argue that the value of these letters depends on who reads them.",T12
331,"Why does the banking industry remain prone to large and costly disruptions despite being so heavily regulated? Is there a need for more regulation, less regulation, or simply different regulation? Our <a href=""https://www.newyorkfed.org/research/staff_reports/sr1155.html"">recent Staff Report</a> combines insights from academic research in economics, finance, and accounting to provide a deeper understanding of the challenges involved in designing and implementing bank regulation, as well as opportunities for future exploration. This post focuses on the regulation of bank capital, but the ideas are applicable more broadly.",T12
332,"This post presents an update of the economic forecasts generated by the Federal Reserve Bank of New York’s dynamic stochastic general equilibrium (DSGE) model. We describe very briefly our forecast and its change since <a href=""https://libertystreeteconomics.newyorkfed.org/2025/09/the-new-york-fed-dsge-model-forecast-september-2025/"" rel=""noreferrer noopener"" target=""_blank"">September 2025</a>. To summarize, growth in 2025 is expected to be stronger than in September due to a lower projected path of the policy rate, as well as higher productivity. Inflation projections are higher in 2025 because of cost-push shocks, which capture the effects of tariffs. The model’s predictions for the short-run real natural rate of interest (or r*) in 2025 have decreased relative to September.",T3
333,"Following the recent passage of <a href=""https://www.congress.gov/bill/119th-congress/senate-bill/1582"" rel=""noreferrer noopener"" target=""_blank"">legislation in the U.S.</a>, payment stablecoins seem to be on the brink of wider-scale adoption and explosive growth in market capitalization. In this post, we contend that the driving factor is not their proximity to digital cash instruments, but rather how they are transferred—via global, open-access, peer-to-peer systems, or “permissionless blockchains,” for short.",T12
334,"There has been a lot of interest in firms’ pricing decisions in the past few years—both during the inflation surge of 2021-23 and in the more recent rounds of tariff increases. In this post, we let firms speak for themselves about what factors they consider when adjusting prices in response to various shocks. The analysis is based on an ongoing research project, joint with the Atlanta and Cleveland Federal Reserve Banks, on how businesses set prices and the extent of passthrough of cost increases. In particular, we leverage the qualitative portion of the study based on open-ended interviews with senior decision-makers on how they approach pricing decisions in their firms. Rather than a uniform approach, a very nuanced picture emerges of businesses trying to balance competing objectives while keeping an eye on demand conditions for their products as well as on their direct competitors’ behavior in the market.",T3
335,"A <a href=""https://libertystreeteconomics.newyorkfed.org/2012/10/is-us-monetary-policy-seasonal/"" rel=""noreferrer noopener"" target=""_blank"">2012 <em>Liberty Street Economics</em> post</a> noted that U.S. monetary policy exhibits a surprising degree of seasonal behavior: over the 1987-2008 period, the Federal Reserve was much more likely to lower interest rates (or abstain from raising rates) in the first month of each quarter than in the two subsequent months. Thirteen years later, we revisit that analysis to investigate whether the seasonal pattern in monetary policy still holds today, in the wake of a rate hiking cycle, a pandemic, a surge in inflation, and a second round of rate hikes. We find that the pattern has indeed continued; however, unlike in the earlier sample period, it can be completely explained by the timing of the FOMC calendar.",T3
336,"In a <a href=""https://libertystreeteconomics.newyorkfed.org/u-s-banks-have-developed-a-significant-nonbank-footprint"">previous post</a>, we documented how, over the past five decades, the typical U.S. bank has evolved from an entity mainly focused on deposit taking and loan making to a more diversified conglomerate also incorporating a variety of nonbank activities. In this post, we show that an important driver of the evolution of this new organizational form is the desire of banks to efficiently manage liquidity needs.<br />",T12
337,"<br />In light of the rapid growth of nonbank financial institutions (NBFIs), many have argued that bank-led financial intermediation is on the decline, based on the traditional notion that banks operate to take in deposits and make loans. However, we argue that deposit-taking and loan-making have not accurately characterized U.S. banking operations in recent decades. Instead, as we propose in this post, absent regulatory restrictions, banks naturally expand their boundaries to include NBFI subsidiaries. A significant component of the growth of NBFIs has in fact taken place <em>inside </em>the boundaries of banking firms.",T12
338,"In 2025, the Federal Reserve has cut interest rates, trade policy has shifted abruptly, and economic policy uncertainty has increased. How have these developments affected the functioning of the key U.S. Treasury securities market? In this post, we return to some familiar metrics to assess the recent behavior of Treasury market liquidity. We find that liquidity briefly worsened around the April 2025 tariff announcements but that its relation to Treasury volatility has been similar to what it was in the past.",T5
339,"Bank failures and distress can be costly to the economy, causing losses to creditors and reducing the flow of credit and other financial intermediation services. Thus, there is significant value in being able to identify “at risk” banks in a timely and accurate way. In a <a href=""https://libertystreeteconomics.newyorkfed.org/2025/09/economic-capital-a-new-measure-of-bank-solvency/"" rel=""noreferrer noopener"" target=""_blank"">previous post</a>, we presented a new solvency metric, Economic Capital, and showed how solvency risks in the U.S. banking industry have evolved over time according to this measure. In this post, we continue to draw on our recent <a href=""https://www.newyorkfed.org/research/staff_reports/sr1144.html"" rel=""noreferrer noopener"" target=""_blank"">Staff Report</a> to present analysis showing that Economic Capital identifies failing banks earlier and more accurately than more conventional solvency measures.",T12
340,"As in previous years, we provide in this post an update on the vulnerability of the U.S. banking system based on four analytical models that capture different aspects of this vulnerability. We use data through 2025:Q2 for our analysis, and also discuss how the vulnerability measures have changed since our last update <a href=""https://libertystreeteconomics.newyorkfed.org/2024/11/banking-system-vulnerability-2024-update/?_ppp=6960e497ee"">one year ago</a>.",T12
341,"After the Great Financial Crisis, the European Central Bank (ECB) extended its monetary policy toolbox to include the use of long-term loans to banks at interest rates close to zero or even negative. These central bank interventions were aimed at supporting the transmission of expansionary monetary policy and likely played a crucial role in bolstering the financial stability of the euro area, namely by reducing the chance of bank runs. However, quantitative evidence on the effects of these interventions on financial stability remains scant. In this post, we quantify the effectiveness of central bank lending programs in supporting financial stability through the lens of a novel structural model discussed in this <a href=""https://papers.ssrn.com/sol3/papers.cfm?abstract_id=3708226"">paper</a>.",T12
342,"Every state in the country has a law permitting involuntary hospitalization if a person presents a danger to themselves or others as a result of mental illness. If a person reaches this high bar, the logic goes, they should be confined in a psychiatric hospital for treatment until they are stabilized. (The process is also sometimes called involuntary commitment, involuntary psychiatric hold, or sectioning.) Although there is no definitive national accounting, it is estimated that about 1.2 million involuntary psychiatric hospitalizations occur every year (<a href=""https://psychiatryonline.org/doi/10.1176/appi.ps.201900477"">Lee and Cohen 2021</a>). This puts the magnitude on par with the 1.2 million individuals imprisoned in state, federal, and military prisons every year (<a href=""https://bjs.ojp.gov/library/publications/prisoners-2021-statistical-tables"">Carson 2022</a>). In a new <a href=""https://www.newyorkfed.org/research/staff_reports/sr1158.html"">Staff Report</a>, we use data from Allegheny County, which includes Pittsburgh, to measure how psychiatric commitments are impacting an individual’s risk of danger to themselves or others, earnings, and housing.",T2
343,"Uncertainty is a key component of everyday economic decisions of consumers and, perhaps not surprisingly, it plays a central role in economic models. According to economic theory, forward-looking consumers rely on their expectations and perceived uncertainty when making economic decisions. Nevertheless, measuring the uncertainty that households actually perceive, and how it affects consumer behavior, is challenging. The probabilistic nature of the <a href=""https://www.newyorkfed.org/microeconomics/sce"" rel=""noreferrer noopener"" target=""_blank"">Survey of Consumer Expectations</a> enables us to make progress on this subject and to construct household-specific time-varying uncertainty. In our recent <a href=""https://www.newyorkfed.org/research/staff_reports/sr1148"" rel=""noreferrer noopener"" target=""_blank"">Staff Report</a>, we empirically show that the marginal propensity to consume (MPC) is increasing and concave in perceived uncertainty. This novel empirical evidence poses a challenge for the conventional consumption-savings model with incomplete markets.",T3
344,"In <a href=""https://libertystreeteconomics.newyorkfed.org/2024/09/end-of-month-liquidity-in-the-treasury-market/"" rel=""noreferrer noopener"" target=""_blank"">a 2024 post</a>, we showed that interdealer trading in benchmark U.S. Treasury notes and bonds concentrates on the last trading day of the month, likely due to passive investment funds’ turn-of-month portfolio rebalancing. In this post, we extend our trading activity analysis to the full range of Treasury securities and market segments. We find that trading is even more concentrated on the last trading day of the month for other types of Treasury securities and in the dealer-to-customer segment of the market, with trading volume in off-the-run Treasuries twice as high as on other days, on average.",T5
345,"Recently instituted rule amendments have initiated a large migration of dealer-to-client Treasury repurchase trades to central clearing. To date, the main avenue used to access central clearing is Sponsored Service, a clearing product that has, until now, received little attention. This post highlights the results from <a href=""https://www.newyorkfed.org/research/staff_reports/sr1140"">a recent Staff Report</a> which presents a deep dive into Sponsored Service. Here, we summarize the description of the institutional details of this service and its costs and benefits. We then document some basic facts on how market participants use this service, based on confidential data.",T12
346,"The term “exorbitant privilege” emerged in the 1960s to describe the advantages derived by the U.S. economy from the dollar’s status as the de facto global reserve currency. In this post, we examine the exorbitant privilege that accrued to the Netherlands in the eighteenth century, when the Dutch guilder enjoyed global <a href=""https://www.ijcb.org/journal/ijcb16q4a2.pdf"">reserve currency</a> status. We show how the private actions of financial institutions created and maintained this privilege, even in the absence of a central bank. While privilege benefited the Dutch financial system in many ways, it also laid the seeds of later financial crisis.",T12
347,"U.S. trade policy remains in flux. Nevertheless, important elements of the new policy regime are apparent in data through July. What stands out are the large differences in realized tariff rates by trading partner, ranging from less than 5 percent for Canada and Mexico to 15 percent for Japan and to 40 percent for China. This post shows that the bulk of cross-country differences in tariff rates is explained by two factors:  the U.S.-Canada-Mexico free trade agreement and differing sales shares in tariff-exempt categories.",T11
348,"Over the past few months, New Jersey and Vermont have joined a growing number of U.S. states in requiring employers to include an estimated salary range in their online job listings. Has this push for greater pay transparency been effective? In this post, we use granular data on U.S. job postings from Lightcast to assess employers’ compliance with these new regulations. Focusing on the jurisdictions that adopted pay transparency laws early on, we find that many employers ignore pay transparency requirements; roughly a quarter of job listings covered by these laws fail to include salary information.",T13
349,"Digital currencies have grown rapidly in recent years. In July 2025, Congress passed the “Guiding and Establishing National Innovation for U.S. Stablecoins Act” (GENIUS) Act, establishing the first comprehensive federal framework governing the issuance of stablecoins. In this post, we place stablecoins in a historical perspective by comparing them to national bank notes, a form of privately issued money that circulated in the United States from 1863 through 1935.",T12
350,London-based manager’s new open-ended global interval fund focuses on synthetic risk transfer and capital relief.,T1
351,The Italian public pension fund has issued a request for proposal for private debt funds.,T10
352,"The New York-based manager was targeting $2bn for Fund VII, but has amassed more with a boost from the strategy’s anticipated leverage.",T1
353,The vehicle’s $2.6bn final close came months before Brookfield agreed to buy the Los Angeles-based manager’s outstanding shares.,T1
354,The manager will expand its fixed income exposure through the all-cash transaction valued at $473m.,T1
355,"US attorneys claim Tricolor execs Chu, Goodgame, Kollar and Seibold fabricated data to obtain loans.",T12
356,"Blackstone signs forward flow deal with real estate-secured lender. Also, bank lending to non-depository financial institutions 'raising risks'. Here's today's brief for our valued subscribers only.",T12
357,"Israeli firm leverages Blackstone’s origination capability, including corporate, real estate and asset-based credit strategies.",T12
358,"Spreads on newly originated retail loans were largely stable in the third quarter, according to Trepp research.",T12
359,"The secondaries giant is the latest player to set up a formal strategy targeting the asset class, Secondaries Investor understands.",T8
360,"Boxing Day bonanza: $27 billion in bitcoin, ether options set for year-end reset",T9
361,Bullish bitcoin plays on Bitfinex swell to highest since early 2024,T4
362,Uniswap token burn moves closer to reality as 99% voters favor ‘fee switch’ proposal,T9
363,Hong Kong proposes new rules to tap insurance capital into cryptocurrencies,T9
364,Binance opens up ways for users to generate income using ETH options,T9
365,Dogecoin slips below $0.129 as range support gives way,T4
366,XRP weakens after repeated price-action failures near $1.95,T4
367,"Bitcoin steadies near $89,000 as gold hits record and Asia stocks rise",T9
368,Galaxy Digital’s head of research explains why bitcoin’s outlook is so uncertain in 2026,T9
369,"Fed’s Hammack tilts hawkish on rates, questions CPI drop as distorted",T5
370,‘DeFi is dead’: Maple Finance’s CEO says onchain markets will swallow Wall Street,T9
371,Tom Lee responds to controversy surrounding Fundstrat’s differing bitcoin outlooks,T9
372,Uniswap’s UNI Jumps 19% as governance vote to activate protocol fees opens,T9
373,VanEck's new Avalanche ETF filing to include staking rewards for AVAX investors,T9
374,Ethereum’s ‘Glamsterdam’ upgrade aims to fix MEV fairness,T4
375,State of Crypto: Trying to figure out the market structure bill's prognosis,T9
376,Hilbert Group buys Enigma Nordic in $32 million deal to boost crypto trading edge,T9
377,Crypto user loses $50 million in 'address poisoning' scam,T7
378,"Brazil’s Gen Z drives crypto boom as stablecoins, income tokens surge",T9
379,"<p>Following the Money is a Q&#38;A series that spotlights how Chainalysis customers use our products in the real world —&#8230;</p>
<p>The post <a href=""https://www.chainalysis.com/blog/following-the-money-with-chainalysis-clement-santerre-meria/"">Following the Money with Chainalysis: 9 Questions for Clément Santerre</a> appeared first on <a href=""https://www.chainalysis.com"">Chainalysis</a>.</p>",T7
380,<p>※この記事は自動翻訳されています。正確な内容につきましては原文をご参照ください。 暗号資産サービスから2025年上半期だけで21億7000万ドル以上が盗まれるなど、分散型金融（DeFi）およびWeb3プロトコルをハッカー、運用上の不具合、ガバナンス攻撃、金融的な不正から守ることがこれまで以上に急務となっています。これには、積極的な予防、データセキュリティ基盤、ツール整備、エコシステム全体での連携への継続的な投資が必要です。 統一された防御体制：チェーン・開発者・エンドユーザーの保護 当社はエコシステムを強化するため、ブロックチェーン財団と連携し、チェーン自体のセキュリティ強化だけでなく、各ネットワーク上でプロトコルを構築する開発者に特化したHexagateの無料提供も行っています。 Hexagateとは？リアルタイムのオンチェーンセキュリティレイヤー Hexagateはオンチェーン環境向けのランタイムセキュリティプラットフォームで、進行中の攻撃を検知し、損失が発生する前にチームが対策を講じられるよう支援します。従来のサイバーセキュリティがサーバーやクラウドを守るのに対し、Hexagateはスマートコントラクト、トランザクション、オンチェーン資産を守る、従来型ツールがカバーできない領域のためのソリューションです。 &#160; チェーン向け：インフラ一貫性の確保 チェーンのセキュリティ担当者は、インフラやトレジャリーの保護という重要かつ複雑なミッションに直面しています。主要なブロックチェーンでは、エンドツーエンドのオンチェーンセキュリティ確保のためにHexagateを導入し、以下のような保護を実現しています。 リアルタイム脅威インテリジェンス：新たな攻撃ベクトルを即座に把握 エコシステム全体のモニタリング：オンチェーン活動を包括的に監視 ウォレット侵害検知：運用ウォレットやトレジャリーウォレットの侵害を早期に特定 リスク自動低減：エクスプロイトを未然に防ぎ、ブロックチェーンネットワークの健全性を維持するツール 当社は、Base、Avalanche、Plasma、MegaETH、Polygon、Cronos、Immutableなど、業界のリーダーと提携できていることを誇りに思います。 開発者向け：無料AI搭載プロトコル保護 Web3プロトコルの構築には多大な労力がかかります。開発者は、プロダクトの革新、優れたユーザー体験、持続可能なトークノミクス、効率的なオンボーディング、大規模なスケーリングなど、複雑な課題のバランスを常に求められます。 しかし、その全ての基盤となるのがセキュリティです。セキュリティは最も重要かつ困難なフロンティアであり、1件のエクスプロイトが甚大な経済的損失やユーザーの信頼喪失に直結します。 ブロックチェーン財団との戦略的パートナーシッ,T5
