id,text,topic_id
0,There’s one thing worse than hunkering down during a snowstorm — and that’s doing so with someone who resents your spending.,T5
1,“The projected snowfall this weekend doesn’t look to be changing too much.”,T5
2,"“If she didn’t want the home, it would have been sold at fair market value.”",T5
3,"Airlines have canceled nearly 15,000 flights due to a winter storm expected to wallop two-thirds of the U.S. over the weekend — with hubs in Dallas and Atlanta among the most affected.",T5
4,Telehealth has become a ‘mainstream part of care delivery’,T7
5,Trump administration admits to security breaches that had been outlined in a whistleblower complaint,T0
6,What can go wrong? Being in a couple complicates your decision-making.,T5
7,Here are the vital estate-planning moves solo agers and people without children need to take.,T5
8,"Retirees can face larger spending shocks than workers, often driven by unpredictable costs such as healthcare.",T2
9,U.S. productivity slows down in fourth quarter while unit labor costs accelerate,T2
10,Beyond to buy rights to Buy Buy Baby brand and reunite it with Bed Bath & Beyond,T6
11,Amazon says it had best-ever Thanksgiving Holiday week with record sales and number of items sold,T8
12,U.S. stock futures and bond yields drop on reports Putin has updated nuclear doctrine,T10
13,Charter Communications announces buyout deal for Liberty Broadband at terms above its previous proposal,T6
14,General Motors unveils new all-electric Cadillac called the Vistiq with 300-mile range,T9
15,Vestas Wind Systems stock slumps as company says margins to be at low end of guidance,T3
16,Burberry shares rise on report Moncler could bid for it,T3
17,Kazatomprom reports 17% increase in production during the third quarter,T3
18,Anheuser-Busch InBev shares slip as sales come up shy of estimates,T3
19,Wingstop’s stock slides 12% after profit falls short of estimates,T3
20,Novartis hikes sales and profit guidance for the year,T8
21,Plus500 says it will meet expectations after quarterly revenue climbs 11%,T3
22,Trainline boosts guidance for the second time this year,T8
23,Barclays reports 18% profit rise as it lifts income guidance,T3
24,"London Stock Exchange Group says income grew, led by Tradeweb",T3
25,"With GLP-1 drugs rising in popularity, how are businesses adapting to a new type of consumer?",T8
26,Some artists already ban phones at their gigs while some headteachers say locking them away helps children learn.,T7
27,"Liberal Democrat leader Sir Ed Davey says the bonds would ""give ordinary people the opportunity to contribute to Britain's security"".",T1
28,It comes as tensions appear to have escalated between Trump and Canadian Prime Minister Mark Carney.,T4
29,Heathrow says it has become the biggest airport to drop the limit after rolling out new high-tech scanners.,T5
30,The British arm of Tesla has faced multiple court proceedings linked to allegations of road traffic offences.,T9
31,"While TikTok's future in the US has been secured, questions remain about exactly what changes US users will see.",T9
32,Lee Castleton is taking legal action against his former employer over the Horizon IT scandal.,T7
33,"Sales rose by more than expected, but it remained a difficult festive period for many retailers.",T8
34,Greenland's natural resources include large reserves of rare earth deposits.,T10
35,Civil service pension scheme failed to pay some pensions and lump sums after transferring to a new administrator.,T2
36,It is a challenge for TikTok's parent company ByteDance as well as global ambitions for other Chinese tech companies.,T9
37,The app was due to be banned in the US a year ago if its Chinese owner didn't sell its business in America.,T9
38,"Installers should be investigated by the Serious Fraud Office, an influential parliamentary committee has said.",T0
39,"JPMorgan Chase said the lawsuit has ""no merit"" and the bank ""does not close accounts for political or religious reasons"".",T5
40,"More money than expected was collected through tax and higher National Insurance Contributions, although public sector spending also increased.",T2
41,"About 46,000 customers lost thousands of pounds when Safe Hands Plans Ltd collapsed in 2022.",T3
42,"The Office of Road and Rail says it was missing ""critical points"" when it made a decision.",T8
43,"At Davos, the US president said he would not use force to take the island and later floated a possible ""forever"" deal.",T10
44,Jamie Dimon said Donald Trump's interest rate cap proposal would restrict Americans' access to credit.,T13
45,Mexican Senator Armando Rios Piter told CNN that he plans to introduce a bill this week that would stop Mexican purchases of American corn.,T14
46,The days of plugging in an iPhone to charge won't last forever.,T3
47,"Nandan Nilekani, co-founder of one of India's biggest outsourcing companies, says an H-1B visa crackdown would ultimately hurt the U.S.",T10
48,The market is at all-time highs and many say Trump is the reason. But stocks were rallying when investors thought Hillary Clinton would win. Janet Yellen and the Fed may deserve more of the credit for the market's move.,T10
49,Apple stock is less than $1 away from its all-time high amid renewed optimism for the iPhone.,T3
50,President-elect Donald Trump focuses his criticism of NAFTA on Mexico. But Canada and America have a rocky trade history too.,T4
51,"Verizon has decided to bring back unlimited data plans. But while that's great for its subscribers, it's awful news for investors. It's another sign of how brutally competitive the telecom business is. And it's hurting Verizon's stock.",T6
52,The price of crude oil has more than doubled over the past year after bottoming out at $26 per barrel in February 2016.,T8
53,The automaker announced Monday that its first official venture in the oil-rich Middle East will be in the United Arab Emirates.,T9
54,Uber's top rival in India has some unsolicited advice for the U.S. startup: Go local.,T9
55,"Apple CEO Tim Cook wants the tech industry to take action against ""fake news"" stories that are polluting the web.",T7
56,"Sears Holdings, the company that owns retail stores Sears and Kmart, said this weekend that it would remove 31 Trump-branded items from its website.",T5
57,"Universal Biopack makes packaging that it sells to restaurants and manufacturers. But rather than plastic, it uses a mixture of bamboo and cassava.",T4
58,"Nike on Sunday launched a star-studded short film titled ""Equality"" that coincides with Black History Month.",T6
59,"Treasury secretary pick Steven Mnuchin is an executive producer on Warner Bros.' ""The Lego Batman Movie,"" which pulled in an estimated $55.6 million from U.S. audiences during its opening weekend.",T4
60,"It may seem like a recurring nightmare, but Greece is in danger of running out of money again.",T8
61,"European Council president Antonio Costa arrived in India on Sunday, as the EU and New Delhi seek to seal a free-trade pact, capping nearly two decades of negotiations between the economic behemoths.
Costa and European Commission President Ursula von der Leyen are chief guests for this year’s Republic Day celebrations in New Delhi on Monday before the 16th EU-India summit on Tuesday, where they hope to shake hands on the accord, described as the “mother of all deals”.
“The summit will be an...",T12
62,"China’s Miao ethnic group is marked out from others thanks to their observance of a unique tradition known as “moving house at night”.
The custom sees young men smear soot on their faces, dance, turn lights on and off and conclude the relocation by firing a hunting rifle before sunrise.
The tradition is long-standing in a Miao ethnic township in Xiangyun county, Dali Bai Autonomous Prefecture, Yunnan province, southwestern China.
The Miao people, who primarily live in the mountainous regions of...",T9
63,"A new Chinese military special-ops drone has shown unprecedented accuracy in live-fire tests, hitting a human-sized target with every shot while using a standard infantry assault rifle.
The drone fired 20 single rounds while hovering at a height of 10 metres (3.2 feet) and a distance of 100 metres from the human-sized target, a standard 50cm by 50cm (about 20 by 20 inches) chest board.
The drone achieved a 100 per cent hit rate during flight trials, according to a peer-reviewed study published...",T0
64,"The operator of Hong Kong’s Mandatory Provident Fund (MPF) has tightened its online security by scrapping an electronic verification system after scammers used forged identity cards to open accounts and steal residents’ pensions.
Ayesha Macpherson Lau, chairwoman of the Mandatory Provident Fund Schemes Authority, said in a blog post on Sunday that the authority had jettisoned the identification tool for the electronic Mandatory Provident Fund (eMPF) platform in favour of the government’s...",T14
65,"The South Korean government is moving towards regulatory actions against Grok, xAI’s generative artificial intelligence (AI) chatbot, following mounting concerns over its alleged involvement in generating and distributing sexually exploitative deepfake images.
The Personal Information Protection Commission (PIPC) has launched a preliminary fact-finding review into Grok after the allegations were reported on Sunday.
The preliminary process is to confirm whether the violation actually occurred and...",T7
66,"Chinese electric vehicle (EV) king BYD aims for a 24 per cent increase in its overseas deliveries in 2026, buoyed by an expanded sales network and new model launches, as it pursues growth abroad to counteract a slowing domestic market.
The Shenzhen-based company, the world’s largest builder of pure electric and plug-in hybrid vehicles, expected to sell 1.3 million cars this year outside mainland China, up 24.3 per cent from 2025, said Li Yunfei, general manager of branding and public relations,...",T9
67,"The reason ordinary Hongkongers acted so swiftly and generously to help the victims of the Tai Po fire is that they understood instinctively just what a traumatic effect the tragedy must have had on their fellow citizens.
The loss of the family home would arouse the deepest emotions at any time. In circumstances where the loss was sudden, not the fault of the individuals themselves and accompanied by the deaths of scores of neighbours, the feelings would be particularly intense.
There is a...",T9
68,"The arrival of 2026 has brought anything but peace to the Middle East, caught in the gravitational pull of rival ambitions and with the uneasy sense that the next war may already be under way.
From Gaza to Syria, conflict hotspots are flaring as the region finds itself at the epicentre of a global order in flux.
The result is a landscape in which rivalries are multiplying, former partners are pitted against each other and more violence appears inevitable, analysts say.
“While it is still early...",T8
69,"China has recorded a five-year peak in the number of provincial governments raising minimum wages, official data showed, as Beijing pledges to “invest in people” to support economic growth over the course of its latest five-year plan.
Twenty-seven of the mainland’s 31 provincial-level jurisdictions have increased monthly minimum wages over the past year, with half introducing double-digit rises – outpacing China’s 5 per cent gross domestic product growth rate in 2025 – according to the Post’s...",T2
70,"A woman in China who suffers from baldness on the top of her head because of a skin disease has been cruelly divorced by her husband, arousing much sympathy on social media.
The 36-year-old, who lives in Shangqiu, central Henan province, said her husband did not care for her at all; instead he has disdained her since she became ill two years ago, Henan TV reported.
“I have devoted myself to the family. I take care of our child, wash clothes, prepare food and do other domestic chores,” the wife,...",T9
71,"When Kevin Ng Shu-keung inspected the mock-up of a curved glass panel in 2019 to be mass-produced for the facade of The Henderson, a grade A commercial tower in Hong Kong, he was shocked to discover its flaws.
The geometrically complex glass panels had never been used in Hong Kong before and his team had to put them through rounds of tests and trials at a residential construction site in Sham Shui Po, said Ng, senior deputy general manager of project management at property giant Henderson...",T6
72,"Fans gathered at a Tokyo zoo on Sunday to bid farewell to the last two giant pandas in the country, long a symbol of Sino-Japanese friendship, two days before they leave for China.
The departure of Xiao Xiao and his sister, Lei Lei, will leave Japan without any pandas for the first time since 1972, when China gifted a pair to Japan following the normalisation of bilateral ties.
Prospects for a new panda loan by China remain uncertain amid soured ties following remarks last year by Prime Minister...",T9
73,"Jensen Huang marked the coming Lunar New Year with Nvidia employees in Shanghai on Saturday, as the CEO of the world’s most valuable company made his first trip to China in 2026 amid uncertainties around its H200 graphics processing unit (GPU).
Huang received a rock-star welcome when he joined Nvidia’s annual Lunar New Year celebration, according to two employees who asked not to be named as they were not authorised to speak to the media. Huang gave a speech and handed out tangerines that he...",T9
74,"A 65-year-old Hong Kong woman has died after being trapped inside a taxi that crashed into a private car and overturned early on Sunday, police have said.
A subsequent investigation by the force led to the arrest of the driver and passenger of the car involved in the collision in Pat Heung. They were suspected of possessing offensive weapons after officers found a knife and an extendable baton at the scene.
The crash occurred at around 12.30am when the driver of the taxi travelling along Kam Tin...",T9
75,"A Chinese primary school boy saved his pocket money for half a year, accumulating one yuan at a time (14 US cents), to buy his mother a pair of shoes as a birthday gift, touching both the shop owner and millions of netizens.
The 11-year-old boy from Hebei province in northern China entered a shoe shop with a stack of one-yuan notes in his hands, asking to purchase a pair of shoes for his mother.
He indicated that it was a birthday gift for her to use during her daily commute, as he had noticed...",T9
76,"As a Singaporean urban farming company in the land-scarce city state, Archisen found itself in need of more land, ready talent and lower costs of production that would allow it to access the local market.
The Johor-Singapore Special Economic Zone (JS-SEZ) has provided an attractive solution, according to chief executive Vincent Wei.
The economic zone, the world’s first involving two countries, was officially launched a year ago, with Malaysian Prime Minister Anwar Ibrahim and his Singaporean...",T6
77,"Many passengers crowded the lower decks of Hong Kong buses on Sunday out of concern that they would not be able to unbuckle their seat belts in time to alight on the first day of the new rule's implementation.
A Post reporter and lawmaker Mark Chong Ho-fung took trips on two of the busiest routes in Tuen Mun and found passengers crowding the lower decks of one of the buses, with some residents unaware of the new law on both journeys.
Passengers behaved differently on MTR’s K54A service, a...",T5
78,"Singapore Exchange (SGX) Group is seeking to widen its cross-listing schemes with Shanghai and Shenzhen and explore partnerships with Hong Kong Exchanges and Clearing (HKEX) and other exchanges, according to its CEO.
“Connectivity, in my view, is the new architecture for capital markets,” said Loh Boon Chye in an exclusive interview with the Post during his visit to Shenzhen last week. “We look towards more connectivity, not just with China but with other like-minded exchanges.”
Loh said if...",T6
79,"Hong Kong’s flag carrier Cathay Pacific Airways has joined a wave of global aviation shutdowns, cancelling at least four US-bound flights on Sunday as a monster winter storm grounded more than 9,500 flights across America, with about 1,800 pre-emptively cancelled for Monday.
Cathay on Sunday stopped short of revealing the exact number of flights affected, saying only that it was “making a number of cancellations” to services between Hong Kong and the US from Saturday to Monday, including those...",T5
80,"After a months-long war of words between an online influencer and a restaurant chain owner, a Communist Party mouthpiece has taken the unusual step of direct intervention – underlining China’s desire to rein in internet celebrities and social media platforms.
Since Sunday, People’s Daily has published four commentaries about the restaurant chain Xibei, which says it expects to lose 500 million yuan (US$71.8 million) following an influencer’s online complaints about pre-made dishes.
“This is...",T9
81,Protests spread across US after second fatal shooting by law enforcement during immigration crackdown,T0
82,"Even if you are not interested in the superpowers, they will sooner or later be interested in you",T9
83,North American tensions resurface after Mark Carney warned of ‘rupture’ in global order at Davos,T10
84,Washington to invest in USA Rare Earth as bank run by Howard Lutnick’s sons advises group on separate fundraising,T3
85,‘Insatiable’ demand and supply bottlenecks drive rally in once-unglamorous sector,T8
86,Companies set to increase advertising spending this year to defuse growing public opposition to vast projects,T2
87,"U.S. stocks were mostly lower, with the Nasdaq leading declines as makers of AI infrastructure suffered steep falls, many in the double digits. Nvidia was down 16%.",T3
88,"Gold settled 1.4% lower, down two of the past three sessions, and silver fell 2.5%, down three of the past four sessions.",T3
89,"Panic fueling the selloff of Nvidia, Broadcom and other tech giants is overblown.",T3
90,"Gain insight on Experian, SoFi Technologies and more in the latest Market Talks covering Financial Services.",T6
91,"Arabica coffee prices hit a record level, as traders digested the withdrawal of President Trump’s threats to impose tariffs and economic sanctions on Colombia.",T4
92,The Yen and Swiss Franc were stronger against the dollar as investors sought safe havens after Chinese start-up DeepSeek’s new AI model hit U.S. tech stocks.,T10
93,U.S. natural gas futures fell after weekend updates took some of the chill out of early February weather forecasts.,T8
94,QXO is taking its offer directly to shareholders after being rebuffed on several occasions.,T6
95,Maverick Natural Resources has operations in Texas and Oklahoma.,T12
96,"There are some new wrinkles, especially for those who sell things online or bought an EV.",T6
97,Companies with good payouts are now the hottest bet in China markets.,T6
98,The 10-year U.S. Treasury yield fell and ING said the the long end of the Treasury curve will continue trading at higher yields even as Trump hasn’t delivered anything to shock markets so far.,T10
99,Oil edged lower in early trade as Goldman Sachs said the latest round of U.S. sanctions against Russia haven’t had a significant impact on the country’s oil exports.,T10
100,"There is little sign of crimped demand for equities among individual investors, who remain bullish after two years of blockbuster gains.",T8
101,Check out the stocks Heard on the Street writers favor in their eighth annual stock-picking contest.,T3
102,The real costs of owning a house in neighborhoods that are vulnerable to flooding and wildfires are becoming clearer.,T5
103,"Venture-capital firms are bringing AI and dealmaking to accounting, property management and other unglamorous fields.",T7
104,"Recent court cases reveal how middlemen are facilitating a booming trade, eluding a crackdown.",T8
105,The story of home affordability in the U.S. told from a single front porch.,T5
106,The president has told Bank of America and JPMorgan Chase to stop cutting conservatives off from doing business.,T5
107,BofA examines a spike in natural gas prices as strong winter storm in U.S. looms,T2
108,Could physical AI usher in a new era for industrial robots?,T7
109,Is 2026 the long-awaited turning point for Tesla’s Semi truck?,T9
110,"Here Are the Top Four Blue-Chip Stocks To Buy in 2026, According to WarrenAI",T6
111,"5 big analyst AI moves: Buy Microsoft, Arm weakness; Google lifted to Strong Buy",T7
112,Here’s how Morgan Stanley recommends approaching Brazil’s 2026 elections,T12
113,Will tariff noise derail Europe’s earnings recovery?,T4
114,US climber scales Taiwan’s tallest building Taipei 101 without ropes,T6
115,Dollar set for hefty weekly loss; sterling edges higher,T10
116,Asia FX rises as dollar nurses weekly loss; yen soft after BOJ hold,T10
117,Exclusive-Big North European investors reassess US exposure as geopolitical risk mounts,T10
118,Dollar edges higher after Trump’s Greenland shift; euro drifts lower,T10
119,Asia FX dips as Trump eases tariff jitters; Aussie hits 15-mth high on strong jobs,T4
120,Taiwan’s regulatory shifts unlikely to drive USD/TWD uptrend: UBS,T10
121,UBS CEO: ’no choice but the dollar’ despite geopolitical tensions,T4
122,Dollar stays near lows ahead of Trump’s Davos speech; Greenland issue in spotlight,T10
123,"Asia FX mixed as yen steadies amid JGB rout; won rebounds, rupee hits record low",T10
124,"South Korea’s Lee plays down proposed US chip tariffs, warns of higher prices",T4
125,Deutsche Bank forecasts S&P 500 to hit 7000 by end of 2025,T3
126,"Trump's tariffs, Fed minutes, Rumble's Bitcoin buy - what's moving markets",T3
127,Bitcoin price today: slips to $94k as risk appetite sours on Trump tariff threat,T3
128,2025 macro outlook for the US is 'murky at best' says Deutsche Bank,T12
129,Trump says he will impose additional 10% tariffs on China over drug inflow,T4
130,"Asia stocks fall after Trump threatens tariffs, Japan's Nikkei leads losses",T10
131,"S&P 500 positioning levels at record highs, pullback risks rise, Citi warns",T3
132,"Analyst calls Bitcoin 'global bubble', could soar to infinity",T3
133,Stock market today: Dow hits record as Trump's pick for Treasury stokes optimism,T10
134,Jump in Tesla stock mostly driven by 'animal spirits/momentum' says UBS,T3
135,"Federal Reserve Board announces approval of application by Banco Inter, S.A.",T11
136,Federal Reserve Board issues enforcement action with former employee of PrimeLending,T11
137,Federal Reserve Board announces approval of application by Fifth Third Bancorp,T11
138,Agencies issue 2025 Shared National Credit Program report,T13
139,Federal Reserve Board announces the designation of the Chairs and Deputy Chairs of the 12 Federal Reserve Banks for 2026,T11
140,"Federal Reserve Board announces approval of application by Prosperity Bancshares, Inc.",T11
141,"Minutes of the Board's discount rate meeting on December 10, 2025",T12
142,Federal Reserve Board issues enforcement action with former employee of Regions Bank,T11
143,"Minutes of the Federal Open Market Committee, December 9–10, 2025",T12
144,Agencies release annual asset-size thresholds under Community Reinvestment Act regulations,T13
145,Federal Reserve Board announces approval of the application by National Bank Holdings Corporation,T11
146,"Federal Reserve Board publishes its biennial report on debit card transactions, which summarizes information collected from large debit card issuers and payment card networks",T11
147,"Federal Reserve Board requests public input on “payment account,” which eligible financial institutions could use for the limited purpose of clearing and settling their payments",T11
148,Federal Reserve Board publishes first of several staff manuals for the supervision of the largest and most complex banks,T11
149,Federal Reserve Board withdraws 2023 policy statement and issues new policy statement regarding the treatment of certain Board-supervised banks that facilitates responsible innovation,T11
150,"Federal Reserve Board announces termination of enforcement actions with The Goldman Sachs Group, Inc. and Metropolitan Commercial Bank",T11
151,Agencies announce dollar thresholds for smaller loan exemption from appraisal requirements for higher-priced mortgage loans,T13
152,Agencies announce dollar thresholds for applicability of truth in lending and consumer leasing rules for consumer credit and lease transactions,T13
153,"Federal Reserve Board announces approval of application by The PNC Financial Services Group, Inc.",T11
154,"Federal Reserve Board announces approval of application by Banco BTG Pactual S.A., its parent holding companies, and subsidiary, BTG Pactual Bancorp, LLC",T11
155,"One data provider, Australia-based Dysrupt Labs, has built a product using prediction markets' odds.",T6
156,"Car companies signaled they were discontinuing V8 engines a few years ago. Now, they're making a big U-turn &mdash; and Detroit is leading the way.",T9
157,"William Tunstall-Pedoe co-founded Evi, which became Amazon Alexa. Here's why he decided to leave the tech giant and launch a startup.",T9
158,"Warren Buffett said there's ""nothing magic"" about managing your finances, and credited his dad for always having ""faith"" in him.",T5
159,Online resale market expands as eBay users Sydney Frost and Jessamine Black detail their strategies for finding affordable vintage fashion.,T6
160,"EY's global chief innovation officer, Joe Depa, said he advises his teams to write their own content first and then ask AI to refine it.",T7
161,"80-year-old Robin Blair runs his family's greengrocer's, founded in 1875. He started helping in the business at age 5 and says he will never retire.",T5
