id,text,topic_id
0,"In China, conspicuous consumption is out, and “local heroes” are in.",T4
1,"The federal tax collector seems poised to run out of funding on Saturday, just days after it started processing 2025 income-tax returns.",T11
2,“I am the third trustee appointed to my late parents’ trust.”,T10
3,Trump’s nominee for Fed chair has been hawkish about easy money. But this president demands lower rates.,T2
4,Reading too much into short-term market moves can land you in trouble.,T9
5,"If “safe” investments like gold and silver can crash in a single day, investors need to reconsider their portfolio hedges.",T8
6,The group of major oil producers known as OPEC+ will have to take oil flow uncertainty and an expected global supply surplus into account when they meet this weekend to discuss production targets.,T1
7,A double-whammy selloff of tech stocks and metals shook markets on Friday.,T8
8,"Student fines “would be paid out of pocket, exactly like if a student-athlete gets a parking ticket on campus,” a University of Colorado athletic department spokesperson said.",T11
9,"“My home is paid for and has an estimated value of $700,000.”",T10
10,U.S. productivity slows down in fourth quarter while unit labor costs accelerate,T11
11,Beyond to buy rights to Buy Buy Baby brand and reunite it with Bed Bath & Beyond,T14
12,Amazon says it had best-ever Thanksgiving Holiday week with record sales and number of items sold,T4
13,U.S. stock futures and bond yields drop on reports Putin has updated nuclear doctrine,T6
14,Charter Communications announces buyout deal for Liberty Broadband at terms above its previous proposal,T14
15,General Motors unveils new all-electric Cadillac called the Vistiq with 300-mile range,T9
16,Vestas Wind Systems stock slumps as company says margins to be at low end of guidance,T8
17,Burberry shares rise on report Moncler could bid for it,T8
18,Kazatomprom reports 17% increase in production during the third quarter,T9
19,Anheuser-Busch InBev shares slip as sales come up shy of estimates,T9
20,Wingstop’s stock slides 12% after profit falls short of estimates,T9
21,Novartis hikes sales and profit guidance for the year,T9
22,Plus500 says it will meet expectations after quarterly revenue climbs 11%,T9
23,Trainline boosts guidance for the second time this year,T4
24,Barclays reports 18% profit rise as it lifts income guidance,T9
25,"London Stock Exchange Group says income grew, led by Tradeweb",T8
26,The 55-year-old economist had been considered for Fed chair during Trump's first term.,T2
27,Opinion is divided over whether Warsh will align with the US president's views over how the Federal Reserve should be run.,T2
28,Gold has fallen from recent highs but there are several reasons investors are still finding refuge in the precious metal.,T8
29,The furry dolls have a signature spiky-toothed grin and became a viral purchase last summer.,T14
30,"The Leicester-based family firm of 73 years said it has been hit by ""prices going up, but demand going down"".",T6
31,Hundreds of miles from Denmark's coast a project is underway to inject CO2 into an old oil field.,T1
32,The government has confirmed the discount for six million low-income households will continue for the rest of the decade.,T10
33,"Sir Keir Starmer's visit to China brought agreements on visas, services, healthcare, green tech and finance.",T1
34,The US president's comments come as Sir Keir Starmer arrives in Shanghai on the third day of his visit to China.,T1
35,Workers share how toxic managers have affected them and their lives. Here's what to do if you have one.,T10
36,The falls have sparked questions about whether the world's go-to currency is losing its lustre.,T8
37,"The company's revenue was boosted by iPhone sales, but sales of its wearable tech and Mac computers dipped.",T9
38,"Since returning to the White House last year, the US president has used tariffs as a key policy tool.",T1
39,"While planning applications have risen, home building has lowered, new data suggests.",T10
40,Paul Patterson will become the chair of Fujitsu's UK business responsible for its inquiry response.,T2
41,The change could pave the way for more foreign investment in the country's oil industry.,T1
42,"Women hit by changes to the state pension age say the decision shows ""utter contempt"" for their situation.",T10
43,Cabinet Office Minister Nick Thomas-Symonds says the waits faced by retired civil servants are unacceptable.,T10
44,The high-street lender is the latest to announce a swathe of branch closures.,T0
45,The average annual household bill in England and Wales will increase by £33 from April.,T9
46,Mexican Senator Armando Rios Piter told CNN that he plans to introduce a bill this week that would stop Mexican purchases of American corn.,T11
47,The days of plugging in an iPhone to charge won't last forever.,T9
48,"Nandan Nilekani, co-founder of one of India's biggest outsourcing companies, says an H-1B visa crackdown would ultimately hurt the U.S.",T1
49,The market is at all-time highs and many say Trump is the reason. But stocks were rallying when investors thought Hillary Clinton would win. Janet Yellen and the Fed may deserve more of the credit for the market's move.,T6
50,Apple stock is less than $1 away from its all-time high amid renewed optimism for the iPhone.,T6
51,President-elect Donald Trump focuses his criticism of NAFTA on Mexico. But Canada and America have a rocky trade history too.,T1
52,"Verizon has decided to bring back unlimited data plans. But while that's great for its subscribers, it's awful news for investors. It's another sign of how brutally competitive the telecom business is. And it's hurting Verizon's stock.",T14
53,The price of crude oil has more than doubled over the past year after bottoming out at $26 per barrel in February 2016.,T6
54,The automaker announced Monday that its first official venture in the oil-rich Middle East will be in the United Arab Emirates.,T4
55,Uber's top rival in India has some unsolicited advice for the U.S. startup: Go local.,T4
56,"Apple CEO Tim Cook wants the tech industry to take action against ""fake news"" stories that are polluting the web.",T7
57,"Sears Holdings, the company that owns retail stores Sears and Kmart, said this weekend that it would remove 31 Trump-branded items from its website.",T2
58,"Universal Biopack makes packaging that it sells to restaurants and manufacturers. But rather than plastic, it uses a mixture of bamboo and cassava.",T1
59,"Nike on Sunday launched a star-studded short film titled ""Equality"" that coincides with Black History Month.",T14
60,"Treasury secretary pick Steven Mnuchin is an executive producer on Warner Bros.' ""The Lego Batman Movie,"" which pulled in an estimated $55.6 million from U.S. audiences during its opening weekend.",T2
61,"It may seem like a recurring nightmare, but Greece is in danger of running out of money again.",T1
62,"UK Prime Minister Keir Starmer has landed in Tokyo ahead of a meeting with his Japanese counterpart at the conclusion of his visit to East Asia.
Speaking to reporters on the flight from Shanghai to Tokyo, the prime minister said he looked forward to discussing both defence and security issues and trade and the economy with Japanese Prime Minister Sanae Takaichi.
Describing the visit to the Group of Seven (G7) and G20 ally as “really important”, Starmer said: “Outside of Europe and the US, Japan...",T1
63,"Flight routes between Europe and China are suddenly crowded with prime ministers and presidents, giving the impression of a continent pivoting eastward.
A flurry that began late last year with visits to Beijing by the Spanish king and French president has continued with leaders of Britain, Ireland and Finland, with Germany’s chancellor to follow next month.
The frenzied outreach comes with the transatlantic relationship on the rocks. US President Donald Trump’s designs on Greenland have even...",T1
64,"A 32-year-old Chinese programmer who died suddenly after working intensively for years received a new work task message eight hours after his death.
News of his overwork and death trended online and struck a chord with many people.
Gao Guanghui died on a Saturday in November 2025. His wife, who used the pseudonym Li, said that he woke up early that day saying he felt unwell, needed to sit down and “do some work while he was at it”.
Soon he felt more unwell, convulsed and passed out en route to...",T4
65,"The new generation of Hong Kong police officers will need “iron bones” in the face of unrelenting “oppression by hostile foreign forces”, the security minister has said.
Secretary for Security Chris Tang Ping-keung, speaking at the force’s passing-out parade on Saturday, was also moved to tears when he recalled the force’s efforts to recover the human remains of those killed in the Wang Fuk Court blaze last November.
“The oppression by hostile foreign forces will not stop. Those who are...",T4
66,"A landslide earlier this week collapsed several mines at a major coltan mining site in the eastern Democratic Republic of Congo (DRC), leaving at least 200 people dead, rebel authorities said on Saturday.
The collapse took place on Wednesday at the Rubaya mines, which are controlled by the M23 rebels, said Lumumba Kambere Muyisa, spokesman for the rebel-appointed governor of North Kivu province.
He said the landslide was caused by heavy rains.
“For now, there are more than 200 dead, some of whom...",T5
67,"Compared with the turmoil threatened by US President Donald Trump’s actions in everything from geopolitics to trade, the outcome of Japan’s parliamentary lower house election, set for February 8, may seem like small beer. Yet it could presage a great upheaval in global finance.
The election outcome is widely expected to strengthen the political power base of the fiscally expansionist Japanese prime minister, Sanae Takaichi, and increase borrowing when government debt almost everywhere is already...",T6
68,"Russia’s call to revive a troika with China and India is unlikely to be greeted with enthusiasm by New Delhi, with critics pointing to tense border stand-offs and India’s reluctance to be seen as part of an “anti-West” grouping.
Russian Foreign Minister Sergey Lavrov earlier this month lauded Moscow’s bilateral ties with Delhi and Beijing, calling for the revival of the Russia-India-China (RIC) trialogue.
First mooted in 1998 by then Russian prime minister Yevgeny Primakov, the RIC has not taken...",T1
69,"Some restaurants in Tokyo have ignited controversy for reportedly enforcing age restrictions on their patrons, with some allowing entry only for people over 25 and others permitting those under 40.
In Japan, certain eateries in the capital have begun to adopt these age limitations. For instance, some izakaya, or Japanese pubs, explicitly state, “No entry for customers over 40,” while others only admit those aged 25 and above.
One particular izakaya in Shibuya, whose name has not been disclosed,...",T4
70,"Chinese regulators have slapped a 26 million yuan (US$3.7 million) fine on a unit of Kuaishou Technology, operator of the country’s No 2 short video platform, over multiple violations and misconduct in its live-streaming e-commerce operations, signalling tighter oversight of this market segment.
Chengdu Kuaigou Technology, a unit of Beijing-based Kuaishou, was found to have committed seven breaches including failure to disclose information in accordance with the law, charging unreasonable fees...",T4
71,"A man who was sentenced to jail in Singapore over an altercation with the police was released on the same day he was sentenced due to an error in calculating the jail term.
Muhammad Fathurrahman Mohd Adzlan was contacted and returned to jail four days later to complete his sentence.
In a statement on Friday, a judiciary spokeswoman said Muhammad was sentenced to 32 weeks’ jail on October 27, last year. However, this was erroneously reflected as 20 weeks.
According to court papers, Muhammad, then...",T4
72,"Hong Kong’s health minister is seeking to amend legislation to reform and speed up the complaint system of a medical watchdog, but has warned against “arbitrarily” adding more non-professionals to the body.
Lo Chung-mau said on Saturday that the Health Bureau would table an amendment to the Medical Registration Ordinance at a meeting of the Legislative Council’s health services panel in February, with the aim of implementing the new measures in April.
The amendment would review the Medical...",T14
73,"Wingtech Technology, the Chinese owner of chipmaker Nexperia, is expected to post a loss of between 9 billion yuan (US$1.3 billion) and 13.5 billion yuan in 2025, owing to the Dutch government’s takeover of the semiconductor firm, the Shanghai-listed company said in a statement on Friday.
Wingtech said that its authority over the chipmaker continues to be “temporarily restricted” since the October 7 ruling of the Dutch Enterprise Chamber, a special division of the Amsterdam Court of Appeal,...",T4
74,"A Nevada jury on Friday convicted Dances With Wolves actor Nathan Chasing Horse of sexually assaulting indigenous women and girls in a case that sent shock waves through Indian Country.
The jurors in Las Vegas found Chasing Horse guilty of 13 of the 21 charges he faced. Most of the guilty verdicts centred on Chasing Horse’s conduct with a victim who was 14 years old when he began assaulting her. He was acquitted of some sexual assault charges when the main victim was older and lived with him and...",T14
75,"Enterprises across China’s semiconductor industry recorded hefty profit growth last year, according to their unaudited financial results, driven by the country’s artificial intelligence infrastructure buildout and Beijing’s push for tech self-reliance.
Graphics processing unit (GPU) designer Cambricon Technologies on Friday reported a net profit of 2.2 billion yuan (US$316 million) in 2025, its first profitable year, on the back of “the continuous rise in computing power demand within the AI...",T4
76,"Hong Kong film producer Tiffany Chen has announced her intention to work until the age of 100, encouraging young people not to rush into retirement.
Chen, 67, is the wife of Hong Kong film mogul Charles Heung Wah-keung and is well-known on mainland social media as Madam Heung. She is also the mother of actor Jacky Heung.
As vice-chairman of China Star Entertainment, Chen has been instrumental in launching the careers of superstars such as Andy Lau Tak-wah.

On January 13, she released a video...",T4
77,"Hong Kong police have arrested six suspects in connection with a 58 million yen (US$376,600) robbery outside a currency exchange shop, including a victim who allegedly acted as a mole in the plot.
Commissioner of Police Joe Chow Yat-ming said on Saturday that three Japanese men, two mainland Chinese residents, including a woman, and a local man were detained.
“Two Japanese men reported to police that they were robbed [on Friday]. Upon investigation, we found that one of them was a mole who had...",T4
78,"There was no mayday call from the commercial fishing vessel Lily Jean as it navigated the frigid Atlantic Ocean on Friday morning on its way home to Gloucester, Massachusetts, America’s oldest fishing port. The US Coast Guard was notified by the boat’s beacon that alerts when it hits the water.
When rescuers arrived they found one person dead, floating in the water, along with a debris field and an empty lifeboat. Six people remain missing.
The fate of the Lily Jean, a 22-metre (72-foot) fishing...",T10
79,"Hong Kong must maintain cash reserves to cope with geopolitical shocks and support long-term growth, even with a surplus expected in the government’s operating account this year, the financial secretary has said.
Paul Chan Mo-po also said on Saturday that the city’s economy outperformed forecasts last year, lifted by strong exports to Southeast Asia and a booming financial market.
On Friday, the government announced a surplus of HK$43.9 billion (US$5.6 billion) in its operating account, which...",T4
80,"China’s factory activity faltered in January as weak domestic demand dragged down production at the start of the new ‍year, an official survey showed on Saturday.
The official purchasing managers’ index (PMI) dropped to 49.3 in January, from 50.1 in December, below the 50-mark separating growth from contraction. It missed a forecast of 50 in a Reuters poll of analysts.
Sub-indexes of new orders and new export orders also saw declines, respectively, down to 49.2 from 50.8 ⁠in December and 47.8...",T6
81,"At an Indian gourmet food store, Avanti Mehta is organising a blind tasting of drinks sourced from France, Italy and India. No, this is not wine, it is water.
Participants use tiny shot glasses to check the minerality, carbonation and salinity in samples of Evian from the French Alps, Perrier from southern France, San Pellegrino from Italy and India’s Aava from the foothills of the Aravalli mountains.
“They will all taste different … you should be choosing a water that can give you some sort of...",T4
82,Donald Trump’s pick has called for a sweeping overhaul,T2
83,Inside the turbulent contest for the most important job in global finance,T4
84,"As American cities have been left reeling by ICE federal agents, the acclaimed novelist explores the deeper conflict behind Donald Trump’s show of force",T1
85,The cynics are wrong about a film that will outlast our era,T7
86,"Files contain new revelations on Microsoft founder, Elon Musk, the former Prince Andrew and other powerful men",T3
87,Messages contradict Mountbatten-Windsor’s account of pair’s relationship after disgraced financier was convicted in 2008,T14
88,Compromise deal averts costly shutdown while lawmakers argue over limits on Trump’s immigration crackdown,T11
89,US president picks BLS veteran after withdrawing earlier pick viewed as more controversial,T2
90,Initiative for homegrown tools reflects rising anxiety over relying on US platforms amid shifting geopolitics,T10
91,Emirates workers have had visas to the kingdom rejected since tensions erupted between the Gulf powerhouses,T1
92,"U.S. stocks were mostly lower, with the Nasdaq leading declines as makers of AI infrastructure suffered steep falls, many in the double digits. Nvidia was down 16%.",T6
93,"Gold settled 1.4% lower, down two of the past three sessions, and silver fell 2.5%, down three of the past four sessions.",T8
94,"Panic fueling the selloff of Nvidia, Broadcom and other tech giants is overblown.",T9
95,"Gain insight on Experian, SoFi Technologies and more in the latest Market Talks covering Financial Services.",T7
96,"Arabica coffee prices hit a record level, as traders digested the withdrawal of President Trump’s threats to impose tariffs and economic sanctions on Colombia.",T6
97,The Yen and Swiss Franc were stronger against the dollar as investors sought safe havens after Chinese start-up DeepSeek’s new AI model hit U.S. tech stocks.,T6
98,U.S. natural gas futures fell after weekend updates took some of the chill out of early February weather forecasts.,T6
99,QXO is taking its offer directly to shareholders after being rebuffed on several occasions.,T5
100,Maverick Natural Resources has operations in Texas and Oklahoma.,T1
101,"There are some new wrinkles, especially for those who sell things online or bought an EV.",T14
102,Companies with good payouts are now the hottest bet in China markets.,T4
103,The 10-year U.S. Treasury yield fell and ING said the the long end of the Treasury curve will continue trading at higher yields even as Trump hasn’t delivered anything to shock markets so far.,T6
104,Oil edged lower in early trade as Goldman Sachs said the latest round of U.S. sanctions against Russia haven’t had a significant impact on the country’s oil exports.,T1
105,"There is little sign of crimped demand for equities among individual investors, who remain bullish after two years of blockbuster gains.",T9
106,Check out the stocks Heard on the Street writers favor in their eighth annual stock-picking contest.,T6
107,The real costs of owning a house in neighborhoods that are vulnerable to flooding and wildfires are becoming clearer.,T10
108,"Venture-capital firms are bringing AI and dealmaking to accounting, property management and other unglamorous fields.",T7
109,"Recent court cases reveal how middlemen are facilitating a booming trade, eluding a crackdown.",T6
110,The story of home affordability in the U.S. told from a single front porch.,T10
111,The president has told Bank of America and JPMorgan Chase to stop cutting conservatives off from doing business.,T2
112,"CBS News chief Weiss touts commentator push, draws mixed reaction in newsroom",T14
113,Will management changes hurt UK REITs’ share price performance?,T9
114,BofA says this airline may have been hit hard by the strong U.S. winter storm,T1
115,Will Japan stock market rally accelerate if LDP wins majority?,T6
116,How OpenAI Ads will impact competitors like Google and Meta?,T14
117,Can European banks match U.S. rivals in capital markets?,T0
118,Can U.S. dollar remain as the backbone of the global financial system?,T1
119,Investor says AI’s next phase will be shaped by power and inference economics,T7
120,Dollar rebounds after Warsh pick as chair allays Fed independence concerns,T2
121,Be careful over positioning for further dollar weakness - UBS,T8
122,"Japan’s FX market intervention limited to verbal warnings, MoF data shows",T6
123,Asia FX muted but heads for Jan gains; dollar steadies with Fed chair in focus,T6
124,"US Treasury strengthens currency monitoring criteria, but finds no manipulation",T6
125,ECB’s Cipollone says digital euro needed for European autonomy,T13
126,Dollar languishes near four-year lows after Fed stands pat; euro back below $1.20,T6
127,Asia FX muted as dollar declines after Fed rate hold; yen intervention eyed,T6
128,Deutsche Bank forecasts S&P 500 to hit 7000 by end of 2025,T8
129,"Trump's tariffs, Fed minutes, Rumble's Bitcoin buy - what's moving markets",T8
130,Bitcoin price today: slips to $94k as risk appetite sours on Trump tariff threat,T8
131,2025 macro outlook for the US is 'murky at best' says Deutsche Bank,T11
132,Trump says he will impose additional 10% tariffs on China over drug inflow,T1
133,"Asia stocks fall after Trump threatens tariffs, Japan's Nikkei leads losses",T6
134,"S&P 500 positioning levels at record highs, pullback risks rise, Citi warns",T9
135,"Analyst calls Bitcoin 'global bubble', could soar to infinity",T8
136,Stock market today: Dow hits record as Trump's pick for Treasury stokes optimism,T6
137,Jump in Tesla stock mostly driven by 'animal spirits/momentum' says UBS,T8
138,"Federal Reserve Board announces approval of application by Cornerstone Capital Bancorp, Inc.",T0
139,"Federal Reserve Board announces appointment of seven members, including four new members, to its Insurance Policy Advisory Committee (IPAC)",T0
140,"Federal Open Market Committee reaffirms its ""Statement on Longer-Run Goals and Monetary Policy Strategy""",T0
141,"Federal Reserve Board announces approval of application by Banco Inter, S.A.",T0
142,Federal Reserve Board issues enforcement action with former employee of PrimeLending,T0
143,Federal Reserve Board announces approval of application by Fifth Third Bancorp,T0
144,Agencies issue 2025 Shared National Credit Program report,T0
145,Federal Reserve Board announces the designation of the Chairs and Deputy Chairs of the 12 Federal Reserve Banks for 2026,T0
146,"Federal Reserve Board announces approval of application by Prosperity Bancshares, Inc.",T0
147,"Minutes of the Board's discount rate meeting on December 10, 2025",T12
148,Federal Reserve Board issues enforcement action with former employee of Regions Bank,T0
149,"Minutes of the Federal Open Market Committee, December 9–10, 2025",T0
150,Agencies release annual asset-size thresholds under Community Reinvestment Act regulations,T10
151,Federal Reserve Board announces approval of the application by National Bank Holdings Corporation,T0
152,"Federal Reserve Board publishes its biennial report on debit card transactions, which summarizes information collected from large debit card issuers and payment card networks",T0
153,"Federal Reserve Board requests public input on “payment account,” which eligible financial institutions could use for the limited purpose of clearing and settling their payments",T0
154,Federal Reserve Board publishes first of several staff manuals for the supervision of the largest and most complex banks,T0
155,Federal Reserve Board withdraws 2023 policy statement and issues new policy statement regarding the treatment of certain Board-supervised banks that facilitates responsible innovation,T0
156,"Federal Reserve Board announces termination of enforcement actions with The Goldman Sachs Group, Inc. and Metropolitan Commercial Bank",T0
157,"Job seekers can stand out by contacting employers before roles are posted, a veteran career coach told Business Insider.",T10
158,"AI is taking on routine tasks for junior employees at the Big Four, but is it damaging their skills development and future potential?",T7
159,It's time to hit redial on phone etiquette and bring back randomly calling friends. It's time to raw dial.,T14
160,"A viral TikTok video claims Sephora fired an employee for attending an ICE protest, sparking backlash despite questions about the video's accuracy.",T10
161,"Our home flooded on our first night after moving in. Luckily, our new neighbors came over to help, which led to a beautiful, meaningful friendship.",T10
162,"As Amazon Fresh closes stores, workers say the chain struggled to resonate with customers and differentiate itself from Whole Foods",T4
